observed_on,user_id,created_at,taxon_family_name,taxon_genus_name,taxon_species_name,broader,establishment_means
18/09/2020,2488549,2020-09-18 07:57:58 UTC,Fabaceae,Acacia,Acacia baileyana,3.dicot,introduced
18/07/2021,2488549,2021-07-19 11:33:08 UTC,Fabaceae,Acacia,Acacia baileyana,3.dicot,introduced
20/08/2021,2488549,2021-08-20 10:53:39 UTC,Fabaceae,Acacia,Acacia baileyana,3.dicot,introduced
4/02/2022,2488549,2022-02-05 09:09:26 UTC,Fabaceae,Acacia,Acacia baileyana,3.dicot,introduced
14/05/2022,2488549,2022-05-14 09:10:16 UTC,Fabaceae,Acacia,Acacia baileyana,3.dicot,introduced
11/08/2022,2488549,2022-08-11 11:41:07 UTC,Fabaceae,Acacia,Acacia baileyana,3.dicot,introduced
29/08/2020,2488549,2020-08-29 07:42:50 UTC,Fabaceae,Acacia,Acacia binervata,3.dicot,native
11/10/2020,2488549,2020-10-11 08:34:44 UTC,Fabaceae,Acacia,Acacia binervata,3.dicot,native
22/09/2020,4743351,2021-07-24 04:35:38 UTC,Fabaceae,Acacia,Acacia binervata,3.dicot,native
12/09/2021,2488549,2021-09-12 06:57:49 UTC,Fabaceae,Acacia,Acacia binervata,3.dicot,native
12/09/2021,2488549,2021-09-12 09:30:46 UTC,Fabaceae,Acacia,Acacia binervata,3.dicot,native
21/09/2021,4743351,2021-09-22 10:48:03 UTC,Fabaceae,Acacia,Acacia binervata,3.dicot,native
30/09/2021,2488549,2021-09-30 10:15:41 UTC,Fabaceae,Acacia,Acacia binervata,3.dicot,native
13/02/2022,4025155,2022-02-13 08:43:49 UTC,Fabaceae,Acacia,Acacia binervata,3.dicot,native
10/11/2022,2488549,2022-11-10 10:10:37 UTC,Fabaceae,Acacia,Acacia binervata,3.dicot,native
25/09/2022,4743351,2022-12-23 04:06:54 UTC,Fabaceae,Acacia,Acacia binervata,3.dicot,native
3/09/2023,2488549,2023-09-03 03:37:28 UTC,Fabaceae,Acacia,Acacia binervata,3.dicot,native
25/07/2021,2488549,2021-07-25 10:05:14 UTC,Fabaceae,Acacia,Acacia binervia,3.dicot,native
9/09/2021,4887682,2021-09-08 23:59:56 UTC,Fabaceae,Acacia,Acacia binervia,3.dicot,native
15/04/2022,2488549,2022-04-15 08:59:02 UTC,Fabaceae,Acacia,Acacia binervia,3.dicot,native
5/09/2022,2488549,2022-09-05 07:17:51 UTC,Fabaceae,Acacia,Acacia binervia,3.dicot,native
8/09/2020,3408787,2020-09-09 11:03:21 UTC,Fabaceae,Acacia,Acacia brownii,3.dicot,native
18/09/2020,2488549,2020-09-18 02:48:08 UTC,Fabaceae,Acacia,Acacia brownii,3.dicot,native
18/09/2020,2488549,2020-09-18 05:20:41 UTC,Fabaceae,Acacia,Acacia brownii,3.dicot,native
20/08/2021,2488549,2021-08-20 10:53:37 UTC,Fabaceae,Acacia,Acacia brownii,3.dicot,native
20/08/2021,2488549,2021-08-20 11:08:42 UTC,Fabaceae,Acacia,Acacia brownii,3.dicot,native
5/09/2021,2488549,2021-09-05 10:32:52 UTC,Fabaceae,Acacia,Acacia brownii,3.dicot,native
5/09/2021,2488549,2021-09-05 10:39:04 UTC,Fabaceae,Acacia,Acacia brownii,3.dicot,native
5/09/2021,2488549,2021-09-05 10:39:05 UTC,Fabaceae,Acacia,Acacia brownii,3.dicot,native
18/09/2021,3712636,2021-09-18 02:07:47 UTC,Fabaceae,Acacia,Acacia brownii,3.dicot,native
9/08/2022,2488549,2022-08-09 03:46:11 UTC,Fabaceae,Acacia,Acacia brownii,3.dicot,native
15/09/2022,2488549,2022-09-15 01:11:04 UTC,Fabaceae,Acacia,Acacia brownii,3.dicot,native
15/09/2022,2488549,2022-09-15 01:11:07 UTC,Fabaceae,Acacia,Acacia brownii,3.dicot,native
15/09/2022,2488549,2022-09-15 01:11:08 UTC,Fabaceae,Acacia,Acacia brownii,3.dicot,native
15/09/2022,2488549,2022-09-15 01:11:09 UTC,Fabaceae,Acacia,Acacia brownii,3.dicot,native
22/06/2023,2488549,2023-06-22 03:39:39 UTC,Fabaceae,Acacia,Acacia brownii,3.dicot,native
18/08/2020,4743351,2021-07-26 01:34:28 UTC,Fabaceae,Acacia,Acacia decurrens,3.dicot,native
30/07/2021,2488549,2021-07-30 07:06:04 UTC,Fabaceae,Acacia,Acacia decurrens,3.dicot,native
27/08/2021,4743351,2021-08-29 04:54:42 UTC,Fabaceae,Acacia,Acacia decurrens,3.dicot,native
17/09/2021,2488549,2021-09-17 11:35:15 UTC,Fabaceae,Acacia,Acacia decurrens,3.dicot,native
4/06/2022,2488549,2022-06-04 08:15:27 UTC,Fabaceae,Acacia,Acacia decurrens,3.dicot,native
6/08/2022,2488549,2022-08-06 08:57:19 UTC,Fabaceae,Acacia,Acacia decurrens,3.dicot,native
21/08/2023,4177273,2023-08-21 22:29:33 UTC,Fabaceae,Acacia,Acacia decurrens,3.dicot,native
22/03/2024,7134096,2024-03-22 08:30:13 UTC,Fabaceae,Acacia,Acacia decurrens,3.dicot,native
10/09/2021,2488549,2021-09-10 10:04:19 UTC,Fabaceae,Acacia,Acacia echinula,3.dicot,native
10/09/2021,2488549,2021-09-10 10:44:09 UTC,Fabaceae,Acacia,Acacia echinula,3.dicot,native
24/07/2022,3978191,2022-07-24 06:44:50 UTC,Fabaceae,Acacia,Acacia echinula,3.dicot,native
29/07/2022,2488549,2022-07-29 03:25:33 UTC,Fabaceae,Acacia,Acacia echinula,3.dicot,native
29/07/2022,2488549,2022-07-29 03:26:32 UTC,Fabaceae,Acacia,Acacia echinula,3.dicot,native
29/07/2022,2488549,2022-07-29 03:49:01 UTC,Fabaceae,Acacia,Acacia echinula,3.dicot,native
9/08/2022,2488549,2022-08-09 04:00:46 UTC,Fabaceae,Acacia,Acacia echinula,3.dicot,native
9/08/2022,2488549,2022-08-09 04:05:06 UTC,Fabaceae,Acacia,Acacia echinula,3.dicot,native
24/06/2023,2488549,2023-06-24 09:55:55 UTC,Fabaceae,Acacia,Acacia echinula,3.dicot,native
24/06/2023,2488549,2023-06-24 09:55:56 UTC,Fabaceae,Acacia,Acacia echinula,3.dicot,native
24/06/2023,2488549,2023-06-24 09:55:57 UTC,Fabaceae,Acacia,Acacia echinula,3.dicot,native
23/07/2023,3978191,2023-07-23 10:22:43 UTC,Fabaceae,Acacia,Acacia echinula,3.dicot,native
19/08/2023,6209647,2023-08-21 15:21:51 UTC,Fabaceae,Acacia,Acacia echinula,3.dicot,native
24/09/2020,2488549,2020-09-24 10:09:35 UTC,Fabaceae,Acacia,Acacia elongata,3.dicot,native
4/09/2021,3712636,2021-09-04 10:50:05 UTC,Fabaceae,Acacia,Acacia elongata,3.dicot,native
4/09/2021,3712636,2021-09-04 10:57:48 UTC,Fabaceae,Acacia,Acacia elongata,3.dicot,native
9/09/2021,4887682,2021-09-09 00:40:33 UTC,Fabaceae,Acacia,Acacia elongata,3.dicot,native
9/12/2021,2488549,2021-12-09 07:04:14 UTC,Fabaceae,Acacia,Acacia elongata,3.dicot,native
23/06/2022,2488549,2022-06-23 05:23:13 UTC,Fabaceae,Acacia,Acacia elongata,3.dicot,native
23/06/2022,2488549,2022-06-23 05:24:41 UTC,Fabaceae,Acacia,Acacia elongata,3.dicot,native
14/08/2022,265090,2022-08-14 05:54:13 UTC,Fabaceae,Acacia,Acacia elongata,3.dicot,native
21/08/2023,6209647,2023-08-21 09:53:25 UTC,Fabaceae,Acacia,Acacia elongata,3.dicot,native
8/05/2020,2488549,2020-05-08 01:24:14 UTC,Fabaceae,Acacia,Acacia falcata,3.dicot,native
8/05/2020,2488549,2020-05-08 01:28:05 UTC,Fabaceae,Acacia,Acacia falcata,3.dicot,native
15/07/2020,2488549,2020-07-15 06:29:43 UTC,Fabaceae,Acacia,Acacia falcata,3.dicot,native
4/07/2021,2488549,2021-07-04 09:43:27 UTC,Fabaceae,Acacia,Acacia falcata,3.dicot,native
18/07/2021,2488549,2021-07-19 11:30:50 UTC,Fabaceae,Acacia,Acacia falcata,3.dicot,native
5/09/2021,2488549,2021-09-05 09:57:55 UTC,Fabaceae,Acacia,Acacia falcata,3.dicot,native
24/07/2022,2488549,2022-07-24 03:56:42 UTC,Fabaceae,Acacia,Acacia falcata,3.dicot,native
6/08/2019,783222,2019-08-14 01:37:13 UTC,Fabaceae,Acacia,Acacia fimbriata,3.dicot,native
26/08/2021,2488549,2021-08-27 01:32:32 UTC,Fabaceae,Acacia,Acacia fimbriata,3.dicot,native
10/09/2021,2488549,2021-09-10 08:11:58 UTC,Fabaceae,Acacia,Acacia fimbriata,3.dicot,native
21/02/2022,2488549,2022-02-21 08:41:53 UTC,Fabaceae,Acacia,Acacia fimbriata,3.dicot,native
27/05/2022,2488549,2022-05-27 04:02:26 UTC,Fabaceae,Acacia,Acacia fimbriata,3.dicot,native
29/07/2022,2488549,2022-07-29 03:46:03 UTC,Fabaceae,Acacia,Acacia fimbriata,3.dicot,native
24/06/2023,2488549,2023-06-24 09:55:55 UTC,Fabaceae,Acacia,Acacia fimbriata,3.dicot,native
8/05/2020,2488549,2020-05-08 02:58:40 UTC,Fabaceae,Acacia,Acacia floribunda,3.dicot,native
5/08/2020,2488549,2020-08-05 06:21:58 UTC,Fabaceae,Acacia,Acacia floribunda,3.dicot,native
18/07/2021,2488549,2021-07-19 11:33:46 UTC,Fabaceae,Acacia,Acacia floribunda,3.dicot,native
30/07/2021,2488549,2021-07-30 07:06:04 UTC,Fabaceae,Acacia,Acacia floribunda,3.dicot,native
15/05/2022,2488549,2022-05-15 04:26:07 UTC,Fabaceae,Acacia,Acacia floribunda,3.dicot,native
11/08/2023,2488549,2023-08-11 11:56:57 UTC,Fabaceae,Acacia,Acacia floribunda,3.dicot,native
5/09/2023,3678274,2023-09-05 22:29:34 UTC,Fabaceae,Acacia,Acacia floribunda,3.dicot,native
24/04/2020,2488549,2020-04-24 03:46:33 UTC,Fabaceae,Acacia,Acacia hispidula,3.dicot,native
26/04/2020,2488549,2020-04-26 08:47:12 UTC,Fabaceae,Acacia,Acacia hispidula,3.dicot,native
1/05/2020,2488549,2020-05-01 06:10:11 UTC,Fabaceae,Acacia,Acacia hispidula,3.dicot,native
2/05/2020,2488549,2020-05-02 08:28:38 UTC,Fabaceae,Acacia,Acacia hispidula,3.dicot,native
11/06/2020,2488549,2020-06-11 06:52:57 UTC,Fabaceae,Acacia,Acacia hispidula,3.dicot,native
3/10/2020,2488549,2020-10-03 10:02:35 UTC,Fabaceae,Acacia,Acacia hispidula,3.dicot,native
22/01/2021,2488549,2021-01-22 00:08:46 UTC,Fabaceae,Acacia,Acacia hispidula,3.dicot,native
19/11/2021,2488549,2021-11-20 02:23:21 UTC,Fabaceae,Acacia,Acacia hispidula,3.dicot,native
31/12/2021,2488549,2021-12-31 09:29:08 UTC,Fabaceae,Acacia,Acacia hispidula,3.dicot,native
31/12/2021,2488549,2021-12-31 09:29:09 UTC,Fabaceae,Acacia,Acacia hispidula,3.dicot,native
31/12/2021,2488549,2021-12-31 09:29:09 UTC,Fabaceae,Acacia,Acacia hispidula,3.dicot,native
10/03/2022,2488549,2022-03-10 10:40:08 UTC,Fabaceae,Acacia,Acacia hispidula,3.dicot,native
23/06/2022,2488549,2022-06-23 04:04:02 UTC,Fabaceae,Acacia,Acacia hispidula,3.dicot,native
23/06/2022,2488549,2022-06-23 04:07:44 UTC,Fabaceae,Acacia,Acacia hispidula,3.dicot,native
24/07/2022,2488549,2022-07-24 04:18:56 UTC,Fabaceae,Acacia,Acacia hispidula,3.dicot,native
28/12/2022,2488549,2022-12-28 02:17:23 UTC,Fabaceae,Acacia,Acacia hispidula,3.dicot,native
28/12/2022,2488549,2022-12-28 02:28:48 UTC,Fabaceae,Acacia,Acacia hispidula,3.dicot,native
30/07/2021,2488549,2021-07-30 07:06:04 UTC,Fabaceae,Acacia,Acacia irrorata,3.dicot,native
16/12/2021,2488549,2021-12-16 10:03:14 UTC,Fabaceae,Acacia,Acacia irrorata,3.dicot,native
16/12/2021,2488549,2021-12-16 10:03:16 UTC,Fabaceae,Acacia,Acacia irrorata,3.dicot,native
16/12/2021,2488549,2021-12-16 10:03:23 UTC,Fabaceae,Acacia,Acacia irrorata,3.dicot,native
20/12/2021,3978426,2021-12-20 01:51:18 UTC,Fabaceae,Acacia,Acacia irrorata,3.dicot,native
26/12/2021,2488549,2021-12-27 10:30:27 UTC,Fabaceae,Acacia,Acacia irrorata,3.dicot,native
10/01/2022,2488549,2022-01-14 05:15:15 UTC,Fabaceae,Acacia,Acacia irrorata,3.dicot,native
4/02/2022,2488549,2022-02-05 09:09:25 UTC,Fabaceae,Acacia,Acacia irrorata,3.dicot,native
26/02/2022,2488549,2022-02-26 01:07:32 UTC,Fabaceae,Acacia,Acacia irrorata,3.dicot,native
26/02/2022,2488549,2022-02-26 01:07:33 UTC,Fabaceae,Acacia,Acacia irrorata,3.dicot,native
15/04/2022,2488549,2022-04-15 08:56:09 UTC,Fabaceae,Acacia,Acacia irrorata,3.dicot,native
15/04/2022,2488549,2022-04-15 09:00:14 UTC,Fabaceae,Acacia,Acacia irrorata,3.dicot,native
30/04/2022,1138587,2022-04-30 09:06:31 UTC,Fabaceae,Acacia,Acacia irrorata,3.dicot,native
15/05/2022,2488549,2022-05-15 04:26:10 UTC,Fabaceae,Acacia,Acacia irrorata,3.dicot,native
9/06/2022,2373989,2022-06-09 02:16:00 UTC,Fabaceae,Acacia,Acacia irrorata,3.dicot,native
29/07/2022,2488549,2022-07-29 02:27:40 UTC,Fabaceae,Acacia,Acacia irrorata,3.dicot,native
29/07/2022,2488549,2022-07-29 02:31:58 UTC,Fabaceae,Acacia,Acacia irrorata,3.dicot,native
9/08/2022,2488549,2022-08-09 03:44:29 UTC,Fabaceae,Acacia,Acacia irrorata,3.dicot,native
9/08/2022,2488549,2022-08-09 11:28:39 UTC,Fabaceae,Acacia,Acacia irrorata,3.dicot,native
10/08/2022,2488549,2022-08-10 06:54:06 UTC,Fabaceae,Acacia,Acacia irrorata,3.dicot,native
10/11/2022,2488549,2022-11-10 10:11:10 UTC,Fabaceae,Acacia,Acacia irrorata,3.dicot,native
17/11/2022,2488549,2022-11-17 02:28:21 UTC,Fabaceae,Acacia,Acacia irrorata,3.dicot,native
25/09/2022,4743351,2022-12-22 10:42:29 UTC,Fabaceae,Acacia,Acacia irrorata,3.dicot,native
12/02/2023,4743351,2023-02-13 10:50:57 UTC,Fabaceae,Acacia,Acacia irrorata,3.dicot,native
15/06/2023,2488549,2023-06-15 03:34:39 UTC,Fabaceae,Acacia,Acacia irrorata,3.dicot,native
11/08/2023,6196075,2023-08-11 00:02:23 UTC,Fabaceae,Acacia,Acacia irrorata,3.dicot,native
11/08/2023,4743351,2023-08-12 12:27:02 UTC,Fabaceae,Acacia,Acacia irrorata,3.dicot,native
11/08/2023,4743351,2023-08-12 12:27:07 UTC,Fabaceae,Acacia,Acacia irrorata,3.dicot,native
24/09/2023,1138587,2023-09-27 02:45:34 UTC,Fabaceae,Acacia,Acacia irrorata,3.dicot,native
18/08/2019,265090,2019-08-20 18:39:11 UTC,Fabaceae,Acacia,Acacia linifolia,3.dicot,native
23/12/2019,2488549,2019-12-23 00:52:14 UTC,Fabaceae,Acacia,Acacia linifolia,3.dicot,native
18/01/2020,2488549,2020-01-17 23:39:37 UTC,Fabaceae,Acacia,Acacia linifolia,3.dicot,native
25/01/2020,2488549,2020-01-25 01:25:55 UTC,Fabaceae,Acacia,Acacia linifolia,3.dicot,native
5/04/2020,2488549,2020-04-05 04:35:17 UTC,Fabaceae,Acacia,Acacia linifolia,3.dicot,native
8/05/2020,2488549,2020-05-08 01:31:24 UTC,Fabaceae,Acacia,Acacia linifolia,3.dicot,native
12/07/2020,2488549,2020-07-15 01:29:59 UTC,Fabaceae,Acacia,Acacia linifolia,3.dicot,native
16/07/2020,2488549,2020-07-16 09:04:10 UTC,Fabaceae,Acacia,Acacia linifolia,3.dicot,native
18/07/2020,2488549,2020-07-18 08:50:11 UTC,Fabaceae,Acacia,Acacia linifolia,3.dicot,native
7/04/2020,3408787,2020-08-09 11:47:22 UTC,Fabaceae,Acacia,Acacia linifolia,3.dicot,native
27/12/2020,2488549,2020-12-27 09:11:24 UTC,Fabaceae,Acacia,Acacia linifolia,3.dicot,native
28/12/2020,2488549,2020-12-28 20:46:31 UTC,Fabaceae,Acacia,Acacia linifolia,3.dicot,native
5/01/2021,2488549,2021-01-05 10:10:02 UTC,Fabaceae,Acacia,Acacia linifolia,3.dicot,native
31/01/2021,2488549,2021-01-31 04:54:27 UTC,Fabaceae,Acacia,Acacia linifolia,3.dicot,native
25/06/2021,2488549,2021-06-27 02:36:40 UTC,Fabaceae,Acacia,Acacia linifolia,3.dicot,native
18/07/2021,2488549,2021-07-19 11:29:42 UTC,Fabaceae,Acacia,Acacia linifolia,3.dicot,native
28/04/2021,4743351,2021-07-20 11:17:55 UTC,Fabaceae,Acacia,Acacia linifolia,3.dicot,native
18/08/2020,4743351,2021-07-26 05:31:18 UTC,Fabaceae,Acacia,Acacia linifolia,3.dicot,native
26/08/2021,2488549,2021-08-27 01:32:32 UTC,Fabaceae,Acacia,Acacia linifolia,3.dicot,native
27/08/2021,4743351,2021-08-29 04:54:38 UTC,Fabaceae,Acacia,Acacia linifolia,3.dicot,native
5/09/2021,2488549,2021-09-05 09:57:56 UTC,Fabaceae,Acacia,Acacia linifolia,3.dicot,native
5/09/2021,2488549,2021-09-05 10:32:50 UTC,Fabaceae,Acacia,Acacia linifolia,3.dicot,native
6/09/2021,4916136,2021-09-06 10:19:14 UTC,Fabaceae,Acacia,Acacia linifolia,3.dicot,native
10/09/2021,2488549,2021-09-10 11:01:02 UTC,Fabaceae,Acacia,Acacia linifolia,3.dicot,native
17/09/2021,2488549,2021-09-17 11:35:13 UTC,Fabaceae,Acacia,Acacia linifolia,3.dicot,native
21/09/2021,4743351,2021-09-22 10:47:54 UTC,Fabaceae,Acacia,Acacia linifolia,3.dicot,native
19/10/2021,4743351,2021-10-24 07:28:49 UTC,Fabaceae,Acacia,Acacia linifolia,3.dicot,native
17/12/2021,2488549,2021-12-17 09:59:12 UTC,Fabaceae,Acacia,Acacia linifolia,3.dicot,native
31/12/2021,2488549,2021-12-31 09:29:08 UTC,Fabaceae,Acacia,Acacia linifolia,3.dicot,native
1/01/2022,265090,2022-01-01 19:11:30 UTC,Fabaceae,Acacia,Acacia linifolia,3.dicot,native
4/02/2022,2488549,2022-02-05 09:09:28 UTC,Fabaceae,Acacia,Acacia linifolia,3.dicot,native
13/02/2022,2488549,2022-02-13 04:11:58 UTC,Fabaceae,Acacia,Acacia linifolia,3.dicot,native
13/02/2022,2488549,2022-02-13 08:49:34 UTC,Fabaceae,Acacia,Acacia linifolia,3.dicot,native
16/05/2020,3408787,2022-02-15 16:38:06 UTC,Fabaceae,Acacia,Acacia linifolia,3.dicot,native
16/05/2020,3408787,2022-02-15 17:50:52 UTC,Fabaceae,Acacia,Acacia linifolia,3.dicot,native
21/02/2022,2488549,2022-02-21 08:41:53 UTC,Fabaceae,Acacia,Acacia linifolia,3.dicot,native
21/02/2022,2488549,2022-02-21 08:42:00 UTC,Fabaceae,Acacia,Acacia linifolia,3.dicot,native
9/02/2022,4916136,2022-02-26 06:41:00 UTC,Fabaceae,Acacia,Acacia linifolia,3.dicot,native
10/03/2022,2488549,2022-03-10 10:40:06 UTC,Fabaceae,Acacia,Acacia linifolia,3.dicot,native
10/03/2022,2488549,2022-03-10 10:40:07 UTC,Fabaceae,Acacia,Acacia linifolia,3.dicot,native
13/04/2022,5084744,2022-04-13 01:46:56 UTC,Fabaceae,Acacia,Acacia linifolia,3.dicot,native
16/04/2022,2488549,2022-04-16 06:31:28 UTC,Fabaceae,Acacia,Acacia linifolia,3.dicot,native
16/04/2022,3751299,2022-04-16 10:28:10 UTC,Fabaceae,Acacia,Acacia linifolia,3.dicot,native
28/04/2022,2488549,2022-04-28 06:27:23 UTC,Fabaceae,Acacia,Acacia linifolia,3.dicot,native
30/04/2022,1138587,2022-04-30 08:39:48 UTC,Fabaceae,Acacia,Acacia linifolia,3.dicot,native
30/04/2022,1138587,2022-04-30 09:48:58 UTC,Fabaceae,Acacia,Acacia linifolia,3.dicot,native
22/05/2022,2488549,2022-05-22 11:46:20 UTC,Fabaceae,Acacia,Acacia linifolia,3.dicot,native
4/06/2022,2488549,2022-06-04 08:14:41 UTC,Fabaceae,Acacia,Acacia linifolia,3.dicot,native
9/06/2022,2488549,2022-06-09 04:16:36 UTC,Fabaceae,Acacia,Acacia linifolia,3.dicot,native
23/06/2022,2488549,2022-06-23 04:05:22 UTC,Fabaceae,Acacia,Acacia linifolia,3.dicot,native
26/06/2022,2322306,2022-06-27 09:28:13 UTC,Fabaceae,Acacia,Acacia linifolia,3.dicot,native
29/07/2022,2488549,2022-07-29 03:32:33 UTC,Fabaceae,Acacia,Acacia linifolia,3.dicot,native
14/08/2022,265090,2022-08-14 07:58:15 UTC,Fabaceae,Acacia,Acacia linifolia,3.dicot,native
9/10/2022,6195722,2022-10-24 10:48:58 UTC,Fabaceae,Acacia,Acacia linifolia,3.dicot,native
13/11/2022,2488549,2022-11-13 06:15:41 UTC,Fabaceae,Acacia,Acacia linifolia,3.dicot,native
26/11/2022,4743351,2022-11-29 10:16:14 UTC,Fabaceae,Acacia,Acacia linifolia,3.dicot,native
25/09/2022,4743351,2022-12-22 23:49:49 UTC,Fabaceae,Acacia,Acacia linifolia,3.dicot,native
26/01/2023,2376854,2023-01-27 12:25:29 UTC,Fabaceae,Acacia,Acacia linifolia,3.dicot,native
10/02/2023,1175154,2023-02-10 20:23:07 UTC,Fabaceae,Acacia,Acacia linifolia,3.dicot,native
12/02/2023,74355,2023-02-12 00:18:45 UTC,Fabaceae,Acacia,Acacia linifolia,3.dicot,native
12/02/2023,4743351,2023-02-13 10:50:54 UTC,Fabaceae,Acacia,Acacia linifolia,3.dicot,native
26/02/2023,6190122,2023-02-26 07:26:30 UTC,Fabaceae,Acacia,Acacia linifolia,3.dicot,native
12/03/2023,6566631,2023-03-12 05:27:54 UTC,Fabaceae,Acacia,Acacia linifolia,3.dicot,native
9/03/2023,1658043,2023-03-13 07:22:33 UTC,Fabaceae,Acacia,Acacia linifolia,3.dicot,native
25/03/2023,5439347,2023-03-25 02:32:32 UTC,Fabaceae,Acacia,Acacia linifolia,3.dicot,native
5/04/2023,1809954,2023-04-06 22:54:28 UTC,Fabaceae,Acacia,Acacia linifolia,3.dicot,native
17/04/2023,6308282,2023-04-17 02:35:56 UTC,Fabaceae,Acacia,Acacia linifolia,3.dicot,native
17/04/2023,6308282,2023-04-17 02:47:05 UTC,Fabaceae,Acacia,Acacia linifolia,3.dicot,native
25/05/2023,2488549,2023-05-25 08:57:02 UTC,Fabaceae,Acacia,Acacia linifolia,3.dicot,native
22/06/2023,2488549,2023-06-22 03:39:37 UTC,Fabaceae,Acacia,Acacia linifolia,3.dicot,native
24/06/2023,2488549,2023-06-24 09:55:56 UTC,Fabaceae,Acacia,Acacia linifolia,3.dicot,native
16/07/2023,7001195,2023-07-16 06:14:13 UTC,Fabaceae,Acacia,Acacia linifolia,3.dicot,native
16/07/2023,6310500,2023-07-16 06:14:38 UTC,Fabaceae,Acacia,Acacia linifolia,3.dicot,native
16/07/2023,5315657,2023-07-16 06:16:23 UTC,Fabaceae,Acacia,Acacia linifolia,3.dicot,native
11/08/2023,4743351,2023-08-12 12:27:01 UTC,Fabaceae,Acacia,Acacia linifolia,3.dicot,native
11/08/2023,4743351,2023-08-12 12:27:06 UTC,Fabaceae,Acacia,Acacia linifolia,3.dicot,native
28/08/2023,3678274,2023-08-28 13:24:23 UTC,Fabaceae,Acacia,Acacia linifolia,3.dicot,native
14/09/2023,4203451,2023-09-14 02:23:19 UTC,Fabaceae,Acacia,Acacia linifolia,3.dicot,native
5/09/2023,4743351,2023-09-14 11:56:19 UTC,Fabaceae,Acacia,Acacia linifolia,3.dicot,native
20/09/2023,5435930,2023-09-25 12:15:13 UTC,Fabaceae,Acacia,Acacia linifolia,3.dicot,native
24/09/2023,1138587,2023-09-27 01:50:04 UTC,Fabaceae,Acacia,Acacia linifolia,3.dicot,native
24/09/2023,661392,2023-09-28 09:29:30 UTC,Fabaceae,Acacia,Acacia linifolia,3.dicot,native
24/09/2023,661392,2023-09-28 09:37:38 UTC,Fabaceae,Acacia,Acacia linifolia,3.dicot,native
8/10/2023,7143748,2023-10-08 05:41:03 UTC,Fabaceae,Acacia,Acacia linifolia,3.dicot,native
16/09/2023,745089,2023-11-07 07:10:03 UTC,Fabaceae,Acacia,Acacia linifolia,3.dicot,native
25/11/2023,3408787,2023-12-07 12:57:56 UTC,Fabaceae,Acacia,Acacia linifolia,3.dicot,native
17/09/2023,745089,2023-12-09 05:39:10 UTC,Fabaceae,Acacia,Acacia linifolia,3.dicot,native
17/09/2023,745089,2023-12-10 01:19:08 UTC,Fabaceae,Acacia,Acacia linifolia,3.dicot,native
17/12/2023,1305186,2023-12-17 12:07:23 UTC,Fabaceae,Acacia,Acacia linifolia,3.dicot,native
3/02/2024,3879229,2024-02-03 05:47:13 UTC,Fabaceae,Acacia,Acacia linifolia,3.dicot,native
10/02/2024,1138587,2024-02-10 07:12:38 UTC,Fabaceae,Acacia,Acacia linifolia,3.dicot,native
11/02/2024,4672448,2024-02-11 03:51:23 UTC,Fabaceae,Acacia,Acacia linifolia,3.dicot,native
20/02/2024,4743351,2024-02-20 23:21:14 UTC,Fabaceae,Acacia,Acacia linifolia,3.dicot,native
24/05/2020,2488549,2020-05-24 03:56:07 UTC,Fabaceae,Acacia,Acacia longifolia,3.dicot,native
11/06/2020,2488549,2020-06-11 06:47:09 UTC,Fabaceae,Acacia,Acacia longifolia,3.dicot,native
15/06/2020,2488549,2020-06-15 06:55:31 UTC,Fabaceae,Acacia,Acacia longifolia,3.dicot,native
15/06/2020,2488549,2020-06-15 07:23:34 UTC,Fabaceae,Acacia,Acacia longifolia,3.dicot,native
23/06/2020,2488549,2020-06-23 05:15:23 UTC,Fabaceae,Acacia,Acacia longifolia,3.dicot,native
23/06/2020,2488549,2020-06-23 05:52:50 UTC,Fabaceae,Acacia,Acacia longifolia,3.dicot,native
23/06/2020,2488549,2020-06-23 06:46:09 UTC,Fabaceae,Acacia,Acacia longifolia,3.dicot,native
7/07/2020,3030240,2020-07-08 02:58:07 UTC,Fabaceae,Acacia,Acacia longifolia,3.dicot,native
9/07/2020,2488549,2020-07-09 12:35:31 UTC,Fabaceae,Acacia,Acacia longifolia,3.dicot,native
9/07/2020,2488549,2020-07-09 12:53:39 UTC,Fabaceae,Acacia,Acacia longifolia,3.dicot,native
12/07/2020,2488549,2020-07-15 01:25:16 UTC,Fabaceae,Acacia,Acacia longifolia,3.dicot,native
15/07/2020,3299714,2020-07-15 06:00:42 UTC,Fabaceae,Acacia,Acacia longifolia,3.dicot,native
15/07/2020,2488549,2020-07-15 07:03:52 UTC,Fabaceae,Acacia,Acacia longifolia,3.dicot,native
18/07/2020,2488549,2020-07-18 08:43:18 UTC,Fabaceae,Acacia,Acacia longifolia,3.dicot,native
18/07/2020,2518052,2020-07-20 11:31:39 UTC,Fabaceae,Acacia,Acacia longifolia,3.dicot,native
24/07/2020,2488549,2020-07-24 11:45:31 UTC,Fabaceae,Acacia,Acacia longifolia,3.dicot,native
20/07/2020,793005,2020-08-03 02:21:59 UTC,Fabaceae,Acacia,Acacia longifolia,3.dicot,native
12/08/2020,2488549,2020-08-12 02:56:11 UTC,Fabaceae,Acacia,Acacia longifolia,3.dicot,native
15/08/2020,575123,2020-09-05 07:26:45 UTC,Fabaceae,Acacia,Acacia longifolia,3.dicot,native
25/06/2021,2488549,2021-06-27 02:36:39 UTC,Fabaceae,Acacia,Acacia longifolia,3.dicot,native
25/06/2021,2488549,2021-06-27 02:36:42 UTC,Fabaceae,Acacia,Acacia longifolia,3.dicot,native
27/06/2021,3957444,2021-06-27 08:05:01 UTC,Fabaceae,Acacia,Acacia longifolia,3.dicot,native
18/07/2021,2488549,2021-07-19 11:34:33 UTC,Fabaceae,Acacia,Acacia longifolia,3.dicot,native
25/07/2021,2488549,2021-07-25 10:03:18 UTC,Fabaceae,Acacia,Acacia longifolia,3.dicot,native
30/07/2021,2488549,2021-07-30 07:06:02 UTC,Fabaceae,Acacia,Acacia longifolia,3.dicot,native
20/08/2021,2488549,2021-08-20 10:53:37 UTC,Fabaceae,Acacia,Acacia longifolia,3.dicot,native
5/09/2021,2488549,2021-09-05 09:57:55 UTC,Fabaceae,Acacia,Acacia longifolia,3.dicot,native
10/09/2021,2488549,2021-09-10 08:06:52 UTC,Fabaceae,Acacia,Acacia longifolia,3.dicot,native
12/09/2021,2488549,2021-09-12 09:15:49 UTC,Fabaceae,Acacia,Acacia longifolia,3.dicot,native
18/09/2021,4945027,2021-09-18 10:35:56 UTC,Fabaceae,Acacia,Acacia longifolia,3.dicot,native
20/11/2021,2488549,2021-11-20 10:17:39 UTC,Fabaceae,Acacia,Acacia longifolia,3.dicot,native
21/02/2022,2488549,2022-02-21 08:42:01 UTC,Fabaceae,Acacia,Acacia longifolia,3.dicot,native
15/04/2022,2488549,2022-04-15 08:57:18 UTC,Fabaceae,Acacia,Acacia longifolia,3.dicot,native
30/04/2022,1138587,2022-04-30 08:39:35 UTC,Fabaceae,Acacia,Acacia longifolia,3.dicot,native
30/04/2022,1138587,2022-04-30 09:06:29 UTC,Fabaceae,Acacia,Acacia longifolia,3.dicot,native
22/05/2022,2488549,2022-05-23 06:44:25 UTC,Fabaceae,Acacia,Acacia longifolia,3.dicot,native
27/05/2022,2488549,2022-05-27 04:02:25 UTC,Fabaceae,Acacia,Acacia longifolia,3.dicot,native
15/07/1989,717200,2022-06-02 06:49:27 UTC,Fabaceae,Acacia,Acacia longifolia,3.dicot,native
4/06/2022,2488549,2022-06-04 08:12:29 UTC,Fabaceae,Acacia,Acacia longifolia,3.dicot,native
23/06/2022,2488549,2022-06-23 04:02:50 UTC,Fabaceae,Acacia,Acacia longifolia,3.dicot,native
23/06/2022,2488549,2022-06-23 04:04:29 UTC,Fabaceae,Acacia,Acacia longifolia,3.dicot,native
1/07/2022,4743351,2022-07-02 03:14:35 UTC,Fabaceae,Acacia,Acacia longifolia,3.dicot,native
24/07/2022,1175154,2022-07-24 07:15:20 UTC,Fabaceae,Acacia,Acacia longifolia,3.dicot,native
24/07/2022,1175154,2022-07-24 07:18:09 UTC,Fabaceae,Acacia,Acacia longifolia,3.dicot,native
29/07/2022,2488549,2022-07-29 03:11:38 UTC,Fabaceae,Acacia,Acacia longifolia,3.dicot,native
6/08/2022,2488549,2022-08-06 08:55:27 UTC,Fabaceae,Acacia,Acacia longifolia,3.dicot,native
7/08/2022,4045770,2022-08-07 06:03:33 UTC,Fabaceae,Acacia,Acacia longifolia,3.dicot,native
6/08/2022,4743351,2022-08-08 01:05:19 UTC,Fabaceae,Acacia,Acacia longifolia,3.dicot,native
9/08/2022,2488549,2022-08-09 04:00:23 UTC,Fabaceae,Acacia,Acacia longifolia,3.dicot,native
17/08/2022,2488549,2022-08-17 21:28:54 UTC,Fabaceae,Acacia,Acacia longifolia,3.dicot,native
12/04/2023,6612786,2023-04-27 03:00:37 UTC,Fabaceae,Acacia,Acacia longifolia,3.dicot,native
25/05/2023,2488549,2023-05-25 08:54:33 UTC,Fabaceae,Acacia,Acacia longifolia,3.dicot,native
15/06/2023,2531563,2023-06-20 04:47:34 UTC,Fabaceae,Acacia,Acacia longifolia,3.dicot,native
22/06/2023,2488549,2023-06-22 03:39:36 UTC,Fabaceae,Acacia,Acacia longifolia,3.dicot,native
22/06/2023,2488549,2023-06-22 03:39:40 UTC,Fabaceae,Acacia,Acacia longifolia,3.dicot,native
2/07/2023,3936801,2023-07-02 02:48:00 UTC,Fabaceae,Acacia,Acacia longifolia,3.dicot,native
2/07/2023,3936801,2023-07-02 02:49:35 UTC,Fabaceae,Acacia,Acacia longifolia,3.dicot,native
6/07/2023,4916136,2023-07-06 06:06:33 UTC,Fabaceae,Acacia,Acacia longifolia,3.dicot,native
11/07/2023,4916136,2023-07-11 08:30:55 UTC,Fabaceae,Acacia,Acacia longifolia,3.dicot,native
16/07/2023,2366151,2023-07-16 11:27:15 UTC,Fabaceae,Acacia,Acacia longifolia,3.dicot,native
20/07/2023,6196075,2023-07-20 01:48:48 UTC,Fabaceae,Acacia,Acacia longifolia,3.dicot,native
20/07/2023,6196075,2023-07-20 01:54:56 UTC,Fabaceae,Acacia,Acacia longifolia,3.dicot,native
29/07/2023,2650798,2023-07-30 10:44:08 UTC,Fabaceae,Acacia,Acacia longifolia,3.dicot,native
3/08/2023,5300031,2023-08-03 10:13:45 UTC,Fabaceae,Acacia,Acacia longifolia,3.dicot,native
11/08/2023,4743351,2023-08-13 03:27:29 UTC,Fabaceae,Acacia,Acacia longifolia,3.dicot,native
19/08/2023,6209647,2023-08-25 14:28:15 UTC,Fabaceae,Acacia,Acacia longifolia,3.dicot,native
24/09/2023,1138587,2023-09-27 02:45:30 UTC,Fabaceae,Acacia,Acacia longifolia,3.dicot,native
24/09/2023,661392,2023-09-28 07:58:54 UTC,Fabaceae,Acacia,Acacia longifolia,3.dicot,native
16/12/2021,2488549,2021-12-16 10:03:21 UTC,Fabaceae,Acacia,Acacia longissima,3.dicot,native
16/12/2021,2488549,2021-12-16 10:03:22 UTC,Fabaceae,Acacia,Acacia longissima,3.dicot,native
29/08/2020,4743351,2021-07-25 10:37:34 UTC,Fabaceae,Acacia,Acacia mearnsii,3.dicot,native
22/06/2023,2488549,2023-06-22 03:39:38 UTC,Fabaceae,Acacia,Acacia mearnsii,3.dicot,native
28/12/2020,2488549,2020-12-28 08:45:55 UTC,Fabaceae,Acacia,Acacia melanoxylon,3.dicot,native
24/04/2020,2488549,2020-04-24 03:57:11 UTC,Fabaceae,Acacia,Acacia myrtifolia,3.dicot,native
26/04/2020,2488549,2020-04-26 07:58:44 UTC,Fabaceae,Acacia,Acacia myrtifolia,3.dicot,native
26/04/2020,2488549,2020-04-26 08:01:03 UTC,Fabaceae,Acacia,Acacia myrtifolia,3.dicot,native
1/05/2020,2488549,2020-05-01 06:30:12 UTC,Fabaceae,Acacia,Acacia myrtifolia,3.dicot,native
1/05/2020,2488549,2020-05-01 07:27:43 UTC,Fabaceae,Acacia,Acacia myrtifolia,3.dicot,native
2/05/2020,2488549,2020-05-02 09:11:15 UTC,Fabaceae,Acacia,Acacia myrtifolia,3.dicot,native
3/05/2020,2488549,2020-05-03 01:38:08 UTC,Fabaceae,Acacia,Acacia myrtifolia,3.dicot,native
8/05/2020,2488549,2020-05-08 01:41:45 UTC,Fabaceae,Acacia,Acacia myrtifolia,3.dicot,native
24/05/2020,2488549,2020-05-24 04:57:52 UTC,Fabaceae,Acacia,Acacia myrtifolia,3.dicot,native
11/06/2020,2488549,2020-06-11 06:46:19 UTC,Fabaceae,Acacia,Acacia myrtifolia,3.dicot,native
11/06/2020,2488549,2020-06-11 06:49:20 UTC,Fabaceae,Acacia,Acacia myrtifolia,3.dicot,native
9/07/2020,2488549,2020-07-09 12:54:42 UTC,Fabaceae,Acacia,Acacia myrtifolia,3.dicot,native
15/07/2020,2488549,2020-07-15 07:01:31 UTC,Fabaceae,Acacia,Acacia myrtifolia,3.dicot,native
16/07/2020,2488549,2020-07-16 10:44:03 UTC,Fabaceae,Acacia,Acacia myrtifolia,3.dicot,native
19/07/2020,447429,2020-07-19 08:05:22 UTC,Fabaceae,Acacia,Acacia myrtifolia,3.dicot,native
12/08/2020,2488549,2020-08-12 04:53:04 UTC,Fabaceae,Acacia,Acacia myrtifolia,3.dicot,native
12/08/2020,2488549,2020-08-12 07:10:50 UTC,Fabaceae,Acacia,Acacia myrtifolia,3.dicot,native
15/08/2020,575123,2020-09-05 07:23:46 UTC,Fabaceae,Acacia,Acacia myrtifolia,3.dicot,native
18/09/2020,2488549,2020-09-18 03:21:55 UTC,Fabaceae,Acacia,Acacia myrtifolia,3.dicot,native
18/09/2020,2488549,2020-09-18 08:44:30 UTC,Fabaceae,Acacia,Acacia myrtifolia,3.dicot,native
26/09/2020,2488549,2020-09-26 10:04:10 UTC,Fabaceae,Acacia,Acacia myrtifolia,3.dicot,native
25/06/2021,2488549,2021-06-27 02:36:41 UTC,Fabaceae,Acacia,Acacia myrtifolia,3.dicot,native
25/06/2021,2488549,2021-06-27 02:36:42 UTC,Fabaceae,Acacia,Acacia myrtifolia,3.dicot,native
4/07/2021,2488549,2021-07-04 09:57:44 UTC,Fabaceae,Acacia,Acacia myrtifolia,3.dicot,native
25/07/2021,2488549,2021-07-25 10:27:26 UTC,Fabaceae,Acacia,Acacia myrtifolia,3.dicot,native
30/07/2021,2488549,2021-07-30 07:06:03 UTC,Fabaceae,Acacia,Acacia myrtifolia,3.dicot,native
7/07/2020,4743351,2021-08-01 10:31:29 UTC,Fabaceae,Acacia,Acacia myrtifolia,3.dicot,native
20/08/2021,2488549,2021-08-20 10:53:39 UTC,Fabaceae,Acacia,Acacia myrtifolia,3.dicot,native
26/08/2021,2488549,2021-08-27 01:32:35 UTC,Fabaceae,Acacia,Acacia myrtifolia,3.dicot,native
5/09/2021,2488549,2021-09-05 10:15:16 UTC,Fabaceae,Acacia,Acacia myrtifolia,3.dicot,native
19/11/2021,2488549,2021-11-20 02:23:24 UTC,Fabaceae,Acacia,Acacia myrtifolia,3.dicot,native
4/02/2022,2488549,2022-02-05 09:09:26 UTC,Fabaceae,Acacia,Acacia myrtifolia,3.dicot,native
13/02/2022,2488549,2022-02-13 08:49:35 UTC,Fabaceae,Acacia,Acacia myrtifolia,3.dicot,native
13/02/2022,2488549,2022-02-13 08:49:37 UTC,Fabaceae,Acacia,Acacia myrtifolia,3.dicot,native
10/03/2022,2488549,2022-03-10 10:40:08 UTC,Fabaceae,Acacia,Acacia myrtifolia,3.dicot,native
10/03/2022,2488549,2022-03-10 10:40:09 UTC,Fabaceae,Acacia,Acacia myrtifolia,3.dicot,native
16/04/2022,2488549,2022-04-16 06:31:35 UTC,Fabaceae,Acacia,Acacia myrtifolia,3.dicot,native
30/04/2022,1138587,2022-04-30 09:06:29 UTC,Fabaceae,Acacia,Acacia myrtifolia,3.dicot,native
30/04/2022,1138587,2022-04-30 09:06:34 UTC,Fabaceae,Acacia,Acacia myrtifolia,3.dicot,native
14/05/2022,2488549,2022-05-14 09:10:40 UTC,Fabaceae,Acacia,Acacia myrtifolia,3.dicot,native
22/05/2022,2488549,2022-05-22 11:46:10 UTC,Fabaceae,Acacia,Acacia myrtifolia,3.dicot,native
23/06/2022,2488549,2022-06-23 04:09:05 UTC,Fabaceae,Acacia,Acacia myrtifolia,3.dicot,native
23/06/2022,2488549,2022-06-23 05:21:35 UTC,Fabaceae,Acacia,Acacia myrtifolia,3.dicot,native
23/06/2022,2488549,2022-06-23 05:22:29 UTC,Fabaceae,Acacia,Acacia myrtifolia,3.dicot,native
24/07/2022,2488549,2022-07-24 04:00:52 UTC,Fabaceae,Acacia,Acacia myrtifolia,3.dicot,native
24/07/2022,1175154,2022-07-24 07:16:45 UTC,Fabaceae,Acacia,Acacia myrtifolia,3.dicot,native
24/07/2022,265090,2022-07-25 19:23:34 UTC,Fabaceae,Acacia,Acacia myrtifolia,3.dicot,native
6/08/2022,4743351,2022-08-08 05:06:56 UTC,Fabaceae,Acacia,Acacia myrtifolia,3.dicot,native
9/08/2022,2488549,2022-08-09 03:53:40 UTC,Fabaceae,Acacia,Acacia myrtifolia,3.dicot,native
14/08/2022,265090,2022-08-14 09:20:14 UTC,Fabaceae,Acacia,Acacia myrtifolia,3.dicot,native
9/03/2023,1658043,2023-03-13 07:22:46 UTC,Fabaceae,Acacia,Acacia myrtifolia,3.dicot,native
5/04/2023,1809954,2023-04-06 22:54:27 UTC,Fabaceae,Acacia,Acacia myrtifolia,3.dicot,native
25/05/2023,2488549,2023-05-25 09:01:17 UTC,Fabaceae,Acacia,Acacia myrtifolia,3.dicot,native
22/06/2023,2488549,2023-06-22 03:39:36 UTC,Fabaceae,Acacia,Acacia myrtifolia,3.dicot,native
24/06/2023,2488549,2023-06-24 09:55:58 UTC,Fabaceae,Acacia,Acacia myrtifolia,3.dicot,native
16/07/2023,3978191,2023-07-16 10:01:53 UTC,Fabaceae,Acacia,Acacia myrtifolia,3.dicot,native
29/07/2023,2650798,2023-07-30 10:30:05 UTC,Fabaceae,Acacia,Acacia myrtifolia,3.dicot,native
11/08/2023,4743351,2023-08-12 12:27:00 UTC,Fabaceae,Acacia,Acacia myrtifolia,3.dicot,native
21/08/2023,4177273,2023-08-21 19:41:11 UTC,Fabaceae,Acacia,Acacia myrtifolia,3.dicot,native
2/01/2024,1138587,2024-01-02 07:38:42 UTC,Fabaceae,Acacia,Acacia myrtifolia,3.dicot,native
21/04/2024,265090,2024-04-21 06:15:00 UTC,Fabaceae,Acacia,Acacia myrtifolia,3.dicot,native
5/05/2024,4317345,2024-05-05 09:31:42 UTC,Fabaceae,Acacia,Acacia myrtifolia,3.dicot,native
25/07/2021,2488549,2021-07-26 01:13:43 UTC,Fabaceae,Acacia,Acacia parramattensis,3.dicot,native
9/09/2021,4887682,2021-09-08 23:45:06 UTC,Fabaceae,Acacia,Acacia parramattensis,3.dicot,native
10/09/2021,2488549,2021-09-10 08:11:58 UTC,Fabaceae,Acacia,Acacia parramattensis,3.dicot,native
22/10/2021,2488549,2021-10-22 09:10:44 UTC,Fabaceae,Acacia,Acacia parramattensis,3.dicot,native
20/11/2021,2488549,2021-11-20 10:17:45 UTC,Fabaceae,Acacia,Acacia parramattensis,3.dicot,native
16/12/2021,2488549,2021-12-16 10:03:15 UTC,Fabaceae,Acacia,Acacia parramattensis,3.dicot,native
10/01/2022,2488549,2022-01-14 05:15:16 UTC,Fabaceae,Acacia,Acacia parramattensis,3.dicot,native
4/02/2022,2488549,2022-02-05 09:09:26 UTC,Fabaceae,Acacia,Acacia parramattensis,3.dicot,native
15/04/2022,2488549,2022-04-15 09:00:44 UTC,Fabaceae,Acacia,Acacia parramattensis,3.dicot,native
27/05/2022,2488549,2022-05-27 04:02:26 UTC,Fabaceae,Acacia,Acacia parramattensis,3.dicot,native
4/06/2022,2488549,2022-06-04 08:14:52 UTC,Fabaceae,Acacia,Acacia parramattensis,3.dicot,native
23/06/2022,2488549,2022-06-23 03:54:33 UTC,Fabaceae,Acacia,Acacia parramattensis,3.dicot,native
23/06/2022,2488549,2022-06-23 03:56:09 UTC,Fabaceae,Acacia,Acacia parramattensis,3.dicot,native
24/07/2022,2488549,2022-07-24 03:57:08 UTC,Fabaceae,Acacia,Acacia parramattensis,3.dicot,native
24/07/2022,2488549,2022-07-24 04:21:37 UTC,Fabaceae,Acacia,Acacia parramattensis,3.dicot,native
6/08/2022,2488549,2022-08-06 08:56:57 UTC,Fabaceae,Acacia,Acacia parramattensis,3.dicot,native
10/11/2022,2488549,2022-11-10 05:03:40 UTC,Fabaceae,Acacia,Acacia parramattensis,3.dicot,native
11/12/2022,2488549,2022-12-11 06:06:56 UTC,Fabaceae,Acacia,Acacia parramattensis,3.dicot,native
22/06/2023,2488549,2023-06-22 03:39:39 UTC,Fabaceae,Acacia,Acacia parramattensis,3.dicot,native
4/10/2020,2488549,2020-10-05 03:19:12 UTC,Fabaceae,Acacia,Acacia podalyriifolia,3.dicot,introduced
12/02/2023,4743351,2023-02-14 02:07:13 UTC,Fabaceae,Acacia,Acacia podalyriifolia,3.dicot,introduced
24/09/2023,1138587,2023-09-27 02:56:01 UTC,Fabaceae,Acacia,Acacia podalyriifolia,3.dicot,introduced
24/09/2023,661392,2023-10-03 13:49:19 UTC,Fabaceae,Acacia,Acacia podalyriifolia,3.dicot,introduced
12/08/2020,2488549,2020-08-12 07:38:37 UTC,Fabaceae,Acacia,Acacia stricta,3.dicot,native
18/09/2020,2488549,2020-09-18 07:27:04 UTC,Fabaceae,Acacia,Acacia stricta,3.dicot,native
14/05/2022,2488549,2022-05-14 09:13:41 UTC,Fabaceae,Acacia,Acacia stricta,3.dicot,native
17/08/2022,2488549,2022-08-17 13:17:52 UTC,Fabaceae,Acacia,Acacia stricta,3.dicot,native
25/05/2023,2488549,2023-05-25 08:53:46 UTC,Fabaceae,Acacia,Acacia stricta,3.dicot,native
16/04/2024,3936801,2024-04-16 12:27:58 UTC,Fabaceae,Acacia,Acacia stricta,3.dicot,native
13/06/2015,64271,2015-06-20 13:14:51 UTC,Fabaceae,Acacia,Acacia suaveolens,3.dicot,native
31/05/2012,1163555,2018-09-08 17:58:01 UTC,Fabaceae,Acacia,Acacia suaveolens,3.dicot,native
2/07/2019,196849,2019-07-02 10:02:51 UTC,Fabaceae,Acacia,Acacia suaveolens,3.dicot,native
9/04/2020,2723279,2020-04-10 11:18:16 UTC,Fabaceae,Acacia,Acacia suaveolens,3.dicot,native
9/04/2020,2723140,2020-04-17 03:08:44 UTC,Fabaceae,Acacia,Acacia suaveolens,3.dicot,native
17/04/2020,2761779,2020-04-17 05:44:35 UTC,Fabaceae,Acacia,Acacia suaveolens,3.dicot,native
17/04/2020,2488549,2020-04-17 07:49:02 UTC,Fabaceae,Acacia,Acacia suaveolens,3.dicot,native
17/04/2020,2488549,2020-04-17 09:30:32 UTC,Fabaceae,Acacia,Acacia suaveolens,3.dicot,native
18/04/2020,2488549,2020-04-18 23:55:31 UTC,Fabaceae,Acacia,Acacia suaveolens,3.dicot,native
18/04/2020,2488549,2020-04-19 00:06:35 UTC,Fabaceae,Acacia,Acacia suaveolens,3.dicot,native
26/04/2020,2488549,2020-04-26 08:01:33 UTC,Fabaceae,Acacia,Acacia suaveolens,3.dicot,native
1/05/2020,2488549,2020-05-01 06:24:20 UTC,Fabaceae,Acacia,Acacia suaveolens,3.dicot,native
8/05/2020,2488549,2020-05-08 01:40:38 UTC,Fabaceae,Acacia,Acacia suaveolens,3.dicot,native
16/05/2020,2488549,2020-05-16 01:23:50 UTC,Fabaceae,Acacia,Acacia suaveolens,3.dicot,native
24/05/2020,2488549,2020-05-24 04:56:44 UTC,Fabaceae,Acacia,Acacia suaveolens,3.dicot,native
11/06/2020,2488549,2020-06-11 06:45:15 UTC,Fabaceae,Acacia,Acacia suaveolens,3.dicot,native
11/06/2020,2488549,2020-06-11 06:51:16 UTC,Fabaceae,Acacia,Acacia suaveolens,3.dicot,native
5/07/2020,265090,2020-07-06 06:53:30 UTC,Fabaceae,Acacia,Acacia suaveolens,3.dicot,native
7/07/2020,3030240,2020-07-08 02:59:06 UTC,Fabaceae,Acacia,Acacia suaveolens,3.dicot,native
16/07/2020,2488549,2020-07-16 08:54:25 UTC,Fabaceae,Acacia,Acacia suaveolens,3.dicot,native
16/07/2020,2488549,2020-07-16 10:37:01 UTC,Fabaceae,Acacia,Acacia suaveolens,3.dicot,native
18/07/2020,2488549,2020-07-18 08:40:39 UTC,Fabaceae,Acacia,Acacia suaveolens,3.dicot,native
18/07/2020,2488549,2020-07-18 09:00:27 UTC,Fabaceae,Acacia,Acacia suaveolens,3.dicot,native
24/07/2020,2488549,2020-07-24 10:20:33 UTC,Fabaceae,Acacia,Acacia suaveolens,3.dicot,native
12/08/2020,2488549,2020-08-12 03:37:51 UTC,Fabaceae,Acacia,Acacia suaveolens,3.dicot,native
12/08/2020,2488549,2020-08-12 04:48:04 UTC,Fabaceae,Acacia,Acacia suaveolens,3.dicot,native
29/08/2020,2488549,2020-08-29 09:49:08 UTC,Fabaceae,Acacia,Acacia suaveolens,3.dicot,native
18/10/2020,265090,2020-10-19 19:24:01 UTC,Fabaceae,Acacia,Acacia suaveolens,3.dicot,native
6/04/2021,3748684,2021-04-08 12:48:16 UTC,Fabaceae,Acacia,Acacia suaveolens,3.dicot,native
24/05/2021,3957444,2021-05-24 11:02:38 UTC,Fabaceae,Acacia,Acacia suaveolens,3.dicot,native
6/06/2021,3313584,2021-06-20 13:17:41 UTC,Fabaceae,Acacia,Acacia suaveolens,3.dicot,native
25/06/2021,3197473,2021-06-25 05:09:49 UTC,Fabaceae,Acacia,Acacia suaveolens,3.dicot,native
25/06/2021,2488549,2021-06-27 02:36:40 UTC,Fabaceae,Acacia,Acacia suaveolens,3.dicot,native
3/07/2021,3978426,2021-07-03 06:48:16 UTC,Fabaceae,Acacia,Acacia suaveolens,3.dicot,native
3/07/2021,3978426,2021-07-03 07:10:11 UTC,Fabaceae,Acacia,Acacia suaveolens,3.dicot,native
3/07/2021,3313584,2021-07-07 12:43:48 UTC,Fabaceae,Acacia,Acacia suaveolens,3.dicot,native
18/07/2021,2488549,2021-07-19 11:14:59 UTC,Fabaceae,Acacia,Acacia suaveolens,3.dicot,native
15/06/2021,4743351,2021-07-20 05:32:45 UTC,Fabaceae,Acacia,Acacia suaveolens,3.dicot,native
25/07/2021,2488549,2021-07-25 10:28:33 UTC,Fabaceae,Acacia,Acacia suaveolens,3.dicot,native
24/07/2021,4095677,2021-07-25 11:42:00 UTC,Fabaceae,Acacia,Acacia suaveolens,3.dicot,native
30/07/2021,2488549,2021-07-30 07:06:02 UTC,Fabaceae,Acacia,Acacia suaveolens,3.dicot,native
7/07/2020,4743351,2021-08-02 00:11:34 UTC,Fabaceae,Acacia,Acacia suaveolens,3.dicot,native
22/07/2019,4743351,2021-08-04 05:58:49 UTC,Fabaceae,Acacia,Acacia suaveolens,3.dicot,native
2/07/2019,4743351,2021-08-04 06:25:29 UTC,Fabaceae,Acacia,Acacia suaveolens,3.dicot,native
20/08/2021,2488549,2021-08-20 11:00:24 UTC,Fabaceae,Acacia,Acacia suaveolens,3.dicot,native
26/08/2021,2488549,2021-08-27 01:32:34 UTC,Fabaceae,Acacia,Acacia suaveolens,3.dicot,native
30/08/2021,4916136,2021-08-30 11:52:08 UTC,Fabaceae,Acacia,Acacia suaveolens,3.dicot,native
5/09/2021,2488549,2021-09-05 09:57:56 UTC,Fabaceae,Acacia,Acacia suaveolens,3.dicot,native
10/09/2021,2488549,2021-09-10 10:04:20 UTC,Fabaceae,Acacia,Acacia suaveolens,3.dicot,native
10/09/2021,2488549,2021-09-10 10:44:10 UTC,Fabaceae,Acacia,Acacia suaveolens,3.dicot,native
17/09/2021,2488549,2021-09-17 11:31:55 UTC,Fabaceae,Acacia,Acacia suaveolens,3.dicot,native
28/09/2021,4916136,2021-09-28 12:57:43 UTC,Fabaceae,Acacia,Acacia suaveolens,3.dicot,native
28/10/2021,2665854,2021-10-29 20:25:38 UTC,Fabaceae,Acacia,Acacia suaveolens,3.dicot,native
20/11/2021,2488549,2021-11-20 10:17:42 UTC,Fabaceae,Acacia,Acacia suaveolens,3.dicot,native
14/12/2021,2488549,2021-12-15 01:46:58 UTC,Fabaceae,Acacia,Acacia suaveolens,3.dicot,native
13/02/2022,2488549,2022-02-13 08:49:35 UTC,Fabaceae,Acacia,Acacia suaveolens,3.dicot,native
7/04/2020,3408787,2022-02-14 18:20:12 UTC,Fabaceae,Acacia,Acacia suaveolens,3.dicot,native
21/02/2022,2488549,2022-02-21 08:41:58 UTC,Fabaceae,Acacia,Acacia suaveolens,3.dicot,native
24/11/2021,5376627,2022-02-23 21:13:49 UTC,Fabaceae,Acacia,Acacia suaveolens,3.dicot,native
16/05/2015,4002106,2022-03-06 19:47:26 UTC,Fabaceae,Acacia,Acacia suaveolens,3.dicot,native
10/03/2022,2488549,2022-03-10 10:40:07 UTC,Fabaceae,Acacia,Acacia suaveolens,3.dicot,native
15/04/2022,2488549,2022-04-15 09:02:11 UTC,Fabaceae,Acacia,Acacia suaveolens,3.dicot,native
16/04/2022,2488549,2022-04-16 06:31:29 UTC,Fabaceae,Acacia,Acacia suaveolens,3.dicot,native
16/04/2022,2488549,2022-04-16 06:31:33 UTC,Fabaceae,Acacia,Acacia suaveolens,3.dicot,native
16/04/2022,2488549,2022-04-16 06:31:41 UTC,Fabaceae,Acacia,Acacia suaveolens,3.dicot,native
28/04/2022,2488549,2022-04-28 06:24:51 UTC,Fabaceae,Acacia,Acacia suaveolens,3.dicot,native
30/04/2022,1138587,2022-04-30 08:15:18 UTC,Fabaceae,Acacia,Acacia suaveolens,3.dicot,native
30/04/2022,1138587,2022-04-30 09:06:30 UTC,Fabaceae,Acacia,Acacia suaveolens,3.dicot,native
7/05/2022,1175154,2022-05-07 05:02:13 UTC,Fabaceae,Acacia,Acacia suaveolens,3.dicot,native
1/05/2022,5648269,2022-05-08 19:25:06 UTC,Fabaceae,Acacia,Acacia suaveolens,3.dicot,native
7/05/2022,2399118,2022-05-13 04:32:10 UTC,Fabaceae,Acacia,Acacia suaveolens,3.dicot,native
14/05/2022,5640535,2022-05-14 01:18:31 UTC,Fabaceae,Acacia,Acacia suaveolens,3.dicot,native
14/05/2022,2488549,2022-05-14 09:11:17 UTC,Fabaceae,Acacia,Acacia suaveolens,3.dicot,native
7/06/2022,1233583,2022-06-07 08:49:26 UTC,Fabaceae,Acacia,Acacia suaveolens,3.dicot,native
12/06/2022,3425899,2022-06-23 06:50:46 UTC,Fabaceae,Acacia,Acacia suaveolens,3.dicot,native
24/04/2022,3221790,2022-06-29 10:31:40 UTC,Fabaceae,Acacia,Acacia suaveolens,3.dicot,native
25/07/2022,4724286,2022-07-25 09:10:37 UTC,Fabaceae,Acacia,Acacia suaveolens,3.dicot,native
29/07/2022,2488549,2022-07-29 03:33:25 UTC,Fabaceae,Acacia,Acacia suaveolens,3.dicot,native
7/08/2022,4045770,2022-08-07 05:48:43 UTC,Fabaceae,Acacia,Acacia suaveolens,3.dicot,native
7/08/2022,4045770,2022-08-07 05:58:12 UTC,Fabaceae,Acacia,Acacia suaveolens,3.dicot,native
14/08/2022,265090,2022-08-14 08:31:48 UTC,Fabaceae,Acacia,Acacia suaveolens,3.dicot,native
17/08/2022,2488549,2022-08-17 21:34:52 UTC,Fabaceae,Acacia,Acacia suaveolens,3.dicot,native
21/08/2022,3839358,2022-08-21 11:08:21 UTC,Fabaceae,Acacia,Acacia suaveolens,3.dicot,native
3/06/2017,5971295,2022-08-29 19:19:09 UTC,Fabaceae,Acacia,Acacia suaveolens,3.dicot,native
16/09/2022,3678274,2022-09-17 10:23:13 UTC,Fabaceae,Acacia,Acacia suaveolens,3.dicot,native
4/10/2022,3678274,2022-10-06 10:29:18 UTC,Fabaceae,Acacia,Acacia suaveolens,3.dicot,native
17/11/2022,2488549,2022-11-17 02:46:05 UTC,Fabaceae,Acacia,Acacia suaveolens,3.dicot,native
19/11/2022,6308282,2022-11-23 08:13:49 UTC,Fabaceae,Acacia,Acacia suaveolens,3.dicot,native
26/11/2022,4743351,2022-11-29 10:16:15 UTC,Fabaceae,Acacia,Acacia suaveolens,3.dicot,native
26/02/2023,4743351,2023-02-27 01:01:29 UTC,Fabaceae,Acacia,Acacia suaveolens,3.dicot,native
9/03/2023,1658043,2023-03-13 05:43:54 UTC,Fabaceae,Acacia,Acacia suaveolens,3.dicot,native
28/04/2023,5989765,2023-04-30 13:01:27 UTC,Fabaceae,Acacia,Acacia suaveolens,3.dicot,native
9/05/2023,389804,2023-05-24 03:06:24 UTC,Fabaceae,Acacia,Acacia suaveolens,3.dicot,native
25/05/2023,2488549,2023-05-25 09:00:56 UTC,Fabaceae,Acacia,Acacia suaveolens,3.dicot,native
28/05/2023,4095677,2023-05-29 04:24:37 UTC,Fabaceae,Acacia,Acacia suaveolens,3.dicot,native
3/06/2023,2376854,2023-06-03 17:47:26 UTC,Fabaceae,Acacia,Acacia suaveolens,3.dicot,native
6/06/2023,4743351,2023-06-07 00:31:38 UTC,Fabaceae,Acacia,Acacia suaveolens,3.dicot,native
25/06/2023,6955767,2023-06-25 05:42:45 UTC,Fabaceae,Acacia,Acacia suaveolens,3.dicot,native
27/06/2023,5300031,2023-06-27 04:58:33 UTC,Fabaceae,Acacia,Acacia suaveolens,3.dicot,native
2/07/2023,3936801,2023-07-02 02:47:30 UTC,Fabaceae,Acacia,Acacia suaveolens,3.dicot,native
16/07/2023,7001195,2023-07-16 05:30:55 UTC,Fabaceae,Acacia,Acacia suaveolens,3.dicot,native
29/07/2023,2650798,2023-07-30 11:15:05 UTC,Fabaceae,Acacia,Acacia suaveolens,3.dicot,native
20/09/2023,5435930,2023-09-25 12:15:02 UTC,Fabaceae,Acacia,Acacia suaveolens,3.dicot,native
24/09/2023,1138587,2023-09-27 03:20:47 UTC,Fabaceae,Acacia,Acacia suaveolens,3.dicot,native
20/10/2023,4453532,2023-10-20 09:40:48 UTC,Fabaceae,Acacia,Acacia suaveolens,3.dicot,native
21/10/2023,5739,2023-10-23 23:51:58 UTC,Fabaceae,Acacia,Acacia suaveolens,3.dicot,native
16/09/2023,745089,2023-11-07 07:31:13 UTC,Fabaceae,Acacia,Acacia suaveolens,3.dicot,native
10/08/2023,2379395,2023-12-05 05:35:58 UTC,Fabaceae,Acacia,Acacia suaveolens,3.dicot,native
17/09/2023,745089,2023-12-09 05:38:57 UTC,Fabaceae,Acacia,Acacia suaveolens,3.dicot,native
17/09/2023,745089,2023-12-10 00:46:42 UTC,Fabaceae,Acacia,Acacia suaveolens,3.dicot,native
2/01/2024,1138587,2024-01-02 09:03:01 UTC,Fabaceae,Acacia,Acacia suaveolens,3.dicot,native
14/09/2022,745089,2024-03-13 12:07:49 UTC,Fabaceae,Acacia,Acacia suaveolens,3.dicot,native
16/04/2024,3936801,2024-04-16 12:24:27 UTC,Fabaceae,Acacia,Acacia suaveolens,3.dicot,native
16/04/2024,3936801,2024-04-16 12:27:35 UTC,Fabaceae,Acacia,Acacia suaveolens,3.dicot,native
19/05/2024,319382,2024-05-19 00:31:20 UTC,Fabaceae,Acacia,Acacia suaveolens,3.dicot,native
19/04/2019,45978,2019-04-19 07:09:04 UTC,Fabaceae,Acacia,Acacia terminalis,3.dicot,native
9/03/2020,2488549,2020-03-09 09:20:00 UTC,Fabaceae,Acacia,Acacia terminalis,3.dicot,native
19/03/2020,2488549,2020-03-19 05:50:43 UTC,Fabaceae,Acacia,Acacia terminalis,3.dicot,native
28/03/2020,2488549,2020-03-28 08:52:21 UTC,Fabaceae,Acacia,Acacia terminalis,3.dicot,native
14/04/2020,2742244,2020-04-15 23:27:45 UTC,Fabaceae,Acacia,Acacia terminalis,3.dicot,native
18/04/2020,2488549,2020-04-18 23:52:37 UTC,Fabaceae,Acacia,Acacia terminalis,3.dicot,native
18/04/2020,2488549,2020-04-18 23:53:54 UTC,Fabaceae,Acacia,Acacia terminalis,3.dicot,native
18/04/2020,2488549,2020-04-19 00:05:50 UTC,Fabaceae,Acacia,Acacia terminalis,3.dicot,native
24/04/2020,2488549,2020-04-24 04:02:31 UTC,Fabaceae,Acacia,Acacia terminalis,3.dicot,native
26/04/2020,2488549,2020-04-26 02:14:15 UTC,Fabaceae,Acacia,Acacia terminalis,3.dicot,native
1/05/2020,2488549,2020-05-01 08:25:16 UTC,Fabaceae,Acacia,Acacia terminalis,3.dicot,native
8/05/2020,2488549,2020-05-08 01:41:08 UTC,Fabaceae,Acacia,Acacia terminalis,3.dicot,native
11/06/2020,2488549,2020-06-11 06:52:08 UTC,Fabaceae,Acacia,Acacia terminalis,3.dicot,native
15/07/2020,2488549,2020-07-15 06:34:38 UTC,Fabaceae,Acacia,Acacia terminalis,3.dicot,native
7/04/2020,3408787,2020-08-06 09:17:10 UTC,Fabaceae,Acacia,Acacia terminalis,3.dicot,native
8/04/2021,325733,2021-04-09 12:17:30 UTC,Fabaceae,Acacia,Acacia terminalis,3.dicot,native
25/06/2021,2488549,2021-06-27 02:36:40 UTC,Fabaceae,Acacia,Acacia terminalis,3.dicot,native
6/04/2021,4743351,2021-07-21 03:57:42 UTC,Fabaceae,Acacia,Acacia terminalis,3.dicot,native
25/07/2021,2488549,2021-07-25 10:01:59 UTC,Fabaceae,Acacia,Acacia terminalis,3.dicot,native
30/07/2021,2488549,2021-07-30 07:06:02 UTC,Fabaceae,Acacia,Acacia terminalis,3.dicot,native
27/08/2021,4743351,2021-08-29 04:54:37 UTC,Fabaceae,Acacia,Acacia terminalis,3.dicot,native
5/09/2021,2488549,2021-09-05 09:57:56 UTC,Fabaceae,Acacia,Acacia terminalis,3.dicot,native
9/09/2021,4887682,2021-09-09 00:10:08 UTC,Fabaceae,Acacia,Acacia terminalis,3.dicot,native
10/09/2021,2488549,2021-09-10 10:39:32 UTC,Fabaceae,Acacia,Acacia terminalis,3.dicot,native
17/09/2021,2488549,2021-09-17 10:36:02 UTC,Fabaceae,Acacia,Acacia terminalis,3.dicot,native
17/09/2021,2488549,2021-09-17 10:46:22 UTC,Fabaceae,Acacia,Acacia terminalis,3.dicot,native
17/09/2021,2488549,2021-09-17 11:35:13 UTC,Fabaceae,Acacia,Acacia terminalis,3.dicot,native
30/09/2021,2488549,2021-09-30 10:24:33 UTC,Fabaceae,Acacia,Acacia terminalis,3.dicot,native
19/10/2021,4743351,2021-10-24 07:28:48 UTC,Fabaceae,Acacia,Acacia terminalis,3.dicot,native
19/11/2021,2488549,2021-11-20 02:23:23 UTC,Fabaceae,Acacia,Acacia terminalis,3.dicot,native
20/11/2021,2488549,2021-11-20 10:17:37 UTC,Fabaceae,Acacia,Acacia terminalis,3.dicot,native
26/12/2021,2488549,2021-12-27 10:30:28 UTC,Fabaceae,Acacia,Acacia terminalis,3.dicot,native
31/12/2021,2488549,2021-12-31 09:29:03 UTC,Fabaceae,Acacia,Acacia terminalis,3.dicot,native
31/12/2021,2488549,2021-12-31 09:29:09 UTC,Fabaceae,Acacia,Acacia terminalis,3.dicot,native
31/12/2021,2488549,2021-12-31 09:29:10 UTC,Fabaceae,Acacia,Acacia terminalis,3.dicot,native
13/02/2022,4025155,2022-02-13 08:43:20 UTC,Fabaceae,Acacia,Acacia terminalis,3.dicot,native
10/03/2022,2488549,2022-03-10 10:40:04 UTC,Fabaceae,Acacia,Acacia terminalis,3.dicot,native
10/03/2022,2488549,2022-03-10 10:40:05 UTC,Fabaceae,Acacia,Acacia terminalis,3.dicot,native
27/03/2022,5451322,2022-03-27 00:59:32 UTC,Fabaceae,Acacia,Acacia terminalis,3.dicot,native
16/04/2022,2488549,2022-04-16 06:31:33 UTC,Fabaceae,Acacia,Acacia terminalis,3.dicot,native
16/04/2022,2488549,2022-04-16 06:31:34 UTC,Fabaceae,Acacia,Acacia terminalis,3.dicot,native
4/06/2022,2488549,2022-06-04 08:25:33 UTC,Fabaceae,Acacia,Acacia terminalis,3.dicot,native
23/06/2022,2488549,2022-06-23 03:59:53 UTC,Fabaceae,Acacia,Acacia terminalis,3.dicot,native
23/06/2022,2488549,2022-06-23 05:26:04 UTC,Fabaceae,Acacia,Acacia terminalis,3.dicot,native
24/04/2022,3221790,2022-06-29 10:34:57 UTC,Fabaceae,Acacia,Acacia terminalis,3.dicot,native
11/09/2022,1175154,2022-09-11 07:25:53 UTC,Fabaceae,Acacia,Acacia terminalis,3.dicot,native
26/11/2022,4743351,2022-11-29 10:38:58 UTC,Fabaceae,Acacia,Acacia terminalis,3.dicot,native
25/09/2022,4743351,2022-12-22 04:08:29 UTC,Fabaceae,Acacia,Acacia terminalis,3.dicot,native
25/09/2022,4743351,2022-12-23 04:06:51 UTC,Fabaceae,Acacia,Acacia terminalis,3.dicot,native
28/12/2022,2488549,2022-12-28 02:25:53 UTC,Fabaceae,Acacia,Acacia terminalis,3.dicot,native
12/02/2023,4743351,2023-02-13 10:50:56 UTC,Fabaceae,Acacia,Acacia terminalis,3.dicot,native
9/03/2023,1658043,2023-03-13 05:43:53 UTC,Fabaceae,Acacia,Acacia terminalis,3.dicot,native
19/03/2023,149222,2023-03-18 23:58:00 UTC,Fabaceae,Acacia,Acacia terminalis,3.dicot,native
26/03/2023,1747867,2023-03-26 05:19:58 UTC,Fabaceae,Acacia,Acacia terminalis,3.dicot,native
22/06/2023,2488549,2023-06-22 03:39:41 UTC,Fabaceae,Acacia,Acacia terminalis,3.dicot,native
16/07/2023,7001195,2023-07-16 05:48:45 UTC,Fabaceae,Acacia,Acacia terminalis,3.dicot,native
29/07/2023,2650798,2023-07-30 11:08:35 UTC,Fabaceae,Acacia,Acacia terminalis,3.dicot,native
11/08/2023,4743351,2023-08-12 12:27:05 UTC,Fabaceae,Acacia,Acacia terminalis,3.dicot,native
24/09/2023,1138587,2023-09-27 02:56:08 UTC,Fabaceae,Acacia,Acacia terminalis,3.dicot,native
10/02/2024,1138587,2024-02-10 07:12:39 UTC,Fabaceae,Acacia,Acacia terminalis,3.dicot,native
5/03/2024,1175154,2024-03-05 08:43:23 UTC,Fabaceae,Acacia,Acacia terminalis,3.dicot,native
22/03/2024,7134096,2024-03-22 07:43:49 UTC,Fabaceae,Acacia,Acacia terminalis,3.dicot,native
23/03/2024,7861002,2024-03-23 06:35:38 UTC,Fabaceae,Acacia,Acacia terminalis,3.dicot,native
16/04/2024,3936801,2024-04-16 12:25:30 UTC,Fabaceae,Acacia,Acacia terminalis,3.dicot,native
29/10/2014,2991,2015-07-23 17:56:22 UTC,Fabaceae,Acacia,Acacia ulicifolia,3.dicot,native
24/04/2017,458427,2017-04-24 12:03:07 UTC,Fabaceae,Acacia,Acacia ulicifolia,3.dicot,native
17/05/2018,364713,2018-05-17 09:02:06 UTC,Fabaceae,Acacia,Acacia ulicifolia,3.dicot,native
9/03/2020,2488549,2020-03-09 10:03:29 UTC,Fabaceae,Acacia,Acacia ulicifolia,3.dicot,native
3/04/2020,2488549,2020-04-03 08:25:54 UTC,Fabaceae,Acacia,Acacia ulicifolia,3.dicot,native
18/04/2020,2488549,2020-04-19 00:07:27 UTC,Fabaceae,Acacia,Acacia ulicifolia,3.dicot,native
24/04/2020,2488549,2020-04-24 04:01:34 UTC,Fabaceae,Acacia,Acacia ulicifolia,3.dicot,native
1/05/2020,2488549,2020-05-01 06:23:13 UTC,Fabaceae,Acacia,Acacia ulicifolia,3.dicot,native
8/05/2020,2488549,2020-05-08 01:38:29 UTC,Fabaceae,Acacia,Acacia ulicifolia,3.dicot,native
24/05/2020,2488549,2020-05-24 04:30:43 UTC,Fabaceae,Acacia,Acacia ulicifolia,3.dicot,native
11/06/2020,2488549,2020-06-11 06:50:27 UTC,Fabaceae,Acacia,Acacia ulicifolia,3.dicot,native
27/06/2020,45978,2020-06-27 09:19:59 UTC,Fabaceae,Acacia,Acacia ulicifolia,3.dicot,native
15/07/2020,2488549,2020-07-15 06:31:56 UTC,Fabaceae,Acacia,Acacia ulicifolia,3.dicot,native
24/07/2020,2488549,2020-07-24 11:59:18 UTC,Fabaceae,Acacia,Acacia ulicifolia,3.dicot,native
2/08/2020,2444826,2020-08-02 02:12:58 UTC,Fabaceae,Acacia,Acacia ulicifolia,3.dicot,native
5/08/2020,793005,2020-08-05 17:21:16 UTC,Fabaceae,Acacia,Acacia ulicifolia,3.dicot,native
12/08/2020,2488549,2020-08-12 04:09:08 UTC,Fabaceae,Acacia,Acacia ulicifolia,3.dicot,native
12/08/2020,2488549,2020-08-12 07:41:54 UTC,Fabaceae,Acacia,Acacia ulicifolia,3.dicot,native
30/08/2020,3012594,2020-08-31 04:04:02 UTC,Fabaceae,Acacia,Acacia ulicifolia,3.dicot,native
30/08/2020,3572304,2020-09-09 22:02:26 UTC,Fabaceae,Acacia,Acacia ulicifolia,3.dicot,native
18/04/2021,3712636,2021-04-17 23:40:20 UTC,Fabaceae,Acacia,Acacia ulicifolia,3.dicot,native
25/06/2021,2488549,2021-06-27 02:36:39 UTC,Fabaceae,Acacia,Acacia ulicifolia,3.dicot,native
3/07/2021,3313584,2021-07-09 04:07:45 UTC,Fabaceae,Acacia,Acacia ulicifolia,3.dicot,native
12/07/2021,4095677,2021-07-12 06:03:14 UTC,Fabaceae,Acacia,Acacia ulicifolia,3.dicot,native
18/07/2021,2488549,2021-07-19 11:30:12 UTC,Fabaceae,Acacia,Acacia ulicifolia,3.dicot,native
16/04/2021,4743351,2021-07-21 03:11:13 UTC,Fabaceae,Acacia,Acacia ulicifolia,3.dicot,native
6/04/2021,4743351,2021-07-21 03:57:43 UTC,Fabaceae,Acacia,Acacia ulicifolia,3.dicot,native
25/07/2021,2488549,2021-07-25 10:25:04 UTC,Fabaceae,Acacia,Acacia ulicifolia,3.dicot,native
30/07/2021,2488549,2021-07-30 07:06:01 UTC,Fabaceae,Acacia,Acacia ulicifolia,3.dicot,native
22/07/2019,4743351,2021-08-04 05:58:52 UTC,Fabaceae,Acacia,Acacia ulicifolia,3.dicot,native
26/08/2021,2488549,2021-08-27 01:32:32 UTC,Fabaceae,Acacia,Acacia ulicifolia,3.dicot,native
27/08/2021,4743351,2021-08-29 04:54:37 UTC,Fabaceae,Acacia,Acacia ulicifolia,3.dicot,native
6/09/2021,4887682,2021-09-06 09:17:07 UTC,Fabaceae,Acacia,Acacia ulicifolia,3.dicot,native
12/09/2021,2488549,2021-09-12 06:57:48 UTC,Fabaceae,Acacia,Acacia ulicifolia,3.dicot,native
3/09/2021,4916136,2021-10-03 13:18:11 UTC,Fabaceae,Acacia,Acacia ulicifolia,3.dicot,native
9/10/2021,2488549,2021-10-09 09:21:15 UTC,Fabaceae,Acacia,Acacia ulicifolia,3.dicot,native
19/11/2021,2488549,2021-11-20 02:23:26 UTC,Fabaceae,Acacia,Acacia ulicifolia,3.dicot,native
14/12/2021,2488549,2021-12-15 01:46:57 UTC,Fabaceae,Acacia,Acacia ulicifolia,3.dicot,native
10/01/2022,2488549,2022-01-14 05:15:14 UTC,Fabaceae,Acacia,Acacia ulicifolia,3.dicot,native
23/01/2022,2665854,2022-02-10 06:08:10 UTC,Fabaceae,Acacia,Acacia ulicifolia,3.dicot,native
10/03/2022,2488549,2022-03-10 10:40:10 UTC,Fabaceae,Acacia,Acacia ulicifolia,3.dicot,native
15/04/2022,2488549,2022-04-15 08:53:56 UTC,Fabaceae,Acacia,Acacia ulicifolia,3.dicot,native
15/04/2022,2488549,2022-04-15 08:56:41 UTC,Fabaceae,Acacia,Acacia ulicifolia,3.dicot,native
16/04/2022,2488549,2022-04-16 06:31:25 UTC,Fabaceae,Acacia,Acacia ulicifolia,3.dicot,native
16/04/2022,2488549,2022-04-16 06:31:39 UTC,Fabaceae,Acacia,Acacia ulicifolia,3.dicot,native
14/05/2022,2488549,2022-05-14 09:10:56 UTC,Fabaceae,Acacia,Acacia ulicifolia,3.dicot,native
15/07/1989,717200,2022-06-02 06:49:34 UTC,Fabaceae,Acacia,Acacia ulicifolia,3.dicot,native
4/06/2022,2488549,2022-06-04 08:25:08 UTC,Fabaceae,Acacia,Acacia ulicifolia,3.dicot,native
7/06/2022,1233583,2022-06-07 08:47:50 UTC,Fabaceae,Acacia,Acacia ulicifolia,3.dicot,native
9/06/2022,2488549,2022-06-09 04:16:48 UTC,Fabaceae,Acacia,Acacia ulicifolia,3.dicot,native
29/07/2022,2488549,2022-07-29 02:31:17 UTC,Fabaceae,Acacia,Acacia ulicifolia,3.dicot,native
31/07/2022,265090,2022-07-31 08:58:20 UTC,Fabaceae,Acacia,Acacia ulicifolia,3.dicot,native
30/07/2022,4743351,2022-08-01 12:37:31 UTC,Fabaceae,Acacia,Acacia ulicifolia,3.dicot,native
30/07/2022,4743351,2022-08-01 12:37:35 UTC,Fabaceae,Acacia,Acacia ulicifolia,3.dicot,native
6/08/2022,4743351,2022-08-08 01:05:18 UTC,Fabaceae,Acacia,Acacia ulicifolia,3.dicot,native
10/08/2022,2488549,2022-08-10 06:51:20 UTC,Fabaceae,Acacia,Acacia ulicifolia,3.dicot,native
17/08/2022,2488549,2022-08-17 22:04:45 UTC,Fabaceae,Acacia,Acacia ulicifolia,3.dicot,native
21/08/2022,1175154,2022-08-21 10:43:05 UTC,Fabaceae,Acacia,Acacia ulicifolia,3.dicot,native
26/11/2022,4743351,2022-11-29 08:56:48 UTC,Fabaceae,Acacia,Acacia ulicifolia,3.dicot,native
25/09/2022,4743351,2022-12-23 04:06:51 UTC,Fabaceae,Acacia,Acacia ulicifolia,3.dicot,native
20/03/2023,1259195,2023-03-26 10:27:39 UTC,Fabaceae,Acacia,Acacia ulicifolia,3.dicot,native
17/04/2023,6308282,2023-04-17 03:37:09 UTC,Fabaceae,Acacia,Acacia ulicifolia,3.dicot,native
9/05/2023,389804,2023-05-24 03:06:26 UTC,Fabaceae,Acacia,Acacia ulicifolia,3.dicot,native
25/05/2023,2488549,2023-05-25 09:03:45 UTC,Fabaceae,Acacia,Acacia ulicifolia,3.dicot,native
22/06/2023,2488549,2023-06-22 03:39:38 UTC,Fabaceae,Acacia,Acacia ulicifolia,3.dicot,native
24/06/2023,2488549,2023-06-24 09:56:05 UTC,Fabaceae,Acacia,Acacia ulicifolia,3.dicot,native
25/06/2023,5300031,2023-06-25 05:38:35 UTC,Fabaceae,Acacia,Acacia ulicifolia,3.dicot,native
25/06/2023,5300031,2023-06-25 05:40:15 UTC,Fabaceae,Acacia,Acacia ulicifolia,3.dicot,native
26/06/2023,6308282,2023-06-26 03:26:29 UTC,Fabaceae,Acacia,Acacia ulicifolia,3.dicot,native
16/07/2023,7001195,2023-07-16 05:21:28 UTC,Fabaceae,Acacia,Acacia ulicifolia,3.dicot,native
16/07/2023,2366151,2023-07-16 11:20:41 UTC,Fabaceae,Acacia,Acacia ulicifolia,3.dicot,native
27/07/2023,6196075,2023-07-27 05:13:06 UTC,Fabaceae,Acacia,Acacia ulicifolia,3.dicot,native
12/08/2023,3936801,2023-08-12 03:46:28 UTC,Fabaceae,Acacia,Acacia ulicifolia,3.dicot,native
12/08/2023,3936801,2023-08-12 03:47:16 UTC,Fabaceae,Acacia,Acacia ulicifolia,3.dicot,native
11/08/2023,4743351,2023-08-12 12:27:01 UTC,Fabaceae,Acacia,Acacia ulicifolia,3.dicot,native
21/08/2023,6209647,2023-08-21 11:38:51 UTC,Fabaceae,Acacia,Acacia ulicifolia,3.dicot,native
24/09/2023,1138587,2023-09-27 02:45:27 UTC,Fabaceae,Acacia,Acacia ulicifolia,3.dicot,native
24/09/2023,661392,2023-09-29 11:06:31 UTC,Fabaceae,Acacia,Acacia ulicifolia,3.dicot,native
28/10/2023,2631448,2023-10-29 01:39:53 UTC,Fabaceae,Acacia,Acacia ulicifolia,3.dicot,native
17/09/2023,745089,2023-12-10 00:55:29 UTC,Fabaceae,Acacia,Acacia ulicifolia,3.dicot,native
11/02/2024,4672448,2024-02-11 03:52:17 UTC,Fabaceae,Acacia,Acacia ulicifolia,3.dicot,native
14/09/2022,745089,2024-03-29 03:15:55 UTC,Fabaceae,Acacia,Acacia ulicifolia,3.dicot,native
16/04/2024,3936801,2024-04-16 12:19:28 UTC,Fabaceae,Acacia,Acacia ulicifolia,3.dicot,native
16/04/2024,3936801,2024-04-16 12:26:10 UTC,Fabaceae,Acacia,Acacia ulicifolia,3.dicot,native
21/04/2024,265090,2024-04-21 05:31:26 UTC,Fabaceae,Acacia,Acacia ulicifolia,3.dicot,native
19/05/2024,319382,2024-05-18 23:58:39 UTC,Fabaceae,Acacia,Acacia ulicifolia,3.dicot,native
20/12/2023,1305186,2023-12-20 10:28:09 UTC,Asteraceae,Acanthospermum,Acanthospermum australe,3.dicot,introduced
8/06/2020,2701041,2020-06-09 07:50:22 UTC,Orchidaceae,Acianthus,Acianthus caudatus,5.monocot-colorful,native
9/07/2020,2488549,2020-07-09 12:58:13 UTC,Orchidaceae,Acianthus,Acianthus caudatus,5.monocot-colorful,native
2/06/2022,5150898,2022-06-02 00:55:56 UTC,Orchidaceae,Acianthus,Acianthus caudatus,5.monocot-colorful,native
13/06/2022,5150898,2022-06-13 04:50:19 UTC,Orchidaceae,Acianthus,Acianthus caudatus,5.monocot-colorful,native
13/06/2022,5150898,2022-06-13 04:52:16 UTC,Orchidaceae,Acianthus,Acianthus caudatus,5.monocot-colorful,native
19/06/2022,5150898,2022-06-19 04:49:33 UTC,Orchidaceae,Acianthus,Acianthus caudatus,5.monocot-colorful,native
23/06/2022,2488549,2022-06-23 04:18:41 UTC,Orchidaceae,Acianthus,Acianthus caudatus,5.monocot-colorful,native
24/06/2022,5150898,2022-06-26 05:25:13 UTC,Orchidaceae,Acianthus,Acianthus caudatus,5.monocot-colorful,native
8/07/2022,5188972,2022-07-09 09:07:38 UTC,Orchidaceae,Acianthus,Acianthus caudatus,5.monocot-colorful,native
17/07/2022,3880468,2022-07-18 08:41:47 UTC,Orchidaceae,Acianthus,Acianthus caudatus,5.monocot-colorful,native
17/07/2022,3880468,2022-07-18 08:41:48 UTC,Orchidaceae,Acianthus,Acianthus caudatus,5.monocot-colorful,native
17/07/2022,3880468,2022-07-18 08:41:51 UTC,Orchidaceae,Acianthus,Acianthus caudatus,5.monocot-colorful,native
29/07/2022,5150898,2022-07-29 10:55:22 UTC,Orchidaceae,Acianthus,Acianthus caudatus,5.monocot-colorful,native
24/06/2023,2488549,2023-06-24 09:55:58 UTC,Orchidaceae,Acianthus,Acianthus caudatus,5.monocot-colorful,native
16/07/2023,2366151,2023-07-16 11:12:10 UTC,Orchidaceae,Acianthus,Acianthus caudatus,5.monocot-colorful,native
16/07/2023,3653978,2023-07-16 11:21:56 UTC,Orchidaceae,Acianthus,Acianthus caudatus,5.monocot-colorful,native
16/07/2023,2376854,2023-07-16 15:22:36 UTC,Orchidaceae,Acianthus,Acianthus caudatus,5.monocot-colorful,native
22/07/2023,3978191,2023-07-22 09:04:15 UTC,Orchidaceae,Acianthus,Acianthus caudatus,5.monocot-colorful,native
30/07/2023,2488549,2023-07-30 02:12:18 UTC,Orchidaceae,Acianthus,Acianthus caudatus,5.monocot-colorful,native
11/08/2023,5188972,2023-08-11 09:43:34 UTC,Orchidaceae,Acianthus,Acianthus caudatus,5.monocot-colorful,native
12/08/2023,2376854,2023-08-13 05:12:17 UTC,Orchidaceae,Acianthus,Acianthus caudatus,5.monocot-colorful,native
30/07/2023,5280950,2023-11-29 09:19:49 UTC,Orchidaceae,Acianthus,Acianthus caudatus,5.monocot-colorful,native
25/05/2024,5150898,2024-05-25 03:53:30 UTC,Orchidaceae,Acianthus,Acianthus caudatus,5.monocot-colorful,native
24/05/2020,2488549,2020-05-24 04:08:03 UTC,Orchidaceae,Acianthus,Acianthus fornicatus,5.monocot-colorful,native
10/06/2020,2701041,2020-06-10 21:55:29 UTC,Orchidaceae,Acianthus,Acianthus fornicatus,5.monocot-colorful,native
16/07/2020,2488549,2020-07-16 09:14:35 UTC,Orchidaceae,Acianthus,Acianthus fornicatus,5.monocot-colorful,native
18/07/2020,2518052,2020-07-18 08:39:51 UTC,Orchidaceae,Acianthus,Acianthus fornicatus,5.monocot-colorful,native
25/06/2021,2488549,2021-06-26 05:16:03 UTC,Orchidaceae,Acianthus,Acianthus fornicatus,5.monocot-colorful,native
14/05/2022,5188972,2022-05-14 12:16:15 UTC,Orchidaceae,Acianthus,Acianthus fornicatus,5.monocot-colorful,native
15/05/2022,2488549,2022-05-15 04:26:08 UTC,Orchidaceae,Acianthus,Acianthus fornicatus,5.monocot-colorful,native
15/05/2022,5150898,2022-05-15 10:18:50 UTC,Orchidaceae,Acianthus,Acianthus fornicatus,5.monocot-colorful,native
14/05/2022,3880468,2022-05-15 10:48:01 UTC,Orchidaceae,Acianthus,Acianthus fornicatus,5.monocot-colorful,native
14/05/2022,3880468,2022-05-15 10:48:06 UTC,Orchidaceae,Acianthus,Acianthus fornicatus,5.monocot-colorful,native
22/05/2022,5150898,2022-05-22 10:18:17 UTC,Orchidaceae,Acianthus,Acianthus fornicatus,5.monocot-colorful,native
13/06/2022,5150898,2022-06-13 04:52:58 UTC,Orchidaceae,Acianthus,Acianthus fornicatus,5.monocot-colorful,native
23/06/2022,2488549,2022-06-23 04:10:57 UTC,Orchidaceae,Acianthus,Acianthus fornicatus,5.monocot-colorful,native
23/06/2022,2488549,2022-06-23 04:16:07 UTC,Orchidaceae,Acianthus,Acianthus fornicatus,5.monocot-colorful,native
8/07/2022,5188972,2022-07-09 08:32:16 UTC,Orchidaceae,Acianthus,Acianthus fornicatus,5.monocot-colorful,native
17/07/2022,3880468,2022-07-18 08:41:49 UTC,Orchidaceae,Acianthus,Acianthus fornicatus,5.monocot-colorful,native
20/05/2023,3978191,2023-05-20 10:06:45 UTC,Orchidaceae,Acianthus,Acianthus fornicatus,5.monocot-colorful,native
20/05/2023,3978191,2023-05-20 10:06:45 UTC,Orchidaceae,Acianthus,Acianthus fornicatus,5.monocot-colorful,native
20/05/2023,3978191,2023-05-20 10:06:45 UTC,Orchidaceae,Acianthus,Acianthus fornicatus,5.monocot-colorful,native
27/05/2023,3978191,2023-05-27 08:08:57 UTC,Orchidaceae,Acianthus,Acianthus fornicatus,5.monocot-colorful,native
27/05/2023,3978191,2023-05-27 08:08:58 UTC,Orchidaceae,Acianthus,Acianthus fornicatus,5.monocot-colorful,native
4/06/2023,3978191,2023-06-04 06:51:31 UTC,Orchidaceae,Acianthus,Acianthus fornicatus,5.monocot-colorful,native
15/06/2023,2488549,2023-06-15 03:34:42 UTC,Orchidaceae,Acianthus,Acianthus fornicatus,5.monocot-colorful,native
17/06/2023,5150898,2023-06-17 07:00:35 UTC,Orchidaceae,Acianthus,Acianthus fornicatus,5.monocot-colorful,native
1/07/2023,3978191,2023-07-01 10:09:07 UTC,Orchidaceae,Acianthus,Acianthus fornicatus,5.monocot-colorful,native
16/07/2023,3978191,2023-07-16 09:57:54 UTC,Orchidaceae,Acianthus,Acianthus fornicatus,5.monocot-colorful,native
16/07/2023,2366151,2023-07-16 11:16:37 UTC,Orchidaceae,Acianthus,Acianthus fornicatus,5.monocot-colorful,native
16/07/2023,3653978,2023-07-16 11:20:17 UTC,Orchidaceae,Acianthus,Acianthus fornicatus,5.monocot-colorful,native
22/07/2023,3978191,2023-07-22 09:19:17 UTC,Orchidaceae,Acianthus,Acianthus fornicatus,5.monocot-colorful,native
11/08/2023,2488549,2023-08-11 11:53:50 UTC,Orchidaceae,Acianthus,Acianthus fornicatus,5.monocot-colorful,native
7/05/2024,2663646,2024-05-07 08:24:05 UTC,Orchidaceae,Acianthus,Acianthus fornicatus,5.monocot-colorful,native
25/05/2024,5150898,2024-05-25 03:55:37 UTC,Orchidaceae,Acianthus,Acianthus fornicatus,5.monocot-colorful,native
17/04/2021,636550,2021-04-20 03:05:34 UTC,Orchidaceae,Acianthus,Acianthus pusillus,5.monocot-colorful,native
29/03/2022,5150898,2022-03-29 09:59:42 UTC,Orchidaceae,Acianthus,Acianthus pusillus,5.monocot-colorful,native
28/04/2022,2488549,2022-04-28 06:37:12 UTC,Orchidaceae,Acianthus,Acianthus pusillus,5.monocot-colorful,native
17/04/2023,3012653,2023-04-20 13:54:50 UTC,Orchidaceae,Acianthus,Acianthus pusillus,5.monocot-colorful,native
25/05/2024,5150898,2024-05-25 03:54:41 UTC,Orchidaceae,Acianthus,Acianthus pusillus,5.monocot-colorful,native
9/05/2020,2488549,2020-05-09 12:18:02 UTC,Ericaceae,Acrotriche,Acrotriche divaricata,3.dicot,native
15/06/2023,2488549,2023-06-15 03:45:29 UTC,Ericaceae,Acrotriche,Acrotriche divaricata,3.dicot,native
2/11/2011,2991,2011-12-29 21:10:30 UTC,Apiaceae,Actinotus,Actinotus helianthi,3.dicot,native
20/11/2014,63675,2014-11-22 01:18:42 UTC,Apiaceae,Actinotus,Actinotus helianthi,3.dicot,native
1/01/2018,269775,2018-06-13 07:44:35 UTC,Apiaceae,Actinotus,Actinotus helianthi,3.dicot,native
25/08/2019,64271,2019-08-29 12:30:31 UTC,Apiaceae,Actinotus,Actinotus helianthi,3.dicot,native
27/10/2019,2488549,2019-12-15 02:24:06 UTC,Apiaceae,Actinotus,Actinotus helianthi,3.dicot,native
31/12/2019,2488549,2019-12-31 01:37:11 UTC,Apiaceae,Actinotus,Actinotus helianthi,3.dicot,native
18/01/2020,2488549,2020-01-17 23:42:36 UTC,Apiaceae,Actinotus,Actinotus helianthi,3.dicot,native
9/03/2020,2488549,2020-03-09 09:26:08 UTC,Apiaceae,Actinotus,Actinotus helianthi,3.dicot,native
16/10/2005,2584563,2020-04-08 00:35:28 UTC,Apiaceae,Actinotus,Actinotus helianthi,3.dicot,native
9/04/2020,2723140,2020-04-17 02:58:10 UTC,Apiaceae,Actinotus,Actinotus helianthi,3.dicot,native
12/06/2020,2602714,2020-06-12 10:50:49 UTC,Apiaceae,Actinotus,Actinotus helianthi,3.dicot,native
24/12/1981,648584,2020-07-04 02:25:07 UTC,Apiaceae,Actinotus,Actinotus helianthi,3.dicot,native
29/09/2020,738376,2020-10-02 02:40:50 UTC,Apiaceae,Actinotus,Actinotus helianthi,3.dicot,native
15/10/2020,3754725,2020-10-18 06:08:51 UTC,Apiaceae,Actinotus,Actinotus helianthi,3.dicot,native
19/10/2020,793005,2020-10-30 01:10:16 UTC,Apiaceae,Actinotus,Actinotus helianthi,3.dicot,native
19/10/2020,793005,2020-10-30 01:10:50 UTC,Apiaceae,Actinotus,Actinotus helianthi,3.dicot,native
26/11/2020,793005,2020-12-20 04:25:24 UTC,Apiaceae,Actinotus,Actinotus helianthi,3.dicot,native
26/11/2020,793005,2020-12-21 02:54:49 UTC,Apiaceae,Actinotus,Actinotus helianthi,3.dicot,native
8/12/2020,793005,2020-12-28 14:38:23 UTC,Apiaceae,Actinotus,Actinotus helianthi,3.dicot,native
31/12/2020,2583305,2020-12-31 07:49:21 UTC,Apiaceae,Actinotus,Actinotus helianthi,3.dicot,native
1/01/2021,2376854,2021-01-01 15:52:44 UTC,Apiaceae,Actinotus,Actinotus helianthi,3.dicot,native
15/11/2020,3313573,2021-01-03 03:39:48 UTC,Apiaceae,Actinotus,Actinotus helianthi,3.dicot,native
7/02/2021,2376854,2021-02-07 09:17:00 UTC,Apiaceae,Actinotus,Actinotus helianthi,3.dicot,native
2/04/2021,2768711,2021-04-02 06:32:47 UTC,Apiaceae,Actinotus,Actinotus helianthi,3.dicot,native
1/04/2021,3527375,2021-04-06 06:52:06 UTC,Apiaceae,Actinotus,Actinotus helianthi,3.dicot,native
1/02/2004,614054,2021-07-06 10:58:16 UTC,Apiaceae,Actinotus,Actinotus helianthi,3.dicot,native
12/10/2020,4743351,2021-07-23 12:34:55 UTC,Apiaceae,Actinotus,Actinotus helianthi,3.dicot,native
3/12/2019,4743351,2021-08-02 11:30:37 UTC,Apiaceae,Actinotus,Actinotus helianthi,3.dicot,native
9/09/2021,4887682,2021-09-08 23:33:12 UTC,Apiaceae,Actinotus,Actinotus helianthi,3.dicot,native
7/09/2021,4916136,2021-09-12 06:04:47 UTC,Apiaceae,Actinotus,Actinotus helianthi,3.dicot,native
28/09/2021,4916136,2021-09-28 08:39:14 UTC,Apiaceae,Actinotus,Actinotus helianthi,3.dicot,native
1/10/2021,4916136,2021-10-01 11:33:12 UTC,Apiaceae,Actinotus,Actinotus helianthi,3.dicot,native
12/10/2021,4743351,2021-10-15 10:56:51 UTC,Apiaceae,Actinotus,Actinotus helianthi,3.dicot,native
18/10/2021,5136334,2021-10-19 03:08:13 UTC,Apiaceae,Actinotus,Actinotus helianthi,3.dicot,native
22/10/2021,2665854,2021-10-22 05:38:10 UTC,Apiaceae,Actinotus,Actinotus helianthi,3.dicot,native
23/10/2021,2376854,2021-10-23 12:45:04 UTC,Apiaceae,Actinotus,Actinotus helianthi,3.dicot,native
19/10/2021,4743351,2021-10-24 07:28:55 UTC,Apiaceae,Actinotus,Actinotus helianthi,3.dicot,native
28/09/2021,3792160,2021-10-24 13:31:45 UTC,Apiaceae,Actinotus,Actinotus helianthi,3.dicot,native
31/10/2021,575123,2021-10-31 05:12:51 UTC,Apiaceae,Actinotus,Actinotus helianthi,3.dicot,native
9/11/2021,2453859,2021-11-12 01:27:46 UTC,Apiaceae,Actinotus,Actinotus helianthi,3.dicot,native
10/11/2021,5215279,2021-11-17 03:52:57 UTC,Apiaceae,Actinotus,Actinotus helianthi,3.dicot,native
17/11/2021,3880468,2021-11-17 11:56:41 UTC,Apiaceae,Actinotus,Actinotus helianthi,3.dicot,native
13/11/2021,325733,2021-11-18 01:46:35 UTC,Apiaceae,Actinotus,Actinotus helianthi,3.dicot,native
30/12/2021,3880468,2021-12-30 13:54:48 UTC,Apiaceae,Actinotus,Actinotus helianthi,3.dicot,native
24/11/2021,5376627,2022-02-23 21:01:55 UTC,Apiaceae,Actinotus,Actinotus helianthi,3.dicot,native
16/04/2022,3751299,2022-04-16 11:08:22 UTC,Apiaceae,Actinotus,Actinotus helianthi,3.dicot,native
18/01/1988,717200,2022-06-17 02:20:43 UTC,Apiaceae,Actinotus,Actinotus helianthi,3.dicot,native
16/11/2021,6029661,2022-08-17 00:42:39 UTC,Apiaceae,Actinotus,Actinotus helianthi,3.dicot,native
26/09/2022,3678274,2022-10-03 11:45:25 UTC,Apiaceae,Actinotus,Actinotus helianthi,3.dicot,native
4/10/2022,4743351,2022-10-06 09:52:02 UTC,Apiaceae,Actinotus,Actinotus helianthi,3.dicot,native
13/10/2022,285621,2022-10-13 03:23:55 UTC,Apiaceae,Actinotus,Actinotus helianthi,3.dicot,native
25/10/2022,2512752,2022-10-25 22:11:56 UTC,Apiaceae,Actinotus,Actinotus helianthi,3.dicot,native
29/10/2022,1175154,2022-10-29 05:13:20 UTC,Apiaceae,Actinotus,Actinotus helianthi,3.dicot,native
27/10/2022,2631448,2022-10-31 10:08:32 UTC,Apiaceae,Actinotus,Actinotus helianthi,3.dicot,native
8/01/2022,3280868,2022-11-05 23:55:26 UTC,Apiaceae,Actinotus,Actinotus helianthi,3.dicot,native
9/11/2022,4109301,2022-11-09 10:58:04 UTC,Apiaceae,Actinotus,Actinotus helianthi,3.dicot,native
14/11/2022,3441963,2022-11-18 19:58:56 UTC,Apiaceae,Actinotus,Actinotus helianthi,3.dicot,native
13/11/2022,624851,2022-11-21 06:14:59 UTC,Apiaceae,Actinotus,Actinotus helianthi,3.dicot,native
19/11/2022,6308282,2022-11-24 09:53:57 UTC,Apiaceae,Actinotus,Actinotus helianthi,3.dicot,native
19/11/2022,6308282,2022-11-27 08:43:48 UTC,Apiaceae,Actinotus,Actinotus helianthi,3.dicot,native
28/11/2022,2531563,2022-11-28 21:40:58 UTC,Apiaceae,Actinotus,Actinotus helianthi,3.dicot,native
11/10/2022,6259435,2022-12-02 13:16:27 UTC,Apiaceae,Actinotus,Actinotus helianthi,3.dicot,native
11/10/2022,6259435,2022-12-02 13:17:05 UTC,Apiaceae,Actinotus,Actinotus helianthi,3.dicot,native
23/10/2022,4945302,2022-12-13 08:18:04 UTC,Apiaceae,Actinotus,Actinotus helianthi,3.dicot,native
14/12/2022,1974770,2022-12-15 05:01:55 UTC,Apiaceae,Actinotus,Actinotus helianthi,3.dicot,native
17/11/2022,2442561,2022-12-16 19:40:01 UTC,Apiaceae,Actinotus,Actinotus helianthi,3.dicot,native
14/11/2022,3441963,2022-12-18 08:32:27 UTC,Apiaceae,Actinotus,Actinotus helianthi,3.dicot,native
21/12/2022,3957444,2022-12-21 10:19:59 UTC,Apiaceae,Actinotus,Actinotus helianthi,3.dicot,native
26/12/2022,6020519,2022-12-26 06:46:14 UTC,Apiaceae,Actinotus,Actinotus helianthi,3.dicot,native
24/10/2021,6423038,2023-01-10 07:25:48 UTC,Apiaceae,Actinotus,Actinotus helianthi,3.dicot,native
13/02/2023,2631448,2023-02-13 11:38:06 UTC,Apiaceae,Actinotus,Actinotus helianthi,3.dicot,native
11/12/2022,6224734,2023-02-24 23:26:50 UTC,Apiaceae,Actinotus,Actinotus helianthi,3.dicot,native
26/02/2023,4743351,2023-02-27 01:01:32 UTC,Apiaceae,Actinotus,Actinotus helianthi,3.dicot,native
12/03/2023,6566631,2023-03-12 06:06:45 UTC,Apiaceae,Actinotus,Actinotus helianthi,3.dicot,native
9/03/2023,1658043,2023-03-13 05:43:55 UTC,Apiaceae,Actinotus,Actinotus helianthi,3.dicot,native
20/03/2023,1259195,2023-03-26 10:27:31 UTC,Apiaceae,Actinotus,Actinotus helianthi,3.dicot,native
20/03/2023,1259195,2023-03-26 10:28:11 UTC,Apiaceae,Actinotus,Actinotus helianthi,3.dicot,native
10/04/2023,6437775,2023-04-10 08:53:56 UTC,Apiaceae,Actinotus,Actinotus helianthi,3.dicot,native
29/12/2022,542372,2023-05-13 10:10:25 UTC,Apiaceae,Actinotus,Actinotus helianthi,3.dicot,native
2/07/2023,3936801,2023-07-01 23:18:42 UTC,Apiaceae,Actinotus,Actinotus helianthi,3.dicot,native
5/11/2022,74355,2023-07-11 21:26:16 UTC,Apiaceae,Actinotus,Actinotus helianthi,3.dicot,native
16/07/2023,2366151,2023-07-16 10:53:35 UTC,Apiaceae,Actinotus,Actinotus helianthi,3.dicot,native
29/07/2023,2650798,2023-07-30 11:11:40 UTC,Apiaceae,Actinotus,Actinotus helianthi,3.dicot,native
21/08/2023,4177273,2023-08-21 22:28:19 UTC,Apiaceae,Actinotus,Actinotus helianthi,3.dicot,native
3/09/2023,5194154,2023-09-03 00:06:21 UTC,Apiaceae,Actinotus,Actinotus helianthi,3.dicot,native
7/09/2023,2338918,2023-09-07 20:24:56 UTC,Apiaceae,Actinotus,Actinotus helianthi,3.dicot,native
20/09/2023,5435930,2023-09-25 12:15:13 UTC,Apiaceae,Actinotus,Actinotus helianthi,3.dicot,native
24/09/2023,1138587,2023-09-27 03:10:25 UTC,Apiaceae,Actinotus,Actinotus helianthi,3.dicot,native
27/09/2023,5140725,2023-09-27 09:26:16 UTC,Apiaceae,Actinotus,Actinotus helianthi,3.dicot,native
27/09/2023,5140725,2023-09-27 09:26:24 UTC,Apiaceae,Actinotus,Actinotus helianthi,3.dicot,native
24/09/2023,661392,2023-09-29 12:41:11 UTC,Apiaceae,Actinotus,Actinotus helianthi,3.dicot,native
7/10/2023,7464161,2023-10-07 23:30:25 UTC,Apiaceae,Actinotus,Actinotus helianthi,3.dicot,native
14/10/2023,3751299,2023-10-14 05:42:18 UTC,Apiaceae,Actinotus,Actinotus helianthi,3.dicot,native
15/10/2023,2751244,2023-10-15 01:08:11 UTC,Apiaceae,Actinotus,Actinotus helianthi,3.dicot,native
2/10/2023,7488793,2023-10-16 10:38:14 UTC,Apiaceae,Actinotus,Actinotus helianthi,3.dicot,native
20/10/2023,4453532,2023-10-20 09:32:16 UTC,Apiaceae,Actinotus,Actinotus helianthi,3.dicot,native
21/10/2023,993680,2023-10-21 00:01:58 UTC,Apiaceae,Actinotus,Actinotus helianthi,3.dicot,native
12/10/2023,6516136,2023-10-23 03:38:02 UTC,Apiaceae,Actinotus,Actinotus helianthi,3.dicot,native
21/10/2023,1708045,2023-10-23 16:43:48 UTC,Apiaceae,Actinotus,Actinotus helianthi,3.dicot,native
21/10/2023,5739,2023-10-24 00:00:59 UTC,Apiaceae,Actinotus,Actinotus helianthi,3.dicot,native
21/10/2023,1708045,2023-10-24 04:37:28 UTC,Apiaceae,Actinotus,Actinotus helianthi,3.dicot,native
21/10/2023,1708045,2023-10-24 04:42:41 UTC,Apiaceae,Actinotus,Actinotus helianthi,3.dicot,native
24/10/2023,3311964,2023-10-25 19:27:59 UTC,Apiaceae,Actinotus,Actinotus helianthi,3.dicot,native
30/10/2023,2453859,2023-11-04 03:49:43 UTC,Apiaceae,Actinotus,Actinotus helianthi,3.dicot,native
11/11/2023,6585857,2023-11-11 06:53:22 UTC,Apiaceae,Actinotus,Actinotus helianthi,3.dicot,native
30/11/2023,3175896,2023-11-30 06:33:50 UTC,Apiaceae,Actinotus,Actinotus helianthi,3.dicot,native
12/12/2023,3786096,2023-12-14 07:02:05 UTC,Apiaceae,Actinotus,Actinotus helianthi,3.dicot,native
17/12/2023,1305186,2023-12-18 00:21:46 UTC,Apiaceae,Actinotus,Actinotus helianthi,3.dicot,native
23/12/2023,2574311,2023-12-23 05:01:03 UTC,Apiaceae,Actinotus,Actinotus helianthi,3.dicot,native
28/12/2023,7464766,2024-01-02 03:28:41 UTC,Apiaceae,Actinotus,Actinotus helianthi,3.dicot,native
8/12/2023,6308847,2024-01-04 23:38:22 UTC,Apiaceae,Actinotus,Actinotus helianthi,3.dicot,native
30/01/2024,3478104,2024-02-04 06:22:05 UTC,Apiaceae,Actinotus,Actinotus helianthi,3.dicot,native
11/02/2024,4672448,2024-02-11 03:47:29 UTC,Apiaceae,Actinotus,Actinotus helianthi,3.dicot,native
20/02/2024,4743351,2024-02-20 23:21:10 UTC,Apiaceae,Actinotus,Actinotus helianthi,3.dicot,native
9/02/2024,1926016,2024-03-22 08:33:41 UTC,Apiaceae,Actinotus,Actinotus helianthi,3.dicot,native
14/09/2022,745089,2024-03-29 03:51:05 UTC,Apiaceae,Actinotus,Actinotus helianthi,3.dicot,native
27/04/2024,8057547,2024-04-27 03:44:31 UTC,Apiaceae,Actinotus,Actinotus helianthi,3.dicot,native
26/01/2023,8088598,2024-05-03 04:20:29 UTC,Apiaceae,Actinotus,Actinotus helianthi,3.dicot,native
24/05/2024,2177281,2024-05-26 00:22:00 UTC,Apiaceae,Actinotus,Actinotus helianthi,3.dicot,native
2/11/2011,2991,2011-12-29 21:25:20 UTC,Apiaceae,Actinotus,Actinotus minor,3.dicot,native
2/01/2015,62990,2015-01-02 06:24:18 UTC,Apiaceae,Actinotus,Actinotus minor,3.dicot,native
13/06/2015,64271,2015-06-20 13:15:41 UTC,Apiaceae,Actinotus,Actinotus minor,3.dicot,native
29/10/2014,2991,2015-07-18 05:15:32 UTC,Apiaceae,Actinotus,Actinotus minor,3.dicot,native
17/05/2018,364713,2018-05-17 09:00:01 UTC,Apiaceae,Actinotus,Actinotus minor,3.dicot,native
7/01/2019,1382106,2019-01-07 06:25:50 UTC,Apiaceae,Actinotus,Actinotus minor,3.dicot,native
11/08/2019,45978,2019-08-11 06:09:28 UTC,Apiaceae,Actinotus,Actinotus minor,3.dicot,native
7/10/2019,708958,2019-10-07 06:03:16 UTC,Apiaceae,Actinotus,Actinotus minor,3.dicot,native
23/09/2019,636550,2019-10-18 08:07:05 UTC,Apiaceae,Actinotus,Actinotus minor,3.dicot,native
15/12/2019,2488549,2019-12-15 05:54:36 UTC,Apiaceae,Actinotus,Actinotus minor,3.dicot,native
31/12/2019,2488549,2019-12-30 23:21:17 UTC,Apiaceae,Actinotus,Actinotus minor,3.dicot,native
12/01/2020,2488549,2020-01-12 02:13:45 UTC,Apiaceae,Actinotus,Actinotus minor,3.dicot,native
18/01/2020,2488549,2020-01-18 01:05:40 UTC,Apiaceae,Actinotus,Actinotus minor,3.dicot,native
26/04/2020,2488549,2020-04-26 08:02:53 UTC,Apiaceae,Actinotus,Actinotus minor,3.dicot,native
30/10/2018,3408787,2020-08-04 08:13:09 UTC,Apiaceae,Actinotus,Actinotus minor,3.dicot,native
5/08/2020,793005,2020-08-05 17:20:57 UTC,Apiaceae,Actinotus,Actinotus minor,3.dicot,native
12/08/2020,2488549,2020-08-12 03:36:10 UTC,Apiaceae,Actinotus,Actinotus minor,3.dicot,native
29/09/2020,738376,2020-10-02 02:40:52 UTC,Apiaceae,Actinotus,Actinotus minor,3.dicot,native
10/10/2020,3769223,2020-10-21 12:07:47 UTC,Apiaceae,Actinotus,Actinotus minor,3.dicot,native
19/10/2020,793005,2020-10-29 13:28:20 UTC,Apiaceae,Actinotus,Actinotus minor,3.dicot,native
26/11/2020,793005,2020-12-20 04:24:58 UTC,Apiaceae,Actinotus,Actinotus minor,3.dicot,native
27/12/2020,2488549,2020-12-27 09:10:11 UTC,Apiaceae,Actinotus,Actinotus minor,3.dicot,native
1/01/2021,2376854,2021-01-01 15:02:49 UTC,Apiaceae,Actinotus,Actinotus minor,3.dicot,native
1/01/2021,2376854,2021-01-01 15:08:25 UTC,Apiaceae,Actinotus,Actinotus minor,3.dicot,native
15/11/2020,3313573,2021-01-03 02:38:59 UTC,Apiaceae,Actinotus,Actinotus minor,3.dicot,native
7/02/2021,2376854,2021-02-07 10:50:30 UTC,Apiaceae,Actinotus,Actinotus minor,3.dicot,native
14/02/2021,2560596,2021-02-14 11:09:07 UTC,Apiaceae,Actinotus,Actinotus minor,3.dicot,native
28/02/2021,2376854,2021-02-28 11:24:35 UTC,Apiaceae,Actinotus,Actinotus minor,3.dicot,native
28/02/2021,2376854,2021-02-28 11:25:09 UTC,Apiaceae,Actinotus,Actinotus minor,3.dicot,native
8/04/2021,325733,2021-04-09 12:20:27 UTC,Apiaceae,Actinotus,Actinotus minor,3.dicot,native
18/11/2018,3313573,2021-07-26 11:34:55 UTC,Apiaceae,Actinotus,Actinotus minor,3.dicot,native
30/08/2021,4916136,2021-08-30 11:46:23 UTC,Apiaceae,Actinotus,Actinotus minor,3.dicot,native
4/09/2021,3893507,2021-09-04 21:25:00 UTC,Apiaceae,Actinotus,Actinotus minor,3.dicot,native
6/09/2021,4887682,2021-09-06 08:23:52 UTC,Apiaceae,Actinotus,Actinotus minor,3.dicot,native
8/09/2021,4743351,2021-09-09 13:11:12 UTC,Apiaceae,Actinotus,Actinotus minor,3.dicot,native
17/09/2021,2488549,2021-09-17 11:31:53 UTC,Apiaceae,Actinotus,Actinotus minor,3.dicot,native
18/09/2021,4945027,2021-09-18 09:58:00 UTC,Apiaceae,Actinotus,Actinotus minor,3.dicot,native
4/10/2021,4916136,2021-10-06 08:09:21 UTC,Apiaceae,Actinotus,Actinotus minor,3.dicot,native
9/10/2021,5033453,2021-10-16 23:58:18 UTC,Apiaceae,Actinotus,Actinotus minor,3.dicot,native
23/10/2021,2376854,2021-10-23 12:45:56 UTC,Apiaceae,Actinotus,Actinotus minor,3.dicot,native
23/10/2021,3880468,2021-10-24 11:10:47 UTC,Apiaceae,Actinotus,Actinotus minor,3.dicot,native
30/10/2021,4916136,2021-10-30 12:23:12 UTC,Apiaceae,Actinotus,Actinotus minor,3.dicot,native
13/11/2021,325733,2021-11-15 23:36:38 UTC,Apiaceae,Actinotus,Actinotus minor,3.dicot,native
17/11/2021,3880468,2021-11-17 11:56:36 UTC,Apiaceae,Actinotus,Actinotus minor,3.dicot,native
1/01/2022,2317723,2021-12-31 23:47:52 UTC,Apiaceae,Actinotus,Actinotus minor,3.dicot,native
5/04/2022,4743351,2022-04-06 05:37:15 UTC,Apiaceae,Actinotus,Actinotus minor,3.dicot,native
16/04/2022,3751299,2022-04-16 11:18:15 UTC,Apiaceae,Actinotus,Actinotus minor,3.dicot,native
30/04/2022,1138587,2022-04-30 10:27:05 UTC,Apiaceae,Actinotus,Actinotus minor,3.dicot,native
19/09/2021,3425899,2022-06-23 08:16:09 UTC,Apiaceae,Actinotus,Actinotus minor,3.dicot,native
30/07/2022,149222,2022-07-29 23:58:39 UTC,Apiaceae,Actinotus,Actinotus minor,3.dicot,native
16/11/2021,6029661,2022-08-17 01:16:43 UTC,Apiaceae,Actinotus,Actinotus minor,3.dicot,native
11/09/2022,2366151,2022-09-11 04:39:04 UTC,Apiaceae,Actinotus,Actinotus minor,3.dicot,native
25/09/2022,1138587,2022-09-25 06:58:30 UTC,Apiaceae,Actinotus,Actinotus minor,3.dicot,native
25/09/2022,3957444,2022-09-25 08:38:46 UTC,Apiaceae,Actinotus,Actinotus minor,3.dicot,native
24/09/2022,3933721,2022-09-25 21:39:04 UTC,Apiaceae,Actinotus,Actinotus minor,3.dicot,native
27/10/2022,2631448,2022-10-31 10:07:30 UTC,Apiaceae,Actinotus,Actinotus minor,3.dicot,native
13/11/2022,624851,2022-11-21 06:14:57 UTC,Apiaceae,Actinotus,Actinotus minor,3.dicot,native
14/12/2022,1974770,2022-12-15 05:11:22 UTC,Apiaceae,Actinotus,Actinotus minor,3.dicot,native
14/01/2023,6228722,2023-01-14 04:08:18 UTC,Apiaceae,Actinotus,Actinotus minor,3.dicot,native
27/01/2023,5534230,2023-01-28 05:19:36 UTC,Apiaceae,Actinotus,Actinotus minor,3.dicot,native
5/04/2023,1809954,2023-04-06 22:54:27 UTC,Apiaceae,Actinotus,Actinotus minor,3.dicot,native
18/04/2023,3009465,2023-04-18 06:31:30 UTC,Apiaceae,Actinotus,Actinotus minor,3.dicot,native
28/05/2023,2325183,2023-05-28 07:28:16 UTC,Apiaceae,Actinotus,Actinotus minor,3.dicot,native
26/06/2023,6308282,2023-06-26 02:15:16 UTC,Apiaceae,Actinotus,Actinotus minor,3.dicot,native
8/07/2023,6196075,2023-07-08 01:53:33 UTC,Apiaceae,Actinotus,Actinotus minor,3.dicot,native
16/07/2023,7001195,2023-07-16 05:52:26 UTC,Apiaceae,Actinotus,Actinotus minor,3.dicot,native
16/07/2023,5315657,2023-07-16 05:52:49 UTC,Apiaceae,Actinotus,Actinotus minor,3.dicot,native
16/07/2023,2366151,2023-07-16 11:02:28 UTC,Apiaceae,Actinotus,Actinotus minor,3.dicot,native
28/07/2023,4124411,2023-07-28 04:20:58 UTC,Apiaceae,Actinotus,Actinotus minor,3.dicot,native
29/07/2023,2650798,2023-07-30 11:29:32 UTC,Apiaceae,Actinotus,Actinotus minor,3.dicot,native
25/08/2023,6196075,2023-08-25 08:02:40 UTC,Apiaceae,Actinotus,Actinotus minor,3.dicot,native
7/09/2023,5188972,2023-09-07 12:29:26 UTC,Apiaceae,Actinotus,Actinotus minor,3.dicot,native
20/09/2023,5435930,2023-09-25 12:15:13 UTC,Apiaceae,Actinotus,Actinotus minor,3.dicot,native
24/09/2023,4359490,2023-09-26 08:14:42 UTC,Apiaceae,Actinotus,Actinotus minor,3.dicot,native
24/09/2023,1138587,2023-09-27 03:10:26 UTC,Apiaceae,Actinotus,Actinotus minor,3.dicot,native
24/09/2023,661392,2023-09-29 13:18:57 UTC,Apiaceae,Actinotus,Actinotus minor,3.dicot,native
2/10/2023,7066727,2023-10-02 02:00:14 UTC,Apiaceae,Actinotus,Actinotus minor,3.dicot,native
14/10/2023,3751299,2023-10-14 05:42:55 UTC,Apiaceae,Actinotus,Actinotus minor,3.dicot,native
9/10/2023,6308282,2023-10-15 01:00:34 UTC,Apiaceae,Actinotus,Actinotus minor,3.dicot,native
12/10/2023,6516136,2023-10-23 03:39:29 UTC,Apiaceae,Actinotus,Actinotus minor,3.dicot,native
21/10/2023,1708045,2023-10-24 04:36:45 UTC,Apiaceae,Actinotus,Actinotus minor,3.dicot,native
28/10/2023,6585857,2023-10-28 05:20:17 UTC,Apiaceae,Actinotus,Actinotus minor,3.dicot,native
16/09/2023,745089,2023-11-07 06:28:21 UTC,Apiaceae,Actinotus,Actinotus minor,3.dicot,native
27/11/2023,7204155,2023-11-27 08:35:56 UTC,Apiaceae,Actinotus,Actinotus minor,3.dicot,native
10/08/2023,2379395,2023-12-05 05:26:29 UTC,Apiaceae,Actinotus,Actinotus minor,3.dicot,native
15/12/2023,6542702,2023-12-15 00:18:45 UTC,Apiaceae,Actinotus,Actinotus minor,3.dicot,native
15/12/2023,7471329,2023-12-22 09:11:07 UTC,Apiaceae,Actinotus,Actinotus minor,3.dicot,native
28/12/2023,7464766,2023-12-28 10:01:25 UTC,Apiaceae,Actinotus,Actinotus minor,3.dicot,native
2/01/2024,1138587,2024-01-02 09:12:30 UTC,Apiaceae,Actinotus,Actinotus minor,3.dicot,native
4/01/2024,6908976,2024-01-04 04:27:41 UTC,Apiaceae,Actinotus,Actinotus minor,3.dicot,native
11/02/2024,4672448,2024-02-11 03:48:00 UTC,Apiaceae,Actinotus,Actinotus minor,3.dicot,native
20/02/2024,4743351,2024-02-20 23:21:06 UTC,Apiaceae,Actinotus,Actinotus minor,3.dicot,native
21/04/2024,265090,2024-04-21 05:27:33 UTC,Apiaceae,Actinotus,Actinotus minor,3.dicot,native
16/05/2018,558419,2018-05-17 08:12:26 UTC,Pteridaceae,Adiantum,Adiantum aethiopicum,1.ferns/primitive,native
5/08/2020,793005,2020-08-06 01:56:49 UTC,Pteridaceae,Adiantum,Adiantum aethiopicum,1.ferns/primitive,native
24/09/2021,4887682,2021-09-24 05:36:41 UTC,Pteridaceae,Adiantum,Adiantum aethiopicum,1.ferns/primitive,native
20/03/2023,1259195,2023-03-26 10:28:00 UTC,Pteridaceae,Adiantum,Adiantum aethiopicum,1.ferns/primitive,native
20/07/2023,6196075,2023-07-20 03:00:46 UTC,Pteridaceae,Adiantum,Adiantum aethiopicum,1.ferns/primitive,native
2/01/2024,1138587,2024-01-02 08:07:04 UTC,Pteridaceae,Adiantum,Adiantum aethiopicum,1.ferns/primitive,native
23/12/2017,58341,2017-12-27 04:28:33 UTC,Pteridaceae,Adiantum,Adiantum formosum,1.ferns/primitive,native
3/04/2020,2488549,2020-04-03 19:29:55 UTC,Pteridaceae,Adiantum,Adiantum formosum,1.ferns/primitive,native
9/05/2020,2488549,2020-05-09 19:46:20 UTC,Pteridaceae,Adiantum,Adiantum formosum,1.ferns/primitive,native
5/06/2020,793005,2020-07-25 05:41:10 UTC,Pteridaceae,Adiantum,Adiantum formosum,1.ferns/primitive,native
5/08/2020,793005,2020-08-06 01:35:38 UTC,Pteridaceae,Adiantum,Adiantum formosum,1.ferns/primitive,native
5/08/2020,793005,2020-08-06 01:40:10 UTC,Pteridaceae,Adiantum,Adiantum formosum,1.ferns/primitive,native
10/05/2021,793005,2021-06-02 04:25:25 UTC,Pteridaceae,Adiantum,Adiantum formosum,1.ferns/primitive,native
4/07/2021,4743351,2021-07-19 11:31:10 UTC,Pteridaceae,Adiantum,Adiantum formosum,1.ferns/primitive,native
21/05/2021,4743351,2021-07-20 10:25:39 UTC,Pteridaceae,Adiantum,Adiantum formosum,1.ferns/primitive,native
21/09/2021,4743351,2021-09-23 10:03:53 UTC,Pteridaceae,Adiantum,Adiantum formosum,1.ferns/primitive,native
26/10/2021,4743351,2021-10-26 11:05:54 UTC,Pteridaceae,Adiantum,Adiantum formosum,1.ferns/primitive,native
28/10/2021,706931,2021-10-28 08:27:25 UTC,Pteridaceae,Adiantum,Adiantum formosum,1.ferns/primitive,native
15/07/1989,717200,2022-06-02 06:49:32 UTC,Pteridaceae,Adiantum,Adiantum formosum,1.ferns/primitive,native
26/01/2022,793005,2022-12-15 11:30:12 UTC,Pteridaceae,Adiantum,Adiantum formosum,1.ferns/primitive,native
26/03/2023,5810336,2023-03-27 23:35:04 UTC,Pteridaceae,Adiantum,Adiantum formosum,1.ferns/primitive,native
2/06/2023,5037697,2023-06-02 02:37:50 UTC,Pteridaceae,Adiantum,Adiantum formosum,1.ferns/primitive,native
28/05/2023,4317345,2023-06-09 11:08:39 UTC,Pteridaceae,Adiantum,Adiantum formosum,1.ferns/primitive,native
28/10/2023,2631448,2023-10-29 05:01:22 UTC,Pteridaceae,Adiantum,Adiantum formosum,1.ferns/primitive,native
13/11/2023,2518411,2023-11-13 08:45:16 UTC,Pteridaceae,Adiantum,Adiantum formosum,1.ferns/primitive,native
2/01/2024,661392,2024-01-02 05:36:05 UTC,Pteridaceae,Adiantum,Adiantum formosum,1.ferns/primitive,native
2/01/2024,1138587,2024-01-02 08:07:09 UTC,Pteridaceae,Adiantum,Adiantum formosum,1.ferns/primitive,native
23/04/2024,2517717,2024-04-23 04:49:43 UTC,Pteridaceae,Adiantum,Adiantum formosum,1.ferns/primitive,native
19/03/2020,2488549,2020-03-19 09:49:37 UTC,Pteridaceae,Adiantum,Adiantum hispidulum,1.ferns/primitive,native
12/02/2023,4743351,2023-02-14 02:07:12 UTC,Pteridaceae,Adiantum,Adiantum hispidulum,1.ferns/primitive,native
25/01/2020,2488549,2020-01-25 01:12:11 UTC,Primulaceae,Aegiceras,Aegiceras corniculatum,3.dicot,native
19/09/2021,4945027,2021-09-19 06:15:17 UTC,Primulaceae,Aegiceras,Aegiceras corniculatum,3.dicot,native
8/11/2021,4916136,2021-11-08 09:35:32 UTC,Primulaceae,Aegiceras,Aegiceras corniculatum,3.dicot,native
29/05/2022,265090,2022-05-29 03:41:18 UTC,Primulaceae,Aegiceras,Aegiceras corniculatum,3.dicot,native
29/05/2022,265090,2022-05-29 04:06:44 UTC,Primulaceae,Aegiceras,Aegiceras corniculatum,3.dicot,native
29/05/2022,265090,2022-05-29 04:10:36 UTC,Primulaceae,Aegiceras,Aegiceras corniculatum,3.dicot,native
18/01/1988,717200,2022-06-17 02:20:59 UTC,Primulaceae,Aegiceras,Aegiceras corniculatum,3.dicot,native
13/08/2022,265090,2022-08-13 01:55:52 UTC,Primulaceae,Aegiceras,Aegiceras corniculatum,3.dicot,native
13/08/2022,265090,2022-08-13 02:00:40 UTC,Primulaceae,Aegiceras,Aegiceras corniculatum,3.dicot,native
11/03/2023,745089,2023-03-11 20:38:42 UTC,Primulaceae,Aegiceras,Aegiceras corniculatum,3.dicot,native
9/03/2023,1658043,2023-03-13 05:43:50 UTC,Primulaceae,Aegiceras,Aegiceras corniculatum,3.dicot,native
9/03/2023,1658043,2023-03-13 05:43:52 UTC,Primulaceae,Aegiceras,Aegiceras corniculatum,3.dicot,native
9/03/2023,1658043,2023-03-13 05:44:00 UTC,Primulaceae,Aegiceras,Aegiceras corniculatum,3.dicot,native
25/12/2022,1175154,2022-12-25 08:46:29 UTC,Amaryllidaceae,Agapanthus,Agapanthus praecox,5.monocot-colorful,introduced
26/12/2019,2488549,2019-12-26 07:48:28 UTC,Asteraceae,Ageratina,Ageratina adenophora,3.dicot,introduced
15/07/2020,2488549,2020-07-15 07:12:07 UTC,Asteraceae,Ageratina,Ageratina adenophora,3.dicot,introduced
29/08/2020,2488549,2020-08-29 03:54:39 UTC,Asteraceae,Ageratina,Ageratina adenophora,3.dicot,introduced
10/09/2021,2488549,2021-09-10 08:11:58 UTC,Asteraceae,Ageratina,Ageratina adenophora,3.dicot,introduced
30/03/2022,4094096,2022-03-30 03:20:00 UTC,Asteraceae,Ageratina,Ageratina adenophora,3.dicot,introduced
25/09/2022,1138587,2022-09-25 06:58:39 UTC,Asteraceae,Ageratina,Ageratina adenophora,3.dicot,introduced
3/10/2022,6209647,2022-10-03 12:31:03 UTC,Asteraceae,Ageratina,Ageratina adenophora,3.dicot,introduced
13/11/2022,624851,2022-11-21 06:14:57 UTC,Asteraceae,Ageratina,Ageratina adenophora,3.dicot,introduced
20/03/2023,1259195,2023-03-26 10:27:51 UTC,Asteraceae,Ageratina,Ageratina adenophora,3.dicot,introduced
8/07/2023,2583877,2023-07-08 05:20:13 UTC,Asteraceae,Ageratina,Ageratina adenophora,3.dicot,introduced
21/08/2023,4177273,2023-08-21 22:25:18 UTC,Asteraceae,Ageratina,Ageratina adenophora,3.dicot,introduced
20/09/2023,5435930,2023-09-25 12:15:03 UTC,Asteraceae,Ageratina,Ageratina adenophora,3.dicot,introduced
2/01/2024,1138587,2024-01-02 08:51:14 UTC,Asteraceae,Ageratina,Ageratina adenophora,3.dicot,introduced
21/08/2020,2488549,2020-08-21 09:57:32 UTC,Asteraceae,Ageratina,Ageratina riparia,3.dicot,introduced
29/08/2020,2488549,2020-08-29 03:46:04 UTC,Asteraceae,Ageratina,Ageratina riparia,3.dicot,introduced
24/09/2023,1138587,2023-09-27 02:55:57 UTC,Asteraceae,Ageratina,Ageratina riparia,3.dicot,introduced
24/09/2023,1138587,2023-09-27 02:55:57 UTC,Asteraceae,Ageratina,Ageratina riparia,3.dicot,introduced
24/09/2023,1138587,2023-09-27 02:55:58 UTC,Asteraceae,Ageratina,Ageratina riparia,3.dicot,introduced
24/09/2023,1138587,2023-09-27 02:55:59 UTC,Asteraceae,Ageratina,Ageratina riparia,3.dicot,introduced
24/09/2023,1138587,2023-09-27 03:20:50 UTC,Asteraceae,Ageratina,Ageratina riparia,3.dicot,introduced
24/09/2023,661392,2023-09-29 11:38:16 UTC,Asteraceae,Ageratina,Ageratina riparia,3.dicot,introduced
26/04/2020,2488549,2020-04-26 08:39:22 UTC,Casuarinaceae,Allocasuarina,Allocasuarina distyla,3.dicot,native
23/05/2020,62599,2020-05-23 10:31:28 UTC,Casuarinaceae,Allocasuarina,Allocasuarina distyla,3.dicot,native
7/02/2015,215669,2020-06-07 22:59:57 UTC,Casuarinaceae,Allocasuarina,Allocasuarina distyla,3.dicot,native
30/11/2021,4916136,2021-11-30 11:46:28 UTC,Casuarinaceae,Allocasuarina,Allocasuarina distyla,3.dicot,native
16/05/2015,4002106,2022-03-10 18:04:18 UTC,Casuarinaceae,Allocasuarina,Allocasuarina distyla,3.dicot,native
30/04/2022,1138587,2022-04-30 09:41:59 UTC,Casuarinaceae,Allocasuarina,Allocasuarina distyla,3.dicot,native
24/08/2022,6011270,2022-08-24 01:49:07 UTC,Casuarinaceae,Allocasuarina,Allocasuarina distyla,3.dicot,native
26/02/2023,4743351,2023-02-27 09:57:03 UTC,Casuarinaceae,Allocasuarina,Allocasuarina distyla,3.dicot,native
4/03/2023,1187603,2023-03-14 11:11:38 UTC,Casuarinaceae,Allocasuarina,Allocasuarina distyla,3.dicot,native
9/07/2023,4059674,2023-07-09 05:05:59 UTC,Casuarinaceae,Allocasuarina,Allocasuarina distyla,3.dicot,native
28/12/2023,7464766,2024-01-01 04:16:38 UTC,Casuarinaceae,Allocasuarina,Allocasuarina distyla,3.dicot,native
2/01/2024,661392,2024-01-02 06:21:11 UTC,Casuarinaceae,Allocasuarina,Allocasuarina distyla,3.dicot,native
9/03/2023,1658043,2023-03-13 07:22:43 UTC,Casuarinaceae,Allocasuarina,Allocasuarina littoralis,3.dicot,native
31/07/2022,265090,2022-07-31 10:11:34 UTC,Casuarinaceae,Allocasuarina,Allocasuarina torulosa,3.dicot,native
4/07/2021,3957444,2021-07-04 05:48:19 UTC,Casuarinaceae,Allocasuarina,Allocasuarina verticillata,3.dicot,native
12/03/2023,6566631,2023-03-12 05:26:08 UTC,Araceae,Alocasia,Alocasia brisbanensis,5.monocot-colorful,native
9/05/2020,2488549,2020-05-09 09:24:26 UTC,Rhamnaceae,Alphitonia,Alphitonia excelsa,3.dicot,native
10/02/2021,706931,2021-02-10 06:57:47 UTC,Rhamnaceae,Alphitonia,Alphitonia excelsa,3.dicot,native
28/03/2022,603063,2022-04-26 10:57:45 UTC,Alstroemeriaceae,Alstroemeria,Alstroemeria psittacina,5.monocot-colorful,introduced
10/02/2023,1175154,2023-02-10 20:20:58 UTC,Alstroemeriaceae,Alstroemeria,Alstroemeria psittacina,5.monocot-colorful,introduced
9/10/2020,2488549,2020-10-09 20:59:08 UTC,Euphorbiaceae,Amperea,Amperea xiphoclada,3.dicot,native
28/09/2021,4743351,2021-09-29 10:19:10 UTC,Euphorbiaceae,Amperea,Amperea xiphoclada,3.dicot,native
26/06/2022,2322306,2022-06-27 23:16:35 UTC,Euphorbiaceae,Amperea,Amperea xiphoclada,3.dicot,native
20/09/2023,5435930,2023-09-25 12:15:30 UTC,Euphorbiaceae,Amperea,Amperea xiphoclada,3.dicot,native
24/09/2023,661392,2023-09-28 13:41:04 UTC,Euphorbiaceae,Amperea,Amperea xiphoclada,3.dicot,native
16/06/2020,2602714,2020-06-16 05:12:47 UTC,Loranthaceae,Amyema,Amyema congener,3.dicot,native
30/05/2023,3978191,2023-05-30 08:47:24 UTC,Poaceae,Andropogon,Andropogon virginicus,4.monocot,introduced
20/07/2023,6196075,2023-07-20 02:47:37 UTC,Poaceae,Andropogon,Andropogon virginicus,4.monocot,introduced
2/01/2024,661392,2024-01-02 06:02:33 UTC,Commelinaceae,Aneilema,Aneilema acuminatum,5.monocot-colorful,native
2/01/2024,1138587,2024-01-02 08:51:15 UTC,Commelinaceae,Aneilema,Aneilema acuminatum,5.monocot-colorful,native
25/10/2010,2991,2012-10-09 01:09:03 UTC,Myrtaceae,Angophora,Angophora costata,3.dicot,native
2/11/2011,2991,2013-06-10 21:07:38 UTC,Myrtaceae,Angophora,Angophora costata,3.dicot,native
19/04/2018,841801,2018-04-19 06:27:35 UTC,Myrtaceae,Angophora,Angophora costata,3.dicot,native
7/01/2019,1382106,2019-01-07 06:21:50 UTC,Myrtaceae,Angophora,Angophora costata,3.dicot,native
19/05/2019,1527933,2019-05-19 12:23:02 UTC,Myrtaceae,Angophora,Angophora costata,3.dicot,native
1/12/2014,38771,2019-12-05 00:20:47 UTC,Myrtaceae,Angophora,Angophora costata,3.dicot,native
23/12/2019,2488549,2019-12-23 06:04:19 UTC,Myrtaceae,Angophora,Angophora costata,3.dicot,native
12/01/2020,2488549,2020-01-12 08:29:02 UTC,Myrtaceae,Angophora,Angophora costata,3.dicot,native
26/01/2020,2488549,2020-01-26 08:13:58 UTC,Myrtaceae,Angophora,Angophora costata,3.dicot,native
9/12/2020,3748684,2020-12-09 12:57:40 UTC,Myrtaceae,Angophora,Angophora costata,3.dicot,native
7/02/2021,2376854,2021-02-07 08:56:14 UTC,Myrtaceae,Angophora,Angophora costata,3.dicot,native
4/03/2021,3678274,2021-03-12 12:23:17 UTC,Myrtaceae,Angophora,Angophora costata,3.dicot,native
3/09/2021,4887682,2021-09-03 08:48:40 UTC,Myrtaceae,Angophora,Angophora costata,3.dicot,native
1/01/2022,265090,2022-01-01 19:34:27 UTC,Myrtaceae,Angophora,Angophora costata,3.dicot,native
1/01/2022,265090,2022-01-01 21:51:30 UTC,Myrtaceae,Angophora,Angophora costata,3.dicot,native
4/02/2022,2705795,2022-02-04 15:22:51 UTC,Myrtaceae,Angophora,Angophora costata,3.dicot,native
13/04/2022,5436874,2022-05-08 02:01:54 UTC,Myrtaceae,Angophora,Angophora costata,3.dicot,native
12/06/2022,2479985,2022-06-15 10:50:15 UTC,Myrtaceae,Angophora,Angophora costata,3.dicot,native
24/07/2022,265090,2022-07-25 19:02:14 UTC,Myrtaceae,Angophora,Angophora costata,3.dicot,native
14/08/2022,265090,2022-08-14 05:34:19 UTC,Myrtaceae,Angophora,Angophora costata,3.dicot,native
11/09/2022,1175154,2022-09-11 07:20:12 UTC,Myrtaceae,Angophora,Angophora costata,3.dicot,native
29/05/2022,4378750,2022-12-11 10:09:49 UTC,Myrtaceae,Angophora,Angophora costata,3.dicot,native
3/01/2023,576419,2023-01-02 22:28:33 UTC,Myrtaceae,Angophora,Angophora costata,3.dicot,native
11/03/2023,745089,2023-03-11 20:56:57 UTC,Myrtaceae,Angophora,Angophora costata,3.dicot,native
10/04/2023,6437775,2023-04-10 08:56:06 UTC,Myrtaceae,Angophora,Angophora costata,3.dicot,native
12/04/2023,6592640,2023-04-13 03:59:25 UTC,Myrtaceae,Angophora,Angophora costata,3.dicot,native
16/07/2023,2366151,2023-07-16 11:04:20 UTC,Myrtaceae,Angophora,Angophora costata,3.dicot,native
21/08/2023,4177273,2023-08-21 22:23:11 UTC,Myrtaceae,Angophora,Angophora costata,3.dicot,native
24/09/2023,661392,2023-09-28 14:03:02 UTC,Myrtaceae,Angophora,Angophora costata,3.dicot,native
8/10/2023,7143748,2023-10-08 05:53:31 UTC,Myrtaceae,Angophora,Angophora costata,3.dicot,native
28/12/2023,7464766,2023-12-30 11:21:24 UTC,Myrtaceae,Angophora,Angophora costata,3.dicot,native
21/04/2024,265090,2024-04-21 06:23:00 UTC,Myrtaceae,Angophora,Angophora costata,3.dicot,native
2/11/2011,2991,2013-06-10 20:52:53 UTC,Myrtaceae,Angophora,Angophora hispida,3.dicot,native
2/01/2015,62990,2015-01-02 06:24:16 UTC,Myrtaceae,Angophora,Angophora hispida,3.dicot,native
1/11/2017,689909,2017-10-31 21:45:11 UTC,Myrtaceae,Angophora,Angophora hispida,3.dicot,native
18/08/2019,265090,2019-08-20 18:39:11 UTC,Myrtaceae,Angophora,Angophora hispida,3.dicot,native
1/12/2014,38771,2019-12-05 00:20:44 UTC,Myrtaceae,Angophora,Angophora hispida,3.dicot,native
3/11/2018,2488549,2019-12-19 20:24:08 UTC,Myrtaceae,Angophora,Angophora hispida,3.dicot,native
12/01/2020,2488549,2020-01-12 07:28:26 UTC,Myrtaceae,Angophora,Angophora hispida,3.dicot,native
16/10/2005,2584563,2020-04-04 06:22:12 UTC,Myrtaceae,Angophora,Angophora hispida,3.dicot,native
22/03/2020,2633838,2020-04-11 11:32:58 UTC,Myrtaceae,Angophora,Angophora hispida,3.dicot,native
23/05/2020,62599,2020-05-23 11:11:43 UTC,Myrtaceae,Angophora,Angophora hispida,3.dicot,native
23/02/2020,2698489,2020-05-23 12:24:03 UTC,Myrtaceae,Angophora,Angophora hispida,3.dicot,native
10/10/2020,2779982,2020-10-11 03:14:36 UTC,Myrtaceae,Angophora,Angophora hispida,3.dicot,native
18/10/2020,265090,2020-10-19 07:17:14 UTC,Myrtaceae,Angophora,Angophora hispida,3.dicot,native
18/10/2020,265090,2020-10-19 08:30:16 UTC,Myrtaceae,Angophora,Angophora hispida,3.dicot,native
18/10/2020,265090,2020-10-19 19:23:59 UTC,Myrtaceae,Angophora,Angophora hispida,3.dicot,native
12/12/2020,3063457,2020-12-13 11:03:43 UTC,Myrtaceae,Angophora,Angophora hispida,3.dicot,native
12/12/2020,3063457,2020-12-13 11:12:37 UTC,Myrtaceae,Angophora,Angophora hispida,3.dicot,native
12/12/2020,2399118,2020-12-13 21:48:00 UTC,Myrtaceae,Angophora,Angophora hispida,3.dicot,native
28/12/2020,2488549,2020-12-28 20:58:13 UTC,Myrtaceae,Angophora,Angophora hispida,3.dicot,native
1/01/2021,2376854,2021-01-01 14:39:50 UTC,Myrtaceae,Angophora,Angophora hispida,3.dicot,native
7/02/2021,2376854,2021-02-07 08:31:02 UTC,Myrtaceae,Angophora,Angophora hispida,3.dicot,native
28/02/2021,2376854,2021-02-28 11:56:04 UTC,Myrtaceae,Angophora,Angophora hispida,3.dicot,native
3/07/2021,3978426,2021-07-03 06:59:48 UTC,Myrtaceae,Angophora,Angophora hispida,3.dicot,native
21/05/2021,4743351,2021-07-20 10:25:38 UTC,Myrtaceae,Angophora,Angophora hispida,3.dicot,native
28/04/2021,4743351,2021-07-20 11:17:56 UTC,Myrtaceae,Angophora,Angophora hispida,3.dicot,native
29/08/2020,4743351,2021-07-25 12:03:22 UTC,Myrtaceae,Angophora,Angophora hispida,3.dicot,native
18/11/2020,3313573,2021-07-26 11:42:46 UTC,Myrtaceae,Angophora,Angophora hispida,3.dicot,native
3/12/2019,4743351,2021-08-02 11:30:40 UTC,Myrtaceae,Angophora,Angophora hispida,3.dicot,native
3/12/2019,4743351,2021-08-02 11:30:40 UTC,Myrtaceae,Angophora,Angophora hispida,3.dicot,native
3/12/2019,4743351,2021-08-02 11:30:40 UTC,Myrtaceae,Angophora,Angophora hispida,3.dicot,native
5/09/2021,2488549,2021-09-05 10:39:03 UTC,Myrtaceae,Angophora,Angophora hispida,3.dicot,native
6/09/2021,4887682,2021-09-06 09:17:06 UTC,Myrtaceae,Angophora,Angophora hispida,3.dicot,native
10/09/2021,2488549,2021-09-10 10:44:10 UTC,Myrtaceae,Angophora,Angophora hispida,3.dicot,native
18/09/2021,4945027,2021-09-18 10:02:36 UTC,Myrtaceae,Angophora,Angophora hispida,3.dicot,native
24/09/2021,4916136,2021-09-24 14:26:38 UTC,Myrtaceae,Angophora,Angophora hispida,3.dicot,native
27/09/2021,4916136,2021-09-29 13:10:46 UTC,Myrtaceae,Angophora,Angophora hispida,3.dicot,native
28/09/2021,4743351,2021-10-01 07:22:24 UTC,Myrtaceae,Angophora,Angophora hispida,3.dicot,native
3/10/2021,2488549,2021-10-03 09:45:19 UTC,Myrtaceae,Angophora,Angophora hispida,3.dicot,native
18/10/2021,5136334,2021-10-19 02:55:41 UTC,Myrtaceae,Angophora,Angophora hispida,3.dicot,native
6/11/2021,2376854,2021-11-08 00:13:07 UTC,Myrtaceae,Angophora,Angophora hispida,3.dicot,native
19/11/2021,2488549,2021-11-20 02:23:19 UTC,Myrtaceae,Angophora,Angophora hispida,3.dicot,native
27/12/2019,18575,2021-12-06 07:58:42 UTC,Myrtaceae,Angophora,Angophora hispida,3.dicot,native
8/12/2021,4002123,2021-12-11 09:35:27 UTC,Myrtaceae,Angophora,Angophora hispida,3.dicot,native
21/12/2021,738376,2021-12-23 11:54:57 UTC,Myrtaceae,Angophora,Angophora hispida,3.dicot,native
31/12/2021,2488549,2021-12-31 09:29:06 UTC,Myrtaceae,Angophora,Angophora hispida,3.dicot,native
1/01/2022,2317723,2021-12-31 23:41:50 UTC,Myrtaceae,Angophora,Angophora hispida,3.dicot,native
1/01/2022,265090,2022-01-01 21:58:07 UTC,Myrtaceae,Angophora,Angophora hispida,3.dicot,native
1/01/2022,265090,2022-01-02 00:27:35 UTC,Myrtaceae,Angophora,Angophora hispida,3.dicot,native
1/01/2022,265090,2022-01-02 00:40:33 UTC,Myrtaceae,Angophora,Angophora hispida,3.dicot,native
29/12/2019,5283632,2022-01-10 09:06:18 UTC,Myrtaceae,Angophora,Angophora hispida,3.dicot,native
8/12/2018,5376779,2022-03-03 11:06:50 UTC,Myrtaceae,Angophora,Angophora hispida,3.dicot,native
30/04/2022,1138587,2022-04-30 09:41:58 UTC,Myrtaceae,Angophora,Angophora hispida,3.dicot,native
30/04/2022,1138587,2022-04-30 09:41:59 UTC,Myrtaceae,Angophora,Angophora hispida,3.dicot,native
17/11/2021,3880468,2022-05-04 14:23:13 UTC,Myrtaceae,Angophora,Angophora hispida,3.dicot,native
18/01/1988,717200,2022-06-17 02:20:50 UTC,Myrtaceae,Angophora,Angophora hispida,3.dicot,native
24/07/2022,265090,2022-07-25 11:13:04 UTC,Myrtaceae,Angophora,Angophora hispida,3.dicot,native
25/09/2022,1138587,2022-09-25 06:58:32 UTC,Myrtaceae,Angophora,Angophora hispida,3.dicot,native
4/10/2022,3678274,2022-10-12 06:31:19 UTC,Myrtaceae,Angophora,Angophora hispida,3.dicot,native
29/10/2022,1175154,2022-10-29 05:12:50 UTC,Myrtaceae,Angophora,Angophora hispida,3.dicot,native
29/10/2022,1175154,2022-10-29 05:14:45 UTC,Myrtaceae,Angophora,Angophora hispida,3.dicot,native
2/11/2022,2631448,2022-11-05 04:59:02 UTC,Myrtaceae,Angophora,Angophora hispida,3.dicot,native
10/12/2022,3382917,2022-12-10 11:33:32 UTC,Myrtaceae,Angophora,Angophora hispida,3.dicot,native
11/12/2022,6332085,2022-12-11 07:19:02 UTC,Myrtaceae,Angophora,Angophora hispida,3.dicot,native
10/12/2022,3879318,2022-12-11 09:30:30 UTC,Myrtaceae,Angophora,Angophora hispida,3.dicot,native
14/12/2022,1974770,2022-12-14 05:46:44 UTC,Myrtaceae,Angophora,Angophora hispida,3.dicot,native
15/12/2022,6331842,2022-12-17 22:05:50 UTC,Myrtaceae,Angophora,Angophora hispida,3.dicot,native
9/12/2022,2531563,2022-12-22 09:44:19 UTC,Myrtaceae,Angophora,Angophora hispida,3.dicot,native
20/12/2022,3280868,2022-12-24 05:48:39 UTC,Myrtaceae,Angophora,Angophora hispida,3.dicot,native
26/12/2022,6020519,2022-12-26 06:47:15 UTC,Myrtaceae,Angophora,Angophora hispida,3.dicot,native
27/12/2022,3978191,2022-12-27 04:40:42 UTC,Myrtaceae,Angophora,Angophora hispida,3.dicot,native
31/12/2022,3932690,2023-01-01 05:48:48 UTC,Myrtaceae,Angophora,Angophora hispida,3.dicot,native
1/01/2023,3978191,2023-01-01 13:12:51 UTC,Myrtaceae,Angophora,Angophora hispida,3.dicot,native
1/01/2023,2376854,2023-01-01 15:40:37 UTC,Myrtaceae,Angophora,Angophora hispida,3.dicot,native
4/01/2023,5027854,2023-01-05 03:33:47 UTC,Myrtaceae,Angophora,Angophora hispida,3.dicot,native
26/01/2023,2376854,2023-01-27 12:25:32 UTC,Myrtaceae,Angophora,Angophora hispida,3.dicot,native
11/03/2023,1175154,2023-03-11 08:05:03 UTC,Myrtaceae,Angophora,Angophora hispida,3.dicot,native
11/03/2023,1175154,2023-03-11 08:06:11 UTC,Myrtaceae,Angophora,Angophora hispida,3.dicot,native
5/04/2023,1809954,2023-04-06 22:54:30 UTC,Myrtaceae,Angophora,Angophora hispida,3.dicot,native
12/05/2023,2531563,2023-05-31 00:17:01 UTC,Myrtaceae,Angophora,Angophora hispida,3.dicot,native
4/01/2023,4916136,2023-07-12 13:34:48 UTC,Myrtaceae,Angophora,Angophora hispida,3.dicot,native
16/07/2023,2366151,2023-07-16 11:02:42 UTC,Myrtaceae,Angophora,Angophora hispida,3.dicot,native
11/08/2023,4743351,2023-08-12 12:27:06 UTC,Myrtaceae,Angophora,Angophora hispida,3.dicot,native
14/08/2023,4059674,2023-08-14 05:58:15 UTC,Myrtaceae,Angophora,Angophora hispida,3.dicot,native
20/08/2023,5150199,2023-08-24 12:38:09 UTC,Myrtaceae,Angophora,Angophora hispida,3.dicot,native
20/09/2023,5435930,2023-09-25 12:15:15 UTC,Myrtaceae,Angophora,Angophora hispida,3.dicot,native
24/09/2023,1138587,2023-09-26 11:45:54 UTC,Myrtaceae,Angophora,Angophora hispida,3.dicot,native
24/09/2023,661392,2023-09-29 14:08:37 UTC,Myrtaceae,Angophora,Angophora hispida,3.dicot,native
14/10/2023,1175154,2023-10-14 09:52:24 UTC,Myrtaceae,Angophora,Angophora hispida,3.dicot,native
20/10/2023,4453532,2023-10-20 09:38:08 UTC,Myrtaceae,Angophora,Angophora hispida,3.dicot,native
16/10/2023,2754606,2023-10-23 23:38:43 UTC,Myrtaceae,Angophora,Angophora hispida,3.dicot,native
21/10/2023,1708045,2023-10-24 04:39:35 UTC,Myrtaceae,Angophora,Angophora hispida,3.dicot,native
29/10/2023,7487860,2023-10-28 23:11:03 UTC,Myrtaceae,Angophora,Angophora hispida,3.dicot,native
5/11/2023,1437366,2023-11-05 20:51:59 UTC,Myrtaceae,Angophora,Angophora hispida,3.dicot,native
6/11/2023,2441642,2023-11-06 01:21:53 UTC,Myrtaceae,Angophora,Angophora hispida,3.dicot,native
16/09/2023,745089,2023-11-07 06:01:42 UTC,Myrtaceae,Angophora,Angophora hispida,3.dicot,native
8/11/2023,6603620,2023-11-08 04:27:32 UTC,Myrtaceae,Angophora,Angophora hispida,3.dicot,native
22/11/2023,4410852,2023-11-22 09:46:01 UTC,Myrtaceae,Angophora,Angophora hispida,3.dicot,native
27/11/2023,7204155,2023-11-27 08:37:27 UTC,Myrtaceae,Angophora,Angophora hispida,3.dicot,native
27/11/2023,6983320,2023-11-27 11:17:46 UTC,Myrtaceae,Angophora,Angophora hispida,3.dicot,native
26/11/2023,1438982,2023-11-29 21:24:39 UTC,Myrtaceae,Angophora,Angophora hispida,3.dicot,native
30/11/2023,3175896,2023-11-30 06:33:50 UTC,Myrtaceae,Angophora,Angophora hispida,3.dicot,native
11/11/2023,6209647,2023-11-30 09:09:59 UTC,Myrtaceae,Angophora,Angophora hispida,3.dicot,native
30/11/2023,5188972,2023-11-30 13:18:20 UTC,Myrtaceae,Angophora,Angophora hispida,3.dicot,native
30/11/2023,3936801,2023-12-02 00:17:00 UTC,Myrtaceae,Angophora,Angophora hispida,3.dicot,native
7/12/2023,5183897,2023-12-07 01:39:17 UTC,Myrtaceae,Angophora,Angophora hispida,3.dicot,native
11/12/2023,164735,2023-12-11 07:57:05 UTC,Myrtaceae,Angophora,Angophora hispida,3.dicot,native
11/12/2023,164735,2023-12-11 07:57:48 UTC,Myrtaceae,Angophora,Angophora hispida,3.dicot,native
11/12/2023,164735,2023-12-11 07:58:12 UTC,Myrtaceae,Angophora,Angophora hispida,3.dicot,native
11/12/2023,164735,2023-12-11 07:58:18 UTC,Myrtaceae,Angophora,Angophora hispida,3.dicot,native
11/12/2023,164735,2023-12-11 07:59:24 UTC,Myrtaceae,Angophora,Angophora hispida,3.dicot,native
11/12/2023,164735,2023-12-11 07:59:30 UTC,Myrtaceae,Angophora,Angophora hispida,3.dicot,native
11/12/2023,164735,2023-12-11 08:09:23 UTC,Myrtaceae,Angophora,Angophora hispida,3.dicot,native
15/12/2023,6542702,2023-12-14 18:58:23 UTC,Myrtaceae,Angophora,Angophora hispida,3.dicot,native
11/12/2023,164735,2023-12-17 15:14:50 UTC,Myrtaceae,Angophora,Angophora hispida,3.dicot,native
8/12/2023,6308847,2023-12-24 05:47:00 UTC,Myrtaceae,Angophora,Angophora hispida,3.dicot,native
27/12/2023,3866035,2023-12-27 05:35:51 UTC,Myrtaceae,Angophora,Angophora hispida,3.dicot,native
28/12/2023,7464766,2023-12-28 11:15:25 UTC,Myrtaceae,Angophora,Angophora hispida,3.dicot,native
28/12/2023,7464766,2023-12-29 04:39:31 UTC,Myrtaceae,Angophora,Angophora hispida,3.dicot,native
28/12/2023,7464766,2023-12-31 02:55:24 UTC,Myrtaceae,Angophora,Angophora hispida,3.dicot,native
2/01/2024,661392,2024-01-02 06:22:41 UTC,Myrtaceae,Angophora,Angophora hispida,3.dicot,native
2/01/2024,1138587,2024-01-02 09:12:26 UTC,Myrtaceae,Angophora,Angophora hispida,3.dicot,native
19/12/2022,4493686,2024-02-09 09:34:17 UTC,Myrtaceae,Angophora,Angophora hispida,3.dicot,native
9/02/2024,37233,2024-02-16 09:53:05 UTC,Myrtaceae,Angophora,Angophora hispida,3.dicot,native
20/02/2024,4743351,2024-02-20 23:21:08 UTC,Myrtaceae,Angophora,Angophora hispida,3.dicot,native
3/03/2024,3026110,2024-03-03 21:55:51 UTC,Myrtaceae,Angophora,Angophora hispida,3.dicot,native
14/09/2022,745089,2024-03-29 03:15:53 UTC,Myrtaceae,Angophora,Angophora hispida,3.dicot,native
16/04/2024,3936801,2024-04-16 12:23:56 UTC,Myrtaceae,Angophora,Angophora hispida,3.dicot,native
19/05/2024,319382,2024-05-19 00:18:24 UTC,Myrtaceae,Angophora,Angophora hispida,3.dicot,native
2/12/2023,8036011,2024-05-23 05:33:12 UTC,Myrtaceae,Angophora,Angophora hispida,3.dicot,native
23/10/2020,3654699,2020-10-26 05:36:06 UTC,Poaceae,Anisopogon,Anisopogon avenaceus,4.monocot,native
28/10/2023,2631448,2023-10-29 02:37:26 UTC,Poaceae,Anisopogon,Anisopogon avenaceus,4.monocot,native
22/09/2018,2488549,2019-12-20 02:22:29 UTC,Fabaceae,Aotus,Aotus ericoides,3.dicot,native
16/08/2019,64271,2020-05-23 00:14:51 UTC,Fabaceae,Aotus,Aotus ericoides,3.dicot,native
29/08/2020,2488549,2020-08-29 10:09:00 UTC,Fabaceae,Aotus,Aotus ericoides,3.dicot,native
23/08/2020,575123,2020-09-05 07:12:13 UTC,Fabaceae,Aotus,Aotus ericoides,3.dicot,native
30/08/2021,4916136,2021-08-30 08:34:45 UTC,Fabaceae,Aotus,Aotus ericoides,3.dicot,native
21/09/2021,4743351,2021-09-21 13:10:20 UTC,Fabaceae,Aotus,Aotus ericoides,3.dicot,native
4/09/2016,2451999,2022-02-06 04:51:40 UTC,Fabaceae,Aotus,Aotus ericoides,3.dicot,native
25/09/2022,6385192,2022-12-19 01:46:14 UTC,Fabaceae,Aotus,Aotus ericoides,3.dicot,native
29/07/2023,2650798,2023-07-30 10:28:35 UTC,Fabaceae,Aotus,Aotus ericoides,3.dicot,native
28/08/2023,3678274,2023-08-28 13:24:25 UTC,Fabaceae,Aotus,Aotus ericoides,3.dicot,native
5/09/2023,3678274,2023-09-05 22:29:33 UTC,Fabaceae,Aotus,Aotus ericoides,3.dicot,native
19/08/2023,4317345,2023-09-07 22:50:40 UTC,Fabaceae,Aotus,Aotus ericoides,3.dicot,native
5/09/2023,4743351,2023-09-14 11:56:19 UTC,Fabaceae,Aotus,Aotus ericoides,3.dicot,native
5/09/2023,4743351,2023-09-14 11:56:20 UTC,Fabaceae,Aotus,Aotus ericoides,3.dicot,native
24/09/2023,1138587,2023-09-26 11:42:12 UTC,Fabaceae,Aotus,Aotus ericoides,3.dicot,native
24/09/2023,661392,2023-09-29 12:23:42 UTC,Fabaceae,Aotus,Aotus ericoides,3.dicot,native
7/09/2023,6516136,2023-10-04 01:18:08 UTC,Fabaceae,Aotus,Aotus ericoides,3.dicot,native
22/10/2023,2583877,2023-10-22 00:36:45 UTC,Fabaceae,Aotus,Aotus ericoides,3.dicot,native
10/09/2023,4317345,2024-01-06 18:38:38 UTC,Fabaceae,Aotus,Aotus ericoides,3.dicot,native
24/09/2021,4887682,2021-09-24 05:36:43 UTC,Aphanopetalaceae,Aphanopetalum,Aphanopetalum resinosum,3.dicot,native
18/09/2021,4945027,2021-09-18 10:17:12 UTC,Vitaceae,Apocissus,Apocissus antarctica,3.dicot,native
20/03/2023,1259195,2023-03-26 10:27:46 UTC,Vitaceae,Apocissus,Apocissus antarctica,3.dicot,native
27/05/2023,5283632,2023-05-29 11:29:52 UTC,Vitaceae,Apocissus,Apocissus antarctica,3.dicot,native
22/03/2024,7134096,2024-03-22 08:43:17 UTC,Vitaceae,Apocissus,Apocissus antarctica,3.dicot,native
3/04/2020,2488549,2020-04-03 09:09:38 UTC,Vitaceae,Apocissus,Apocissus hypoglauca,3.dicot,native
5/08/2020,793005,2020-08-06 01:05:37 UTC,Vitaceae,Apocissus,Apocissus hypoglauca,3.dicot,native
3/03/2021,2602714,2021-03-03 10:00:36 UTC,Vitaceae,Apocissus,Apocissus hypoglauca,3.dicot,native
24/09/2021,4887682,2021-09-24 05:36:43 UTC,Vitaceae,Apocissus,Apocissus hypoglauca,3.dicot,native
26/10/2021,4743351,2021-10-30 01:57:52 UTC,Vitaceae,Apocissus,Apocissus hypoglauca,3.dicot,native
13/02/2022,4025155,2022-02-13 08:45:50 UTC,Vitaceae,Apocissus,Apocissus hypoglauca,3.dicot,native
9/06/2022,2373989,2022-06-09 03:00:19 UTC,Vitaceae,Apocissus,Apocissus hypoglauca,3.dicot,native
28/09/2022,4916136,2022-09-29 06:00:29 UTC,Vitaceae,Apocissus,Apocissus hypoglauca,3.dicot,native
20/03/2023,1259195,2023-03-26 10:27:36 UTC,Vitaceae,Apocissus,Apocissus hypoglauca,3.dicot,native
5/09/2023,3678274,2023-09-05 22:29:35 UTC,Vitaceae,Apocissus,Apocissus hypoglauca,3.dicot,native
2/01/2024,1138587,2024-01-02 08:07:08 UTC,Vitaceae,Apocissus,Apocissus hypoglauca,3.dicot,native
19/11/2022,2488549,2022-11-19 03:03:41 UTC,Araucariaceae,Araucaria,Araucaria cunninghamii,2.gymnosperm,introduced
12/02/2022,3978426,2022-02-12 07:01:50 UTC,Apocynaceae,Araujia,Araujia sericifera,3.dicot,introduced
13/10/2022,6029661,2022-10-13 12:08:38 UTC,Iridaceae,Aristea,Aristea ecklonii,5.monocot-colorful,introduced
20/09/2023,5435930,2023-09-25 12:15:03 UTC,Iridaceae,Aristea,Aristea ecklonii,5.monocot-colorful,introduced
9/10/2023,6308282,2023-10-14 08:48:01 UTC,Iridaceae,Aristea,Aristea ecklonii,5.monocot-colorful,introduced
11/11/2023,6209647,2023-11-30 08:47:58 UTC,Iridaceae,Aristea,Aristea ecklonii,5.monocot-colorful,introduced
25/09/2022,1138587,2022-09-25 06:58:40 UTC,Araceae,Arum,Arum italicum,5.monocot-colorful,introduced
16/07/2023,2366151,2023-07-16 10:48:52 UTC,Araceae,Arum,Arum italicum,5.monocot-colorful,introduced
24/09/2023,1138587,2023-09-26 11:16:01 UTC,Araceae,Arum,Arum italicum,5.monocot-colorful,introduced
24/09/2023,1138587,2023-09-26 11:16:01 UTC,Araceae,Arum,Arum italicum,5.monocot-colorful,introduced
24/09/2023,1138587,2023-09-26 11:16:02 UTC,Araceae,Arum,Arum italicum,5.monocot-colorful,introduced
24/09/2023,1138587,2023-09-26 11:16:02 UTC,Araceae,Arum,Arum italicum,5.monocot-colorful,introduced
24/09/2023,1138587,2023-09-27 01:50:04 UTC,Araceae,Arum,Arum italicum,5.monocot-colorful,introduced
24/09/2023,661392,2023-09-28 07:58:53 UTC,Araceae,Arum,Arum italicum,5.monocot-colorful,introduced
24/09/2023,661392,2023-09-28 09:29:29 UTC,Araceae,Arum,Arum italicum,5.monocot-colorful,introduced
20/11/2021,4916136,2021-11-20 11:32:42 UTC,Apocynaceae,Asclepias,Asclepias curassavica,3.dicot,introduced
16/07/2023,5315657,2023-07-16 05:08:21 UTC,Apocynaceae,Asclepias,Asclepias curassavica,3.dicot,introduced
16/07/2023,7001195,2023-07-16 05:08:35 UTC,Apocynaceae,Asclepias,Asclepias curassavica,3.dicot,introduced
4/10/2023,6196075,2023-10-08 02:03:06 UTC,Apocynaceae,Asclepias,Asclepias curassavica,3.dicot,introduced
13/12/2023,35619,2023-12-13 10:37:40 UTC,Apocynaceae,Asclepias,Asclepias curassavica,3.dicot,introduced
10/02/2024,7508320,2024-02-10 07:05:41 UTC,Apocynaceae,Asclepias,Asclepias curassavica,3.dicot,introduced
20/12/2023,1305186,2023-12-20 10:31:36 UTC,Asparagaceae,Asparagus,Asparagus aethiopicus,5.monocot-colorful,introduced
18/09/2020,2488549,2020-09-18 21:59:19 UTC,Asparagaceae,Asparagus,Asparagus asparagoides,5.monocot-colorful,introduced
23/12/2017,58341,2017-12-27 04:14:37 UTC,Aspleniaceae,Asplenium,Asplenium australasicum,1.ferns/primitive,native
28/07/2019,447429,2019-07-28 21:07:31 UTC,Aspleniaceae,Asplenium,Asplenium australasicum,1.ferns/primitive,native
25/08/2019,64271,2019-08-29 12:26:46 UTC,Aspleniaceae,Asplenium,Asplenium australasicum,1.ferns/primitive,native
9/05/2020,2488549,2020-05-09 02:52:03 UTC,Aspleniaceae,Asplenium,Asplenium australasicum,1.ferns/primitive,native
10/05/2020,2488549,2020-05-10 01:42:14 UTC,Aspleniaceae,Asplenium,Asplenium australasicum,1.ferns/primitive,native
21/11/2020,265090,2020-11-21 22:31:48 UTC,Aspleniaceae,Asplenium,Asplenium australasicum,1.ferns/primitive,native
21/11/2020,265090,2020-11-21 22:31:51 UTC,Aspleniaceae,Asplenium,Asplenium australasicum,1.ferns/primitive,native
12/09/2004,614054,2021-09-17 11:35:49 UTC,Aspleniaceae,Asplenium,Asplenium australasicum,1.ferns/primitive,native
30/09/2021,4887682,2021-09-30 07:41:00 UTC,Aspleniaceae,Asplenium,Asplenium australasicum,1.ferns/primitive,native
18/10/2021,4916136,2021-10-20 10:08:20 UTC,Aspleniaceae,Asplenium,Asplenium australasicum,1.ferns/primitive,native
23/10/2021,3880468,2021-10-24 11:10:46 UTC,Aspleniaceae,Asplenium,Asplenium australasicum,1.ferns/primitive,native
1/11/2021,4916136,2021-11-01 11:55:09 UTC,Aspleniaceae,Asplenium,Asplenium australasicum,1.ferns/primitive,native
19/02/2005,614054,2022-09-01 10:45:21 UTC,Aspleniaceae,Asplenium,Asplenium australasicum,1.ferns/primitive,native
29/11/2022,4601724,2022-11-29 06:28:48 UTC,Aspleniaceae,Asplenium,Asplenium australasicum,1.ferns/primitive,native
13/11/2023,2518411,2023-11-13 08:44:37 UTC,Aspleniaceae,Asplenium,Asplenium australasicum,1.ferns/primitive,native
2/01/2024,1138587,2024-01-02 08:07:10 UTC,Aspleniaceae,Asplenium,Asplenium australasicum,1.ferns/primitive,native
9/05/2020,2488549,2020-05-09 09:58:06 UTC,Aspleniaceae,Asplenium,Asplenium flabellifolium,1.ferns/primitive,native
13/03/2020,3712636,2020-10-12 13:02:18 UTC,Aspleniaceae,Asplenium,Asplenium flabellifolium,1.ferns/primitive,native
4/07/2021,4743351,2021-07-19 11:31:12 UTC,Aspleniaceae,Asplenium,Asplenium flabellifolium,1.ferns/primitive,native
2/01/2024,1138587,2024-01-02 08:17:46 UTC,Aspleniaceae,Asplenium,Asplenium flabellifolium,1.ferns/primitive,native
31/01/2021,265090,2021-01-31 06:01:29 UTC,Myrtaceae,Austromyrtus,Austromyrtus tenuifolia,3.dicot,native
25/01/2020,2488549,2020-01-25 01:16:13 UTC,Acanthaceae,Avicennia,Avicennia marina,3.dicot,native
8/11/2021,4916136,2021-11-08 09:40:36 UTC,Acanthaceae,Avicennia,Avicennia marina,3.dicot,native
29/05/2022,265090,2022-05-29 03:45:20 UTC,Acanthaceae,Avicennia,Avicennia marina,3.dicot,native
31/07/2022,265090,2022-07-31 19:33:53 UTC,Acanthaceae,Avicennia,Avicennia marina,3.dicot,native
31/07/2022,265090,2022-07-31 19:36:38 UTC,Acanthaceae,Avicennia,Avicennia marina,3.dicot,native
13/08/2022,265090,2022-08-13 01:53:30 UTC,Acanthaceae,Avicennia,Avicennia marina,3.dicot,native
13/08/2022,265090,2022-08-13 01:58:15 UTC,Acanthaceae,Avicennia,Avicennia marina,3.dicot,native
11/03/2023,745089,2023-03-11 20:39:45 UTC,Acanthaceae,Avicennia,Avicennia marina,3.dicot,native
9/03/2023,1658043,2023-03-13 05:43:51 UTC,Acanthaceae,Avicennia,Avicennia marina,3.dicot,native
9/03/2023,1658043,2023-03-13 05:44:00 UTC,Acanthaceae,Avicennia,Avicennia marina,3.dicot,native
6/12/2020,2488549,2020-12-06 08:47:57 UTC,Myrtaceae,Backhousia,Backhousia myrtifolia,3.dicot,native
12/12/2021,265090,2021-12-12 06:12:02 UTC,Myrtaceae,Backhousia,Backhousia myrtifolia,3.dicot,native
2/01/2024,661392,2024-01-02 06:06:54 UTC,Myrtaceae,Backhousia,Backhousia myrtifolia,3.dicot,native
28/12/2019,59123,2019-12-28 06:09:53 UTC,Myrtaceae,Baeckea,Baeckea imbricata,3.dicot,native
15/02/2020,2488549,2020-02-15 09:04:24 UTC,Myrtaceae,Baeckea,Baeckea imbricata,3.dicot,native
17/04/2020,2488549,2020-04-17 09:02:17 UTC,Myrtaceae,Baeckea,Baeckea imbricata,3.dicot,native
1/05/2020,2488549,2020-05-01 06:03:18 UTC,Myrtaceae,Baeckea,Baeckea imbricata,3.dicot,native
28/12/2020,3345535,2020-12-29 07:05:58 UTC,Myrtaceae,Baeckea,Baeckea imbricata,3.dicot,native
1/01/2021,2376854,2021-01-01 15:58:23 UTC,Myrtaceae,Baeckea,Baeckea imbricata,3.dicot,native
7/02/2021,2376854,2021-02-07 10:43:35 UTC,Myrtaceae,Baeckea,Baeckea imbricata,3.dicot,native
28/02/2021,2376854,2021-02-28 11:23:56 UTC,Myrtaceae,Baeckea,Baeckea imbricata,3.dicot,native
7/03/2021,4074096,2021-03-07 07:50:47 UTC,Myrtaceae,Baeckea,Baeckea imbricata,3.dicot,native
8/04/2021,325733,2021-04-09 12:15:41 UTC,Myrtaceae,Baeckea,Baeckea imbricata,3.dicot,native
18/04/2021,3411959,2021-04-23 10:25:34 UTC,Myrtaceae,Baeckea,Baeckea imbricata,3.dicot,native
3/07/2021,3978426,2021-07-03 07:14:41 UTC,Myrtaceae,Baeckea,Baeckea imbricata,3.dicot,native
6/02/2022,4194794,2022-02-05 22:13:24 UTC,Myrtaceae,Baeckea,Baeckea imbricata,3.dicot,native
16/04/2022,2488549,2022-04-16 06:31:38 UTC,Myrtaceae,Baeckea,Baeckea imbricata,3.dicot,native
18/01/1988,717200,2022-06-17 02:20:56 UTC,Myrtaceae,Baeckea,Baeckea imbricata,3.dicot,native
1/01/2020,542372,2022-08-14 10:45:26 UTC,Myrtaceae,Baeckea,Baeckea imbricata,3.dicot,native
20/08/2022,3678274,2022-09-03 02:10:43 UTC,Myrtaceae,Baeckea,Baeckea imbricata,3.dicot,native
14/11/2022,3441963,2022-12-18 08:32:25 UTC,Myrtaceae,Baeckea,Baeckea imbricata,3.dicot,native
26/12/2022,6020519,2022-12-26 06:46:59 UTC,Myrtaceae,Baeckea,Baeckea imbricata,3.dicot,native
29/12/2022,4299702,2022-12-29 03:29:39 UTC,Myrtaceae,Baeckea,Baeckea imbricata,3.dicot,native
5/02/2023,2376854,2023-02-06 13:16:36 UTC,Myrtaceae,Baeckea,Baeckea imbricata,3.dicot,native
25/01/2023,2873764,2023-02-08 08:05:38 UTC,Myrtaceae,Baeckea,Baeckea imbricata,3.dicot,native
25/01/2023,2873764,2023-02-08 08:05:39 UTC,Myrtaceae,Baeckea,Baeckea imbricata,3.dicot,native
9/03/2023,1658043,2023-03-13 05:43:49 UTC,Myrtaceae,Baeckea,Baeckea imbricata,3.dicot,native
16/07/2023,2366151,2023-07-16 11:01:17 UTC,Myrtaceae,Baeckea,Baeckea imbricata,3.dicot,native
17/12/2023,1305186,2023-12-18 00:15:41 UTC,Myrtaceae,Baeckea,Baeckea imbricata,3.dicot,native
30/01/2024,3478104,2024-02-04 05:58:57 UTC,Myrtaceae,Baeckea,Baeckea imbricata,3.dicot,native
25/01/2020,2488549,2020-01-25 18:30:59 UTC,Myrtaceae,Baeckea,Baeckea linifolia,3.dicot,native
26/01/2020,2488549,2020-01-26 05:34:07 UTC,Myrtaceae,Baeckea,Baeckea linifolia,3.dicot,native
2/05/2020,2488549,2020-05-02 03:00:11 UTC,Myrtaceae,Baeckea,Baeckea linifolia,3.dicot,native
3/05/2020,2488549,2020-05-03 01:03:36 UTC,Myrtaceae,Baeckea,Baeckea linifolia,3.dicot,native
5/01/2021,2488549,2021-01-05 07:11:55 UTC,Myrtaceae,Baeckea,Baeckea linifolia,3.dicot,native
29/01/2022,3345535,2022-01-29 06:59:28 UTC,Myrtaceae,Baeckea,Baeckea linifolia,3.dicot,native
10/02/2024,1138587,2024-02-10 07:12:41 UTC,Myrtaceae,Baeckea,Baeckea linifolia,3.dicot,native
26/11/2014,37233,2014-12-18 12:28:49 UTC,Proteaceae,Banksia,Banksia ericifolia,3.dicot,native
21/10/2016,13444,2016-10-23 22:17:15 UTC,Proteaceae,Banksia,Banksia ericifolia,3.dicot,native
20/04/2017,457036,2017-04-20 03:59:13 UTC,Proteaceae,Banksia,Banksia ericifolia,3.dicot,native
25/04/2017,467663,2017-04-27 23:53:21 UTC,Proteaceae,Banksia,Banksia ericifolia,3.dicot,native
19/04/2018,841801,2018-04-19 06:28:11 UTC,Proteaceae,Banksia,Banksia ericifolia,3.dicot,native
17/05/2018,364713,2018-05-17 09:02:59 UTC,Proteaceae,Banksia,Banksia ericifolia,3.dicot,native
19/04/2014,356301,2018-05-21 10:33:29 UTC,Proteaceae,Banksia,Banksia ericifolia,3.dicot,native
17/05/2018,558419,2018-05-28 21:20:10 UTC,Proteaceae,Banksia,Banksia ericifolia,3.dicot,native
31/05/2012,1163555,2018-09-08 18:00:51 UTC,Proteaceae,Banksia,Banksia ericifolia,3.dicot,native
31/05/2012,1163555,2018-09-08 18:02:15 UTC,Proteaceae,Banksia,Banksia ericifolia,3.dicot,native
16/04/2019,1604594,2019-04-16 21:59:56 UTC,Proteaceae,Banksia,Banksia ericifolia,3.dicot,native
19/04/2019,45978,2019-04-19 07:07:15 UTC,Proteaceae,Banksia,Banksia ericifolia,3.dicot,native
8/04/2011,2173044,2019-08-27 04:21:05 UTC,Proteaceae,Banksia,Banksia ericifolia,3.dicot,native
26/12/2019,2488549,2019-12-26 08:15:31 UTC,Proteaceae,Banksia,Banksia ericifolia,3.dicot,native
31/12/2019,2488549,2019-12-31 02:24:23 UTC,Proteaceae,Banksia,Banksia ericifolia,3.dicot,native
12/01/2020,2488549,2020-01-12 02:36:14 UTC,Proteaceae,Banksia,Banksia ericifolia,3.dicot,native
25/01/2020,2488549,2020-01-25 01:27:19 UTC,Proteaceae,Banksia,Banksia ericifolia,3.dicot,native
9/03/2020,2488549,2020-03-09 09:44:58 UTC,Proteaceae,Banksia,Banksia ericifolia,3.dicot,native
22/03/2020,2633838,2020-04-11 10:43:27 UTC,Proteaceae,Banksia,Banksia ericifolia,3.dicot,native
14/04/2020,2742244,2020-04-15 23:27:47 UTC,Proteaceae,Banksia,Banksia ericifolia,3.dicot,native
17/04/2020,2761779,2020-04-17 05:21:10 UTC,Proteaceae,Banksia,Banksia ericifolia,3.dicot,native
24/04/2020,2488549,2020-04-24 11:33:40 UTC,Proteaceae,Banksia,Banksia ericifolia,3.dicot,native
8/05/2020,2488549,2020-05-08 11:11:18 UTC,Proteaceae,Banksia,Banksia ericifolia,3.dicot,native
16/08/2019,64271,2020-05-23 00:19:00 UTC,Proteaceae,Banksia,Banksia ericifolia,3.dicot,native
11/08/1980,2851,2020-06-15 22:37:26 UTC,Proteaceae,Banksia,Banksia ericifolia,3.dicot,native
3/07/2020,3279908,2020-07-03 22:09:08 UTC,Proteaceae,Banksia,Banksia ericifolia,3.dicot,native
12/04/2019,364517,2020-07-05 10:38:07 UTC,Proteaceae,Banksia,Banksia ericifolia,3.dicot,native
12/07/2020,2488549,2020-07-12 22:35:45 UTC,Proteaceae,Banksia,Banksia ericifolia,3.dicot,native
24/07/2020,2488549,2020-07-24 12:07:53 UTC,Proteaceae,Banksia,Banksia ericifolia,3.dicot,native
15/08/2020,575123,2020-09-05 07:20:50 UTC,Proteaceae,Banksia,Banksia ericifolia,3.dicot,native
20/08/2017,3811984,2020-12-10 01:28:51 UTC,Proteaceae,Banksia,Banksia ericifolia,3.dicot,native
7/02/2021,2376854,2021-02-07 09:01:27 UTC,Proteaceae,Banksia,Banksia ericifolia,3.dicot,native
28/02/2021,2376854,2021-02-28 10:25:53 UTC,Proteaceae,Banksia,Banksia ericifolia,3.dicot,native
16/03/2021,3408787,2021-03-16 11:52:21 UTC,Proteaceae,Banksia,Banksia ericifolia,3.dicot,native
8/04/2021,325733,2021-04-09 12:11:20 UTC,Proteaceae,Banksia,Banksia ericifolia,3.dicot,native
8/04/2021,325733,2021-04-09 12:16:37 UTC,Proteaceae,Banksia,Banksia ericifolia,3.dicot,native
1/05/2021,2738946,2021-05-01 10:04:19 UTC,Proteaceae,Banksia,Banksia ericifolia,3.dicot,native
24/05/2021,3957444,2021-05-24 08:27:11 UTC,Proteaceae,Banksia,Banksia ericifolia,3.dicot,native
6/06/2021,3313584,2021-06-20 13:17:12 UTC,Proteaceae,Banksia,Banksia ericifolia,3.dicot,native
16/05/2021,3313584,2021-06-21 13:13:44 UTC,Proteaceae,Banksia,Banksia ericifolia,3.dicot,native
25/06/2021,3197473,2021-06-25 02:27:25 UTC,Proteaceae,Banksia,Banksia ericifolia,3.dicot,native
27/06/2021,3957444,2021-06-27 07:45:01 UTC,Proteaceae,Banksia,Banksia ericifolia,3.dicot,native
3/07/2021,3978426,2021-07-03 06:50:07 UTC,Proteaceae,Banksia,Banksia ericifolia,3.dicot,native
3/07/2021,3978426,2021-07-03 06:51:33 UTC,Proteaceae,Banksia,Banksia ericifolia,3.dicot,native
3/07/2021,3978426,2021-07-03 06:51:42 UTC,Proteaceae,Banksia,Banksia ericifolia,3.dicot,native
3/07/2021,3978426,2021-07-03 06:56:29 UTC,Proteaceae,Banksia,Banksia ericifolia,3.dicot,native
3/07/2021,3978426,2021-07-03 06:56:49 UTC,Proteaceae,Banksia,Banksia ericifolia,3.dicot,native
3/07/2021,3978426,2021-07-03 07:13:25 UTC,Proteaceae,Banksia,Banksia ericifolia,3.dicot,native
15/06/2021,4743351,2021-07-20 05:32:45 UTC,Proteaceae,Banksia,Banksia ericifolia,3.dicot,native
28/04/2021,4743351,2021-07-20 11:17:56 UTC,Proteaceae,Banksia,Banksia ericifolia,3.dicot,native
2/06/2020,4743351,2021-08-02 04:40:08 UTC,Proteaceae,Banksia,Banksia ericifolia,3.dicot,native
22/07/2019,4743351,2021-08-04 05:58:47 UTC,Proteaceae,Banksia,Banksia ericifolia,3.dicot,native
2/07/2019,4743351,2021-08-04 06:25:29 UTC,Proteaceae,Banksia,Banksia ericifolia,3.dicot,native
2/07/2019,4743351,2021-08-04 06:25:30 UTC,Proteaceae,Banksia,Banksia ericifolia,3.dicot,native
3/10/2016,3893507,2021-08-23 12:44:04 UTC,Proteaceae,Banksia,Banksia ericifolia,3.dicot,native
7/10/2013,2451999,2021-09-07 10:49:41 UTC,Proteaceae,Banksia,Banksia ericifolia,3.dicot,native
9/09/2021,4887682,2021-09-09 00:40:33 UTC,Proteaceae,Banksia,Banksia ericifolia,3.dicot,native
12/09/2020,5011317,2021-09-18 11:04:18 UTC,Proteaceae,Banksia,Banksia ericifolia,3.dicot,native
18/09/2021,4025155,2021-09-22 13:06:04 UTC,Proteaceae,Banksia,Banksia ericifolia,3.dicot,native
4/10/2021,4916136,2021-10-04 12:47:38 UTC,Proteaceae,Banksia,Banksia ericifolia,3.dicot,native
8/10/2021,4916136,2021-10-08 08:39:37 UTC,Proteaceae,Banksia,Banksia ericifolia,3.dicot,native
17/11/2021,3880468,2022-01-08 10:55:32 UTC,Proteaceae,Banksia,Banksia ericifolia,3.dicot,native
30/12/2021,3880468,2022-01-08 10:55:33 UTC,Proteaceae,Banksia,Banksia ericifolia,3.dicot,native
12/06/2020,5283632,2022-01-09 14:29:09 UTC,Proteaceae,Banksia,Banksia ericifolia,3.dicot,native
6/02/2022,4194794,2022-02-06 00:42:10 UTC,Proteaceae,Banksia,Banksia ericifolia,3.dicot,native
28/03/2022,2243582,2022-03-28 07:33:17 UTC,Proteaceae,Banksia,Banksia ericifolia,3.dicot,native
5/04/2022,4743351,2022-04-06 05:37:15 UTC,Proteaceae,Banksia,Banksia ericifolia,3.dicot,native
16/04/2022,3751299,2022-04-16 04:55:26 UTC,Proteaceae,Banksia,Banksia ericifolia,3.dicot,native
16/04/2022,2488549,2022-04-16 06:31:27 UTC,Proteaceae,Banksia,Banksia ericifolia,3.dicot,native
16/04/2022,2488549,2022-04-16 06:31:36 UTC,Proteaceae,Banksia,Banksia ericifolia,3.dicot,native
30/04/2022,1138587,2022-04-30 08:39:42 UTC,Proteaceae,Banksia,Banksia ericifolia,3.dicot,native
7/05/2022,2399118,2022-05-13 04:33:33 UTC,Proteaceae,Banksia,Banksia ericifolia,3.dicot,native
14/05/2022,5640535,2022-05-14 02:47:53 UTC,Proteaceae,Banksia,Banksia ericifolia,3.dicot,native
7/06/2022,1233583,2022-06-07 09:02:34 UTC,Proteaceae,Banksia,Banksia ericifolia,3.dicot,native
22/04/2022,3221790,2022-06-29 10:23:44 UTC,Proteaceae,Banksia,Banksia ericifolia,3.dicot,native
24/07/2022,265090,2022-07-24 19:45:08 UTC,Proteaceae,Banksia,Banksia ericifolia,3.dicot,native
25/07/2022,4724286,2022-07-25 08:16:12 UTC,Proteaceae,Banksia,Banksia ericifolia,3.dicot,native
31/07/2022,265090,2022-07-31 09:27:09 UTC,Proteaceae,Banksia,Banksia ericifolia,3.dicot,native
21/08/2022,3839358,2022-08-21 11:06:46 UTC,Proteaceae,Banksia,Banksia ericifolia,3.dicot,native
3/06/2017,5971295,2022-08-29 19:03:00 UTC,Proteaceae,Banksia,Banksia ericifolia,3.dicot,native
11/09/2022,2366151,2022-09-11 04:48:50 UTC,Proteaceae,Banksia,Banksia ericifolia,3.dicot,native
22/09/2022,3893507,2022-09-22 10:55:49 UTC,Proteaceae,Banksia,Banksia ericifolia,3.dicot,native
3/10/2022,3859342,2022-10-03 05:01:11 UTC,Proteaceae,Banksia,Banksia ericifolia,3.dicot,native
25/09/2022,3978191,2022-12-08 22:19:01 UTC,Proteaceae,Banksia,Banksia ericifolia,3.dicot,native
10/12/2022,3879318,2022-12-10 11:52:17 UTC,Proteaceae,Banksia,Banksia ericifolia,3.dicot,native
7/08/2022,3382917,2022-12-10 12:12:05 UTC,Proteaceae,Banksia,Banksia ericifolia,3.dicot,native
14/12/2022,1974770,2022-12-14 05:38:06 UTC,Proteaceae,Banksia,Banksia ericifolia,3.dicot,native
14/11/2022,3441963,2022-12-18 08:32:25 UTC,Proteaceae,Banksia,Banksia ericifolia,3.dicot,native
11/03/2012,2451999,2023-03-11 09:25:24 UTC,Proteaceae,Banksia,Banksia ericifolia,3.dicot,native
12/03/2023,6566631,2023-03-12 05:45:07 UTC,Proteaceae,Banksia,Banksia ericifolia,3.dicot,native
9/03/2023,1658043,2023-03-13 05:43:57 UTC,Proteaceae,Banksia,Banksia ericifolia,3.dicot,native
9/03/2023,1658043,2023-03-13 05:43:58 UTC,Proteaceae,Banksia,Banksia ericifolia,3.dicot,native
4/03/2023,1187603,2023-03-14 11:22:54 UTC,Proteaceae,Banksia,Banksia ericifolia,3.dicot,native
19/03/2023,4743351,2023-03-23 11:18:04 UTC,Proteaceae,Banksia,Banksia ericifolia,3.dicot,native
20/03/2023,1259195,2023-03-26 10:27:39 UTC,Proteaceae,Banksia,Banksia ericifolia,3.dicot,native
20/03/2023,1259195,2023-03-26 10:28:10 UTC,Proteaceae,Banksia,Banksia ericifolia,3.dicot,native
5/04/2023,1809954,2023-04-06 22:54:26 UTC,Proteaceae,Banksia,Banksia ericifolia,3.dicot,native
10/04/2023,6437775,2023-04-10 08:37:07 UTC,Proteaceae,Banksia,Banksia ericifolia,3.dicot,native
23/04/2023,5300031,2023-04-23 05:58:46 UTC,Proteaceae,Banksia,Banksia ericifolia,3.dicot,native
25/04/2023,6486058,2023-04-25 09:55:00 UTC,Proteaceae,Banksia,Banksia ericifolia,3.dicot,native
27/05/2023,6209647,2023-05-29 16:27:44 UTC,Proteaceae,Banksia,Banksia ericifolia,3.dicot,native
10/06/2023,3978191,2023-06-10 10:55:41 UTC,Proteaceae,Banksia,Banksia ericifolia,3.dicot,native
25/06/2023,6955767,2023-06-25 05:36:42 UTC,Proteaceae,Banksia,Banksia ericifolia,3.dicot,native
26/06/2023,6308282,2023-06-26 02:29:45 UTC,Proteaceae,Banksia,Banksia ericifolia,3.dicot,native
16/07/2023,2366151,2023-07-16 11:01:02 UTC,Proteaceae,Banksia,Banksia ericifolia,3.dicot,native
28/07/2023,4124411,2023-07-28 04:24:55 UTC,Proteaceae,Banksia,Banksia ericifolia,3.dicot,native
29/07/2023,1850396,2023-07-29 04:20:10 UTC,Proteaceae,Banksia,Banksia ericifolia,3.dicot,native
5/09/2023,4743351,2023-09-14 11:56:21 UTC,Proteaceae,Banksia,Banksia ericifolia,3.dicot,native
24/09/2023,1138587,2023-09-26 11:45:55 UTC,Proteaceae,Banksia,Banksia ericifolia,3.dicot,native
24/09/2023,661392,2023-10-03 13:30:17 UTC,Proteaceae,Banksia,Banksia ericifolia,3.dicot,native
7/10/2023,7091879,2023-10-15 00:23:57 UTC,Proteaceae,Banksia,Banksia ericifolia,3.dicot,native
28/10/2023,6585857,2023-10-28 05:18:30 UTC,Proteaceae,Banksia,Banksia ericifolia,3.dicot,native
16/09/2023,745089,2023-11-07 06:21:58 UTC,Proteaceae,Banksia,Banksia ericifolia,3.dicot,native
5/12/2023,7204155,2023-12-06 06:26:46 UTC,Proteaceae,Banksia,Banksia ericifolia,3.dicot,native
17/09/2023,745089,2023-12-09 10:06:47 UTC,Proteaceae,Banksia,Banksia ericifolia,3.dicot,native
17/09/2023,745089,2023-12-10 00:35:38 UTC,Proteaceae,Banksia,Banksia ericifolia,3.dicot,native
28/12/2023,7464766,2024-01-01 04:16:38 UTC,Proteaceae,Banksia,Banksia ericifolia,3.dicot,native
11/02/2024,4672448,2024-02-11 03:58:50 UTC,Proteaceae,Banksia,Banksia ericifolia,3.dicot,native
14/09/2022,745089,2024-03-29 04:10:46 UTC,Proteaceae,Banksia,Banksia ericifolia,3.dicot,native
23/09/2016,7789371,2024-04-05 04:44:16 UTC,Proteaceae,Banksia,Banksia ericifolia,3.dicot,native
24/12/1981,648584,2019-06-20 07:56:34 UTC,Proteaceae,Banksia,Banksia integrifolia,3.dicot,native
23/09/2016,742241,2020-09-28 21:22:37 UTC,Proteaceae,Banksia,Banksia integrifolia,3.dicot,native
30/12/2013,1840100,2021-07-01 19:17:28 UTC,Proteaceae,Banksia,Banksia integrifolia,3.dicot,native
7/06/2022,1233583,2022-06-07 08:59:48 UTC,Proteaceae,Banksia,Banksia integrifolia,3.dicot,native
6/08/2021,3678274,2022-07-03 11:59:33 UTC,Proteaceae,Banksia,Banksia integrifolia,3.dicot,native
14/08/2022,3978191,2022-08-14 09:56:30 UTC,Proteaceae,Banksia,Banksia integrifolia,3.dicot,native
20/03/2023,1259195,2023-03-26 10:27:52 UTC,Proteaceae,Banksia,Banksia integrifolia,3.dicot,native
2/04/2023,6524924,2023-04-02 04:44:03 UTC,Proteaceae,Banksia,Banksia integrifolia,3.dicot,native
30/01/2024,3478104,2024-01-30 22:45:04 UTC,Proteaceae,Banksia,Banksia integrifolia,3.dicot,native
14/06/2017,1779497,2024-03-26 23:04:44 UTC,Proteaceae,Banksia,Banksia integrifolia,3.dicot,native
14/06/2017,1779497,2024-03-26 23:04:45 UTC,Proteaceae,Banksia,Banksia integrifolia,3.dicot,native
29/10/2014,2991,2015-07-18 05:15:52 UTC,Proteaceae,Banksia,Banksia marginata,3.dicot,native
31/05/2012,1163555,2018-09-08 16:11:45 UTC,Proteaceae,Banksia,Banksia marginata,3.dicot,native
18/08/2019,265090,2019-08-19 20:27:17 UTC,Proteaceae,Banksia,Banksia marginata,3.dicot,native
22/08/2019,2158793,2019-08-22 03:55:20 UTC,Proteaceae,Banksia,Banksia marginata,3.dicot,native
26/12/2019,2488549,2019-12-26 09:47:35 UTC,Proteaceae,Banksia,Banksia marginata,3.dicot,native
31/12/2019,2488549,2019-12-31 04:50:51 UTC,Proteaceae,Banksia,Banksia marginata,3.dicot,native
12/01/2020,2488549,2020-01-12 07:46:09 UTC,Proteaceae,Banksia,Banksia marginata,3.dicot,native
19/03/2020,2488549,2020-03-19 05:42:27 UTC,Proteaceae,Banksia,Banksia marginata,3.dicot,native
22/03/2020,2512752,2020-03-27 22:47:59 UTC,Proteaceae,Banksia,Banksia marginata,3.dicot,native
24/04/2020,2488549,2020-04-24 11:24:32 UTC,Proteaceae,Banksia,Banksia marginata,3.dicot,native
1/05/2020,2488549,2020-05-01 06:04:09 UTC,Proteaceae,Banksia,Banksia marginata,3.dicot,native
12/07/2020,2488549,2020-07-12 22:35:08 UTC,Proteaceae,Banksia,Banksia marginata,3.dicot,native
24/07/2020,2488549,2020-07-24 12:09:22 UTC,Proteaceae,Banksia,Banksia marginata,3.dicot,native
18/09/2020,2488549,2020-09-18 10:06:05 UTC,Proteaceae,Banksia,Banksia marginata,3.dicot,native
26/09/2020,2488549,2020-09-26 11:20:54 UTC,Proteaceae,Banksia,Banksia marginata,3.dicot,native
3/10/2020,2488549,2020-10-03 09:59:17 UTC,Proteaceae,Banksia,Banksia marginata,3.dicot,native
7/02/2021,2376854,2021-02-07 09:08:26 UTC,Proteaceae,Banksia,Banksia marginata,3.dicot,native
28/02/2021,2376854,2021-02-28 09:39:21 UTC,Proteaceae,Banksia,Banksia marginata,3.dicot,native
8/04/2021,325733,2021-04-09 12:11:56 UTC,Proteaceae,Banksia,Banksia marginata,3.dicot,native
15/06/2021,4743351,2021-07-20 05:32:46 UTC,Proteaceae,Banksia,Banksia marginata,3.dicot,native
28/04/2021,4743351,2021-07-20 11:17:59 UTC,Proteaceae,Banksia,Banksia marginata,3.dicot,native
7/08/2020,4743351,2021-07-30 11:44:06 UTC,Proteaceae,Banksia,Banksia marginata,3.dicot,native
2/06/2020,4743351,2021-08-02 04:40:08 UTC,Proteaceae,Banksia,Banksia marginata,3.dicot,native
22/07/2019,4743351,2021-08-04 05:58:51 UTC,Proteaceae,Banksia,Banksia marginata,3.dicot,native
2/07/2019,4743351,2021-08-04 06:25:28 UTC,Proteaceae,Banksia,Banksia marginata,3.dicot,native
4/09/2021,3893507,2021-09-04 21:20:59 UTC,Proteaceae,Banksia,Banksia marginata,3.dicot,native
6/09/2021,4887682,2021-09-06 09:06:53 UTC,Proteaceae,Banksia,Banksia marginata,3.dicot,native
10/09/2021,2488549,2021-09-12 09:42:58 UTC,Proteaceae,Banksia,Banksia marginata,3.dicot,native
18/09/2021,4025155,2021-09-22 13:25:12 UTC,Proteaceae,Banksia,Banksia marginata,3.dicot,native
12/06/2020,5283632,2022-01-09 14:34:57 UTC,Proteaceae,Banksia,Banksia marginata,3.dicot,native
21/02/2022,2488549,2022-02-21 08:41:52 UTC,Proteaceae,Banksia,Banksia marginata,3.dicot,native
10/03/2022,2488549,2022-03-10 10:40:06 UTC,Proteaceae,Banksia,Banksia marginata,3.dicot,native
10/03/2022,2488549,2022-03-10 10:40:07 UTC,Proteaceae,Banksia,Banksia marginata,3.dicot,native
10/03/2022,2488549,2022-03-10 10:40:09 UTC,Proteaceae,Banksia,Banksia marginata,3.dicot,native
30/03/2022,4094096,2022-03-30 05:11:01 UTC,Proteaceae,Banksia,Banksia marginata,3.dicot,native
4/01/2022,5033453,2022-04-02 09:15:27 UTC,Proteaceae,Banksia,Banksia marginata,3.dicot,native
3/04/2022,3978191,2022-04-03 05:25:03 UTC,Proteaceae,Banksia,Banksia marginata,3.dicot,native
15/04/2022,2488549,2022-04-15 09:01:48 UTC,Proteaceae,Banksia,Banksia marginata,3.dicot,native
16/04/2022,2488549,2022-04-16 06:31:28 UTC,Proteaceae,Banksia,Banksia marginata,3.dicot,native
16/04/2022,2488549,2022-04-16 06:31:37 UTC,Proteaceae,Banksia,Banksia marginata,3.dicot,native
16/04/2022,3751299,2022-04-16 10:19:12 UTC,Proteaceae,Banksia,Banksia marginata,3.dicot,native
28/04/2022,2488549,2022-04-28 06:24:29 UTC,Proteaceae,Banksia,Banksia marginata,3.dicot,native
30/04/2022,1138587,2022-04-30 09:06:36 UTC,Proteaceae,Banksia,Banksia marginata,3.dicot,native
22/05/2022,2488549,2022-05-22 11:46:19 UTC,Proteaceae,Banksia,Banksia marginata,3.dicot,native
7/06/2022,1233583,2022-06-07 09:03:15 UTC,Proteaceae,Banksia,Banksia marginata,3.dicot,native
12/06/2022,3425899,2022-06-23 08:23:40 UTC,Proteaceae,Banksia,Banksia marginata,3.dicot,native
24/04/2022,3221790,2022-06-29 10:32:53 UTC,Proteaceae,Banksia,Banksia marginata,3.dicot,native
24/07/2022,265090,2022-07-24 21:09:59 UTC,Proteaceae,Banksia,Banksia marginata,3.dicot,native
29/07/2022,2488549,2022-07-29 03:20:40 UTC,Proteaceae,Banksia,Banksia marginata,3.dicot,native
6/08/2022,4743351,2022-08-08 05:07:04 UTC,Proteaceae,Banksia,Banksia marginata,3.dicot,native
23/09/2022,4916136,2022-09-23 13:02:46 UTC,Proteaceae,Banksia,Banksia marginata,3.dicot,native
25/09/2022,1138587,2022-09-25 06:58:23 UTC,Proteaceae,Banksia,Banksia marginata,3.dicot,native
26/09/2022,3678274,2022-09-29 03:06:39 UTC,Proteaceae,Banksia,Banksia marginata,3.dicot,native
8/10/2022,3978191,2022-10-08 13:01:48 UTC,Proteaceae,Banksia,Banksia marginata,3.dicot,native
25/09/2022,4743351,2022-12-22 23:49:50 UTC,Proteaceae,Banksia,Banksia marginata,3.dicot,native
9/03/2023,1658043,2023-03-13 07:22:44 UTC,Proteaceae,Banksia,Banksia marginata,3.dicot,native
26/03/2023,3978191,2023-03-26 06:35:49 UTC,Proteaceae,Banksia,Banksia marginata,3.dicot,native
5/04/2023,1809954,2023-04-06 22:54:27 UTC,Proteaceae,Banksia,Banksia marginata,3.dicot,native
10/04/2023,6437775,2023-04-10 08:50:58 UTC,Proteaceae,Banksia,Banksia marginata,3.dicot,native
17/04/2023,6308282,2023-04-17 03:12:48 UTC,Proteaceae,Banksia,Banksia marginata,3.dicot,native
17/04/2023,6308282,2023-04-17 03:12:50 UTC,Proteaceae,Banksia,Banksia marginata,3.dicot,native
17/04/2023,6308282,2023-04-17 04:05:04 UTC,Proteaceae,Banksia,Banksia marginata,3.dicot,native
17/04/2023,6308282,2023-04-17 04:30:50 UTC,Proteaceae,Banksia,Banksia marginata,3.dicot,native
21/04/2023,3978191,2023-05-08 01:40:47 UTC,Proteaceae,Banksia,Banksia marginata,3.dicot,native
28/05/2023,2376854,2023-05-28 23:14:57 UTC,Proteaceae,Banksia,Banksia marginata,3.dicot,native
30/05/2023,4095677,2023-05-30 11:30:11 UTC,Proteaceae,Banksia,Banksia marginata,3.dicot,native
26/06/2023,6308282,2023-06-26 03:02:01 UTC,Proteaceae,Banksia,Banksia marginata,3.dicot,native
26/06/2023,6308282,2023-06-26 03:09:34 UTC,Proteaceae,Banksia,Banksia marginata,3.dicot,native
29/07/2023,1850396,2023-07-29 10:32:37 UTC,Proteaceae,Banksia,Banksia marginata,3.dicot,native
29/07/2023,3978191,2023-07-29 22:40:01 UTC,Proteaceae,Banksia,Banksia marginata,3.dicot,native
18/08/2023,5304898,2023-08-18 10:40:07 UTC,Proteaceae,Banksia,Banksia marginata,3.dicot,native
14/09/2022,745089,2024-03-29 03:15:54 UTC,Proteaceae,Banksia,Banksia marginata,3.dicot,native
23/12/2019,2488549,2019-12-23 08:17:24 UTC,Proteaceae,Banksia,Banksia oblongifolia,3.dicot,native
31/12/2019,2488549,2019-12-31 02:23:04 UTC,Proteaceae,Banksia,Banksia oblongifolia,3.dicot,native
18/01/2020,2488549,2020-01-18 00:24:46 UTC,Proteaceae,Banksia,Banksia oblongifolia,3.dicot,native
9/03/2020,2488549,2020-03-09 09:08:45 UTC,Proteaceae,Banksia,Banksia oblongifolia,3.dicot,native
5/04/2020,2488549,2020-04-05 04:59:53 UTC,Proteaceae,Banksia,Banksia oblongifolia,3.dicot,native
1/05/2020,2488549,2020-05-01 03:29:07 UTC,Proteaceae,Banksia,Banksia oblongifolia,3.dicot,native
23/10/2020,2488549,2020-10-23 10:02:52 UTC,Proteaceae,Banksia,Banksia oblongifolia,3.dicot,native
13/11/2020,2488549,2020-11-13 19:54:55 UTC,Proteaceae,Banksia,Banksia oblongifolia,3.dicot,native
22/11/2020,3361124,2020-11-22 10:31:24 UTC,Proteaceae,Banksia,Banksia oblongifolia,3.dicot,native
12/12/2020,3063457,2020-12-13 09:09:49 UTC,Proteaceae,Banksia,Banksia oblongifolia,3.dicot,native
22/01/2021,2488549,2021-01-22 00:09:39 UTC,Proteaceae,Banksia,Banksia oblongifolia,3.dicot,native
13/10/2008,4916136,2021-10-29 12:39:56 UTC,Proteaceae,Banksia,Banksia oblongifolia,3.dicot,native
7/04/2020,3408787,2022-02-14 18:20:17 UTC,Proteaceae,Banksia,Banksia oblongifolia,3.dicot,native
16/04/2022,2488549,2022-04-16 06:31:35 UTC,Proteaceae,Banksia,Banksia oblongifolia,3.dicot,native
16/04/2022,2488549,2022-04-16 06:31:37 UTC,Proteaceae,Banksia,Banksia oblongifolia,3.dicot,native
16/04/2022,2488549,2022-04-16 06:31:41 UTC,Proteaceae,Banksia,Banksia oblongifolia,3.dicot,native
30/04/2022,1138587,2022-04-30 08:15:20 UTC,Proteaceae,Banksia,Banksia oblongifolia,3.dicot,native
23/01/2022,2512752,2022-05-06 10:44:49 UTC,Proteaceae,Banksia,Banksia oblongifolia,3.dicot,native
22/05/2022,2488549,2022-05-22 11:46:22 UTC,Proteaceae,Banksia,Banksia oblongifolia,3.dicot,native
12/03/2023,6566631,2023-03-12 05:44:09 UTC,Proteaceae,Banksia,Banksia oblongifolia,3.dicot,native
5/04/2023,1809954,2023-04-06 23:26:08 UTC,Proteaceae,Banksia,Banksia oblongifolia,3.dicot,native
17/04/2023,6308282,2023-04-17 04:37:52 UTC,Proteaceae,Banksia,Banksia oblongifolia,3.dicot,native
5/05/2023,3978191,2023-05-06 06:38:40 UTC,Proteaceae,Banksia,Banksia oblongifolia,3.dicot,native
16/07/2023,3978191,2023-07-16 09:46:36 UTC,Proteaceae,Banksia,Banksia oblongifolia,3.dicot,native
29/07/2023,3978191,2023-07-29 10:03:03 UTC,Proteaceae,Banksia,Banksia oblongifolia,3.dicot,native
11/12/2023,164735,2023-12-11 08:00:07 UTC,Proteaceae,Banksia,Banksia oblongifolia,3.dicot,native
28/12/2023,7464766,2023-12-31 02:55:23 UTC,Proteaceae,Banksia,Banksia oblongifolia,3.dicot,native
28/12/2023,7464766,2023-12-31 02:55:25 UTC,Proteaceae,Banksia,Banksia oblongifolia,3.dicot,native
16/04/2024,3936801,2024-04-16 12:21:56 UTC,Proteaceae,Banksia,Banksia oblongifolia,3.dicot,native
7/04/2020,3408787,2020-08-09 11:35:02 UTC,Proteaceae,Banksia,Banksia robur,3.dicot,native
4/10/2022,3678274,2022-10-06 09:25:13 UTC,Proteaceae,Banksia,Banksia robur,3.dicot,native
28/12/2022,2488549,2022-12-28 00:23:19 UTC,Proteaceae,Banksia,Banksia robur,3.dicot,native
29/12/2023,4916136,2023-12-29 22:10:34 UTC,Proteaceae,Banksia,Banksia robur,3.dicot,native
26/11/2014,37233,2014-12-18 12:21:36 UTC,Proteaceae,Banksia,Banksia serrata,3.dicot,native
27/11/2016,322026,2017-07-03 21:26:28 UTC,Proteaceae,Banksia,Banksia serrata,3.dicot,native
23/12/2017,58341,2017-12-27 03:59:15 UTC,Proteaceae,Banksia,Banksia serrata,3.dicot,native
17/05/2018,364713,2018-05-17 08:44:50 UTC,Proteaceae,Banksia,Banksia serrata,3.dicot,native
3/02/2019,793005,2019-02-03 11:40:40 UTC,Proteaceae,Banksia,Banksia serrata,3.dicot,native
25/04/2019,1323036,2019-04-25 00:16:11 UTC,Proteaceae,Banksia,Banksia serrata,3.dicot,native
1/12/2014,38771,2019-12-05 00:14:28 UTC,Proteaceae,Banksia,Banksia serrata,3.dicot,native
23/12/2019,2488549,2019-12-23 07:35:03 UTC,Proteaceae,Banksia,Banksia serrata,3.dicot,native
23/12/2019,2488549,2019-12-23 09:36:04 UTC,Proteaceae,Banksia,Banksia serrata,3.dicot,native
31/12/2019,2488549,2019-12-30 23:28:36 UTC,Proteaceae,Banksia,Banksia serrata,3.dicot,native
12/01/2020,2488549,2020-01-12 02:28:16 UTC,Proteaceae,Banksia,Banksia serrata,3.dicot,native
18/01/2020,2488549,2020-01-18 01:06:25 UTC,Proteaceae,Banksia,Banksia serrata,3.dicot,native
26/01/2020,2488549,2020-01-26 07:54:44 UTC,Proteaceae,Banksia,Banksia serrata,3.dicot,native
16/10/2005,2584563,2020-04-04 06:39:12 UTC,Proteaceae,Banksia,Banksia serrata,3.dicot,native
7/03/2020,746144,2020-04-14 11:23:36 UTC,Proteaceae,Banksia,Banksia serrata,3.dicot,native
24/07/2020,2488549,2020-07-24 12:10:45 UTC,Proteaceae,Banksia,Banksia serrata,3.dicot,native
5/08/2020,2488549,2020-08-05 09:21:29 UTC,Proteaceae,Banksia,Banksia serrata,3.dicot,native
16/08/2020,3328383,2020-08-16 07:38:17 UTC,Proteaceae,Banksia,Banksia serrata,3.dicot,native
13/09/2020,1235871,2020-09-17 01:37:12 UTC,Proteaceae,Banksia,Banksia serrata,3.dicot,native
4/10/2020,2444826,2020-10-04 23:51:54 UTC,Proteaceae,Banksia,Banksia serrata,3.dicot,native
17/10/2020,2657062,2020-10-17 05:10:41 UTC,Proteaceae,Banksia,Banksia serrata,3.dicot,native
20/08/2017,3811984,2020-12-10 01:29:50 UTC,Proteaceae,Banksia,Banksia serrata,3.dicot,native
12/12/2020,3063457,2020-12-13 09:05:51 UTC,Proteaceae,Banksia,Banksia serrata,3.dicot,native
28/12/2020,2488549,2020-12-28 08:50:45 UTC,Proteaceae,Banksia,Banksia serrata,3.dicot,native
1/01/2021,3922709,2021-01-01 10:59:03 UTC,Proteaceae,Banksia,Banksia serrata,3.dicot,native
1/01/2021,2376854,2021-01-01 15:12:57 UTC,Proteaceae,Banksia,Banksia serrata,3.dicot,native
7/01/2021,3564126,2021-01-07 03:19:35 UTC,Proteaceae,Banksia,Banksia serrata,3.dicot,native
13/01/2020,1527919,2021-02-06 20:16:18 UTC,Proteaceae,Banksia,Banksia serrata,3.dicot,native
3/07/2021,3978426,2021-07-03 07:02:15 UTC,Proteaceae,Banksia,Banksia serrata,3.dicot,native
28/04/2021,4743351,2021-07-20 11:17:58 UTC,Proteaceae,Banksia,Banksia serrata,3.dicot,native
6/04/2021,4743351,2021-07-21 03:57:43 UTC,Proteaceae,Banksia,Banksia serrata,3.dicot,native
20/07/2021,3678274,2021-07-22 11:35:39 UTC,Proteaceae,Banksia,Banksia serrata,3.dicot,native
7/08/2020,4743351,2021-07-30 11:44:05 UTC,Proteaceae,Banksia,Banksia serrata,3.dicot,native
6/09/2021,4887682,2021-09-06 09:06:54 UTC,Proteaceae,Banksia,Banksia serrata,3.dicot,native
11/10/2021,4916136,2021-10-11 12:25:49 UTC,Proteaceae,Banksia,Banksia serrata,3.dicot,native
12/10/2021,4743351,2021-10-14 11:00:52 UTC,Proteaceae,Banksia,Banksia serrata,3.dicot,native
23/10/2021,1175154,2021-10-23 08:40:24 UTC,Proteaceae,Banksia,Banksia serrata,3.dicot,native
23/10/2021,1175154,2021-10-23 08:41:03 UTC,Proteaceae,Banksia,Banksia serrata,3.dicot,native
27/12/2019,18575,2021-12-06 07:59:20 UTC,Proteaceae,Banksia,Banksia serrata,3.dicot,native
29/12/2019,5283632,2022-01-09 16:12:17 UTC,Proteaceae,Banksia,Banksia serrata,3.dicot,native
6/02/2022,4194794,2022-02-06 00:44:33 UTC,Proteaceae,Banksia,Banksia serrata,3.dicot,native
13/02/2022,4025155,2022-02-13 08:40:30 UTC,Proteaceae,Banksia,Banksia serrata,3.dicot,native
30/03/2022,4094096,2022-03-30 05:17:14 UTC,Proteaceae,Banksia,Banksia serrata,3.dicot,native
16/04/2022,2488549,2022-04-16 06:31:27 UTC,Proteaceae,Banksia,Banksia serrata,3.dicot,native
16/04/2022,3751299,2022-04-16 08:37:31 UTC,Proteaceae,Banksia,Banksia serrata,3.dicot,native
28/04/2022,2488549,2022-04-28 06:29:44 UTC,Proteaceae,Banksia,Banksia serrata,3.dicot,native
30/04/2022,1138587,2022-04-30 08:39:43 UTC,Proteaceae,Banksia,Banksia serrata,3.dicot,native
14/05/2022,5640535,2022-05-14 02:49:37 UTC,Proteaceae,Banksia,Banksia serrata,3.dicot,native
7/06/2022,1233583,2022-06-07 09:04:01 UTC,Proteaceae,Banksia,Banksia serrata,3.dicot,native
24/05/2022,3425899,2022-06-23 07:10:35 UTC,Proteaceae,Banksia,Banksia serrata,3.dicot,native
1/01/2020,542372,2022-08-14 10:45:26 UTC,Proteaceae,Banksia,Banksia serrata,3.dicot,native
13/11/2022,624851,2022-11-21 06:15:03 UTC,Proteaceae,Banksia,Banksia serrata,3.dicot,native
13/11/2022,624851,2022-11-21 06:15:05 UTC,Proteaceae,Banksia,Banksia serrata,3.dicot,native
19/11/2022,6308282,2022-11-27 08:43:48 UTC,Proteaceae,Banksia,Banksia serrata,3.dicot,native
14/12/2022,1583705,2022-12-16 23:10:16 UTC,Proteaceae,Banksia,Banksia serrata,3.dicot,native
20/12/2022,3280868,2022-12-22 03:11:38 UTC,Proteaceae,Banksia,Banksia serrata,3.dicot,native
29/12/2022,4299702,2023-01-03 01:26:19 UTC,Proteaceae,Banksia,Banksia serrata,3.dicot,native
29/12/2022,4299702,2023-01-05 03:09:07 UTC,Proteaceae,Banksia,Banksia serrata,3.dicot,native
21/01/2023,3978191,2023-01-21 10:55:22 UTC,Proteaceae,Banksia,Banksia serrata,3.dicot,native
26/01/2023,2376854,2023-01-27 12:25:30 UTC,Proteaceae,Banksia,Banksia serrata,3.dicot,native
12/02/2023,4743351,2023-02-13 23:20:25 UTC,Proteaceae,Banksia,Banksia serrata,3.dicot,native
26/02/2023,4743351,2023-02-27 01:01:28 UTC,Proteaceae,Banksia,Banksia serrata,3.dicot,native
4/03/2023,1187603,2023-03-14 11:19:10 UTC,Proteaceae,Banksia,Banksia serrata,3.dicot,native
20/03/2023,1259195,2023-03-26 10:27:39 UTC,Proteaceae,Banksia,Banksia serrata,3.dicot,native
13/09/2013,69857,2023-05-05 03:31:40 UTC,Proteaceae,Banksia,Banksia serrata,3.dicot,native
28/07/2023,4124411,2023-07-28 04:22:45 UTC,Proteaceae,Banksia,Banksia serrata,3.dicot,native
24/09/2023,1138587,2023-09-27 02:08:27 UTC,Proteaceae,Banksia,Banksia serrata,3.dicot,native
8/10/2023,7143748,2023-10-08 05:52:51 UTC,Proteaceae,Banksia,Banksia serrata,3.dicot,native
15/10/2023,7465608,2023-10-19 23:31:43 UTC,Proteaceae,Banksia,Banksia serrata,3.dicot,native
4/11/2023,970589,2023-11-04 06:14:05 UTC,Proteaceae,Banksia,Banksia serrata,3.dicot,native
4/11/2023,970589,2023-11-04 06:14:30 UTC,Proteaceae,Banksia,Banksia serrata,3.dicot,native
18/11/2007,5556630,2023-11-10 20:08:52 UTC,Proteaceae,Banksia,Banksia serrata,3.dicot,native
30/11/2023,3175896,2023-11-30 06:33:51 UTC,Proteaceae,Banksia,Banksia serrata,3.dicot,native
4/12/2023,6308847,2023-12-04 07:00:17 UTC,Proteaceae,Banksia,Banksia serrata,3.dicot,native
11/12/2023,164735,2023-12-11 07:57:24 UTC,Proteaceae,Banksia,Banksia serrata,3.dicot,native
11/12/2023,164735,2023-12-11 07:58:30 UTC,Proteaceae,Banksia,Banksia serrata,3.dicot,native
11/12/2023,164735,2023-12-11 08:00:27 UTC,Proteaceae,Banksia,Banksia serrata,3.dicot,native
11/12/2023,164735,2023-12-11 08:00:34 UTC,Proteaceae,Banksia,Banksia serrata,3.dicot,native
26/12/2023,3978191,2023-12-26 07:59:36 UTC,Proteaceae,Banksia,Banksia serrata,3.dicot,native
26/12/2023,3978191,2023-12-26 08:01:22 UTC,Proteaceae,Banksia,Banksia serrata,3.dicot,native
28/12/2023,4966591,2024-01-02 02:40:09 UTC,Proteaceae,Banksia,Banksia serrata,3.dicot,native
11/02/2024,4672448,2024-02-11 04:01:06 UTC,Proteaceae,Banksia,Banksia serrata,3.dicot,native
10/03/2024,613264,2024-03-12 09:55:05 UTC,Proteaceae,Banksia,Banksia serrata,3.dicot,native
10/02/2024,2335143,2024-03-18 19:46:10 UTC,Proteaceae,Banksia,Banksia serrata,3.dicot,native
22/03/2024,7134096,2024-03-22 08:32:45 UTC,Proteaceae,Banksia,Banksia serrata,3.dicot,native
12/01/2020,2488549,2020-01-12 05:10:47 UTC,Proteaceae,Banksia,Banksia spinulosa,3.dicot,native
12/01/2020,2488549,2020-01-12 08:07:40 UTC,Proteaceae,Banksia,Banksia spinulosa,3.dicot,native
5/04/2020,2488549,2020-04-05 09:38:37 UTC,Proteaceae,Banksia,Banksia spinulosa,3.dicot,native
1/05/2020,2488549,2020-05-01 02:46:39 UTC,Proteaceae,Banksia,Banksia spinulosa,3.dicot,native
18/04/2021,3411959,2021-04-23 10:28:54 UTC,Proteaceae,Banksia,Banksia spinulosa,3.dicot,native
21/05/2021,4743351,2021-07-20 10:25:40 UTC,Proteaceae,Banksia,Banksia spinulosa,3.dicot,native
9/09/2021,4887682,2021-09-08 23:33:12 UTC,Proteaceae,Banksia,Banksia spinulosa,3.dicot,native
8/09/2021,4743351,2021-09-09 13:11:09 UTC,Proteaceae,Banksia,Banksia spinulosa,3.dicot,native
20/12/2021,3978426,2021-12-20 02:05:46 UTC,Proteaceae,Banksia,Banksia spinulosa,3.dicot,native
10/03/2022,2488549,2022-03-10 10:40:11 UTC,Proteaceae,Banksia,Banksia spinulosa,3.dicot,native
16/04/2022,2488549,2022-04-16 06:31:25 UTC,Proteaceae,Banksia,Banksia spinulosa,3.dicot,native
16/04/2022,2488549,2022-04-16 06:31:27 UTC,Proteaceae,Banksia,Banksia spinulosa,3.dicot,native
30/04/2022,1138587,2022-04-30 09:48:57 UTC,Proteaceae,Banksia,Banksia spinulosa,3.dicot,native
30/07/2022,4743351,2022-08-03 12:23:14 UTC,Proteaceae,Banksia,Banksia spinulosa,3.dicot,native
17/04/2023,6308282,2023-04-17 03:30:25 UTC,Proteaceae,Banksia,Banksia spinulosa,3.dicot,native
17/04/2023,6308282,2023-04-17 03:50:28 UTC,Proteaceae,Banksia,Banksia spinulosa,3.dicot,native
17/04/2023,6308282,2023-04-17 04:51:43 UTC,Proteaceae,Banksia,Banksia spinulosa,3.dicot,native
17/04/2023,5300031,2023-04-19 08:52:16 UTC,Proteaceae,Banksia,Banksia spinulosa,3.dicot,native
30/05/2023,3978191,2023-05-30 09:10:01 UTC,Proteaceae,Banksia,Banksia spinulosa,3.dicot,native
26/06/2023,6308282,2023-06-26 03:36:37 UTC,Proteaceae,Banksia,Banksia spinulosa,3.dicot,native
16/07/2023,2366151,2023-07-16 11:06:55 UTC,Proteaceae,Banksia,Banksia spinulosa,3.dicot,native
2/10/2023,7415739,2023-10-03 01:36:30 UTC,Proteaceae,Banksia,Banksia spinulosa,3.dicot,native
24/05/2024,5043304,2024-05-24 06:53:25 UTC,Proteaceae,Banksia,Banksia spinulosa,3.dicot,native
17/11/2008,4916136,2021-09-14 06:15:14 UTC,Asteraceae,Bartlettina,Bartlettina sordida,3.dicot,introduced
23/02/2020,2698489,2020-05-23 09:13:37 UTC,Cunoniaceae,Bauera,Bauera microphylla,3.dicot,native
8/09/2020,3408787,2020-09-10 06:40:53 UTC,Cunoniaceae,Bauera,Bauera microphylla,3.dicot,native
1/01/2021,2376854,2021-01-01 15:15:53 UTC,Cunoniaceae,Bauera,Bauera microphylla,3.dicot,native
6/11/2021,2376854,2021-11-07 14:07:04 UTC,Cunoniaceae,Bauera,Bauera microphylla,3.dicot,native
22/05/2022,2488549,2022-05-22 11:46:14 UTC,Cunoniaceae,Bauera,Bauera microphylla,3.dicot,native
21/08/2022,3313584,2023-07-07 03:21:02 UTC,Cunoniaceae,Bauera,Bauera microphylla,3.dicot,native
2/11/2011,2991,2013-06-10 21:04:02 UTC,Cunoniaceae,Bauera,Bauera rubioides,3.dicot,native
26/10/2014,64271,2014-11-20 22:06:46 UTC,Cunoniaceae,Bauera,Bauera rubioides,3.dicot,native
13/06/2015,64271,2015-06-20 13:14:53 UTC,Cunoniaceae,Bauera,Bauera rubioides,3.dicot,native
29/10/2014,2991,2015-07-18 06:19:36 UTC,Cunoniaceae,Bauera,Bauera rubioides,3.dicot,native
29/10/2014,2991,2015-07-23 17:36:46 UTC,Cunoniaceae,Bauera,Bauera rubioides,3.dicot,native
21/10/2016,13444,2016-10-23 22:17:11 UTC,Cunoniaceae,Bauera,Bauera rubioides,3.dicot,native
16/05/2018,558419,2018-05-17 06:47:25 UTC,Cunoniaceae,Bauera,Bauera rubioides,3.dicot,native
17/05/2018,364713,2018-05-17 09:00:30 UTC,Cunoniaceae,Bauera,Bauera rubioides,3.dicot,native
7/10/2019,708958,2019-10-07 05:59:51 UTC,Cunoniaceae,Bauera,Bauera rubioides,3.dicot,native
23/09/2019,636550,2019-10-18 08:07:10 UTC,Cunoniaceae,Bauera,Bauera rubioides,3.dicot,native
21/10/2019,550350,2019-10-21 06:52:36 UTC,Cunoniaceae,Bauera,Bauera rubioides,3.dicot,native
21/10/2019,550350,2019-10-21 06:57:40 UTC,Cunoniaceae,Bauera,Bauera rubioides,3.dicot,native
19/10/2019,2385182,2019-10-24 03:31:19 UTC,Cunoniaceae,Bauera,Bauera rubioides,3.dicot,native
25/01/2020,2488549,2020-01-25 01:37:11 UTC,Cunoniaceae,Bauera,Bauera rubioides,3.dicot,native
15/02/2020,2488549,2020-02-15 09:05:47 UTC,Cunoniaceae,Bauera,Bauera rubioides,3.dicot,native
26/04/2020,2488549,2020-04-26 08:04:33 UTC,Cunoniaceae,Bauera,Bauera rubioides,3.dicot,native
16/05/2020,2488549,2020-05-16 02:10:04 UTC,Cunoniaceae,Bauera,Bauera rubioides,3.dicot,native
24/07/2020,2488549,2020-07-24 08:52:36 UTC,Cunoniaceae,Bauera,Bauera rubioides,3.dicot,native
12/08/2020,2488549,2020-08-12 04:50:06 UTC,Cunoniaceae,Bauera,Bauera rubioides,3.dicot,native
8/09/2020,3408787,2020-09-09 00:11:47 UTC,Cunoniaceae,Bauera,Bauera rubioides,3.dicot,native
12/09/2020,2488549,2020-09-12 10:13:01 UTC,Cunoniaceae,Bauera,Bauera rubioides,3.dicot,native
13/08/2020,2779982,2020-09-16 05:13:46 UTC,Cunoniaceae,Bauera,Bauera rubioides,3.dicot,native
24/09/2020,2488549,2020-09-24 05:08:43 UTC,Cunoniaceae,Bauera,Bauera rubioides,3.dicot,native
29/09/2020,738376,2020-10-02 02:40:53 UTC,Cunoniaceae,Bauera,Bauera rubioides,3.dicot,native
3/10/2020,2488549,2020-10-04 08:51:44 UTC,Cunoniaceae,Bauera,Bauera rubioides,3.dicot,native
4/10/2020,2444826,2020-10-04 10:06:03 UTC,Cunoniaceae,Bauera,Bauera rubioides,3.dicot,native
16/10/2020,2488549,2020-10-17 02:30:05 UTC,Cunoniaceae,Bauera,Bauera rubioides,3.dicot,native
10/10/2020,3769668,2020-10-21 10:28:23 UTC,Cunoniaceae,Bauera,Bauera rubioides,3.dicot,native
15/11/2020,3313573,2021-01-03 05:44:48 UTC,Cunoniaceae,Bauera,Bauera rubioides,3.dicot,native
3/07/2021,3978426,2021-07-03 07:09:23 UTC,Cunoniaceae,Bauera,Bauera rubioides,3.dicot,native
13/07/2021,4095677,2021-07-14 07:42:15 UTC,Cunoniaceae,Bauera,Bauera rubioides,3.dicot,native
3/11/2020,4743351,2021-07-21 11:50:21 UTC,Cunoniaceae,Bauera,Bauera rubioides,3.dicot,native
12/10/2020,4743351,2021-07-23 12:34:54 UTC,Cunoniaceae,Bauera,Bauera rubioides,3.dicot,native
18/09/2020,4743351,2021-07-24 05:15:45 UTC,Cunoniaceae,Bauera,Bauera rubioides,3.dicot,native
15/09/2020,4743351,2021-07-25 04:51:46 UTC,Cunoniaceae,Bauera,Bauera rubioides,3.dicot,native
29/08/2020,4743351,2021-07-25 12:03:26 UTC,Cunoniaceae,Bauera,Bauera rubioides,3.dicot,native
3/12/2019,4743351,2021-08-02 11:30:37 UTC,Cunoniaceae,Bauera,Bauera rubioides,3.dicot,native
20/10/2018,4359544,2021-08-07 06:25:59 UTC,Cunoniaceae,Bauera,Bauera rubioides,3.dicot,native
27/08/2021,4743351,2021-08-29 04:54:38 UTC,Cunoniaceae,Bauera,Bauera rubioides,3.dicot,native
7/10/2013,2451999,2021-09-07 10:49:41 UTC,Cunoniaceae,Bauera,Bauera rubioides,3.dicot,native
10/09/2021,2488549,2021-09-10 10:39:31 UTC,Cunoniaceae,Bauera,Bauera rubioides,3.dicot,native
12/09/2021,4037891,2021-09-11 23:39:48 UTC,Cunoniaceae,Bauera,Bauera rubioides,3.dicot,native
12/09/2021,2488549,2021-09-12 06:57:50 UTC,Cunoniaceae,Bauera,Bauera rubioides,3.dicot,native
17/09/2021,2488549,2021-09-17 10:36:03 UTC,Cunoniaceae,Bauera,Bauera rubioides,3.dicot,native
18/09/2021,4945027,2021-09-18 09:55:09 UTC,Cunoniaceae,Bauera,Bauera rubioides,3.dicot,native
21/09/2021,4743351,2021-09-21 13:10:19 UTC,Cunoniaceae,Bauera,Bauera rubioides,3.dicot,native
23/09/2021,3893507,2021-09-23 11:37:11 UTC,Cunoniaceae,Bauera,Bauera rubioides,3.dicot,native
23/09/2021,3893507,2021-09-24 12:20:57 UTC,Cunoniaceae,Bauera,Bauera rubioides,3.dicot,native
22/09/2021,4916136,2021-09-26 02:04:42 UTC,Cunoniaceae,Bauera,Bauera rubioides,3.dicot,native
26/09/2021,3544021,2021-09-26 09:13:46 UTC,Cunoniaceae,Bauera,Bauera rubioides,3.dicot,native
28/09/2021,3978426,2021-09-29 00:25:49 UTC,Cunoniaceae,Bauera,Bauera rubioides,3.dicot,native
31/08/2021,4916136,2021-09-29 11:46:46 UTC,Cunoniaceae,Bauera,Bauera rubioides,3.dicot,native
30/09/2021,2488549,2021-09-30 10:24:33 UTC,Cunoniaceae,Bauera,Bauera rubioides,3.dicot,native
28/09/2021,4743351,2021-10-01 07:22:26 UTC,Cunoniaceae,Bauera,Bauera rubioides,3.dicot,native
3/10/2021,2488549,2021-10-03 10:17:54 UTC,Cunoniaceae,Bauera,Bauera rubioides,3.dicot,native
1/10/2021,4916136,2021-10-06 05:30:03 UTC,Cunoniaceae,Bauera,Bauera rubioides,3.dicot,native
24/09/2021,4916136,2021-10-07 12:56:34 UTC,Cunoniaceae,Bauera,Bauera rubioides,3.dicot,native
8/10/2021,4916136,2021-10-08 13:06:17 UTC,Cunoniaceae,Bauera,Bauera rubioides,3.dicot,native
9/10/2021,4916136,2021-10-09 13:28:43 UTC,Cunoniaceae,Bauera,Bauera rubioides,3.dicot,native
14/10/2021,4916136,2021-10-14 13:26:41 UTC,Cunoniaceae,Bauera,Bauera rubioides,3.dicot,native
9/10/2021,5033453,2021-10-16 23:15:55 UTC,Cunoniaceae,Bauera,Bauera rubioides,3.dicot,native
12/10/2021,3313573,2021-10-20 06:41:37 UTC,Cunoniaceae,Bauera,Bauera rubioides,3.dicot,native
15/10/2021,4916136,2021-10-20 12:49:33 UTC,Cunoniaceae,Bauera,Bauera rubioides,3.dicot,native
23/10/2021,2376854,2021-10-23 11:23:41 UTC,Cunoniaceae,Bauera,Bauera rubioides,3.dicot,native
27/10/2021,4916136,2021-10-27 11:30:30 UTC,Cunoniaceae,Bauera,Bauera rubioides,3.dicot,native
30/10/2021,4916136,2021-10-30 13:26:56 UTC,Cunoniaceae,Bauera,Bauera rubioides,3.dicot,native
13/11/2021,325733,2021-11-18 01:48:27 UTC,Cunoniaceae,Bauera,Bauera rubioides,3.dicot,native
22/10/2021,5283632,2022-01-02 09:19:29 UTC,Cunoniaceae,Bauera,Bauera rubioides,3.dicot,native
10/01/2022,5283632,2022-01-10 10:10:01 UTC,Cunoniaceae,Bauera,Bauera rubioides,3.dicot,native
11/10/2015,2451999,2022-01-29 07:05:30 UTC,Cunoniaceae,Bauera,Bauera rubioides,3.dicot,native
6/02/2022,4037891,2022-02-06 10:00:31 UTC,Cunoniaceae,Bauera,Bauera rubioides,3.dicot,native
26/06/2022,2322306,2022-06-27 06:54:58 UTC,Cunoniaceae,Bauera,Bauera rubioides,3.dicot,native
24/07/2022,265090,2022-07-25 10:51:02 UTC,Cunoniaceae,Bauera,Bauera rubioides,3.dicot,native
27/07/2022,5283632,2022-07-27 09:01:03 UTC,Cunoniaceae,Bauera,Bauera rubioides,3.dicot,native
14/08/2022,265090,2022-08-14 06:08:44 UTC,Cunoniaceae,Bauera,Bauera rubioides,3.dicot,native
20/08/2022,3678274,2022-09-03 02:10:44 UTC,Cunoniaceae,Bauera,Bauera rubioides,3.dicot,native
18/09/2022,5650282,2022-09-18 06:52:33 UTC,Cunoniaceae,Bauera,Bauera rubioides,3.dicot,native
23/09/2022,2488549,2022-09-23 11:26:44 UTC,Cunoniaceae,Bauera,Bauera rubioides,3.dicot,native
24/09/2022,2488549,2022-09-24 11:58:34 UTC,Cunoniaceae,Bauera,Bauera rubioides,3.dicot,native
28/08/2022,3629879,2022-09-27 21:52:00 UTC,Cunoniaceae,Bauera,Bauera rubioides,3.dicot,native
4/10/2022,4743351,2022-10-06 09:52:07 UTC,Cunoniaceae,Bauera,Bauera rubioides,3.dicot,native
15/10/2022,1175154,2022-10-15 09:13:54 UTC,Cunoniaceae,Bauera,Bauera rubioides,3.dicot,native
2/10/2022,811913,2022-10-23 18:25:41 UTC,Cunoniaceae,Bauera,Bauera rubioides,3.dicot,native
15/10/2022,6268795,2022-10-25 04:41:00 UTC,Cunoniaceae,Bauera,Bauera rubioides,3.dicot,native
2/11/2022,2631448,2022-11-05 02:37:15 UTC,Cunoniaceae,Bauera,Bauera rubioides,3.dicot,native
23/11/2022,2531563,2022-11-23 09:47:16 UTC,Cunoniaceae,Bauera,Bauera rubioides,3.dicot,native
26/11/2022,2531563,2022-11-26 23:30:11 UTC,Cunoniaceae,Bauera,Bauera rubioides,3.dicot,native
26/11/2022,4743351,2022-11-29 08:56:50 UTC,Cunoniaceae,Bauera,Bauera rubioides,3.dicot,native
11/10/2022,6259435,2022-12-02 13:21:07 UTC,Cunoniaceae,Bauera,Bauera rubioides,3.dicot,native
25/09/2022,4743351,2022-12-22 04:08:28 UTC,Cunoniaceae,Bauera,Bauera rubioides,3.dicot,native
29/12/2022,4299702,2022-12-29 03:32:28 UTC,Cunoniaceae,Bauera,Bauera rubioides,3.dicot,native
29/12/2022,542372,2023-05-13 10:05:56 UTC,Cunoniaceae,Bauera,Bauera rubioides,3.dicot,native
28/05/2023,2325183,2023-05-28 07:26:44 UTC,Cunoniaceae,Bauera,Bauera rubioides,3.dicot,native
29/07/2023,2650798,2023-07-30 11:14:24 UTC,Cunoniaceae,Bauera,Bauera rubioides,3.dicot,native
27/08/2023,3978191,2023-08-27 11:14:12 UTC,Cunoniaceae,Bauera,Bauera rubioides,3.dicot,native
8/09/2023,2338918,2023-09-09 06:29:05 UTC,Cunoniaceae,Bauera,Bauera rubioides,3.dicot,native
18/09/2023,3678274,2023-09-18 23:16:31 UTC,Cunoniaceae,Bauera,Bauera rubioides,3.dicot,native
24/09/2023,4037891,2023-09-27 20:32:04 UTC,Cunoniaceae,Bauera,Bauera rubioides,3.dicot,native
24/09/2023,6209647,2023-10-16 10:41:25 UTC,Cunoniaceae,Bauera,Bauera rubioides,3.dicot,native
14/10/2023,6578850,2023-10-19 22:20:45 UTC,Cunoniaceae,Bauera,Bauera rubioides,3.dicot,native
20/10/2023,4453532,2023-10-20 09:31:11 UTC,Cunoniaceae,Bauera,Bauera rubioides,3.dicot,native
28/10/2023,6585857,2023-10-28 05:18:06 UTC,Cunoniaceae,Bauera,Bauera rubioides,3.dicot,native
10/08/2023,2379395,2023-12-05 05:27:24 UTC,Cunoniaceae,Bauera,Bauera rubioides,3.dicot,native
17/12/2023,1305186,2023-12-17 12:11:34 UTC,Cunoniaceae,Bauera,Bauera rubioides,3.dicot,native
12/12/2023,3786096,2023-12-26 08:17:13 UTC,Cunoniaceae,Bauera,Bauera rubioides,3.dicot,native
10/02/2024,1138587,2024-02-10 07:12:38 UTC,Cunoniaceae,Bauera,Bauera rubioides,3.dicot,native
14/09/2022,745089,2024-03-29 03:15:55 UTC,Cunoniaceae,Bauera,Bauera rubioides,3.dicot,native
23/09/2016,7789371,2024-04-05 04:02:34 UTC,Cunoniaceae,Bauera,Bauera rubioides,3.dicot,native
16/11/2021,4916136,2021-11-16 12:01:04 UTC,Begoniaceae,Begonia,Begonia cucullata,3.dicot,introduced
24/09/2023,1138587,2023-09-27 03:20:49 UTC,Begoniaceae,Begonia,Begonia cucullata,3.dicot,introduced
24/09/2023,661392,2023-10-03 13:51:19 UTC,Begoniaceae,Begonia,Begonia cucullata,3.dicot,introduced
23/01/2022,2665854,2022-02-10 06:19:16 UTC,Asteraceae,Bidens,Bidens alba,3.dicot,introduced
24/05/2020,2488549,2020-05-24 04:45:27 UTC,Pittosporaceae,Billardiera,Billardiera mutabilis,3.dicot,native
12/09/2020,2488549,2020-09-13 00:37:01 UTC,Pittosporaceae,Billardiera,Billardiera mutabilis,3.dicot,native
22/09/2023,3978191,2023-09-22 10:09:54 UTC,Pittosporaceae,Billardiera,Billardiera mutabilis,3.dicot,native
2/01/2024,661392,2024-01-02 05:45:02 UTC,Pittosporaceae,Billardiera,Billardiera mutabilis,3.dicot,native
2/01/2024,1138587,2024-01-02 08:39:09 UTC,Pittosporaceae,Billardiera,Billardiera mutabilis,3.dicot,native
29/10/2014,2991,2015-07-23 16:57:17 UTC,Pittosporaceae,Billardiera,Billardiera scandens,3.dicot,native
3/10/2020,2488549,2020-10-04 09:10:53 UTC,Pittosporaceae,Billardiera,Billardiera scandens,3.dicot,native
30/09/2021,4887682,2021-09-30 07:41:02 UTC,Pittosporaceae,Billardiera,Billardiera scandens,3.dicot,native
11/10/2021,4916136,2021-10-11 11:28:07 UTC,Pittosporaceae,Billardiera,Billardiera scandens,3.dicot,native
1/10/2021,2665854,2021-10-18 20:46:16 UTC,Pittosporaceae,Billardiera,Billardiera scandens,3.dicot,native
18/10/2021,4916136,2021-10-19 00:58:52 UTC,Pittosporaceae,Billardiera,Billardiera scandens,3.dicot,native
6/11/2021,2376854,2021-11-07 14:30:36 UTC,Pittosporaceae,Billardiera,Billardiera scandens,3.dicot,native
6/11/2021,2376854,2021-11-07 14:31:29 UTC,Pittosporaceae,Billardiera,Billardiera scandens,3.dicot,native
23/11/2021,5188972,2021-11-25 09:37:42 UTC,Pittosporaceae,Billardiera,Billardiera scandens,3.dicot,native
1/11/2022,6209647,2022-11-01 09:48:44 UTC,Pittosporaceae,Billardiera,Billardiera scandens,3.dicot,native
13/11/2022,4916136,2022-11-13 06:44:16 UTC,Pittosporaceae,Billardiera,Billardiera scandens,3.dicot,native
28/01/2023,3978191,2023-01-28 10:30:10 UTC,Pittosporaceae,Billardiera,Billardiera scandens,3.dicot,native
24/09/2023,1138587,2023-09-27 02:45:26 UTC,Pittosporaceae,Billardiera,Billardiera scandens,3.dicot,native
27/11/2016,322026,2017-06-26 01:37:34 UTC,Blandfordiaceae,Blandfordia,Blandfordia nobilis,5.monocot-colorful,native
25/11/2017,25160,2017-11-26 23:24:58 UTC,Blandfordiaceae,Blandfordia,Blandfordia nobilis,5.monocot-colorful,native
10/06/2019,1477617,2019-06-11 15:55:53 UTC,Blandfordiaceae,Blandfordia,Blandfordia nobilis,5.monocot-colorful,native
23/12/2019,2488549,2019-12-23 05:59:31 UTC,Blandfordiaceae,Blandfordia,Blandfordia nobilis,5.monocot-colorful,native
26/12/2019,2252898,2019-12-26 05:27:23 UTC,Blandfordiaceae,Blandfordia,Blandfordia nobilis,5.monocot-colorful,native
5/04/2020,2488549,2020-04-05 10:05:52 UTC,Blandfordiaceae,Blandfordia,Blandfordia nobilis,5.monocot-colorful,native
16/08/2019,64271,2020-05-22 23:37:29 UTC,Blandfordiaceae,Blandfordia,Blandfordia nobilis,5.monocot-colorful,native
16/07/2020,2488549,2020-07-16 10:23:12 UTC,Blandfordiaceae,Blandfordia,Blandfordia nobilis,5.monocot-colorful,native
18/10/2020,265090,2020-10-19 08:30:17 UTC,Blandfordiaceae,Blandfordia,Blandfordia nobilis,5.monocot-colorful,native
23/10/2020,2488549,2020-10-24 08:30:30 UTC,Blandfordiaceae,Blandfordia,Blandfordia nobilis,5.monocot-colorful,native
19/10/2020,793005,2020-10-29 13:21:01 UTC,Blandfordiaceae,Blandfordia,Blandfordia nobilis,5.monocot-colorful,native
19/10/2020,793005,2020-10-29 13:27:53 UTC,Blandfordiaceae,Blandfordia,Blandfordia nobilis,5.monocot-colorful,native
12/12/2020,2399118,2020-12-13 21:27:39 UTC,Blandfordiaceae,Blandfordia,Blandfordia nobilis,5.monocot-colorful,native
18/12/2020,2779982,2020-12-19 00:24:05 UTC,Blandfordiaceae,Blandfordia,Blandfordia nobilis,5.monocot-colorful,native
15/11/2020,3313573,2021-01-03 06:11:13 UTC,Blandfordiaceae,Blandfordia,Blandfordia nobilis,5.monocot-colorful,native
3/11/2020,4743351,2021-07-21 11:50:19 UTC,Blandfordiaceae,Blandfordia,Blandfordia nobilis,5.monocot-colorful,native
24/07/2021,4095677,2021-07-25 10:42:17 UTC,Blandfordiaceae,Blandfordia,Blandfordia nobilis,5.monocot-colorful,native
3/09/2019,4743351,2021-08-05 05:52:15 UTC,Blandfordiaceae,Blandfordia,Blandfordia nobilis,5.monocot-colorful,native
18/09/2021,4944844,2021-09-18 07:48:32 UTC,Blandfordiaceae,Blandfordia,Blandfordia nobilis,5.monocot-colorful,native
1/10/2021,4916136,2021-10-03 23:16:38 UTC,Blandfordiaceae,Blandfordia,Blandfordia nobilis,5.monocot-colorful,native
3/09/2021,4916136,2021-10-10 07:35:55 UTC,Blandfordiaceae,Blandfordia,Blandfordia nobilis,5.monocot-colorful,native
23/10/2021,1175154,2021-10-23 09:36:14 UTC,Blandfordiaceae,Blandfordia,Blandfordia nobilis,5.monocot-colorful,native
19/10/2021,4743351,2021-10-24 07:28:52 UTC,Blandfordiaceae,Blandfordia,Blandfordia nobilis,5.monocot-colorful,native
14/11/2021,5194154,2021-11-13 23:16:47 UTC,Blandfordiaceae,Blandfordia,Blandfordia nobilis,5.monocot-colorful,native
6/12/2021,4231868,2021-12-06 08:48:32 UTC,Blandfordiaceae,Blandfordia,Blandfordia nobilis,5.monocot-colorful,native
8/12/2021,4002123,2021-12-11 09:56:37 UTC,Blandfordiaceae,Blandfordia,Blandfordia nobilis,5.monocot-colorful,native
17/12/2021,2488549,2021-12-17 09:59:12 UTC,Blandfordiaceae,Blandfordia,Blandfordia nobilis,5.monocot-colorful,native
28/04/2022,2488549,2022-04-28 06:27:35 UTC,Blandfordiaceae,Blandfordia,Blandfordia nobilis,5.monocot-colorful,native
14/05/2022,2553015,2022-05-14 09:19:58 UTC,Blandfordiaceae,Blandfordia,Blandfordia nobilis,5.monocot-colorful,native
20/12/2021,6029661,2022-08-17 00:38:54 UTC,Blandfordiaceae,Blandfordia,Blandfordia nobilis,5.monocot-colorful,native
23/11/2021,6094155,2022-09-08 09:08:17 UTC,Blandfordiaceae,Blandfordia,Blandfordia nobilis,5.monocot-colorful,native
7/11/2021,4025155,2022-11-27 05:20:32 UTC,Blandfordiaceae,Blandfordia,Blandfordia nobilis,5.monocot-colorful,native
28/11/2022,2531563,2022-11-28 21:36:42 UTC,Blandfordiaceae,Blandfordia,Blandfordia nobilis,5.monocot-colorful,native
10/12/2022,3978191,2022-12-11 00:04:03 UTC,Blandfordiaceae,Blandfordia,Blandfordia nobilis,5.monocot-colorful,native
14/12/2022,1583705,2022-12-16 23:11:30 UTC,Blandfordiaceae,Blandfordia,Blandfordia nobilis,5.monocot-colorful,native
22/12/2022,2488549,2022-12-22 02:24:17 UTC,Blandfordiaceae,Blandfordia,Blandfordia nobilis,5.monocot-colorful,native
22/12/2022,2488549,2022-12-22 02:34:51 UTC,Blandfordiaceae,Blandfordia,Blandfordia nobilis,5.monocot-colorful,native
26/12/2022,6020519,2022-12-26 06:48:05 UTC,Blandfordiaceae,Blandfordia,Blandfordia nobilis,5.monocot-colorful,native
1/01/2023,2376854,2023-01-01 15:40:31 UTC,Blandfordiaceae,Blandfordia,Blandfordia nobilis,5.monocot-colorful,native
1/01/2023,2376854,2023-01-01 15:40:32 UTC,Blandfordiaceae,Blandfordia,Blandfordia nobilis,5.monocot-colorful,native
29/07/2023,2650798,2023-07-30 11:03:32 UTC,Blandfordiaceae,Blandfordia,Blandfordia nobilis,5.monocot-colorful,native
7/09/2023,5188972,2023-09-07 11:59:23 UTC,Blandfordiaceae,Blandfordia,Blandfordia nobilis,5.monocot-colorful,native
5/09/2023,4743351,2023-09-14 11:56:25 UTC,Blandfordiaceae,Blandfordia,Blandfordia nobilis,5.monocot-colorful,native
6/11/2023,2441642,2023-11-06 02:00:32 UTC,Blandfordiaceae,Blandfordia,Blandfordia nobilis,5.monocot-colorful,native
16/11/2023,2488549,2023-11-15 22:26:21 UTC,Blandfordiaceae,Blandfordia,Blandfordia nobilis,5.monocot-colorful,native
24/11/2023,3978191,2023-11-25 06:07:58 UTC,Blandfordiaceae,Blandfordia,Blandfordia nobilis,5.monocot-colorful,native
26/11/2023,2589225,2023-11-26 01:59:18 UTC,Blandfordiaceae,Blandfordia,Blandfordia nobilis,5.monocot-colorful,native
26/11/2023,1438982,2023-11-29 21:25:46 UTC,Blandfordiaceae,Blandfordia,Blandfordia nobilis,5.monocot-colorful,native
11/11/2023,6209647,2023-11-30 09:14:27 UTC,Blandfordiaceae,Blandfordia,Blandfordia nobilis,5.monocot-colorful,native
30/11/2023,5188972,2023-11-30 13:16:25 UTC,Blandfordiaceae,Blandfordia,Blandfordia nobilis,5.monocot-colorful,native
5/12/2023,7204155,2023-12-06 06:24:07 UTC,Blandfordiaceae,Blandfordia,Blandfordia nobilis,5.monocot-colorful,native
8/12/2023,6542702,2023-12-08 10:19:23 UTC,Blandfordiaceae,Blandfordia,Blandfordia nobilis,5.monocot-colorful,native
11/12/2023,164735,2023-12-11 07:59:54 UTC,Blandfordiaceae,Blandfordia,Blandfordia nobilis,5.monocot-colorful,native
29/12/2023,5281531,2023-12-29 22:19:51 UTC,Blandfordiaceae,Blandfordia,Blandfordia nobilis,5.monocot-colorful,native
23/10/2021,5280950,2024-02-01 11:03:36 UTC,Blandfordiaceae,Blandfordia,Blandfordia nobilis,5.monocot-colorful,native
25/05/2021,4743351,2021-07-20 06:24:59 UTC,Blechnaceae,Blechnum,Blechnum ambiguum,1.ferns/primitive,native
2/01/2024,661392,2024-01-02 05:56:20 UTC,Blechnaceae,Blechnum,Blechnum nudum,1.ferns/primitive,native
2/01/2024,1138587,2024-01-02 08:51:10 UTC,Blechnaceae,Blechnum,Blechnum nudum,1.ferns/primitive,native
19/10/2023,7471329,2023-10-30 21:31:41 UTC,Blechnaceae,Blechnum,Blechnum patersonii,1.ferns/primitive,native
21/09/2021,4743351,2021-09-22 10:48:02 UTC,Blechnaceae,Blechnum,Blechnum wattsii,1.ferns/primitive,native
21/08/2020,2488549,2020-08-22 00:37:19 UTC,Rutaceae,Boronia,Boronia floribunda,3.dicot,native
21/08/2020,2488549,2020-08-22 00:39:02 UTC,Rutaceae,Boronia,Boronia floribunda,3.dicot,native
30/08/2020,2091535,2020-08-31 01:22:15 UTC,Rutaceae,Boronia,Boronia floribunda,3.dicot,native
19/10/2020,3312793,2020-10-19 00:24:33 UTC,Rutaceae,Boronia,Boronia floribunda,3.dicot,native
15/09/2020,4743351,2021-07-25 04:51:43 UTC,Rutaceae,Boronia,Boronia floribunda,3.dicot,native
11/09/2021,3312793,2021-09-11 08:57:05 UTC,Rutaceae,Boronia,Boronia floribunda,3.dicot,native
23/09/2021,3893507,2021-09-23 08:15:51 UTC,Rutaceae,Boronia,Boronia floribunda,3.dicot,native
28/09/2021,4743351,2021-10-01 07:22:17 UTC,Rutaceae,Boronia,Boronia floribunda,3.dicot,native
28/09/2021,4743351,2021-10-01 07:22:17 UTC,Rutaceae,Boronia,Boronia floribunda,3.dicot,native
9/10/2021,2488549,2021-10-09 10:02:18 UTC,Rutaceae,Boronia,Boronia floribunda,3.dicot,native
9/10/2021,2488549,2021-10-09 10:02:20 UTC,Rutaceae,Boronia,Boronia floribunda,3.dicot,native
9/10/2021,2488549,2021-10-09 10:16:21 UTC,Rutaceae,Boronia,Boronia floribunda,3.dicot,native
23/01/2022,149222,2022-01-23 11:30:57 UTC,Rutaceae,Boronia,Boronia floribunda,3.dicot,native
18/10/2022,4916136,2022-10-24 10:39:33 UTC,Rutaceae,Boronia,Boronia floribunda,3.dicot,native
19/11/2022,2488549,2022-11-19 03:03:54 UTC,Rutaceae,Boronia,Boronia floribunda,3.dicot,native
22/09/2023,3978191,2023-09-23 09:51:11 UTC,Rutaceae,Boronia,Boronia floribunda,3.dicot,native
11/08/2019,45978,2019-08-11 05:29:37 UTC,Rutaceae,Boronia,Boronia ledifolia,3.dicot,native
6/08/2019,783222,2019-08-14 01:45:18 UTC,Rutaceae,Boronia,Boronia ledifolia,3.dicot,native
18/08/2019,265090,2019-08-20 18:39:11 UTC,Rutaceae,Boronia,Boronia ledifolia,3.dicot,native
22/08/2019,2158793,2019-08-22 03:56:36 UTC,Rutaceae,Boronia,Boronia ledifolia,3.dicot,native
21/10/2019,550350,2019-10-21 06:56:45 UTC,Rutaceae,Boronia,Boronia ledifolia,3.dicot,native
13/10/2019,2314979,2019-10-24 12:01:27 UTC,Rutaceae,Boronia,Boronia ledifolia,3.dicot,native
25/08/2019,2488549,2019-12-17 09:40:20 UTC,Rutaceae,Boronia,Boronia ledifolia,3.dicot,native
1/09/2018,2488549,2019-12-21 04:45:24 UTC,Rutaceae,Boronia,Boronia ledifolia,3.dicot,native
24/04/2020,2488549,2020-04-24 04:34:26 UTC,Rutaceae,Boronia,Boronia ledifolia,3.dicot,native
16/08/2019,64271,2020-05-16 00:33:26 UTC,Rutaceae,Boronia,Boronia ledifolia,3.dicot,native
16/08/2019,64271,2020-05-16 07:47:56 UTC,Rutaceae,Boronia,Boronia ledifolia,3.dicot,native
16/08/2019,64271,2020-05-23 00:24:56 UTC,Rutaceae,Boronia,Boronia ledifolia,3.dicot,native
11/08/1980,2851,2020-05-28 19:16:11 UTC,Rutaceae,Boronia,Boronia ledifolia,3.dicot,native
9/07/2020,2488549,2020-07-09 12:31:37 UTC,Rutaceae,Boronia,Boronia ledifolia,3.dicot,native
9/07/2020,2488549,2020-07-09 12:33:22 UTC,Rutaceae,Boronia,Boronia ledifolia,3.dicot,native
12/07/2020,2488549,2020-07-12 08:55:48 UTC,Rutaceae,Boronia,Boronia ledifolia,3.dicot,native
15/07/2020,2488549,2020-07-15 06:28:53 UTC,Rutaceae,Boronia,Boronia ledifolia,3.dicot,native
16/07/2020,2488549,2020-07-16 08:53:52 UTC,Rutaceae,Boronia,Boronia ledifolia,3.dicot,native
16/07/2020,2488549,2020-07-16 09:09:01 UTC,Rutaceae,Boronia,Boronia ledifolia,3.dicot,native
16/07/2020,2488549,2020-07-16 10:40:13 UTC,Rutaceae,Boronia,Boronia ledifolia,3.dicot,native
18/07/2020,2488549,2020-07-18 08:47:25 UTC,Rutaceae,Boronia,Boronia ledifolia,3.dicot,native
22/07/2020,3312793,2020-07-22 02:01:14 UTC,Rutaceae,Boronia,Boronia ledifolia,3.dicot,native
24/07/2020,2488549,2020-07-24 10:28:39 UTC,Rutaceae,Boronia,Boronia ledifolia,3.dicot,native
28/10/2018,3408787,2020-08-04 08:09:15 UTC,Rutaceae,Boronia,Boronia ledifolia,3.dicot,native
5/08/2020,793005,2020-08-06 01:04:23 UTC,Rutaceae,Boronia,Boronia ledifolia,3.dicot,native
12/08/2020,2488549,2020-08-12 03:26:54 UTC,Rutaceae,Boronia,Boronia ledifolia,3.dicot,native
12/08/2020,2488549,2020-08-12 07:44:34 UTC,Rutaceae,Boronia,Boronia ledifolia,3.dicot,native
21/08/2020,2488549,2020-08-21 10:42:45 UTC,Rutaceae,Boronia,Boronia ledifolia,3.dicot,native
21/08/2020,2488549,2020-08-21 22:26:20 UTC,Rutaceae,Boronia,Boronia ledifolia,3.dicot,native
29/08/2020,2488549,2020-08-29 10:31:34 UTC,Rutaceae,Boronia,Boronia ledifolia,3.dicot,native
15/08/2020,575123,2020-09-05 07:28:02 UTC,Rutaceae,Boronia,Boronia ledifolia,3.dicot,native
13/08/2020,2779982,2020-09-16 05:13:45 UTC,Rutaceae,Boronia,Boronia ledifolia,3.dicot,native
27/07/2014,1613510,2021-04-08 05:22:40 UTC,Rutaceae,Boronia,Boronia ledifolia,3.dicot,native
4/07/2021,2488549,2021-07-04 09:44:42 UTC,Rutaceae,Boronia,Boronia ledifolia,3.dicot,native
12/07/2021,4095677,2021-07-12 06:14:26 UTC,Rutaceae,Boronia,Boronia ledifolia,3.dicot,native
29/08/2020,4743351,2021-07-25 12:03:27 UTC,Rutaceae,Boronia,Boronia ledifolia,3.dicot,native
18/08/2020,4743351,2021-07-26 05:31:17 UTC,Rutaceae,Boronia,Boronia ledifolia,3.dicot,native
18/08/2020,4743351,2021-07-26 05:31:18 UTC,Rutaceae,Boronia,Boronia ledifolia,3.dicot,native
18/08/2020,4743351,2021-07-26 10:27:02 UTC,Rutaceae,Boronia,Boronia ledifolia,3.dicot,native
7/08/2020,4743351,2021-07-30 11:44:07 UTC,Rutaceae,Boronia,Boronia ledifolia,3.dicot,native
7/07/2020,4743351,2021-08-02 00:11:34 UTC,Rutaceae,Boronia,Boronia ledifolia,3.dicot,native
22/07/2019,4743351,2021-08-04 05:58:50 UTC,Rutaceae,Boronia,Boronia ledifolia,3.dicot,native
20/08/2021,3721620,2021-08-20 10:12:27 UTC,Rutaceae,Boronia,Boronia ledifolia,3.dicot,native
22/08/2021,3712636,2021-08-23 21:14:36 UTC,Rutaceae,Boronia,Boronia ledifolia,3.dicot,native
29/08/2021,4916136,2021-08-29 12:18:04 UTC,Rutaceae,Boronia,Boronia ledifolia,3.dicot,native
29/08/2021,4916136,2021-08-29 12:28:30 UTC,Rutaceae,Boronia,Boronia ledifolia,3.dicot,native
30/08/2021,4916136,2021-08-30 08:41:51 UTC,Rutaceae,Boronia,Boronia ledifolia,3.dicot,native
31/08/2021,4916136,2021-09-05 13:40:42 UTC,Rutaceae,Boronia,Boronia ledifolia,3.dicot,native
9/09/2021,4887682,2021-09-09 00:40:34 UTC,Rutaceae,Boronia,Boronia ledifolia,3.dicot,native
8/09/2021,4743351,2021-09-09 13:11:05 UTC,Rutaceae,Boronia,Boronia ledifolia,3.dicot,native
17/09/2021,2488549,2021-09-17 11:07:19 UTC,Rutaceae,Boronia,Boronia ledifolia,3.dicot,native
17/09/2021,4916136,2021-09-17 13:38:49 UTC,Rutaceae,Boronia,Boronia ledifolia,3.dicot,native
18/09/2021,4944844,2021-09-18 10:23:10 UTC,Rutaceae,Boronia,Boronia ledifolia,3.dicot,native
18/09/2021,4025155,2021-09-22 11:34:41 UTC,Rutaceae,Boronia,Boronia ledifolia,3.dicot,native
23/09/2021,3893507,2021-09-23 08:20:32 UTC,Rutaceae,Boronia,Boronia ledifolia,3.dicot,native
23/09/2021,3893507,2021-09-23 11:12:30 UTC,Rutaceae,Boronia,Boronia ledifolia,3.dicot,native
28/09/2021,4916136,2021-09-28 08:48:50 UTC,Rutaceae,Boronia,Boronia ledifolia,3.dicot,native
31/08/2021,4916136,2021-10-02 04:48:46 UTC,Rutaceae,Boronia,Boronia ledifolia,3.dicot,native
8/10/2021,4916136,2021-10-08 13:09:22 UTC,Rutaceae,Boronia,Boronia ledifolia,3.dicot,native
1/09/2021,2665854,2021-10-22 06:24:35 UTC,Rutaceae,Boronia,Boronia ledifolia,3.dicot,native
4/09/2016,2451999,2022-02-06 23:53:28 UTC,Rutaceae,Boronia,Boronia ledifolia,3.dicot,native
16/04/2022,2488549,2022-04-16 06:31:38 UTC,Rutaceae,Boronia,Boronia ledifolia,3.dicot,native
16/04/2022,2488549,2022-04-16 06:31:41 UTC,Rutaceae,Boronia,Boronia ledifolia,3.dicot,native
22/05/2022,2488549,2022-05-22 11:46:19 UTC,Rutaceae,Boronia,Boronia ledifolia,3.dicot,native
9/06/2022,2488549,2022-06-09 04:21:39 UTC,Rutaceae,Boronia,Boronia ledifolia,3.dicot,native
20/07/2021,3678274,2022-06-19 11:33:18 UTC,Rutaceae,Boronia,Boronia ledifolia,3.dicot,native
26/06/2022,2322306,2022-06-27 10:40:54 UTC,Rutaceae,Boronia,Boronia ledifolia,3.dicot,native
23/07/2022,4724286,2022-07-23 11:24:04 UTC,Rutaceae,Boronia,Boronia ledifolia,3.dicot,native
24/07/2022,1175154,2022-07-24 07:13:33 UTC,Rutaceae,Boronia,Boronia ledifolia,3.dicot,native
24/07/2022,265090,2022-07-25 10:26:55 UTC,Rutaceae,Boronia,Boronia ledifolia,3.dicot,native
24/07/2022,265090,2022-07-25 18:55:26 UTC,Rutaceae,Boronia,Boronia ledifolia,3.dicot,native
30/07/2022,4743351,2022-08-01 12:37:33 UTC,Rutaceae,Boronia,Boronia ledifolia,3.dicot,native
30/07/2022,4743351,2022-08-03 12:23:14 UTC,Rutaceae,Boronia,Boronia ledifolia,3.dicot,native
5/08/2022,3978191,2022-08-05 09:41:40 UTC,Rutaceae,Boronia,Boronia ledifolia,3.dicot,native
7/08/2022,4045770,2022-08-07 05:44:13 UTC,Rutaceae,Boronia,Boronia ledifolia,3.dicot,native
6/08/2022,4743351,2022-08-08 05:06:56 UTC,Rutaceae,Boronia,Boronia ledifolia,3.dicot,native
6/08/2022,4743351,2022-08-08 05:06:57 UTC,Rutaceae,Boronia,Boronia ledifolia,3.dicot,native
9/08/2022,2488549,2022-08-09 03:56:41 UTC,Rutaceae,Boronia,Boronia ledifolia,3.dicot,native
9/08/2022,2488549,2022-08-09 04:07:13 UTC,Rutaceae,Boronia,Boronia ledifolia,3.dicot,native
14/08/2022,265090,2022-08-14 09:16:41 UTC,Rutaceae,Boronia,Boronia ledifolia,3.dicot,native
15/08/2022,2376854,2022-08-17 08:15:41 UTC,Rutaceae,Boronia,Boronia ledifolia,3.dicot,native
17/08/2022,2488549,2022-08-17 11:06:05 UTC,Rutaceae,Boronia,Boronia ledifolia,3.dicot,native
20/08/2022,3012594,2022-08-21 04:20:44 UTC,Rutaceae,Boronia,Boronia ledifolia,3.dicot,native
21/08/2022,3839358,2022-08-21 11:13:07 UTC,Rutaceae,Boronia,Boronia ledifolia,3.dicot,native
29/04/2022,3880468,2022-08-25 13:34:41 UTC,Rutaceae,Boronia,Boronia ledifolia,3.dicot,native
16/09/2022,3678274,2022-09-17 10:23:12 UTC,Rutaceae,Boronia,Boronia ledifolia,3.dicot,native
18/09/2022,6131012,2022-09-18 06:11:26 UTC,Rutaceae,Boronia,Boronia ledifolia,3.dicot,native
22/09/2022,3893507,2022-09-22 11:12:59 UTC,Rutaceae,Boronia,Boronia ledifolia,3.dicot,native
4/10/2022,4743351,2022-10-06 09:52:01 UTC,Rutaceae,Boronia,Boronia ledifolia,3.dicot,native
27/10/2022,2631448,2022-10-31 10:19:24 UTC,Rutaceae,Boronia,Boronia ledifolia,3.dicot,native
19/11/2022,6308282,2022-11-27 08:43:50 UTC,Rutaceae,Boronia,Boronia ledifolia,3.dicot,native
26/11/2022,4743351,2022-11-29 10:16:14 UTC,Rutaceae,Boronia,Boronia ledifolia,3.dicot,native
25/09/2022,6385192,2022-12-19 01:43:41 UTC,Rutaceae,Boronia,Boronia ledifolia,3.dicot,native
4/09/2016,2451999,2023-05-04 09:10:01 UTC,Rutaceae,Boronia,Boronia ledifolia,3.dicot,native
11/06/2023,2531563,2023-06-12 11:43:31 UTC,Rutaceae,Boronia,Boronia ledifolia,3.dicot,native
21/06/2023,2531563,2023-06-21 06:27:18 UTC,Rutaceae,Boronia,Boronia ledifolia,3.dicot,native
22/06/2023,2488549,2023-06-22 03:39:38 UTC,Rutaceae,Boronia,Boronia ledifolia,3.dicot,native
24/06/2023,2488549,2023-06-24 09:56:02 UTC,Rutaceae,Boronia,Boronia ledifolia,3.dicot,native
25/06/2023,6955767,2023-06-25 05:24:11 UTC,Rutaceae,Boronia,Boronia ledifolia,3.dicot,native
25/06/2023,2376854,2023-06-26 15:25:12 UTC,Rutaceae,Boronia,Boronia ledifolia,3.dicot,native
2/07/2023,4916136,2023-07-02 09:27:28 UTC,Rutaceae,Boronia,Boronia ledifolia,3.dicot,native
1/07/2023,2531563,2023-07-03 02:24:35 UTC,Rutaceae,Boronia,Boronia ledifolia,3.dicot,native
6/07/2023,4916136,2023-07-06 06:09:02 UTC,Rutaceae,Boronia,Boronia ledifolia,3.dicot,native
9/07/2023,4059674,2023-07-09 05:05:53 UTC,Rutaceae,Boronia,Boronia ledifolia,3.dicot,native
11/07/2023,4916136,2023-07-11 08:13:27 UTC,Rutaceae,Boronia,Boronia ledifolia,3.dicot,native
16/07/2023,3978191,2023-07-16 09:59:46 UTC,Rutaceae,Boronia,Boronia ledifolia,3.dicot,native
16/07/2023,2366151,2023-07-16 10:59:23 UTC,Rutaceae,Boronia,Boronia ledifolia,3.dicot,native
20/07/2023,6196075,2023-07-20 02:55:37 UTC,Rutaceae,Boronia,Boronia ledifolia,3.dicot,native
28/07/2023,4124411,2023-07-28 04:16:29 UTC,Rutaceae,Boronia,Boronia ledifolia,3.dicot,native
29/07/2023,2650798,2023-07-30 10:26:27 UTC,Rutaceae,Boronia,Boronia ledifolia,3.dicot,native
29/07/2023,2650798,2023-07-30 11:10:27 UTC,Rutaceae,Boronia,Boronia ledifolia,3.dicot,native
6/08/2023,149222,2023-08-06 05:25:29 UTC,Rutaceae,Boronia,Boronia ledifolia,3.dicot,native
11/08/2023,4743351,2023-08-12 12:27:05 UTC,Rutaceae,Boronia,Boronia ledifolia,3.dicot,native
12/08/2023,2376854,2023-08-13 05:12:16 UTC,Rutaceae,Boronia,Boronia ledifolia,3.dicot,native
14/08/2023,4059674,2023-08-14 04:44:15 UTC,Rutaceae,Boronia,Boronia ledifolia,3.dicot,native
16/08/2023,5869062,2023-08-16 09:04:31 UTC,Rutaceae,Boronia,Boronia ledifolia,3.dicot,native
21/08/2023,6209647,2023-08-21 10:42:50 UTC,Rutaceae,Boronia,Boronia ledifolia,3.dicot,native
21/08/2023,6209647,2023-08-21 13:05:51 UTC,Rutaceae,Boronia,Boronia ledifolia,3.dicot,native
20/08/2023,5150199,2023-08-24 12:46:25 UTC,Rutaceae,Boronia,Boronia ledifolia,3.dicot,native
21/08/2023,6209647,2023-08-25 14:21:37 UTC,Rutaceae,Boronia,Boronia ledifolia,3.dicot,native
18/07/2023,4317345,2023-09-07 02:04:22 UTC,Rutaceae,Boronia,Boronia ledifolia,3.dicot,native
5/09/2023,4743351,2023-09-14 11:56:17 UTC,Rutaceae,Boronia,Boronia ledifolia,3.dicot,native
5/09/2023,4743351,2023-09-14 11:56:29 UTC,Rutaceae,Boronia,Boronia ledifolia,3.dicot,native
24/09/2023,1138587,2023-09-27 03:20:47 UTC,Rutaceae,Boronia,Boronia ledifolia,3.dicot,native
24/09/2023,661392,2023-09-28 10:32:53 UTC,Rutaceae,Boronia,Boronia ledifolia,3.dicot,native
24/09/2023,661392,2023-09-29 13:53:55 UTC,Rutaceae,Boronia,Boronia ledifolia,3.dicot,native
7/10/2023,7091879,2023-10-15 00:48:05 UTC,Rutaceae,Boronia,Boronia ledifolia,3.dicot,native
10/08/2023,2379395,2023-12-05 05:52:13 UTC,Rutaceae,Boronia,Boronia ledifolia,3.dicot,native
14/09/2022,745089,2024-03-29 03:51:07 UTC,Rutaceae,Boronia,Boronia ledifolia,3.dicot,native
21/04/2024,265090,2024-04-21 05:46:27 UTC,Rutaceae,Boronia,Boronia ledifolia,3.dicot,native
4/09/2022,7011911,2024-05-14 10:14:20 UTC,Rutaceae,Boronia,Boronia ledifolia,3.dicot,native
7/04/2020,3408787,2020-08-06 08:52:15 UTC,Rutaceae,Boronia,Boronia parviflora,3.dicot,native
27/08/2021,4743351,2021-08-28 11:42:24 UTC,Rutaceae,Boronia,Boronia pinnata,3.dicot,native
4/09/2021,2215616,2021-09-16 22:27:15 UTC,Rutaceae,Boronia,Boronia pinnata,3.dicot,native
31/10/2021,575123,2021-10-31 05:10:49 UTC,Rutaceae,Boronia,Boronia pinnata,3.dicot,native
10/11/2022,624851,2022-11-19 22:28:41 UTC,Rutaceae,Boronia,Boronia pinnata,3.dicot,native
26/11/2022,4743351,2022-11-29 08:56:47 UTC,Rutaceae,Boronia,Boronia pinnata,3.dicot,native
2/11/2011,2991,2013-06-10 21:18:28 UTC,Rutaceae,Boronia,Boronia serrulata,3.dicot,native
29/10/2014,2991,2015-07-23 16:49:05 UTC,Rutaceae,Boronia,Boronia serrulata,3.dicot,native
29/10/2014,2991,2015-07-23 18:25:22 UTC,Rutaceae,Boronia,Boronia serrulata,3.dicot,native
23/09/2019,636550,2019-10-18 08:07:08 UTC,Rutaceae,Boronia,Boronia serrulata,3.dicot,native
22/09/2018,2488549,2019-12-20 01:51:18 UTC,Rutaceae,Boronia,Boronia serrulata,3.dicot,native
10/05/2020,2488549,2020-05-10 03:05:58 UTC,Rutaceae,Boronia,Boronia serrulata,3.dicot,native
21/08/2020,2488549,2020-08-21 22:23:07 UTC,Rutaceae,Boronia,Boronia serrulata,3.dicot,native
29/08/2020,2488549,2020-08-30 00:04:52 UTC,Rutaceae,Boronia,Boronia serrulata,3.dicot,native
12/09/2020,3312996,2020-09-12 07:26:04 UTC,Rutaceae,Boronia,Boronia serrulata,3.dicot,native
19/10/2020,3312793,2020-10-19 00:41:13 UTC,Rutaceae,Boronia,Boronia serrulata,3.dicot,native
18/10/2020,265090,2020-10-19 19:24:01 UTC,Rutaceae,Boronia,Boronia serrulata,3.dicot,native
14/09/2013,3906655,2021-07-05 20:41:40 UTC,Rutaceae,Boronia,Boronia serrulata,3.dicot,native
19/09/2020,4916136,2021-08-27 12:55:17 UTC,Rutaceae,Boronia,Boronia serrulata,3.dicot,native
4/09/2021,2215616,2021-09-03 22:21:15 UTC,Rutaceae,Boronia,Boronia serrulata,3.dicot,native
1/09/2021,4916136,2021-09-05 13:03:46 UTC,Rutaceae,Boronia,Boronia serrulata,3.dicot,native
7/10/2013,2451999,2021-09-07 10:49:40 UTC,Rutaceae,Boronia,Boronia serrulata,3.dicot,native
7/09/2021,4916136,2021-09-08 07:26:07 UTC,Rutaceae,Boronia,Boronia serrulata,3.dicot,native
10/09/2021,4916136,2021-09-10 13:14:40 UTC,Rutaceae,Boronia,Boronia serrulata,3.dicot,native
12/09/2021,4025155,2021-09-17 08:16:34 UTC,Rutaceae,Boronia,Boronia serrulata,3.dicot,native
18/09/2021,4945027,2021-09-18 09:48:46 UTC,Rutaceae,Boronia,Boronia serrulata,3.dicot,native
17/09/2021,4095677,2021-09-21 05:54:24 UTC,Rutaceae,Boronia,Boronia serrulata,3.dicot,native
23/09/2021,3893507,2021-09-23 11:41:32 UTC,Rutaceae,Boronia,Boronia serrulata,3.dicot,native
23/09/2021,3893507,2021-09-23 11:47:38 UTC,Rutaceae,Boronia,Boronia serrulata,3.dicot,native
22/09/2021,4916136,2021-09-26 02:16:27 UTC,Rutaceae,Boronia,Boronia serrulata,3.dicot,native
3/10/2021,2488549,2021-10-03 09:26:10 UTC,Rutaceae,Boronia,Boronia serrulata,3.dicot,native
3/10/2021,2488549,2021-10-03 09:26:11 UTC,Rutaceae,Boronia,Boronia serrulata,3.dicot,native
3/10/2021,2488549,2021-10-03 09:26:12 UTC,Rutaceae,Boronia,Boronia serrulata,3.dicot,native
3/10/2021,2488549,2021-10-03 09:35:35 UTC,Rutaceae,Boronia,Boronia serrulata,3.dicot,native
9/10/2021,2488549,2021-10-09 10:16:21 UTC,Rutaceae,Boronia,Boronia serrulata,3.dicot,native
12/10/2021,4916136,2021-10-12 12:13:08 UTC,Rutaceae,Boronia,Boronia serrulata,3.dicot,native
24/10/2021,64271,2021-10-24 06:09:21 UTC,Rutaceae,Boronia,Boronia serrulata,3.dicot,native
11/10/2015,2451999,2022-01-29 07:05:32 UTC,Rutaceae,Boronia,Boronia serrulata,3.dicot,native
12/10/2021,3313573,2022-02-16 06:23:14 UTC,Rutaceae,Boronia,Boronia serrulata,3.dicot,native
30/07/2022,149222,2022-07-30 00:47:39 UTC,Rutaceae,Boronia,Boronia serrulata,3.dicot,native
14/08/2022,265090,2022-08-14 07:32:58 UTC,Rutaceae,Boronia,Boronia serrulata,3.dicot,native
14/08/2022,265090,2022-08-14 08:37:39 UTC,Rutaceae,Boronia,Boronia serrulata,3.dicot,native
24/08/2022,6011270,2022-08-24 01:43:03 UTC,Rutaceae,Boronia,Boronia serrulata,3.dicot,native
17/09/2022,2488549,2022-09-17 03:56:48 UTC,Rutaceae,Boronia,Boronia serrulata,3.dicot,native
25/09/2022,1138587,2022-09-25 06:47:26 UTC,Rutaceae,Boronia,Boronia serrulata,3.dicot,native
25/09/2022,3957444,2022-09-25 08:45:38 UTC,Rutaceae,Boronia,Boronia serrulata,3.dicot,native
2/10/2022,1401423,2022-10-03 11:01:41 UTC,Rutaceae,Boronia,Boronia serrulata,3.dicot,native
1/10/2022,6153672,2022-10-24 14:06:26 UTC,Rutaceae,Boronia,Boronia serrulata,3.dicot,native
19/11/2022,2488549,2022-11-19 01:41:26 UTC,Rutaceae,Boronia,Boronia serrulata,3.dicot,native
14/12/2022,1974770,2022-12-14 17:09:20 UTC,Rutaceae,Boronia,Boronia serrulata,3.dicot,native
1/09/2022,5283632,2023-07-11 14:12:58 UTC,Rutaceae,Boronia,Boronia serrulata,3.dicot,native
20/08/2023,5150199,2023-08-24 12:42:19 UTC,Rutaceae,Boronia,Boronia serrulata,3.dicot,native
26/08/2023,1175154,2023-08-26 07:50:19 UTC,Rutaceae,Boronia,Boronia serrulata,3.dicot,native
22/09/2023,3978191,2023-09-23 09:49:21 UTC,Rutaceae,Boronia,Boronia serrulata,3.dicot,native
24/09/2023,4359490,2023-09-24 03:07:00 UTC,Rutaceae,Boronia,Boronia serrulata,3.dicot,native
24/09/2023,6209647,2023-10-16 10:44:41 UTC,Rutaceae,Boronia,Boronia serrulata,3.dicot,native
14/10/2023,6578850,2023-10-19 22:18:04 UTC,Rutaceae,Boronia,Boronia serrulata,3.dicot,native
21/10/2023,1708045,2023-10-24 04:37:48 UTC,Rutaceae,Boronia,Boronia serrulata,3.dicot,native
10/08/2023,2379395,2023-12-05 05:54:06 UTC,Rutaceae,Boronia,Boronia serrulata,3.dicot,native
10/09/2023,4317345,2024-01-06 18:38:33 UTC,Rutaceae,Boronia,Boronia serrulata,3.dicot,native
28/03/2024,1138587,2024-03-28 06:55:21 UTC,Rutaceae,Boronia,Boronia serrulata,3.dicot,native
14/09/2022,745089,2024-03-29 03:31:49 UTC,Rutaceae,Boronia,Boronia serrulata,3.dicot,native
14/09/2022,745089,2024-03-29 03:51:05 UTC,Rutaceae,Boronia,Boronia serrulata,3.dicot,native
23/09/2016,7789371,2024-04-05 03:44:42 UTC,Rutaceae,Boronia,Boronia serrulata,3.dicot,native
24/10/2021,64271,2021-10-24 06:12:23 UTC,Rutaceae,Boronia,Boronia thujona,3.dicot,native
29/10/2014,2991,2015-07-23 17:02:36 UTC,Fabaceae,Bossiaea,Bossiaea ensata,3.dicot,native
18/07/2020,2488549,2020-07-18 09:59:27 UTC,Fabaceae,Bossiaea,Bossiaea ensata,3.dicot,native
29/08/2020,2488549,2020-08-29 09:47:17 UTC,Fabaceae,Bossiaea,Bossiaea ensata,3.dicot,native
9/10/2020,2488549,2020-10-09 20:46:36 UTC,Fabaceae,Bossiaea,Bossiaea ensata,3.dicot,native
29/08/2020,4743351,2021-07-25 10:37:36 UTC,Fabaceae,Bossiaea,Bossiaea ensata,3.dicot,native
4/09/2021,3712636,2021-09-04 10:52:30 UTC,Fabaceae,Bossiaea,Bossiaea ensata,3.dicot,native
4/09/2021,3893507,2021-09-04 21:17:29 UTC,Fabaceae,Bossiaea,Bossiaea ensata,3.dicot,native
6/09/2021,4887682,2021-09-06 08:23:53 UTC,Fabaceae,Bossiaea,Bossiaea ensata,3.dicot,native
12/09/2021,4037891,2021-09-13 12:05:43 UTC,Fabaceae,Bossiaea,Bossiaea ensata,3.dicot,native
17/09/2021,4916136,2021-09-19 12:03:37 UTC,Fabaceae,Bossiaea,Bossiaea ensata,3.dicot,native
3/10/2021,2488549,2021-10-03 10:06:57 UTC,Fabaceae,Bossiaea,Bossiaea ensata,3.dicot,native
4/10/2021,4916136,2021-10-05 11:09:30 UTC,Fabaceae,Bossiaea,Bossiaea ensata,3.dicot,native
12/10/2021,4743351,2021-10-14 11:00:56 UTC,Fabaceae,Bossiaea,Bossiaea ensata,3.dicot,native
31/12/2021,2488549,2021-12-31 09:29:05 UTC,Fabaceae,Bossiaea,Bossiaea ensata,3.dicot,native
24/09/2022,2488549,2022-09-24 11:58:28 UTC,Fabaceae,Bossiaea,Bossiaea ensata,3.dicot,native
25/09/2022,1138587,2022-09-25 06:38:07 UTC,Fabaceae,Bossiaea,Bossiaea ensata,3.dicot,native
26/09/2022,3678274,2022-09-30 10:12:17 UTC,Fabaceae,Bossiaea,Bossiaea ensata,3.dicot,native
22/06/2023,2531563,2023-06-22 08:15:14 UTC,Fabaceae,Bossiaea,Bossiaea ensata,3.dicot,native
6/08/2023,149222,2023-08-06 05:14:43 UTC,Fabaceae,Bossiaea,Bossiaea ensata,3.dicot,native
23/09/2016,7789371,2024-04-05 04:44:18 UTC,Fabaceae,Bossiaea,Bossiaea ensata,3.dicot,native
17/05/2018,364713,2018-05-17 08:47:39 UTC,Fabaceae,Bossiaea,Bossiaea heterophylla,3.dicot,native
19/04/2019,45978,2019-04-19 07:08:17 UTC,Fabaceae,Bossiaea,Bossiaea heterophylla,3.dicot,native
5/05/2019,265090,2019-07-29 10:16:02 UTC,Fabaceae,Bossiaea,Bossiaea heterophylla,3.dicot,native
28/03/2020,2488549,2020-03-28 10:13:22 UTC,Fabaceae,Bossiaea,Bossiaea heterophylla,3.dicot,native
5/04/2020,2488549,2020-04-06 09:46:16 UTC,Fabaceae,Bossiaea,Bossiaea heterophylla,3.dicot,native
18/04/2020,2488549,2020-04-19 00:15:47 UTC,Fabaceae,Bossiaea,Bossiaea heterophylla,3.dicot,native
24/04/2020,2488549,2020-04-24 10:57:32 UTC,Fabaceae,Bossiaea,Bossiaea heterophylla,3.dicot,native
24/04/2020,2488549,2020-04-24 11:16:26 UTC,Fabaceae,Bossiaea,Bossiaea heterophylla,3.dicot,native
1/05/2020,2488549,2020-05-01 02:50:15 UTC,Fabaceae,Bossiaea,Bossiaea heterophylla,3.dicot,native
23/05/2020,62599,2020-05-23 10:23:07 UTC,Fabaceae,Bossiaea,Bossiaea heterophylla,3.dicot,native
23/05/2020,2488549,2020-05-24 09:06:54 UTC,Fabaceae,Bossiaea,Bossiaea heterophylla,3.dicot,native
18/07/2020,2488549,2020-07-18 08:48:49 UTC,Fabaceae,Bossiaea,Bossiaea heterophylla,3.dicot,native
3/10/2020,2488549,2020-10-03 09:55:38 UTC,Fabaceae,Bossiaea,Bossiaea heterophylla,3.dicot,native
8/04/2021,325733,2021-04-09 12:14:50 UTC,Fabaceae,Bossiaea,Bossiaea heterophylla,3.dicot,native
6/04/2021,4743351,2021-07-21 03:57:43 UTC,Fabaceae,Bossiaea,Bossiaea heterophylla,3.dicot,native
6/04/2021,4743351,2021-07-21 03:57:44 UTC,Fabaceae,Bossiaea,Bossiaea heterophylla,3.dicot,native
8/09/2021,4743351,2021-09-09 13:11:04 UTC,Fabaceae,Bossiaea,Bossiaea heterophylla,3.dicot,native
28/09/2021,4743351,2021-09-30 11:51:31 UTC,Fabaceae,Bossiaea,Bossiaea heterophylla,3.dicot,native
9/10/2021,2488549,2021-10-09 09:21:15 UTC,Fabaceae,Bossiaea,Bossiaea heterophylla,3.dicot,native
9/10/2021,2488549,2021-10-09 10:16:23 UTC,Fabaceae,Bossiaea,Bossiaea heterophylla,3.dicot,native
7/04/2020,3408787,2022-02-14 18:20:13 UTC,Fabaceae,Bossiaea,Bossiaea heterophylla,3.dicot,native
7/04/2020,3408787,2022-02-14 18:20:14 UTC,Fabaceae,Bossiaea,Bossiaea heterophylla,3.dicot,native
16/05/2020,3408787,2022-02-15 16:38:08 UTC,Fabaceae,Bossiaea,Bossiaea heterophylla,3.dicot,native
10/03/2022,2488549,2022-03-10 10:40:11 UTC,Fabaceae,Bossiaea,Bossiaea heterophylla,3.dicot,native
15/04/2022,2488549,2022-04-15 09:01:37 UTC,Fabaceae,Bossiaea,Bossiaea heterophylla,3.dicot,native
16/04/2022,2488549,2022-04-16 06:31:47 UTC,Fabaceae,Bossiaea,Bossiaea heterophylla,3.dicot,native
16/04/2022,3751299,2022-04-16 10:14:06 UTC,Fabaceae,Bossiaea,Bossiaea heterophylla,3.dicot,native
28/04/2022,2488549,2022-04-28 06:28:19 UTC,Fabaceae,Bossiaea,Bossiaea heterophylla,3.dicot,native
29/04/2022,4916136,2022-04-29 07:33:53 UTC,Fabaceae,Bossiaea,Bossiaea heterophylla,3.dicot,native
30/04/2022,1138587,2022-04-30 09:06:27 UTC,Fabaceae,Bossiaea,Bossiaea heterophylla,3.dicot,native
30/04/2022,1138587,2022-04-30 10:45:19 UTC,Fabaceae,Bossiaea,Bossiaea heterophylla,3.dicot,native
10/06/2022,2373989,2022-06-10 02:53:30 UTC,Fabaceae,Bossiaea,Bossiaea heterophylla,3.dicot,native
20/07/2021,3678274,2022-06-19 11:33:19 UTC,Fabaceae,Bossiaea,Bossiaea heterophylla,3.dicot,native
24/05/2022,3425899,2022-06-23 06:53:27 UTC,Fabaceae,Bossiaea,Bossiaea heterophylla,3.dicot,native
26/06/2022,2322306,2022-06-27 09:30:55 UTC,Fabaceae,Bossiaea,Bossiaea heterophylla,3.dicot,native
24/04/2022,3221790,2022-06-29 10:33:58 UTC,Fabaceae,Bossiaea,Bossiaea heterophylla,3.dicot,native
24/07/2022,2488549,2022-07-24 04:18:44 UTC,Fabaceae,Bossiaea,Bossiaea heterophylla,3.dicot,native
24/07/2022,265090,2022-07-24 18:25:35 UTC,Fabaceae,Bossiaea,Bossiaea heterophylla,3.dicot,native
24/07/2022,265090,2022-07-24 18:29:40 UTC,Fabaceae,Bossiaea,Bossiaea heterophylla,3.dicot,native
30/07/2022,4743351,2022-08-01 12:37:34 UTC,Fabaceae,Bossiaea,Bossiaea heterophylla,3.dicot,native
12/02/2023,4743351,2023-02-14 10:00:16 UTC,Fabaceae,Bossiaea,Bossiaea heterophylla,3.dicot,native
2/04/2023,2376854,2023-04-03 10:28:19 UTC,Fabaceae,Bossiaea,Bossiaea heterophylla,3.dicot,native
5/04/2023,1809954,2023-04-06 23:42:41 UTC,Fabaceae,Bossiaea,Bossiaea heterophylla,3.dicot,native
22/04/2023,5837256,2023-04-25 20:45:10 UTC,Fabaceae,Bossiaea,Bossiaea heterophylla,3.dicot,native
5/05/2023,3978191,2023-05-05 09:33:21 UTC,Fabaceae,Bossiaea,Bossiaea heterophylla,3.dicot,native
20/05/2023,4025155,2023-05-28 01:12:05 UTC,Fabaceae,Bossiaea,Bossiaea heterophylla,3.dicot,native
27/05/2023,6209647,2023-05-28 16:03:19 UTC,Fabaceae,Bossiaea,Bossiaea heterophylla,3.dicot,native
8/06/2023,4916136,2023-06-08 10:17:45 UTC,Fabaceae,Bossiaea,Bossiaea heterophylla,3.dicot,native
24/06/2023,2488549,2023-06-24 09:56:04 UTC,Fabaceae,Bossiaea,Bossiaea heterophylla,3.dicot,native
16/07/2023,7001195,2023-07-16 06:12:22 UTC,Fabaceae,Bossiaea,Bossiaea heterophylla,3.dicot,native
16/07/2023,5315657,2023-07-16 06:12:37 UTC,Fabaceae,Bossiaea,Bossiaea heterophylla,3.dicot,native
16/07/2023,2366151,2023-07-16 11:08:41 UTC,Fabaceae,Bossiaea,Bossiaea heterophylla,3.dicot,native
24/09/2023,661392,2023-09-29 11:38:19 UTC,Fabaceae,Bossiaea,Bossiaea heterophylla,3.dicot,native
24/09/2023,661392,2023-09-29 11:38:20 UTC,Fabaceae,Bossiaea,Bossiaea heterophylla,3.dicot,native
24/09/2023,661392,2023-09-29 13:53:54 UTC,Fabaceae,Bossiaea,Bossiaea heterophylla,3.dicot,native
16/04/2024,3936801,2024-04-16 12:20:12 UTC,Fabaceae,Bossiaea,Bossiaea heterophylla,3.dicot,native
21/04/2024,265090,2024-04-21 05:37:57 UTC,Fabaceae,Bossiaea,Bossiaea heterophylla,3.dicot,native
24/05/2024,5043304,2024-05-24 06:44:35 UTC,Fabaceae,Bossiaea,Bossiaea heterophylla,3.dicot,native
24/05/2024,5043304,2024-05-24 06:45:24 UTC,Fabaceae,Bossiaea,Bossiaea heterophylla,3.dicot,native
24/05/2024,5043304,2024-05-24 06:49:25 UTC,Fabaceae,Bossiaea,Bossiaea heterophylla,3.dicot,native
28/11/2021,2376854,2021-11-30 04:15:56 UTC,Fabaceae,Bossiaea,Bossiaea scolopendria,3.dicot,native
6/08/2019,783222,2019-08-14 01:39:00 UTC,Fabaceae,Bossiaea,Bossiaea stephensonii,3.dicot,native
3/05/2020,2488549,2020-05-03 01:35:18 UTC,Fabaceae,Bossiaea,Bossiaea stephensonii,3.dicot,native
10/05/2020,2488549,2020-05-10 02:52:21 UTC,Fabaceae,Bossiaea,Bossiaea stephensonii,3.dicot,native
15/07/2020,2488549,2020-07-15 06:30:52 UTC,Fabaceae,Bossiaea,Bossiaea stephensonii,3.dicot,native
15/07/2020,2488549,2020-07-15 07:04:19 UTC,Fabaceae,Bossiaea,Bossiaea stephensonii,3.dicot,native
15/07/2020,2488549,2020-07-15 07:06:30 UTC,Fabaceae,Bossiaea,Bossiaea stephensonii,3.dicot,native
12/08/2020,2488549,2020-08-12 03:59:52 UTC,Fabaceae,Bossiaea,Bossiaea stephensonii,3.dicot,native
12/08/2020,2488549,2020-08-12 05:24:57 UTC,Fabaceae,Bossiaea,Bossiaea stephensonii,3.dicot,native
12/08/2020,2488549,2020-08-12 07:11:43 UTC,Fabaceae,Bossiaea,Bossiaea stephensonii,3.dicot,native
24/08/2020,2488549,2020-08-24 06:58:33 UTC,Fabaceae,Bossiaea,Bossiaea stephensonii,3.dicot,native
18/09/2020,2488549,2020-09-18 08:56:56 UTC,Fabaceae,Bossiaea,Bossiaea stephensonii,3.dicot,native
18/09/2020,2488549,2020-09-18 22:02:40 UTC,Fabaceae,Bossiaea,Bossiaea stephensonii,3.dicot,native
9/10/2020,2488549,2020-10-09 11:07:07 UTC,Fabaceae,Bossiaea,Bossiaea stephensonii,3.dicot,native
13/11/2020,2488549,2020-11-13 20:04:44 UTC,Fabaceae,Bossiaea,Bossiaea stephensonii,3.dicot,native
20/08/2021,2488549,2021-08-20 11:00:23 UTC,Fabaceae,Bossiaea,Bossiaea stephensonii,3.dicot,native
20/08/2021,2488549,2021-08-20 11:00:24 UTC,Fabaceae,Bossiaea,Bossiaea stephensonii,3.dicot,native
27/08/2021,4743351,2021-08-28 11:42:26 UTC,Fabaceae,Bossiaea,Bossiaea stephensonii,3.dicot,native
4/09/2021,3712636,2021-09-04 10:15:24 UTC,Fabaceae,Bossiaea,Bossiaea stephensonii,3.dicot,native
4/09/2021,3893507,2021-09-04 21:48:11 UTC,Fabaceae,Bossiaea,Bossiaea stephensonii,3.dicot,native
9/09/2021,4887682,2021-09-09 00:10:08 UTC,Fabaceae,Bossiaea,Bossiaea stephensonii,3.dicot,native
10/09/2021,2488549,2021-09-10 09:48:23 UTC,Fabaceae,Bossiaea,Bossiaea stephensonii,3.dicot,native
10/09/2021,2488549,2021-09-10 10:04:20 UTC,Fabaceae,Bossiaea,Bossiaea stephensonii,3.dicot,native
10/09/2021,2488549,2021-09-10 11:01:01 UTC,Fabaceae,Bossiaea,Bossiaea stephensonii,3.dicot,native
20/11/2021,2488549,2021-11-20 10:17:39 UTC,Fabaceae,Bossiaea,Bossiaea stephensonii,3.dicot,native
20/11/2021,2488549,2021-11-20 10:17:42 UTC,Fabaceae,Bossiaea,Bossiaea stephensonii,3.dicot,native
16/12/2021,2488549,2021-12-16 10:03:18 UTC,Fabaceae,Bossiaea,Bossiaea stephensonii,3.dicot,native
17/12/2021,2488549,2021-12-17 09:59:11 UTC,Fabaceae,Bossiaea,Bossiaea stephensonii,3.dicot,native
4/02/2022,2488549,2022-02-05 09:09:27 UTC,Fabaceae,Bossiaea,Bossiaea stephensonii,3.dicot,native
13/02/2022,2488549,2022-02-13 08:49:36 UTC,Fabaceae,Bossiaea,Bossiaea stephensonii,3.dicot,native
21/02/2022,2488549,2022-02-21 08:41:52 UTC,Fabaceae,Bossiaea,Bossiaea stephensonii,3.dicot,native
21/02/2022,2488549,2022-02-21 08:41:59 UTC,Fabaceae,Bossiaea,Bossiaea stephensonii,3.dicot,native
28/04/2022,2488549,2022-04-28 06:32:36 UTC,Fabaceae,Bossiaea,Bossiaea stephensonii,3.dicot,native
27/05/2022,2488549,2022-05-27 04:02:28 UTC,Fabaceae,Bossiaea,Bossiaea stephensonii,3.dicot,native
23/06/2022,2488549,2022-06-23 05:21:08 UTC,Fabaceae,Bossiaea,Bossiaea stephensonii,3.dicot,native
24/07/2022,2488549,2022-07-24 03:54:03 UTC,Fabaceae,Bossiaea,Bossiaea stephensonii,3.dicot,native
24/07/2022,2488549,2022-07-24 03:55:26 UTC,Fabaceae,Bossiaea,Bossiaea stephensonii,3.dicot,native
24/07/2022,2488549,2022-07-24 04:02:00 UTC,Fabaceae,Bossiaea,Bossiaea stephensonii,3.dicot,native
29/07/2022,2488549,2022-07-29 03:47:16 UTC,Fabaceae,Bossiaea,Bossiaea stephensonii,3.dicot,native
9/08/2022,2488549,2022-08-09 03:47:32 UTC,Fabaceae,Bossiaea,Bossiaea stephensonii,3.dicot,native
9/08/2022,2488549,2022-08-09 03:48:29 UTC,Fabaceae,Bossiaea,Bossiaea stephensonii,3.dicot,native
9/08/2022,2488549,2022-08-09 03:53:30 UTC,Fabaceae,Bossiaea,Bossiaea stephensonii,3.dicot,native
9/08/2022,2488549,2022-08-09 03:54:49 UTC,Fabaceae,Bossiaea,Bossiaea stephensonii,3.dicot,native
9/08/2022,2488549,2022-08-09 03:56:12 UTC,Fabaceae,Bossiaea,Bossiaea stephensonii,3.dicot,native
9/08/2022,2488549,2022-08-09 03:57:10 UTC,Fabaceae,Bossiaea,Bossiaea stephensonii,3.dicot,native
9/08/2022,2488549,2022-08-09 04:03:47 UTC,Fabaceae,Bossiaea,Bossiaea stephensonii,3.dicot,native
9/08/2022,2488549,2022-08-09 04:06:00 UTC,Fabaceae,Bossiaea,Bossiaea stephensonii,3.dicot,native
9/08/2022,2488549,2022-08-09 04:08:05 UTC,Fabaceae,Bossiaea,Bossiaea stephensonii,3.dicot,native
10/08/2022,2488549,2022-08-10 06:41:15 UTC,Fabaceae,Bossiaea,Bossiaea stephensonii,3.dicot,native
10/08/2022,2488549,2022-08-10 06:42:45 UTC,Fabaceae,Bossiaea,Bossiaea stephensonii,3.dicot,native
10/08/2022,2488549,2022-08-10 06:44:00 UTC,Fabaceae,Bossiaea,Bossiaea stephensonii,3.dicot,native
10/08/2022,2488549,2022-08-10 06:47:03 UTC,Fabaceae,Bossiaea,Bossiaea stephensonii,3.dicot,native
10/08/2022,2488549,2022-08-10 06:47:56 UTC,Fabaceae,Bossiaea,Bossiaea stephensonii,3.dicot,native
10/08/2022,2488549,2022-08-10 06:53:43 UTC,Fabaceae,Bossiaea,Bossiaea stephensonii,3.dicot,native
10/08/2022,2488549,2022-08-10 06:54:29 UTC,Fabaceae,Bossiaea,Bossiaea stephensonii,3.dicot,native
11/08/2022,2488549,2022-08-11 11:41:05 UTC,Fabaceae,Bossiaea,Bossiaea stephensonii,3.dicot,native
13/08/2022,5188972,2022-08-13 08:21:22 UTC,Fabaceae,Bossiaea,Bossiaea stephensonii,3.dicot,native
15/08/2022,2376854,2022-08-17 08:15:36 UTC,Fabaceae,Bossiaea,Bossiaea stephensonii,3.dicot,native
15/09/2022,2488549,2022-09-15 01:11:03 UTC,Fabaceae,Bossiaea,Bossiaea stephensonii,3.dicot,native
15/09/2022,2488549,2022-09-15 01:11:13 UTC,Fabaceae,Bossiaea,Bossiaea stephensonii,3.dicot,native
16/09/2022,2488549,2022-09-16 06:39:12 UTC,Fabaceae,Bossiaea,Bossiaea stephensonii,3.dicot,native
17/09/2022,2488549,2022-09-17 03:46:24 UTC,Fabaceae,Bossiaea,Bossiaea stephensonii,3.dicot,native
23/09/2022,2488549,2022-09-23 06:50:51 UTC,Fabaceae,Bossiaea,Bossiaea stephensonii,3.dicot,native
23/09/2022,2488549,2022-09-23 11:26:41 UTC,Fabaceae,Bossiaea,Bossiaea stephensonii,3.dicot,native
23/09/2022,2488549,2022-09-23 11:26:43 UTC,Fabaceae,Bossiaea,Bossiaea stephensonii,3.dicot,native
3/10/2022,2488549,2022-10-03 07:49:26 UTC,Fabaceae,Bossiaea,Bossiaea stephensonii,3.dicot,native
3/10/2022,2488549,2022-10-03 07:51:20 UTC,Fabaceae,Bossiaea,Bossiaea stephensonii,3.dicot,native
13/11/2022,2488549,2022-11-13 05:44:03 UTC,Fabaceae,Bossiaea,Bossiaea stephensonii,3.dicot,native
26/11/2022,4743351,2022-11-29 08:56:50 UTC,Fabaceae,Bossiaea,Bossiaea stephensonii,3.dicot,native
28/12/2022,2488549,2022-12-28 02:21:25 UTC,Fabaceae,Bossiaea,Bossiaea stephensonii,3.dicot,native
9/03/2023,1658043,2023-03-13 07:22:39 UTC,Fabaceae,Bossiaea,Bossiaea stephensonii,3.dicot,native
9/03/2023,1658043,2023-03-13 07:22:44 UTC,Fabaceae,Bossiaea,Bossiaea stephensonii,3.dicot,native
22/06/2023,2488549,2023-06-22 03:39:37 UTC,Fabaceae,Bossiaea,Bossiaea stephensonii,3.dicot,native
24/06/2023,2488549,2023-06-24 09:55:58 UTC,Fabaceae,Bossiaea,Bossiaea stephensonii,3.dicot,native
16/07/2023,2366151,2023-07-16 10:49:37 UTC,Fabaceae,Bossiaea,Bossiaea stephensonii,3.dicot,native
29/07/2023,3978191,2023-07-29 09:13:55 UTC,Fabaceae,Bossiaea,Bossiaea stephensonii,3.dicot,native
18/08/2023,6308282,2023-08-18 02:39:48 UTC,Fabaceae,Bossiaea,Bossiaea stephensonii,3.dicot,native
18/08/2023,6308282,2023-08-18 03:45:34 UTC,Fabaceae,Bossiaea,Bossiaea stephensonii,3.dicot,native
23/08/2023,3927361,2023-08-22 21:20:37 UTC,Fabaceae,Bossiaea,Bossiaea stephensonii,3.dicot,native
20/09/2023,5435930,2023-09-25 12:15:06 UTC,Fabaceae,Bossiaea,Bossiaea stephensonii,3.dicot,native
24/09/2023,1138587,2023-09-27 01:50:03 UTC,Fabaceae,Bossiaea,Bossiaea stephensonii,3.dicot,native
24/09/2023,1138587,2023-09-27 02:17:55 UTC,Fabaceae,Bossiaea,Bossiaea stephensonii,3.dicot,native
24/09/2023,661392,2023-09-28 07:58:54 UTC,Fabaceae,Bossiaea,Bossiaea stephensonii,3.dicot,native
16/09/2023,745089,2023-11-07 08:00:58 UTC,Fabaceae,Bossiaea,Bossiaea stephensonii,3.dicot,native
8/11/2023,2631448,2023-11-12 05:23:55 UTC,Fabaceae,Bossiaea,Bossiaea stephensonii,3.dicot,native
3/03/2024,3712636,2024-03-03 03:03:14 UTC,Fabaceae,Bossiaea,Bossiaea stephensonii,3.dicot,native
21/04/2024,265090,2024-04-21 06:14:10 UTC,Fabaceae,Bossiaea,Bossiaea stephensonii,3.dicot,native
24/05/2024,5043304,2024-05-24 06:23:25 UTC,Fabaceae,Bossiaea,Bossiaea stephensonii,3.dicot,native
26/03/2023,2650798,2023-03-26 23:26:22 UTC,Ophioglossaceae,Botrychium,Botrychium australe,1.ferns/primitive,native
20/06/2022,1686668,2022-06-20 05:24:11 UTC,Malvaceae,Brachychiton,Brachychiton acerifolius,3.dicot,native
8/10/2023,3978191,2023-10-08 08:03:47 UTC,Malvaceae,Brachychiton,Brachychiton acerifolius,3.dicot,native
27/11/2023,4916136,2023-11-28 11:48:00 UTC,Malvaceae,Brachychiton,Brachychiton acerifolius,3.dicot,native
21/08/2020,2488549,2020-08-21 11:58:03 UTC,Ericaceae,Brachyloma,Brachyloma daphnoides,3.dicot,native
26/09/2020,2488549,2020-09-26 09:26:37 UTC,Ericaceae,Brachyloma,Brachyloma daphnoides,3.dicot,native
4/10/2020,2488549,2020-10-04 10:30:48 UTC,Ericaceae,Brachyloma,Brachyloma daphnoides,3.dicot,native
17/09/2021,4095677,2021-09-21 05:36:49 UTC,Ericaceae,Brachyloma,Brachyloma daphnoides,3.dicot,native
23/09/2021,4916136,2021-09-23 13:17:18 UTC,Ericaceae,Brachyloma,Brachyloma daphnoides,3.dicot,native
23/09/2021,3893507,2021-09-25 11:55:34 UTC,Ericaceae,Brachyloma,Brachyloma daphnoides,3.dicot,native
28/09/2021,4743351,2021-10-01 12:16:19 UTC,Ericaceae,Brachyloma,Brachyloma daphnoides,3.dicot,native
3/10/2021,2488549,2021-10-03 09:45:20 UTC,Ericaceae,Brachyloma,Brachyloma daphnoides,3.dicot,native
27/09/2021,4916136,2021-10-07 12:47:02 UTC,Ericaceae,Brachyloma,Brachyloma daphnoides,3.dicot,native
25/09/2022,1138587,2022-09-25 06:47:27 UTC,Ericaceae,Brachyloma,Brachyloma daphnoides,3.dicot,native
24/09/2023,1138587,2023-09-27 03:10:32 UTC,Ericaceae,Brachyloma,Brachyloma daphnoides,3.dicot,native
24/09/2023,661392,2023-09-29 14:08:37 UTC,Ericaceae,Brachyloma,Brachyloma daphnoides,3.dicot,native
24/09/2023,661392,2023-10-03 13:20:26 UTC,Ericaceae,Brachyloma,Brachyloma daphnoides,3.dicot,native
22/09/2023,5300031,2023-10-13 02:14:07 UTC,Ericaceae,Brachyloma,Brachyloma daphnoides,3.dicot,native
23/02/2020,45978,2020-02-23 07:28:05 UTC,Asteraceae,Brachyscome,Brachyscome graminea,3.dicot,native
6/12/2020,2488549,2020-12-06 07:31:41 UTC,Phyllanthaceae,Breynia,Breynia oblongifolia,3.dicot,native
9/09/2021,4887682,2021-09-08 23:59:56 UTC,Phyllanthaceae,Breynia,Breynia oblongifolia,3.dicot,native
28/01/2023,3978191,2023-01-28 10:05:58 UTC,Phyllanthaceae,Breynia,Breynia oblongifolia,3.dicot,native
11/03/2023,745089,2023-03-11 20:35:28 UTC,Phyllanthaceae,Breynia,Breynia oblongifolia,3.dicot,native
9/05/2023,389804,2023-05-24 03:06:25 UTC,Phyllanthaceae,Breynia,Breynia oblongifolia,3.dicot,native
24/09/2023,1138587,2023-09-27 02:30:59 UTC,Phyllanthaceae,Breynia,Breynia oblongifolia,3.dicot,native
28/10/2023,2631448,2023-10-29 03:13:11 UTC,Phyllanthaceae,Breynia,Breynia oblongifolia,3.dicot,native
20/12/2023,1305186,2023-12-20 10:22:21 UTC,Phyllanthaceae,Breynia,Breynia oblongifolia,3.dicot,native
24/02/2024,2583877,2024-02-24 11:00:55 UTC,Phyllanthaceae,Breynia,Breynia oblongifolia,3.dicot,native
28/10/2021,2665854,2021-10-29 20:14:01 UTC,Poaceae,Briza,Briza maxima,4.monocot,introduced
9/01/2022,3880468,2022-01-09 12:36:27 UTC,Acanthaceae,Brunoniella,Brunoniella pumilio,3.dicot,native
2/11/2011,2991,2013-06-10 21:06:33 UTC,Orchidaceae,Bulbophyllum,Bulbophyllum exiguum,5.monocot-colorful,native
17/04/2021,636550,2021-04-20 03:05:34 UTC,Orchidaceae,Bulbophyllum,Bulbophyllum exiguum,5.monocot-colorful,native
20/03/2022,5188972,2022-03-20 13:02:55 UTC,Orchidaceae,Bulbophyllum,Bulbophyllum exiguum,5.monocot-colorful,native
29/01/2022,5150898,2022-03-22 09:52:43 UTC,Orchidaceae,Bulbophyllum,Bulbophyllum exiguum,5.monocot-colorful,native
17/06/2023,5150898,2023-06-17 06:50:25 UTC,Orchidaceae,Bulbophyllum,Bulbophyllum exiguum,5.monocot-colorful,native
24/06/2023,5150898,2023-06-24 09:07:11 UTC,Orchidaceae,Bulbophyllum,Bulbophyllum exiguum,5.monocot-colorful,native
19/10/2023,7471329,2023-10-30 21:28:51 UTC,Orchidaceae,Bulbophyllum,Bulbophyllum exiguum,5.monocot-colorful,native
9/03/2024,5810336,2024-03-10 06:42:12 UTC,Orchidaceae,Bulbophyllum,Bulbophyllum exiguum,5.monocot-colorful,native
28/02/2021,265090,2021-02-28 03:03:13 UTC,Orchidaceae,Bulbophyllum,Bulbophyllum shepherdii,5.monocot-colorful,native
5/12/2021,5150898,2022-03-22 09:54:25 UTC,Orchidaceae,Bulbophyllum,Bulbophyllum shepherdii,5.monocot-colorful,native
16/12/2022,3978191,2022-12-16 08:06:18 UTC,Orchidaceae,Bulbophyllum,Bulbophyllum shepherdii,5.monocot-colorful,native
5/02/2023,3978191,2023-02-05 09:35:13 UTC,Orchidaceae,Bulbophyllum,Bulbophyllum shepherdii,5.monocot-colorful,native
26/03/2023,2650798,2023-03-26 23:24:44 UTC,Orchidaceae,Bulbophyllum,Bulbophyllum shepherdii,5.monocot-colorful,native
2/11/2011,2991,2013-06-10 20:54:30 UTC,Colchicaceae,Burchardia,Burchardia umbellata,5.monocot-colorful,native
29/10/2014,2991,2015-07-23 16:57:11 UTC,Colchicaceae,Burchardia,Burchardia umbellata,5.monocot-colorful,native
3/10/2019,1477617,2019-10-04 12:03:56 UTC,Colchicaceae,Burchardia,Burchardia umbellata,5.monocot-colorful,native
3/10/2019,1477617,2019-10-05 13:21:16 UTC,Colchicaceae,Burchardia,Burchardia umbellata,5.monocot-colorful,native
18/09/2020,2488549,2020-09-18 10:29:07 UTC,Colchicaceae,Burchardia,Burchardia umbellata,5.monocot-colorful,native
18/09/2020,2488549,2020-09-18 22:03:44 UTC,Colchicaceae,Burchardia,Burchardia umbellata,5.monocot-colorful,native
5/10/2020,2867806,2020-10-05 04:45:13 UTC,Colchicaceae,Burchardia,Burchardia umbellata,5.monocot-colorful,native
9/10/2020,2488549,2020-10-09 10:43:43 UTC,Colchicaceae,Burchardia,Burchardia umbellata,5.monocot-colorful,native
19/10/2020,3312793,2020-10-19 03:00:05 UTC,Colchicaceae,Burchardia,Burchardia umbellata,5.monocot-colorful,native
23/10/2020,2488549,2020-10-23 10:18:01 UTC,Colchicaceae,Burchardia,Burchardia umbellata,5.monocot-colorful,native
23/10/2020,2488549,2020-10-24 08:31:51 UTC,Colchicaceae,Burchardia,Burchardia umbellata,5.monocot-colorful,native
23/10/2020,3654699,2020-10-26 04:42:48 UTC,Colchicaceae,Burchardia,Burchardia umbellata,5.monocot-colorful,native
6/08/2021,4095677,2021-08-12 10:08:23 UTC,Colchicaceae,Burchardia,Burchardia umbellata,5.monocot-colorful,native
4/09/2021,3893507,2021-09-04 13:54:05 UTC,Colchicaceae,Burchardia,Burchardia umbellata,5.monocot-colorful,native
5/09/2021,2488549,2021-09-05 10:39:05 UTC,Colchicaceae,Burchardia,Burchardia umbellata,5.monocot-colorful,native
10/10/2011,4916136,2021-09-06 13:01:28 UTC,Colchicaceae,Burchardia,Burchardia umbellata,5.monocot-colorful,native
9/09/2021,4887682,2021-09-09 00:04:46 UTC,Colchicaceae,Burchardia,Burchardia umbellata,5.monocot-colorful,native
10/09/2021,2488549,2021-09-10 10:44:09 UTC,Colchicaceae,Burchardia,Burchardia umbellata,5.monocot-colorful,native
12/09/2021,4025155,2021-09-15 22:11:35 UTC,Colchicaceae,Burchardia,Burchardia umbellata,5.monocot-colorful,native
16/09/2021,4916136,2021-09-16 08:13:05 UTC,Colchicaceae,Burchardia,Burchardia umbellata,5.monocot-colorful,native
23/09/2021,3893507,2021-09-23 08:28:52 UTC,Colchicaceae,Burchardia,Burchardia umbellata,5.monocot-colorful,native
25/09/2021,4916136,2021-09-26 09:06:31 UTC,Colchicaceae,Burchardia,Burchardia umbellata,5.monocot-colorful,native
25/09/2021,4037891,2021-09-28 10:21:07 UTC,Colchicaceae,Burchardia,Burchardia umbellata,5.monocot-colorful,native
28/09/2021,4916136,2021-09-28 13:23:54 UTC,Colchicaceae,Burchardia,Burchardia umbellata,5.monocot-colorful,native
7/10/2021,4916136,2021-10-07 10:49:58 UTC,Colchicaceae,Burchardia,Burchardia umbellata,5.monocot-colorful,native
23/10/2021,2376854,2021-10-23 11:48:58 UTC,Colchicaceae,Burchardia,Burchardia umbellata,5.monocot-colorful,native
19/10/2021,4743351,2021-10-24 07:28:46 UTC,Colchicaceae,Burchardia,Burchardia umbellata,5.monocot-colorful,native
21/10/2021,325733,2021-11-03 00:55:54 UTC,Colchicaceae,Burchardia,Burchardia umbellata,5.monocot-colorful,native
6/11/2021,2376854,2021-11-07 14:19:44 UTC,Colchicaceae,Burchardia,Burchardia umbellata,5.monocot-colorful,native
30/10/2021,4916136,2021-11-09 13:06:51 UTC,Colchicaceae,Burchardia,Burchardia umbellata,5.monocot-colorful,native
28/11/2021,4916136,2021-11-30 12:08:06 UTC,Colchicaceae,Burchardia,Burchardia umbellata,5.monocot-colorful,native
11/10/2015,2451999,2022-01-29 07:05:31 UTC,Colchicaceae,Burchardia,Burchardia umbellata,5.monocot-colorful,native
1/01/2022,4916136,2022-02-06 06:03:48 UTC,Colchicaceae,Burchardia,Burchardia umbellata,5.monocot-colorful,native
2/10/2021,3425899,2022-06-23 07:04:13 UTC,Colchicaceae,Burchardia,Burchardia umbellata,5.monocot-colorful,native
10/08/2022,2488549,2022-08-10 06:47:14 UTC,Colchicaceae,Burchardia,Burchardia umbellata,5.monocot-colorful,native
5/09/2022,6029661,2022-09-05 05:49:29 UTC,Colchicaceae,Burchardia,Burchardia umbellata,5.monocot-colorful,native
15/09/2022,2488549,2022-09-15 01:11:13 UTC,Colchicaceae,Burchardia,Burchardia umbellata,5.monocot-colorful,native
24/09/2022,3933721,2022-09-24 03:46:05 UTC,Colchicaceae,Burchardia,Burchardia umbellata,5.monocot-colorful,native
24/09/2022,2488549,2022-09-24 11:58:31 UTC,Colchicaceae,Burchardia,Burchardia umbellata,5.monocot-colorful,native
25/09/2022,1138587,2022-09-25 06:38:14 UTC,Colchicaceae,Burchardia,Burchardia umbellata,5.monocot-colorful,native
25/09/2022,3978191,2022-09-25 10:49:48 UTC,Colchicaceae,Burchardia,Burchardia umbellata,5.monocot-colorful,native
1/10/2022,6209647,2022-10-01 10:38:54 UTC,Colchicaceae,Burchardia,Burchardia umbellata,5.monocot-colorful,native
2/11/2022,2631448,2022-11-05 04:53:56 UTC,Colchicaceae,Burchardia,Burchardia umbellata,5.monocot-colorful,native
20/03/2023,1259195,2023-03-26 10:27:41 UTC,Colchicaceae,Burchardia,Burchardia umbellata,5.monocot-colorful,native
22/09/2022,2325183,2023-05-16 09:56:47 UTC,Colchicaceae,Burchardia,Burchardia umbellata,5.monocot-colorful,native
7/09/2023,5188972,2023-09-07 12:04:44 UTC,Colchicaceae,Burchardia,Burchardia umbellata,5.monocot-colorful,native
10/09/2023,3361124,2023-09-10 08:30:16 UTC,Colchicaceae,Burchardia,Burchardia umbellata,5.monocot-colorful,native
10/09/2023,3978191,2023-09-10 09:17:35 UTC,Colchicaceae,Burchardia,Burchardia umbellata,5.monocot-colorful,native
5/09/2023,4743351,2023-09-14 11:56:28 UTC,Colchicaceae,Burchardia,Burchardia umbellata,5.monocot-colorful,native
24/09/2023,4359490,2023-09-24 06:41:44 UTC,Colchicaceae,Burchardia,Burchardia umbellata,5.monocot-colorful,native
7/09/2023,6516136,2023-10-11 01:42:32 UTC,Colchicaceae,Burchardia,Burchardia umbellata,5.monocot-colorful,native
9/10/2023,6308282,2023-10-15 01:14:53 UTC,Colchicaceae,Burchardia,Burchardia umbellata,5.monocot-colorful,native
24/09/2023,6209647,2023-10-16 10:38:40 UTC,Colchicaceae,Burchardia,Burchardia umbellata,5.monocot-colorful,native
23/09/2023,3754725,2023-11-04 01:42:28 UTC,Colchicaceae,Burchardia,Burchardia umbellata,5.monocot-colorful,native
7/09/2023,7117393,2023-11-05 20:32:04 UTC,Colchicaceae,Burchardia,Burchardia umbellata,5.monocot-colorful,native
17/09/2023,745089,2023-12-09 13:24:19 UTC,Colchicaceae,Burchardia,Burchardia umbellata,5.monocot-colorful,native
10/09/2023,4317345,2024-01-06 18:38:32 UTC,Colchicaceae,Burchardia,Burchardia umbellata,5.monocot-colorful,native
24/05/2020,2488549,2020-05-24 04:34:33 UTC,Pittosporaceae,Bursaria,Bursaria spinosa,3.dicot,native
12/09/2020,2488549,2020-09-12 10:26:18 UTC,Pittosporaceae,Bursaria,Bursaria spinosa,3.dicot,native
11/10/2020,2488549,2020-10-12 09:39:37 UTC,Pittosporaceae,Bursaria,Bursaria spinosa,3.dicot,native
12/09/2021,2488549,2021-09-12 09:26:56 UTC,Pittosporaceae,Bursaria,Bursaria spinosa,3.dicot,native
22/10/2021,2488549,2021-10-22 09:10:42 UTC,Pittosporaceae,Bursaria,Bursaria spinosa,3.dicot,native
9/01/2022,3880468,2022-01-09 12:36:26 UTC,Pittosporaceae,Bursaria,Bursaria spinosa,3.dicot,native
29/10/2014,2991,2015-07-23 16:57:13 UTC,Asphodelaceae,Caesia,Caesia parviflora,5.monocot-colorful,native
23/10/2020,2488549,2020-10-24 06:11:03 UTC,Asphodelaceae,Caesia,Caesia parviflora,5.monocot-colorful,native
23/10/2020,3654699,2020-10-26 05:36:05 UTC,Asphodelaceae,Caesia,Caesia parviflora,5.monocot-colorful,native
13/11/2020,2488549,2020-11-13 10:21:02 UTC,Asphodelaceae,Caesia,Caesia parviflora,5.monocot-colorful,native
28/12/2020,2488549,2020-12-28 21:05:24 UTC,Asphodelaceae,Caesia,Caesia parviflora,5.monocot-colorful,native
17/12/2021,2488549,2021-12-17 09:59:13 UTC,Asphodelaceae,Caesia,Caesia parviflora,5.monocot-colorful,native
22/01/2022,2317723,2022-01-28 01:44:40 UTC,Asphodelaceae,Caesia,Caesia parviflora,5.monocot-colorful,native
10/11/2022,2488549,2022-11-10 05:16:46 UTC,Asphodelaceae,Caesia,Caesia parviflora,5.monocot-colorful,native
24/11/2022,2531563,2022-11-26 23:24:18 UTC,Asphodelaceae,Caesia,Caesia parviflora,5.monocot-colorful,native
26/02/2023,4743351,2023-02-27 01:01:28 UTC,Asphodelaceae,Caesia,Caesia parviflora,5.monocot-colorful,native
26/12/2023,3978191,2023-12-26 04:39:53 UTC,Asphodelaceae,Caesia,Caesia parviflora,5.monocot-colorful,native
2/01/2024,661392,2024-01-02 06:19:32 UTC,Asphodelaceae,Caesia,Caesia parviflora,5.monocot-colorful,native
2/01/2024,1138587,2024-01-02 09:03:08 UTC,Asphodelaceae,Caesia,Caesia parviflora,5.monocot-colorful,native
8/09/2020,3408787,2020-09-09 04:33:06 UTC,Orchidaceae,Caladenia,Caladenia alata,5.monocot-colorful,native
12/09/2021,4025155,2021-09-17 08:23:26 UTC,Orchidaceae,Caladenia,Caladenia alata,5.monocot-colorful,native
3/09/2021,5150898,2022-04-19 01:42:08 UTC,Orchidaceae,Caladenia,Caladenia alata,5.monocot-colorful,native
3/09/2021,5150898,2022-04-19 01:42:58 UTC,Orchidaceae,Caladenia,Caladenia alata,5.monocot-colorful,native
31/08/2022,5150898,2022-08-31 11:15:28 UTC,Orchidaceae,Caladenia,Caladenia alata,5.monocot-colorful,native
4/09/2022,5150898,2022-09-04 03:27:52 UTC,Orchidaceae,Caladenia,Caladenia alata,5.monocot-colorful,native
7/09/2022,2488549,2022-09-07 08:33:08 UTC,Orchidaceae,Caladenia,Caladenia alata,5.monocot-colorful,native
8/09/2022,5188972,2022-09-08 12:25:05 UTC,Orchidaceae,Caladenia,Caladenia alata,5.monocot-colorful,native
13/09/2022,6029661,2022-09-14 08:13:56 UTC,Orchidaceae,Caladenia,Caladenia alata,5.monocot-colorful,native
15/09/2022,2488549,2022-09-15 01:11:12 UTC,Orchidaceae,Caladenia,Caladenia alata,5.monocot-colorful,native
15/09/2022,2488549,2022-09-15 01:11:12 UTC,Orchidaceae,Caladenia,Caladenia alata,5.monocot-colorful,native
16/09/2022,2488549,2022-09-16 06:39:15 UTC,Orchidaceae,Caladenia,Caladenia alata,5.monocot-colorful,native
16/09/2022,2488549,2022-09-16 06:39:16 UTC,Orchidaceae,Caladenia,Caladenia alata,5.monocot-colorful,native
16/09/2022,2488549,2022-09-16 06:39:17 UTC,Orchidaceae,Caladenia,Caladenia alata,5.monocot-colorful,native
17/09/2022,2488549,2022-09-17 04:02:12 UTC,Orchidaceae,Caladenia,Caladenia alata,5.monocot-colorful,native
17/09/2022,4916136,2022-09-17 09:04:14 UTC,Orchidaceae,Caladenia,Caladenia alata,5.monocot-colorful,native
1/09/2023,5150898,2023-09-01 08:04:30 UTC,Orchidaceae,Caladenia,Caladenia alata,5.monocot-colorful,native
7/09/2023,5188972,2023-09-07 12:13:30 UTC,Orchidaceae,Caladenia,Caladenia alata,5.monocot-colorful,native
9/09/2021,4887682,2021-09-09 00:23:57 UTC,Orchidaceae,Caladenia,Caladenia carnea,5.monocot-colorful,native
18/09/2021,3712636,2021-09-18 03:06:10 UTC,Orchidaceae,Caladenia,Caladenia carnea,5.monocot-colorful,native
28/09/2021,4743351,2021-09-28 11:51:19 UTC,Orchidaceae,Caladenia,Caladenia carnea,5.monocot-colorful,native
17/09/2021,5150898,2022-04-21 06:39:06 UTC,Orchidaceae,Caladenia,Caladenia carnea,5.monocot-colorful,native
11/09/2021,5150898,2022-04-21 06:40:12 UTC,Orchidaceae,Caladenia,Caladenia carnea,5.monocot-colorful,native
5/09/2021,5150898,2022-04-21 06:40:48 UTC,Orchidaceae,Caladenia,Caladenia carnea,5.monocot-colorful,native
7/09/2022,2488549,2022-09-07 08:33:07 UTC,Orchidaceae,Caladenia,Caladenia carnea,5.monocot-colorful,native
7/09/2022,2488549,2022-09-07 08:33:07 UTC,Orchidaceae,Caladenia,Caladenia carnea,5.monocot-colorful,native
22/09/2022,3978191,2022-09-22 10:04:11 UTC,Orchidaceae,Caladenia,Caladenia carnea,5.monocot-colorful,native
3/10/2022,2488549,2022-10-03 07:42:24 UTC,Orchidaceae,Caladenia,Caladenia carnea,5.monocot-colorful,native
1/09/2023,5150898,2023-09-01 08:08:31 UTC,Orchidaceae,Caladenia,Caladenia carnea,5.monocot-colorful,native
7/09/2023,5188972,2023-09-07 12:36:22 UTC,Orchidaceae,Caladenia,Caladenia carnea,5.monocot-colorful,native
18/09/2023,3678274,2023-09-20 07:02:02 UTC,Orchidaceae,Caladenia,Caladenia carnea,5.monocot-colorful,native
10/09/2019,793994,2019-09-10 03:55:20 UTC,Orchidaceae,Caladenia,Caladenia catenata,5.monocot-colorful,native
3/10/2019,1477617,2019-10-03 15:07:00 UTC,Orchidaceae,Caladenia,Caladenia catenata,5.monocot-colorful,native
28/08/2020,2488549,2020-08-28 06:17:01 UTC,Orchidaceae,Caladenia,Caladenia catenata,5.monocot-colorful,native
29/08/2020,2488549,2020-08-29 07:31:20 UTC,Orchidaceae,Caladenia,Caladenia catenata,5.monocot-colorful,native
29/08/2020,2488549,2020-08-29 08:25:47 UTC,Orchidaceae,Caladenia,Caladenia catenata,5.monocot-colorful,native
31/08/2020,793005,2020-09-08 03:47:32 UTC,Orchidaceae,Caladenia,Caladenia catenata,5.monocot-colorful,native
8/09/2020,3408787,2020-09-09 04:33:07 UTC,Orchidaceae,Caladenia,Caladenia catenata,5.monocot-colorful,native
8/09/2020,3408787,2020-09-11 07:03:33 UTC,Orchidaceae,Caladenia,Caladenia catenata,5.monocot-colorful,native
12/09/2020,2488549,2020-09-12 10:14:05 UTC,Orchidaceae,Caladenia,Caladenia catenata,5.monocot-colorful,native
18/09/2020,2488549,2020-09-18 08:15:43 UTC,Orchidaceae,Caladenia,Caladenia catenata,5.monocot-colorful,native
18/09/2020,2488549,2020-09-18 08:21:15 UTC,Orchidaceae,Caladenia,Caladenia catenata,5.monocot-colorful,native
23/09/2016,742241,2020-09-29 00:13:59 UTC,Orchidaceae,Caladenia,Caladenia catenata,5.monocot-colorful,native
18/09/2020,4743351,2021-07-24 04:44:57 UTC,Orchidaceae,Caladenia,Caladenia catenata,5.monocot-colorful,native
18/08/2020,4743351,2021-07-26 05:31:17 UTC,Orchidaceae,Caladenia,Caladenia catenata,5.monocot-colorful,native
3/09/2019,4743351,2021-08-05 05:52:14 UTC,Orchidaceae,Caladenia,Caladenia catenata,5.monocot-colorful,native
22/08/2021,2215616,2021-08-21 23:27:46 UTC,Orchidaceae,Caladenia,Caladenia catenata,5.monocot-colorful,native
22/08/2021,4095677,2021-08-22 07:48:54 UTC,Orchidaceae,Caladenia,Caladenia catenata,5.monocot-colorful,native
22/08/2021,3712636,2021-08-23 21:13:41 UTC,Orchidaceae,Caladenia,Caladenia catenata,5.monocot-colorful,native
27/08/2021,4743351,2021-08-29 04:54:42 UTC,Orchidaceae,Caladenia,Caladenia catenata,5.monocot-colorful,native
4/09/2021,3893507,2021-09-04 13:43:29 UTC,Orchidaceae,Caladenia,Caladenia catenata,5.monocot-colorful,native
3/09/2021,2779982,2021-09-06 09:44:41 UTC,Orchidaceae,Caladenia,Caladenia catenata,5.monocot-colorful,native
6/09/2021,4916136,2021-09-06 10:40:35 UTC,Orchidaceae,Caladenia,Caladenia catenata,5.monocot-colorful,native
21/09/2021,4743351,2021-09-22 10:48:06 UTC,Orchidaceae,Caladenia,Caladenia catenata,5.monocot-colorful,native
26/09/2021,4766065,2021-09-26 00:41:05 UTC,Orchidaceae,Caladenia,Caladenia catenata,5.monocot-colorful,native
28/09/2021,4743351,2021-09-28 11:51:20 UTC,Orchidaceae,Caladenia,Caladenia catenata,5.monocot-colorful,native
3/10/2021,2488549,2021-10-03 02:57:04 UTC,Orchidaceae,Caladenia,Caladenia catenata,5.monocot-colorful,native
12/10/2021,1786313,2021-10-15 01:32:39 UTC,Orchidaceae,Caladenia,Caladenia catenata,5.monocot-colorful,native
19/10/2021,4743351,2021-10-20 10:37:44 UTC,Orchidaceae,Caladenia,Caladenia catenata,5.monocot-colorful,native
4/09/2016,2451999,2022-02-06 04:51:39 UTC,Orchidaceae,Caladenia,Caladenia catenata,5.monocot-colorful,native
25/09/2021,5150898,2022-04-21 06:42:24 UTC,Orchidaceae,Caladenia,Caladenia catenata,5.monocot-colorful,native
19/09/2021,3425899,2022-06-23 06:54:55 UTC,Orchidaceae,Caladenia,Caladenia catenata,5.monocot-colorful,native
23/08/2022,2664375,2022-08-23 03:54:05 UTC,Orchidaceae,Caladenia,Caladenia catenata,5.monocot-colorful,native
24/08/2022,2664375,2022-08-23 23:33:11 UTC,Orchidaceae,Caladenia,Caladenia catenata,5.monocot-colorful,native
24/08/2022,6011270,2022-08-23 23:48:36 UTC,Orchidaceae,Caladenia,Caladenia catenata,5.monocot-colorful,native
24/08/2022,2664375,2022-08-24 04:09:46 UTC,Orchidaceae,Caladenia,Caladenia catenata,5.monocot-colorful,native
1/09/2022,5241911,2022-09-01 05:18:08 UTC,Orchidaceae,Caladenia,Caladenia catenata,5.monocot-colorful,native
5/09/2022,6029661,2022-09-05 06:02:41 UTC,Orchidaceae,Caladenia,Caladenia catenata,5.monocot-colorful,native
5/09/2022,6029661,2022-09-05 06:03:54 UTC,Orchidaceae,Caladenia,Caladenia catenata,5.monocot-colorful,native
23/01/2003,5188972,2022-09-08 12:06:17 UTC,Orchidaceae,Caladenia,Caladenia catenata,5.monocot-colorful,native
13/09/2022,4916136,2022-09-13 10:36:21 UTC,Orchidaceae,Caladenia,Caladenia catenata,5.monocot-colorful,native
15/09/2022,2488549,2022-09-15 01:11:04 UTC,Orchidaceae,Caladenia,Caladenia catenata,5.monocot-colorful,native
15/09/2022,2488549,2022-09-15 01:11:05 UTC,Orchidaceae,Caladenia,Caladenia catenata,5.monocot-colorful,native
18/09/2022,3978191,2022-09-18 06:08:26 UTC,Orchidaceae,Caladenia,Caladenia catenata,5.monocot-colorful,native
17/09/2022,4916136,2022-09-18 09:32:08 UTC,Orchidaceae,Caladenia,Caladenia catenata,5.monocot-colorful,native
17/09/2022,3012653,2022-09-19 07:31:20 UTC,Orchidaceae,Caladenia,Caladenia catenata,5.monocot-colorful,native
23/09/2022,2488549,2022-09-23 11:26:41 UTC,Orchidaceae,Caladenia,Caladenia catenata,5.monocot-colorful,native
23/09/2022,2488549,2022-09-23 11:26:42 UTC,Orchidaceae,Caladenia,Caladenia catenata,5.monocot-colorful,native
25/09/2022,1138587,2022-09-25 06:38:10 UTC,Orchidaceae,Caladenia,Caladenia catenata,5.monocot-colorful,native
25/09/2022,1138587,2022-09-25 06:38:10 UTC,Orchidaceae,Caladenia,Caladenia catenata,5.monocot-colorful,native
28/08/2022,3629879,2022-09-26 21:24:57 UTC,Orchidaceae,Caladenia,Caladenia catenata,5.monocot-colorful,native
26/09/2022,6199647,2022-09-28 09:52:44 UTC,Orchidaceae,Caladenia,Caladenia catenata,5.monocot-colorful,native
1/10/2022,6209647,2022-10-01 11:09:20 UTC,Orchidaceae,Caladenia,Caladenia catenata,5.monocot-colorful,native
1/10/2022,6209647,2022-10-01 11:10:27 UTC,Orchidaceae,Caladenia,Caladenia catenata,5.monocot-colorful,native
17/09/2022,2376854,2022-10-05 07:30:59 UTC,Orchidaceae,Caladenia,Caladenia catenata,5.monocot-colorful,native
4/10/2022,4743351,2022-10-06 09:52:12 UTC,Orchidaceae,Caladenia,Caladenia catenata,5.monocot-colorful,native
25/09/2022,4743351,2022-12-22 04:08:28 UTC,Orchidaceae,Caladenia,Caladenia catenata,5.monocot-colorful,native
25/09/2022,4743351,2022-12-22 23:49:46 UTC,Orchidaceae,Caladenia,Caladenia catenata,5.monocot-colorful,native
25/09/2022,4743351,2022-12-23 04:06:51 UTC,Orchidaceae,Caladenia,Caladenia catenata,5.monocot-colorful,native
25/09/2022,4743351,2022-12-23 04:06:53 UTC,Orchidaceae,Caladenia,Caladenia catenata,5.monocot-colorful,native
22/09/2022,2325183,2023-05-16 09:56:45 UTC,Orchidaceae,Caladenia,Caladenia catenata,5.monocot-colorful,native
22/09/2022,2325183,2023-05-16 09:56:47 UTC,Orchidaceae,Caladenia,Caladenia catenata,5.monocot-colorful,native
11/08/2023,5188972,2023-08-11 08:54:59 UTC,Orchidaceae,Caladenia,Caladenia catenata,5.monocot-colorful,native
19/08/2023,6209647,2023-08-19 11:34:23 UTC,Orchidaceae,Caladenia,Caladenia catenata,5.monocot-colorful,native
24/08/2023,5150898,2023-08-24 03:38:25 UTC,Orchidaceae,Caladenia,Caladenia catenata,5.monocot-colorful,native
24/08/2023,5150898,2023-08-24 03:38:49 UTC,Orchidaceae,Caladenia,Caladenia catenata,5.monocot-colorful,native
24/08/2023,5150898,2023-08-24 03:39:35 UTC,Orchidaceae,Caladenia,Caladenia catenata,5.monocot-colorful,native
24/08/2023,5150898,2023-08-24 03:40:01 UTC,Orchidaceae,Caladenia,Caladenia catenata,5.monocot-colorful,native
27/08/2023,5364942,2023-08-27 09:26:46 UTC,Orchidaceae,Caladenia,Caladenia catenata,5.monocot-colorful,native
28/08/2023,3678274,2023-08-28 13:24:22 UTC,Orchidaceae,Caladenia,Caladenia catenata,5.monocot-colorful,native
31/08/2023,2488549,2023-08-31 03:33:42 UTC,Orchidaceae,Caladenia,Caladenia catenata,5.monocot-colorful,native
1/09/2023,5150898,2023-09-01 08:06:03 UTC,Orchidaceae,Caladenia,Caladenia catenata,5.monocot-colorful,native
5/08/2023,4317345,2023-09-07 02:04:27 UTC,Orchidaceae,Caladenia,Caladenia catenata,5.monocot-colorful,native
7/09/2023,5188972,2023-09-07 11:38:39 UTC,Orchidaceae,Caladenia,Caladenia catenata,5.monocot-colorful,native
10/09/2023,7311986,2023-09-10 04:03:54 UTC,Orchidaceae,Caladenia,Caladenia catenata,5.monocot-colorful,native
10/09/2023,3361124,2023-09-10 08:19:49 UTC,Orchidaceae,Caladenia,Caladenia catenata,5.monocot-colorful,native
11/09/2023,3978191,2023-09-11 06:25:13 UTC,Orchidaceae,Caladenia,Caladenia catenata,5.monocot-colorful,native
5/09/2023,4743351,2023-09-14 07:05:52 UTC,Orchidaceae,Caladenia,Caladenia catenata,5.monocot-colorful,native
20/09/2023,5435930,2023-09-25 12:15:05 UTC,Orchidaceae,Caladenia,Caladenia catenata,5.monocot-colorful,native
20/09/2023,5435930,2023-09-25 12:15:07 UTC,Orchidaceae,Caladenia,Caladenia catenata,5.monocot-colorful,native
26/09/2023,5997026,2023-09-26 09:20:40 UTC,Orchidaceae,Caladenia,Caladenia catenata,5.monocot-colorful,native
24/09/2023,1138587,2023-09-27 02:17:57 UTC,Orchidaceae,Caladenia,Caladenia catenata,5.monocot-colorful,native
17/09/2023,745089,2023-12-10 01:34:56 UTC,Orchidaceae,Caladenia,Caladenia catenata,5.monocot-colorful,native
26/09/2023,151454,2024-04-30 01:20:50 UTC,Orchidaceae,Caladenia,Caladenia catenata,5.monocot-colorful,native
4/10/2020,2444826,2020-10-04 23:52:54 UTC,Orchidaceae,Caladenia,Caladenia fuscata,5.monocot-colorful,native
17/09/2021,5150898,2022-04-21 06:45:48 UTC,Orchidaceae,Caladenia,Caladenia fuscata,5.monocot-colorful,native
15/09/2023,5188972,2023-09-15 10:43:29 UTC,Orchidaceae,Caladenia,Caladenia fuscata,5.monocot-colorful,native
11/06/2022,3880468,2022-06-11 11:21:38 UTC,Orchidaceae,Caladenia,Caladenia picta,5.monocot-colorful,native
18/09/2021,3712636,2021-09-18 02:10:45 UTC,Orchidaceae,Caladenia,Caladenia transitoria,5.monocot-colorful,native
4/09/2020,2995836,2020-09-05 08:05:29 UTC,Orchidaceae,Caleana,Caleana major,5.monocot-colorful,native
30/09/2020,2701041,2020-10-01 09:18:45 UTC,Orchidaceae,Caleana,Caleana major,5.monocot-colorful,native
16/01/2021,2698489,2021-01-29 00:44:31 UTC,Orchidaceae,Caleana,Caleana major,5.monocot-colorful,native
18/09/2021,4025155,2021-09-18 04:18:18 UTC,Orchidaceae,Caleana,Caleana major,5.monocot-colorful,native
17/09/2021,4916136,2021-09-18 13:45:54 UTC,Orchidaceae,Caleana,Caleana major,5.monocot-colorful,native
19/09/2021,4887682,2021-09-19 09:25:28 UTC,Orchidaceae,Caleana,Caleana major,5.monocot-colorful,native
23/09/2021,3893507,2021-09-23 10:58:38 UTC,Orchidaceae,Caleana,Caleana major,5.monocot-colorful,native
23/09/2021,4916136,2021-09-23 12:35:30 UTC,Orchidaceae,Caleana,Caleana major,5.monocot-colorful,native
1/10/2021,3712636,2021-10-01 02:07:40 UTC,Orchidaceae,Caleana,Caleana major,5.monocot-colorful,native
12/10/2021,1786313,2021-10-15 01:32:39 UTC,Orchidaceae,Caleana,Caleana major,5.monocot-colorful,native
24/10/2021,2376854,2021-10-24 12:57:24 UTC,Orchidaceae,Caleana,Caleana major,5.monocot-colorful,native
24/10/2021,2376854,2021-10-24 12:59:32 UTC,Orchidaceae,Caleana,Caleana major,5.monocot-colorful,native
16/11/2021,4916136,2021-11-16 10:49:01 UTC,Orchidaceae,Caleana,Caleana major,5.monocot-colorful,native
17/11/2021,3880468,2021-11-17 11:56:41 UTC,Orchidaceae,Caleana,Caleana major,5.monocot-colorful,native
15/11/2021,5150898,2021-11-18 17:51:28 UTC,Orchidaceae,Caleana,Caleana major,5.monocot-colorful,native
14/11/2021,5150898,2021-11-19 10:57:53 UTC,Orchidaceae,Caleana,Caleana major,5.monocot-colorful,native
23/11/2021,5188972,2021-11-24 12:43:04 UTC,Orchidaceae,Caleana,Caleana major,5.monocot-colorful,native
31/12/2021,2779982,2022-01-07 00:16:59 UTC,Orchidaceae,Caleana,Caleana major,5.monocot-colorful,native
13/09/2022,6029661,2022-09-13 08:30:28 UTC,Orchidaceae,Caleana,Caleana major,5.monocot-colorful,native
16/09/2022,2488549,2022-09-16 06:39:11 UTC,Orchidaceae,Caleana,Caleana major,5.monocot-colorful,native
15/10/2022,5150898,2022-10-22 23:07:39 UTC,Orchidaceae,Caleana,Caleana major,5.monocot-colorful,native
2/12/2022,5188972,2022-12-02 08:27:38 UTC,Orchidaceae,Caleana,Caleana major,5.monocot-colorful,native
16/08/2023,5150898,2023-08-19 05:54:52 UTC,Orchidaceae,Caleana,Caleana major,5.monocot-colorful,native
1/09/2023,5150898,2023-09-01 08:05:09 UTC,Orchidaceae,Caleana,Caleana major,5.monocot-colorful,native
9/09/2023,6556876,2023-09-09 12:31:18 UTC,Orchidaceae,Caleana,Caleana major,5.monocot-colorful,native
26/09/2023,5997026,2023-09-26 09:19:22 UTC,Orchidaceae,Caleana,Caleana major,5.monocot-colorful,native
24/10/2023,5828482,2023-10-24 00:19:03 UTC,Orchidaceae,Caleana,Caleana major,5.monocot-colorful,native
18/11/2023,3653978,2023-11-18 09:48:05 UTC,Orchidaceae,Caleana,Caleana major,5.monocot-colorful,native
16/10/2023,5280950,2023-11-29 06:07:24 UTC,Orchidaceae,Caleana,Caleana major,5.monocot-colorful,native
30/11/2023,5188972,2023-11-30 11:21:54 UTC,Orchidaceae,Caleana,Caleana major,5.monocot-colorful,native
18/11/2023,2376854,2023-12-01 04:34:02 UTC,Orchidaceae,Caleana,Caleana major,5.monocot-colorful,native
18/11/2023,2376854,2023-12-01 04:34:35 UTC,Orchidaceae,Caleana,Caleana major,5.monocot-colorful,native
30/12/2023,4923400,2023-12-30 09:35:08 UTC,Orchidaceae,Caleana,Caleana major,5.monocot-colorful,native
3/01/2024,3197473,2024-01-03 04:34:20 UTC,Orchidaceae,Caleana,Caleana major,5.monocot-colorful,native
2/11/2011,2991,2013-06-10 21:02:16 UTC,Cunoniaceae,Callicoma,Callicoma serratifolia,3.dicot,native
29/10/2014,2991,2015-07-23 17:37:07 UTC,Cunoniaceae,Callicoma,Callicoma serratifolia,3.dicot,native
19/10/2019,2385182,2019-10-24 01:09:51 UTC,Cunoniaceae,Callicoma,Callicoma serratifolia,3.dicot,native
8/12/2019,2488549,2019-12-14 22:18:21 UTC,Cunoniaceae,Callicoma,Callicoma serratifolia,3.dicot,native
23/12/2019,2488549,2019-12-23 06:00:51 UTC,Cunoniaceae,Callicoma,Callicoma serratifolia,3.dicot,native
31/12/2019,2488549,2019-12-31 05:44:08 UTC,Cunoniaceae,Callicoma,Callicoma serratifolia,3.dicot,native
9/10/2004,2584563,2020-04-03 23:56:59 UTC,Cunoniaceae,Callicoma,Callicoma serratifolia,3.dicot,native
26/04/2020,2488549,2020-04-26 02:48:43 UTC,Cunoniaceae,Callicoma,Callicoma serratifolia,3.dicot,native
23/06/2020,2488549,2020-06-23 06:03:54 UTC,Cunoniaceae,Callicoma,Callicoma serratifolia,3.dicot,native
18/07/2020,2488549,2020-07-18 10:13:52 UTC,Cunoniaceae,Callicoma,Callicoma serratifolia,3.dicot,native
5/08/2020,793005,2020-08-06 02:36:44 UTC,Cunoniaceae,Callicoma,Callicoma serratifolia,3.dicot,native
12/09/2020,2488549,2020-09-12 10:30:53 UTC,Cunoniaceae,Callicoma,Callicoma serratifolia,3.dicot,native
21/09/2020,3345535,2020-10-01 10:53:11 UTC,Cunoniaceae,Callicoma,Callicoma serratifolia,3.dicot,native
3/10/2020,2488549,2020-10-04 08:52:11 UTC,Cunoniaceae,Callicoma,Callicoma serratifolia,3.dicot,native
11/10/2020,2488549,2020-10-11 08:15:31 UTC,Cunoniaceae,Callicoma,Callicoma serratifolia,3.dicot,native
11/10/2020,2488549,2020-10-11 21:08:42 UTC,Cunoniaceae,Callicoma,Callicoma serratifolia,3.dicot,native
16/10/2020,2488549,2020-10-17 02:31:02 UTC,Cunoniaceae,Callicoma,Callicoma serratifolia,3.dicot,native
20/10/2020,3629360,2020-10-22 02:32:09 UTC,Cunoniaceae,Callicoma,Callicoma serratifolia,3.dicot,native
20/10/2020,3629360,2020-10-22 02:32:10 UTC,Cunoniaceae,Callicoma,Callicoma serratifolia,3.dicot,native
20/10/2020,3629360,2020-10-22 02:32:10 UTC,Cunoniaceae,Callicoma,Callicoma serratifolia,3.dicot,native
20/10/2020,3629360,2020-10-22 02:32:11 UTC,Cunoniaceae,Callicoma,Callicoma serratifolia,3.dicot,native
21/05/2021,4743351,2021-07-20 10:25:38 UTC,Cunoniaceae,Callicoma,Callicoma serratifolia,3.dicot,native
27/08/2021,4743351,2021-08-29 04:54:38 UTC,Cunoniaceae,Callicoma,Callicoma serratifolia,3.dicot,native
9/09/2021,4887682,2021-09-09 00:30:41 UTC,Cunoniaceae,Callicoma,Callicoma serratifolia,3.dicot,native
30/09/2021,2488549,2021-09-30 10:15:43 UTC,Cunoniaceae,Callicoma,Callicoma serratifolia,3.dicot,native
14/10/2021,4916136,2021-10-14 13:11:05 UTC,Cunoniaceae,Callicoma,Callicoma serratifolia,3.dicot,native
12/10/2021,1786313,2021-10-15 01:32:37 UTC,Cunoniaceae,Callicoma,Callicoma serratifolia,3.dicot,native
18/10/2021,4916136,2021-10-20 08:00:18 UTC,Cunoniaceae,Callicoma,Callicoma serratifolia,3.dicot,native
22/10/2021,2488549,2021-10-22 09:10:40 UTC,Cunoniaceae,Callicoma,Callicoma serratifolia,3.dicot,native
1/11/2021,4916136,2021-11-02 11:02:27 UTC,Cunoniaceae,Callicoma,Callicoma serratifolia,3.dicot,native
19/11/2021,2488549,2021-11-20 02:23:27 UTC,Cunoniaceae,Callicoma,Callicoma serratifolia,3.dicot,native
18/01/1988,717200,2022-06-17 02:20:48 UTC,Cunoniaceae,Callicoma,Callicoma serratifolia,3.dicot,native
26/06/2022,2322306,2022-06-27 07:00:10 UTC,Cunoniaceae,Callicoma,Callicoma serratifolia,3.dicot,native
4/09/2022,3978191,2022-09-04 06:31:39 UTC,Cunoniaceae,Callicoma,Callicoma serratifolia,3.dicot,native
30/10/2022,3978191,2022-10-30 03:29:23 UTC,Cunoniaceae,Callicoma,Callicoma serratifolia,3.dicot,native
26/11/2022,4743351,2022-11-29 08:56:49 UTC,Cunoniaceae,Callicoma,Callicoma serratifolia,3.dicot,native
12/02/2023,4743351,2023-02-13 23:20:25 UTC,Cunoniaceae,Callicoma,Callicoma serratifolia,3.dicot,native
12/04/2023,6592640,2023-04-13 03:50:47 UTC,Cunoniaceae,Callicoma,Callicoma serratifolia,3.dicot,native
16/07/2023,2366151,2023-07-16 11:03:48 UTC,Cunoniaceae,Callicoma,Callicoma serratifolia,3.dicot,native
20/09/2023,5435930,2023-09-25 12:15:10 UTC,Cunoniaceae,Callicoma,Callicoma serratifolia,3.dicot,native
28/10/2023,6585857,2023-10-28 05:17:54 UTC,Cunoniaceae,Callicoma,Callicoma serratifolia,3.dicot,native
28/12/2023,6542702,2023-12-29 22:20:04 UTC,Cunoniaceae,Callicoma,Callicoma serratifolia,3.dicot,native
14/09/2022,745089,2024-03-29 04:10:47 UTC,Cunoniaceae,Callicoma,Callicoma serratifolia,3.dicot,native
14/09/2022,745089,2024-03-29 04:18:18 UTC,Cunoniaceae,Callicoma,Callicoma serratifolia,3.dicot,native
21/04/2024,265090,2024-04-21 04:54:41 UTC,Cunoniaceae,Callicoma,Callicoma serratifolia,3.dicot,native
21/04/2024,265090,2024-04-21 05:41:22 UTC,Cunoniaceae,Callicoma,Callicoma serratifolia,3.dicot,native
17/12/2023,1305186,2023-12-17 11:56:57 UTC,Cupressaceae,Callitris,Callitris rhomboidea,2.gymnosperm,native
26/09/2020,2488549,2020-09-26 10:14:45 UTC,Orchidaceae,Calochilus,Calochilus campestris,5.monocot-colorful,native
4/10/2020,2488549,2020-10-04 10:18:30 UTC,Orchidaceae,Calochilus,Calochilus campestris,5.monocot-colorful,native
4/10/2020,2488549,2020-10-04 10:21:04 UTC,Orchidaceae,Calochilus,Calochilus campestris,5.monocot-colorful,native
10/10/2020,2779982,2020-10-11 03:14:40 UTC,Orchidaceae,Calochilus,Calochilus campestris,5.monocot-colorful,native
12/09/2021,4037891,2021-09-11 23:38:14 UTC,Orchidaceae,Calochilus,Calochilus campestris,5.monocot-colorful,native
1/10/2021,3712636,2021-10-01 02:09:20 UTC,Orchidaceae,Calochilus,Calochilus campestris,5.monocot-colorful,native
4/10/2021,4916136,2021-10-04 06:36:51 UTC,Orchidaceae,Calochilus,Calochilus campestris,5.monocot-colorful,native
4/10/2021,4916136,2021-10-04 12:59:30 UTC,Orchidaceae,Calochilus,Calochilus campestris,5.monocot-colorful,native
12/10/2021,1786313,2021-10-15 01:32:39 UTC,Orchidaceae,Calochilus,Calochilus campestris,5.monocot-colorful,native
30/10/2021,4916136,2021-10-30 12:13:01 UTC,Orchidaceae,Calochilus,Calochilus campestris,5.monocot-colorful,native
19/09/2021,5150898,2021-11-19 11:00:57 UTC,Orchidaceae,Calochilus,Calochilus campestris,5.monocot-colorful,native
23/09/2021,5150898,2021-11-19 11:03:00 UTC,Orchidaceae,Calochilus,Calochilus campestris,5.monocot-colorful,native
19/09/2021,3425899,2022-06-23 06:52:21 UTC,Orchidaceae,Calochilus,Calochilus campestris,5.monocot-colorful,native
23/09/2022,2488549,2022-09-23 10:05:12 UTC,Orchidaceae,Calochilus,Calochilus campestris,5.monocot-colorful,native
24/09/2022,4597053,2022-09-24 09:06:34 UTC,Orchidaceae,Calochilus,Calochilus campestris,5.monocot-colorful,native
24/09/2022,2488549,2022-09-24 11:58:30 UTC,Orchidaceae,Calochilus,Calochilus campestris,5.monocot-colorful,native
24/09/2022,2488549,2022-09-24 11:58:36 UTC,Orchidaceae,Calochilus,Calochilus campestris,5.monocot-colorful,native
2/10/2022,5150898,2022-10-02 06:38:35 UTC,Orchidaceae,Calochilus,Calochilus campestris,5.monocot-colorful,native
2/10/2022,5150898,2022-10-02 06:42:14 UTC,Orchidaceae,Calochilus,Calochilus campestris,5.monocot-colorful,native
2/10/2022,1401423,2022-10-03 11:01:41 UTC,Orchidaceae,Calochilus,Calochilus campestris,5.monocot-colorful,native
15/10/2022,5150898,2022-10-15 09:41:36 UTC,Orchidaceae,Calochilus,Calochilus campestris,5.monocot-colorful,native
13/09/2023,5150898,2023-09-13 05:20:46 UTC,Orchidaceae,Calochilus,Calochilus campestris,5.monocot-colorful,native
15/09/2023,5188972,2023-09-15 09:52:25 UTC,Orchidaceae,Calochilus,Calochilus campestris,5.monocot-colorful,native
19/09/2023,3978191,2023-09-19 02:18:14 UTC,Orchidaceae,Calochilus,Calochilus campestris,5.monocot-colorful,native
20/09/2023,5435930,2023-09-25 12:15:20 UTC,Orchidaceae,Calochilus,Calochilus campestris,5.monocot-colorful,native
24/09/2023,1138587,2023-09-27 03:20:46 UTC,Orchidaceae,Calochilus,Calochilus campestris,5.monocot-colorful,native
12/10/2023,6516136,2023-10-15 09:29:48 UTC,Orchidaceae,Calochilus,Calochilus campestris,5.monocot-colorful,native
16/10/2023,2322306,2023-10-17 08:04:41 UTC,Orchidaceae,Calochilus,Calochilus campestris,5.monocot-colorful,native
24/10/2023,5828482,2023-10-24 00:19:39 UTC,Orchidaceae,Calochilus,Calochilus campestris,5.monocot-colorful,native
12/10/2023,7117393,2023-11-05 20:11:21 UTC,Orchidaceae,Calochilus,Calochilus campestris,5.monocot-colorful,native
24/09/2023,5280950,2023-11-29 08:27:51 UTC,Orchidaceae,Calochilus,Calochilus campestris,5.monocot-colorful,native
7/12/2021,5150898,2021-12-07 11:28:51 UTC,Orchidaceae,Calochilus,Calochilus gracillimus,5.monocot-colorful,native
14/12/2021,2488549,2021-12-15 01:46:56 UTC,Orchidaceae,Calochilus,Calochilus gracillimus,5.monocot-colorful,native
16/12/2021,2488549,2021-12-16 10:03:16 UTC,Orchidaceae,Calochilus,Calochilus gracillimus,5.monocot-colorful,native
20/12/2021,3880468,2021-12-21 03:21:50 UTC,Orchidaceae,Calochilus,Calochilus gracillimus,5.monocot-colorful,native
16/01/2023,5453857,2023-01-16 09:58:44 UTC,Orchidaceae,Calochilus,Calochilus gracillimus,5.monocot-colorful,native
3/01/2024,3653978,2024-01-03 01:58:09 UTC,Orchidaceae,Calochilus,Calochilus gracillimus,5.monocot-colorful,native
24/09/2020,2518052,2020-09-24 07:29:40 UTC,Orchidaceae,Calochilus,Calochilus paludosus,5.monocot-colorful,native
26/09/2020,2488549,2020-09-26 23:36:23 UTC,Orchidaceae,Calochilus,Calochilus paludosus,5.monocot-colorful,native
1/10/2020,2701041,2020-10-01 09:00:29 UTC,Orchidaceae,Calochilus,Calochilus paludosus,5.monocot-colorful,native
29/09/2020,738376,2020-10-02 02:40:46 UTC,Orchidaceae,Calochilus,Calochilus paludosus,5.monocot-colorful,native
3/10/2020,2488549,2020-10-03 12:00:17 UTC,Orchidaceae,Calochilus,Calochilus paludosus,5.monocot-colorful,native
4/10/2020,2488549,2020-10-04 09:26:05 UTC,Orchidaceae,Calochilus,Calochilus paludosus,5.monocot-colorful,native
4/10/2020,2488549,2020-10-04 09:29:08 UTC,Orchidaceae,Calochilus,Calochilus paludosus,5.monocot-colorful,native
4/10/2020,2444826,2020-10-04 23:52:26 UTC,Orchidaceae,Calochilus,Calochilus paludosus,5.monocot-colorful,native
5/10/2020,2867806,2020-10-05 01:30:04 UTC,Orchidaceae,Calochilus,Calochilus paludosus,5.monocot-colorful,native
10/10/2020,3769223,2020-10-21 12:07:48 UTC,Orchidaceae,Calochilus,Calochilus paludosus,5.monocot-colorful,native
23/09/2021,4916136,2021-09-23 23:35:29 UTC,Orchidaceae,Calochilus,Calochilus paludosus,5.monocot-colorful,native
22/09/2021,4887682,2021-09-24 05:14:17 UTC,Orchidaceae,Calochilus,Calochilus paludosus,5.monocot-colorful,native
25/09/2021,4916136,2021-09-25 08:05:33 UTC,Orchidaceae,Calochilus,Calochilus paludosus,5.monocot-colorful,native
25/09/2021,3978191,2021-09-25 10:20:05 UTC,Orchidaceae,Calochilus,Calochilus paludosus,5.monocot-colorful,native
25/09/2021,3978191,2021-09-25 10:26:00 UTC,Orchidaceae,Calochilus,Calochilus paludosus,5.monocot-colorful,native
27/09/2021,4916136,2021-09-27 11:12:30 UTC,Orchidaceae,Calochilus,Calochilus paludosus,5.monocot-colorful,native
28/09/2021,4743351,2021-09-28 11:51:17 UTC,Orchidaceae,Calochilus,Calochilus paludosus,5.monocot-colorful,native
1/10/2021,3721620,2021-10-01 00:27:40 UTC,Orchidaceae,Calochilus,Calochilus paludosus,5.monocot-colorful,native
1/10/2021,3712636,2021-10-01 02:10:44 UTC,Orchidaceae,Calochilus,Calochilus paludosus,5.monocot-colorful,native
3/10/2021,2488549,2021-10-03 03:11:16 UTC,Orchidaceae,Calochilus,Calochilus paludosus,5.monocot-colorful,native
3/10/2021,2488549,2021-10-03 09:45:17 UTC,Orchidaceae,Calochilus,Calochilus paludosus,5.monocot-colorful,native
30/09/2021,4916136,2021-10-06 13:16:35 UTC,Orchidaceae,Calochilus,Calochilus paludosus,5.monocot-colorful,native
9/10/2021,2488549,2021-10-09 09:21:14 UTC,Orchidaceae,Calochilus,Calochilus paludosus,5.monocot-colorful,native
9/10/2021,2488549,2021-10-09 09:21:16 UTC,Orchidaceae,Calochilus,Calochilus paludosus,5.monocot-colorful,native
9/10/2021,2488549,2021-10-09 10:16:22 UTC,Orchidaceae,Calochilus,Calochilus paludosus,5.monocot-colorful,native
23/10/2021,2376854,2021-10-23 12:17:44 UTC,Orchidaceae,Calochilus,Calochilus paludosus,5.monocot-colorful,native
23/10/2021,2376854,2021-10-23 12:18:26 UTC,Orchidaceae,Calochilus,Calochilus paludosus,5.monocot-colorful,native
23/10/2021,2376854,2021-10-23 12:23:04 UTC,Orchidaceae,Calochilus,Calochilus paludosus,5.monocot-colorful,native
23/10/2021,2376854,2021-10-23 12:26:44 UTC,Orchidaceae,Calochilus,Calochilus paludosus,5.monocot-colorful,native
23/10/2021,3880468,2021-10-24 11:10:47 UTC,Orchidaceae,Calochilus,Calochilus paludosus,5.monocot-colorful,native
3/10/2021,5150898,2021-11-18 18:20:09 UTC,Orchidaceae,Calochilus,Calochilus paludosus,5.monocot-colorful,native
16/09/2022,2488549,2022-09-16 06:39:15 UTC,Orchidaceae,Calochilus,Calochilus paludosus,5.monocot-colorful,native
24/09/2022,4916136,2022-09-24 06:17:46 UTC,Orchidaceae,Calochilus,Calochilus paludosus,5.monocot-colorful,native
24/09/2022,2488549,2022-09-24 11:58:21 UTC,Orchidaceae,Calochilus,Calochilus paludosus,5.monocot-colorful,native
25/09/2022,1138587,2022-09-25 06:47:24 UTC,Orchidaceae,Calochilus,Calochilus paludosus,5.monocot-colorful,native
25/09/2022,1138587,2022-09-25 06:47:27 UTC,Orchidaceae,Calochilus,Calochilus paludosus,5.monocot-colorful,native
26/09/2022,3678274,2022-09-27 04:01:31 UTC,Orchidaceae,Calochilus,Calochilus paludosus,5.monocot-colorful,native
27/09/2022,3978191,2022-09-28 10:39:54 UTC,Orchidaceae,Calochilus,Calochilus paludosus,5.monocot-colorful,native
1/10/2022,5150898,2022-10-01 04:31:23 UTC,Orchidaceae,Calochilus,Calochilus paludosus,5.monocot-colorful,native
1/10/2022,5150898,2022-10-01 04:31:42 UTC,Orchidaceae,Calochilus,Calochilus paludosus,5.monocot-colorful,native
1/10/2022,5335585,2022-10-01 12:01:21 UTC,Orchidaceae,Calochilus,Calochilus paludosus,5.monocot-colorful,native
13/10/2022,6029661,2022-10-13 12:05:33 UTC,Orchidaceae,Calochilus,Calochilus paludosus,5.monocot-colorful,native
15/10/2022,5150898,2022-10-15 09:40:57 UTC,Orchidaceae,Calochilus,Calochilus paludosus,5.monocot-colorful,native
15/10/2022,5150898,2022-10-15 09:41:15 UTC,Orchidaceae,Calochilus,Calochilus paludosus,5.monocot-colorful,native
15/10/2022,5150898,2022-10-15 09:42:02 UTC,Orchidaceae,Calochilus,Calochilus paludosus,5.monocot-colorful,native
15/10/2022,5150898,2022-10-15 09:42:22 UTC,Orchidaceae,Calochilus,Calochilus paludosus,5.monocot-colorful,native
22/10/2022,5150898,2022-10-22 23:02:29 UTC,Orchidaceae,Calochilus,Calochilus paludosus,5.monocot-colorful,native
22/10/2022,5150898,2022-10-22 23:02:50 UTC,Orchidaceae,Calochilus,Calochilus paludosus,5.monocot-colorful,native
1/11/2022,6209647,2022-11-01 09:10:02 UTC,Orchidaceae,Calochilus,Calochilus paludosus,5.monocot-colorful,native
4/10/2021,63317,2022-12-10 03:16:08 UTC,Orchidaceae,Calochilus,Calochilus paludosus,5.monocot-colorful,native
23/10/2022,4945302,2022-12-13 09:38:46 UTC,Orchidaceae,Calochilus,Calochilus paludosus,5.monocot-colorful,native
9/09/2023,6556876,2023-09-09 12:30:10 UTC,Orchidaceae,Calochilus,Calochilus paludosus,5.monocot-colorful,native
15/09/2023,5188972,2023-09-15 09:51:02 UTC,Orchidaceae,Calochilus,Calochilus paludosus,5.monocot-colorful,native
26/09/2023,5997026,2023-09-26 09:17:59 UTC,Orchidaceae,Calochilus,Calochilus paludosus,5.monocot-colorful,native
30/09/2023,3678274,2023-10-03 22:52:05 UTC,Orchidaceae,Calochilus,Calochilus paludosus,5.monocot-colorful,native
30/09/2023,3678274,2023-10-03 22:52:05 UTC,Orchidaceae,Calochilus,Calochilus paludosus,5.monocot-colorful,native
12/10/2023,6516136,2023-10-12 04:02:27 UTC,Orchidaceae,Calochilus,Calochilus paludosus,5.monocot-colorful,native
9/10/2023,6308282,2023-10-15 01:10:50 UTC,Orchidaceae,Calochilus,Calochilus paludosus,5.monocot-colorful,native
12/10/2023,7117393,2023-11-05 20:12:03 UTC,Orchidaceae,Calochilus,Calochilus paludosus,5.monocot-colorful,native
26/09/2023,151454,2024-04-30 01:19:45 UTC,Orchidaceae,Calochilus,Calochilus paludosus,5.monocot-colorful,native
9/10/2020,2488549,2020-10-09 07:51:09 UTC,Orchidaceae,Calochilus,Calochilus robertsonii,5.monocot-colorful,native
23/09/2021,4916136,2021-09-23 12:48:35 UTC,Orchidaceae,Calochilus,Calochilus robertsonii,5.monocot-colorful,native
23/10/2021,2376854,2021-10-23 12:33:14 UTC,Orchidaceae,Calochilus,Calochilus robertsonii,5.monocot-colorful,native
16/09/2021,5150898,2021-11-18 20:55:34 UTC,Orchidaceae,Calochilus,Calochilus robertsonii,5.monocot-colorful,native
17/09/2022,5150898,2022-09-17 02:58:41 UTC,Orchidaceae,Calochilus,Calochilus robertsonii,5.monocot-colorful,native
1/10/2022,5150898,2022-10-01 04:31:58 UTC,Orchidaceae,Calochilus,Calochilus robertsonii,5.monocot-colorful,native
2/10/2022,5150898,2022-10-02 06:43:23 UTC,Orchidaceae,Calochilus,Calochilus robertsonii,5.monocot-colorful,native
15/10/2022,5150898,2022-10-15 09:42:40 UTC,Orchidaceae,Calochilus,Calochilus robertsonii,5.monocot-colorful,native
16/10/2022,5150898,2022-10-16 04:19:24 UTC,Orchidaceae,Calochilus,Calochilus robertsonii,5.monocot-colorful,native
24/09/2023,1138587,2023-09-27 01:50:06 UTC,Orchidaceae,Calochilus,Calochilus robertsonii,5.monocot-colorful,native
24/09/2023,1138587,2023-09-27 03:20:46 UTC,Orchidaceae,Calochilus,Calochilus robertsonii,5.monocot-colorful,native
2/10/2023,3488848,2023-10-02 04:52:25 UTC,Orchidaceae,Calochilus,Calochilus robertsonii,5.monocot-colorful,native
28/09/2021,4743351,2021-10-01 07:22:26 UTC,Dicksoniaceae,Calochlaena,Calochlaena dubia,1.ferns/primitive,native
24/07/2022,4724286,2022-07-24 07:42:28 UTC,Dicksoniaceae,Calochlaena,Calochlaena dubia,1.ferns/primitive,native
12/02/2023,4743351,2023-02-14 02:07:10 UTC,Dicksoniaceae,Calochlaena,Calochlaena dubia,1.ferns/primitive,native
20/03/2023,1259195,2023-03-26 10:27:36 UTC,Dicksoniaceae,Calochlaena,Calochlaena dubia,1.ferns/primitive,native
20/10/2018,4359544,2021-08-07 06:26:01 UTC,Convolvulaceae,Calystegia,Calystegia soldanella,3.dicot,native
23/10/2021,5159187,2021-10-25 22:32:48 UTC,Convolvulaceae,Calystegia,Calystegia soldanella,3.dicot,native
29/10/2014,2991,2015-07-23 16:48:56 UTC,Myrtaceae,Calytrix,Calytrix tetragona,3.dicot,native
24/07/2020,2488549,2020-07-24 11:42:20 UTC,Myrtaceae,Calytrix,Calytrix tetragona,3.dicot,native
8/09/2020,3408787,2020-09-10 06:40:53 UTC,Myrtaceae,Calytrix,Calytrix tetragona,3.dicot,native
24/09/2020,2518052,2020-09-24 11:12:48 UTC,Myrtaceae,Calytrix,Calytrix tetragona,3.dicot,native
26/09/2020,2488549,2020-09-27 07:50:47 UTC,Myrtaceae,Calytrix,Calytrix tetragona,3.dicot,native
3/10/2020,2488549,2020-10-03 09:56:15 UTC,Myrtaceae,Calytrix,Calytrix tetragona,3.dicot,native
15/09/2020,4743351,2021-07-25 04:51:45 UTC,Myrtaceae,Calytrix,Calytrix tetragona,3.dicot,native
25/07/2021,2488549,2021-07-25 10:25:59 UTC,Myrtaceae,Calytrix,Calytrix tetragona,3.dicot,native
29/08/2020,4743351,2021-07-25 12:03:25 UTC,Myrtaceae,Calytrix,Calytrix tetragona,3.dicot,native
29/08/2021,2215616,2021-08-28 22:55:37 UTC,Myrtaceae,Calytrix,Calytrix tetragona,3.dicot,native
5/09/2021,2488549,2021-09-05 10:23:40 UTC,Myrtaceae,Calytrix,Calytrix tetragona,3.dicot,native
5/09/2021,2488549,2021-09-05 10:32:50 UTC,Myrtaceae,Calytrix,Calytrix tetragona,3.dicot,native
31/08/2021,4916136,2021-09-05 13:20:42 UTC,Myrtaceae,Calytrix,Calytrix tetragona,3.dicot,native
6/09/2021,4887682,2021-09-06 08:23:53 UTC,Myrtaceae,Calytrix,Calytrix tetragona,3.dicot,native
4/10/2011,4916136,2021-09-06 12:17:38 UTC,Myrtaceae,Calytrix,Calytrix tetragona,3.dicot,native
8/09/2021,4743351,2021-09-09 13:11:11 UTC,Myrtaceae,Calytrix,Calytrix tetragona,3.dicot,native
12/09/2021,4025155,2021-09-17 10:00:07 UTC,Myrtaceae,Calytrix,Calytrix tetragona,3.dicot,native
18/09/2021,4945027,2021-09-18 09:51:00 UTC,Myrtaceae,Calytrix,Calytrix tetragona,3.dicot,native
3/09/2021,4944844,2021-09-18 10:10:04 UTC,Myrtaceae,Calytrix,Calytrix tetragona,3.dicot,native
18/09/2021,4945027,2021-09-18 10:25:38 UTC,Myrtaceae,Calytrix,Calytrix tetragona,3.dicot,native
18/09/2021,4916136,2021-09-18 13:09:38 UTC,Myrtaceae,Calytrix,Calytrix tetragona,3.dicot,native
22/09/2021,4916136,2021-09-22 13:35:02 UTC,Myrtaceae,Calytrix,Calytrix tetragona,3.dicot,native
23/09/2021,3893507,2021-09-24 12:14:31 UTC,Myrtaceae,Calytrix,Calytrix tetragona,3.dicot,native
24/09/2021,4916136,2021-09-24 14:10:34 UTC,Myrtaceae,Calytrix,Calytrix tetragona,3.dicot,native
22/09/2021,4916136,2021-09-26 02:31:28 UTC,Myrtaceae,Calytrix,Calytrix tetragona,3.dicot,native
28/09/2021,4916136,2021-09-28 12:43:12 UTC,Myrtaceae,Calytrix,Calytrix tetragona,3.dicot,native
28/09/2021,4743351,2021-10-01 07:22:18 UTC,Myrtaceae,Calytrix,Calytrix tetragona,3.dicot,native
1/10/2021,4916136,2021-10-02 02:24:22 UTC,Myrtaceae,Calytrix,Calytrix tetragona,3.dicot,native
30/09/2021,4916136,2021-10-02 02:58:09 UTC,Myrtaceae,Calytrix,Calytrix tetragona,3.dicot,native
3/10/2021,2488549,2021-10-03 09:45:18 UTC,Myrtaceae,Calytrix,Calytrix tetragona,3.dicot,native
8/10/2021,4916136,2021-10-08 12:36:20 UTC,Myrtaceae,Calytrix,Calytrix tetragona,3.dicot,native
9/10/2021,2488549,2021-10-09 10:02:17 UTC,Myrtaceae,Calytrix,Calytrix tetragona,3.dicot,native
12/10/2021,4743351,2021-10-15 10:56:53 UTC,Myrtaceae,Calytrix,Calytrix tetragona,3.dicot,native
5/10/2021,2665854,2021-10-18 20:38:40 UTC,Myrtaceae,Calytrix,Calytrix tetragona,3.dicot,native
12/10/2021,3313573,2021-10-20 11:46:01 UTC,Myrtaceae,Calytrix,Calytrix tetragona,3.dicot,native
21/10/2021,2665854,2021-10-20 22:21:04 UTC,Myrtaceae,Calytrix,Calytrix tetragona,3.dicot,native
6/11/2021,2376854,2021-11-08 00:17:14 UTC,Myrtaceae,Calytrix,Calytrix tetragona,3.dicot,native
14/09/2019,5283632,2022-01-12 05:14:04 UTC,Myrtaceae,Calytrix,Calytrix tetragona,3.dicot,native
11/10/2015,2451999,2022-01-29 07:05:32 UTC,Myrtaceae,Calytrix,Calytrix tetragona,3.dicot,native
24/07/2022,2488549,2022-07-24 04:05:20 UTC,Myrtaceae,Calytrix,Calytrix tetragona,3.dicot,native
24/07/2022,2488549,2022-07-24 04:06:54 UTC,Myrtaceae,Calytrix,Calytrix tetragona,3.dicot,native
30/08/2022,4916136,2022-08-30 12:39:48 UTC,Myrtaceae,Calytrix,Calytrix tetragona,3.dicot,native
22/01/2003,3527375,2022-09-08 00:31:56 UTC,Myrtaceae,Calytrix,Calytrix tetragona,3.dicot,native
16/09/2022,3678274,2022-09-18 04:43:38 UTC,Myrtaceae,Calytrix,Calytrix tetragona,3.dicot,native
25/09/2022,1138587,2022-09-25 06:47:25 UTC,Myrtaceae,Calytrix,Calytrix tetragona,3.dicot,native
3/10/2022,2488549,2022-10-03 07:48:00 UTC,Myrtaceae,Calytrix,Calytrix tetragona,3.dicot,native
4/10/2022,4743351,2022-10-06 09:52:04 UTC,Myrtaceae,Calytrix,Calytrix tetragona,3.dicot,native
4/10/2022,3678274,2022-10-12 06:31:20 UTC,Myrtaceae,Calytrix,Calytrix tetragona,3.dicot,native
15/10/2022,1175154,2022-10-15 09:12:52 UTC,Myrtaceae,Calytrix,Calytrix tetragona,3.dicot,native
2/11/2022,2631448,2022-11-05 02:51:51 UTC,Myrtaceae,Calytrix,Calytrix tetragona,3.dicot,native
17/11/2022,2488549,2022-11-17 02:44:22 UTC,Myrtaceae,Calytrix,Calytrix tetragona,3.dicot,native
27/11/2022,6209647,2023-01-25 12:34:11 UTC,Myrtaceae,Calytrix,Calytrix tetragona,3.dicot,native
1/07/2023,2531563,2023-07-03 02:27:45 UTC,Myrtaceae,Calytrix,Calytrix tetragona,3.dicot,native
26/07/2023,3978191,2023-07-26 09:35:26 UTC,Myrtaceae,Calytrix,Calytrix tetragona,3.dicot,native
18/08/2023,5304898,2023-08-18 10:51:59 UTC,Myrtaceae,Calytrix,Calytrix tetragona,3.dicot,native
21/08/2023,6209647,2023-08-21 11:08:29 UTC,Myrtaceae,Calytrix,Calytrix tetragona,3.dicot,native
18/07/2023,4317345,2023-09-07 02:04:20 UTC,Myrtaceae,Calytrix,Calytrix tetragona,3.dicot,native
20/09/2023,5435930,2023-09-25 12:15:29 UTC,Myrtaceae,Calytrix,Calytrix tetragona,3.dicot,native
30/09/2023,3678274,2023-10-03 22:52:03 UTC,Myrtaceae,Calytrix,Calytrix tetragona,3.dicot,native
20/10/2023,4453532,2023-10-20 09:33:22 UTC,Myrtaceae,Calytrix,Calytrix tetragona,3.dicot,native
16/09/2023,745089,2023-11-07 06:34:54 UTC,Myrtaceae,Calytrix,Calytrix tetragona,3.dicot,native
23/09/2016,7789371,2024-04-05 03:44:42 UTC,Myrtaceae,Calytrix,Calytrix tetragona,3.dicot,native
11/12/2023,164735,2023-12-11 08:00:47 UTC,Bignoniaceae,Campsis,Campsis  tagliabueana,3.dicot,introduced
24/11/2017,25160,2017-11-28 08:29:42 UTC,Aizoaceae,Carpobrotus,Carpobrotus glaucescens,3.dicot,native
11/05/2019,793005,2019-05-11 15:27:24 UTC,Aizoaceae,Carpobrotus,Carpobrotus glaucescens,3.dicot,native
8/07/2021,4095677,2021-07-08 07:40:23 UTC,Aizoaceae,Carpobrotus,Carpobrotus glaucescens,3.dicot,native
15/08/2021,4945027,2021-09-02 23:18:14 UTC,Aizoaceae,Carpobrotus,Carpobrotus glaucescens,3.dicot,native
18/09/2021,4945027,2021-09-18 10:18:24 UTC,Aizoaceae,Carpobrotus,Carpobrotus glaucescens,3.dicot,native
23/10/2021,5159187,2021-10-25 22:25:38 UTC,Aizoaceae,Carpobrotus,Carpobrotus glaucescens,3.dicot,native
12/06/2020,5283632,2022-01-09 14:23:24 UTC,Aizoaceae,Carpobrotus,Carpobrotus glaucescens,3.dicot,native
12/10/2021,3313573,2022-02-16 07:00:27 UTC,Aizoaceae,Carpobrotus,Carpobrotus glaucescens,3.dicot,native
8/12/2018,5376779,2022-03-03 11:06:50 UTC,Aizoaceae,Carpobrotus,Carpobrotus glaucescens,3.dicot,native
16/05/2015,4002106,2022-03-06 19:49:07 UTC,Aizoaceae,Carpobrotus,Carpobrotus glaucescens,3.dicot,native
7/06/2022,1233583,2022-06-07 09:06:53 UTC,Aizoaceae,Carpobrotus,Carpobrotus glaucescens,3.dicot,native
6/08/2021,3678274,2022-07-03 11:59:31 UTC,Aizoaceae,Carpobrotus,Carpobrotus glaucescens,3.dicot,native
21/08/2022,3839358,2022-08-21 08:05:02 UTC,Aizoaceae,Carpobrotus,Carpobrotus glaucescens,3.dicot,native
5/11/2022,4966591,2022-11-05 00:54:45 UTC,Aizoaceae,Carpobrotus,Carpobrotus glaucescens,3.dicot,native
3/03/2024,3026110,2024-03-03 21:52:25 UTC,Aizoaceae,Carpobrotus,Carpobrotus glaucescens,3.dicot,native
22/03/2024,7134096,2024-03-22 08:36:26 UTC,Aizoaceae,Carpobrotus,Carpobrotus glaucescens,3.dicot,native
16/11/2021,4916136,2021-11-16 13:00:43 UTC,Asteraceae,Cassinia,Cassinia aureonitens,3.dicot,native
26/12/2021,2488549,2021-12-27 10:30:26 UTC,Asteraceae,Cassinia,Cassinia aureonitens,3.dicot,native
18/11/2022,2488549,2022-11-18 08:37:08 UTC,Asteraceae,Cassinia,Cassinia aureonitens,3.dicot,native
13/12/2023,35619,2023-12-13 11:02:57 UTC,Asteraceae,Cassinia,Cassinia aureonitens,3.dicot,native
12/10/2021,4743351,2021-10-15 10:56:53 UTC,Asteraceae,Cassinia,Cassinia denticulata,3.dicot,native
17/11/2022,2488549,2022-11-17 02:52:44 UTC,Asteraceae,Cassinia,Cassinia denticulata,3.dicot,native
17/11/2022,2488549,2022-11-17 02:55:35 UTC,Asteraceae,Cassinia,Cassinia denticulata,3.dicot,native
17/11/2022,2488549,2022-11-17 03:00:36 UTC,Asteraceae,Cassinia,Cassinia denticulata,3.dicot,native
10/01/2023,2488549,2023-01-10 02:58:07 UTC,Asteraceae,Cassinia,Cassinia denticulata,3.dicot,native
5/04/2020,2488549,2020-04-05 05:09:30 UTC,Lauraceae,Cassytha,Cassytha glabella,3.dicot,native
27/08/2021,4743351,2021-08-29 04:54:41 UTC,Lauraceae,Cassytha,Cassytha glabella,3.dicot,native
19/03/2023,4743351,2023-03-23 11:18:06 UTC,Lauraceae,Cassytha,Cassytha glabella,3.dicot,native
11/10/2023,6516136,2023-10-23 03:42:46 UTC,Lauraceae,Cassytha,Cassytha glabella,3.dicot,native
31/12/2019,2488549,2019-12-31 05:45:20 UTC,Lauraceae,Cassytha,Cassytha pubescens,3.dicot,native
12/01/2020,2488549,2020-01-13 08:43:27 UTC,Lauraceae,Cassytha,Cassytha pubescens,3.dicot,native
12/09/2021,4037891,2021-09-12 00:57:59 UTC,Lauraceae,Cassytha,Cassytha pubescens,3.dicot,native
28/09/2021,4743351,2021-09-28 11:51:18 UTC,Lauraceae,Cassytha,Cassytha pubescens,3.dicot,native
9/10/2021,2488549,2021-10-09 10:02:17 UTC,Lauraceae,Cassytha,Cassytha pubescens,3.dicot,native
25/09/2022,4743351,2022-12-22 23:49:49 UTC,Lauraceae,Cassytha,Cassytha pubescens,3.dicot,native
1/09/2022,5283632,2023-07-11 07:03:52 UTC,Lauraceae,Cassytha,Cassytha pubescens,3.dicot,native
24/09/2023,1138587,2023-09-27 02:55:56 UTC,Vitaceae,Causonis,Causonis clematidea,3.dicot,native
2/11/2011,2991,2011-12-29 21:40:10 UTC,Cyperaceae,Caustis,Caustis flexuosa,4.monocot,native
29/10/2014,2991,2015-07-23 16:48:49 UTC,Cyperaceae,Caustis,Caustis flexuosa,4.monocot,native
17/05/2018,364713,2018-05-17 08:51:06 UTC,Cyperaceae,Caustis,Caustis flexuosa,4.monocot,native
17/05/2018,558419,2018-05-28 21:12:32 UTC,Cyperaceae,Caustis,Caustis flexuosa,4.monocot,native
15/12/2019,2488549,2019-12-15 09:47:53 UTC,Cyperaceae,Caustis,Caustis flexuosa,4.monocot,native
31/12/2019,2488549,2019-12-31 04:06:54 UTC,Cyperaceae,Caustis,Caustis flexuosa,4.monocot,native
22/07/2020,3312793,2020-07-22 02:01:50 UTC,Cyperaceae,Caustis,Caustis flexuosa,4.monocot,native
1/01/2021,2376854,2021-01-01 16:07:42 UTC,Cyperaceae,Caustis,Caustis flexuosa,4.monocot,native
7/02/2021,2376854,2021-02-07 11:09:53 UTC,Cyperaceae,Caustis,Caustis flexuosa,4.monocot,native
28/02/2021,2376854,2021-02-28 11:54:23 UTC,Cyperaceae,Caustis,Caustis flexuosa,4.monocot,native
8/04/2021,325733,2021-04-09 12:17:12 UTC,Cyperaceae,Caustis,Caustis flexuosa,4.monocot,native
15/09/2020,4743351,2021-07-25 05:08:53 UTC,Cyperaceae,Caustis,Caustis flexuosa,4.monocot,native
16/06/2020,4743351,2021-08-02 03:25:32 UTC,Cyperaceae,Caustis,Caustis flexuosa,4.monocot,native
29/08/2021,2215616,2021-08-28 22:57:20 UTC,Cyperaceae,Caustis,Caustis flexuosa,4.monocot,native
6/09/2021,4887682,2021-09-06 09:44:52 UTC,Cyperaceae,Caustis,Caustis flexuosa,4.monocot,native
27/09/2021,3978426,2021-09-27 03:41:50 UTC,Cyperaceae,Caustis,Caustis flexuosa,4.monocot,native
16/04/2022,3751299,2022-04-16 09:30:05 UTC,Cyperaceae,Caustis,Caustis flexuosa,4.monocot,native
30/04/2022,1138587,2022-04-30 09:42:02 UTC,Cyperaceae,Caustis,Caustis flexuosa,4.monocot,native
30/07/2022,4743351,2022-08-01 12:37:37 UTC,Cyperaceae,Caustis,Caustis flexuosa,4.monocot,native
15/10/2022,6160459,2022-10-24 09:13:32 UTC,Cyperaceae,Caustis,Caustis flexuosa,4.monocot,native
12/02/2023,4743351,2023-02-13 10:50:55 UTC,Cyperaceae,Caustis,Caustis flexuosa,4.monocot,native
5/04/2023,2698420,2023-04-05 08:50:32 UTC,Cyperaceae,Caustis,Caustis flexuosa,4.monocot,native
25/06/2023,5300031,2023-06-25 05:35:02 UTC,Cyperaceae,Caustis,Caustis flexuosa,4.monocot,native
16/07/2023,5315657,2023-07-16 06:06:14 UTC,Cyperaceae,Caustis,Caustis flexuosa,4.monocot,native
16/07/2023,2366151,2023-07-16 11:11:49 UTC,Cyperaceae,Caustis,Caustis flexuosa,4.monocot,native
5/05/2019,265090,2019-07-29 10:16:05 UTC,Cyperaceae,Caustis,Caustis pentandra,4.monocot,native
17/04/2020,2488549,2020-04-17 08:53:31 UTC,Cyperaceae,Caustis,Caustis pentandra,4.monocot,native
26/04/2020,2488549,2020-04-26 08:19:30 UTC,Cyperaceae,Caustis,Caustis pentandra,4.monocot,native
16/04/2022,3751299,2022-04-16 09:45:12 UTC,Cyperaceae,Caustis,Caustis pentandra,4.monocot,native
14/05/2022,2553015,2022-05-14 09:21:22 UTC,Cyperaceae,Caustis,Caustis pentandra,4.monocot,native
30/07/2022,4743351,2022-08-01 12:37:35 UTC,Cyperaceae,Caustis,Caustis pentandra,4.monocot,native
9/04/2021,3678274,2021-08-04 12:15:08 UTC,Cyperaceae,Caustis,Caustis recurvata,4.monocot,native
30/08/2021,4916136,2021-08-30 11:36:03 UTC,Cyperaceae,Caustis,Caustis recurvata,4.monocot,native
9/09/2021,4887682,2021-09-08 23:33:14 UTC,Cyperaceae,Caustis,Caustis recurvata,4.monocot,native
12/11/2021,4916136,2021-11-12 12:53:39 UTC,Cyperaceae,Caustis,Caustis recurvata,4.monocot,native
2/01/2024,661392,2024-01-02 06:21:32 UTC,Gentianaceae,Centaurium,Centaurium tenuiflorum,3.dicot,introduced
2/01/2024,1138587,2024-01-02 09:03:04 UTC,Gentianaceae,Centaurium,Centaurium tenuiflorum,3.dicot,introduced
11/10/2020,2488549,2020-10-12 09:57:47 UTC,Cunoniaceae,Ceratopetalum,Ceratopetalum apetalum,3.dicot,native
11/10/2020,2488549,2020-10-12 10:13:30 UTC,Cunoniaceae,Ceratopetalum,Ceratopetalum apetalum,3.dicot,native
26/12/2021,2488549,2021-12-27 10:30:26 UTC,Cunoniaceae,Ceratopetalum,Ceratopetalum apetalum,3.dicot,native
31/12/2021,2488549,2021-12-31 09:29:02 UTC,Cunoniaceae,Ceratopetalum,Ceratopetalum apetalum,3.dicot,native
28/12/2022,2488549,2022-12-28 02:22:49 UTC,Cunoniaceae,Ceratopetalum,Ceratopetalum apetalum,3.dicot,native
28/12/2023,6542702,2023-12-29 22:20:19 UTC,Cunoniaceae,Ceratopetalum,Ceratopetalum apetalum,3.dicot,native
31/12/2019,2488549,2019-12-31 05:41:35 UTC,Cunoniaceae,Ceratopetalum,Ceratopetalum gummiferum,3.dicot,native
31/12/2019,2488549,2019-12-31 11:56:19 UTC,Cunoniaceae,Ceratopetalum,Ceratopetalum gummiferum,3.dicot,native
12/08/2020,2488549,2020-08-12 22:24:13 UTC,Cunoniaceae,Ceratopetalum,Ceratopetalum gummiferum,3.dicot,native
11/10/2020,2488549,2020-10-12 10:08:39 UTC,Cunoniaceae,Ceratopetalum,Ceratopetalum gummiferum,3.dicot,native
1/01/2021,2376854,2021-01-01 14:33:57 UTC,Cunoniaceae,Ceratopetalum,Ceratopetalum gummiferum,3.dicot,native
15/11/2020,3313573,2021-01-03 08:33:44 UTC,Cunoniaceae,Ceratopetalum,Ceratopetalum gummiferum,3.dicot,native
6/09/2021,4887682,2021-09-06 09:56:15 UTC,Cunoniaceae,Ceratopetalum,Ceratopetalum gummiferum,3.dicot,native
18/01/1988,717200,2022-06-17 02:20:44 UTC,Cunoniaceae,Ceratopetalum,Ceratopetalum gummiferum,3.dicot,native
24/07/2022,265090,2022-07-24 20:41:11 UTC,Cunoniaceae,Ceratopetalum,Ceratopetalum gummiferum,3.dicot,native
10/11/2022,2488549,2022-11-10 10:07:00 UTC,Cunoniaceae,Ceratopetalum,Ceratopetalum gummiferum,3.dicot,native
18/11/2022,2488549,2022-11-18 04:08:34 UTC,Cunoniaceae,Ceratopetalum,Ceratopetalum gummiferum,3.dicot,native
3/01/2023,576419,2023-01-02 23:46:28 UTC,Cunoniaceae,Ceratopetalum,Ceratopetalum gummiferum,3.dicot,native
5/02/2023,2376854,2023-02-06 13:16:41 UTC,Cunoniaceae,Ceratopetalum,Ceratopetalum gummiferum,3.dicot,native
9/03/2023,1658043,2023-03-13 07:22:29 UTC,Cunoniaceae,Ceratopetalum,Ceratopetalum gummiferum,3.dicot,native
16/07/2023,5315657,2023-07-16 06:42:40 UTC,Cunoniaceae,Ceratopetalum,Ceratopetalum gummiferum,3.dicot,native
24/09/2023,1138587,2023-09-27 02:56:07 UTC,Cunoniaceae,Ceratopetalum,Ceratopetalum gummiferum,3.dicot,native
24/09/2023,661392,2023-09-29 12:41:08 UTC,Cunoniaceae,Ceratopetalum,Ceratopetalum gummiferum,3.dicot,native
30/11/2023,3936801,2023-12-02 00:14:47 UTC,Cunoniaceae,Ceratopetalum,Ceratopetalum gummiferum,3.dicot,native
11/02/2024,4672448,2024-02-11 04:02:57 UTC,Cunoniaceae,Ceratopetalum,Ceratopetalum gummiferum,3.dicot,native
11/10/2020,2488549,2020-10-12 09:33:02 UTC,Solanaceae,Cestrum,Cestrum parqui,3.dicot,introduced
19/10/2021,4916136,2021-10-19 05:05:37 UTC,Solanaceae,Cestrum,Cestrum parqui,3.dicot,introduced
8/11/2021,4916136,2021-11-08 13:17:30 UTC,Solanaceae,Cestrum,Cestrum parqui,3.dicot,introduced
26/09/2022,3678274,2022-09-30 11:58:11 UTC,Solanaceae,Cestrum,Cestrum parqui,3.dicot,introduced
18/08/2023,6196075,2023-08-18 23:54:54 UTC,Solanaceae,Cestrum,Cestrum parqui,3.dicot,introduced
3/11/2023,4743351,2023-11-05 02:41:02 UTC,Solanaceae,Cestrum,Cestrum parqui,3.dicot,introduced
20/12/2023,1305186,2023-12-20 10:32:48 UTC,Solanaceae,Cestrum,Cestrum parqui,3.dicot,introduced
4/07/2021,4743351,2021-07-19 11:31:12 UTC,Pteridaceae,Cheilanthes,Cheilanthes sieberi,1.ferns/primitive,native
26/10/2021,4743351,2021-10-26 11:05:53 UTC,Pteridaceae,Cheilanthes,Cheilanthes sieberi,1.ferns/primitive,native
17/04/2021,636550,2021-04-20 03:05:35 UTC,Orchidaceae,Chiloglottis,Chiloglottis diphylla,5.monocot-colorful,native
14/02/2022,5330029,2022-02-14 08:56:26 UTC,Orchidaceae,Chiloglottis,Chiloglottis diphylla,5.monocot-colorful,native
18/04/2022,5150898,2022-04-18 08:39:14 UTC,Orchidaceae,Chiloglottis,Chiloglottis diphylla,5.monocot-colorful,native
8/04/2023,2376854,2023-04-13 11:17:03 UTC,Orchidaceae,Chiloglottis,Chiloglottis diphylla,5.monocot-colorful,native
9/03/2024,5280950,2024-03-09 03:47:02 UTC,Orchidaceae,Chiloglottis,Chiloglottis diphylla,5.monocot-colorful,native
24/07/2022,5150898,2022-07-24 07:56:04 UTC,Orchidaceae,Chiloglottis,Chiloglottis formicifera,5.monocot-colorful,native
7/08/2022,5150898,2022-08-07 04:52:23 UTC,Orchidaceae,Chiloglottis,Chiloglottis formicifera,5.monocot-colorful,native
24/08/2022,3880468,2022-09-04 20:10:53 UTC,Orchidaceae,Chiloglottis,Chiloglottis formicifera,5.monocot-colorful,native
27/08/2023,5150898,2023-08-27 05:11:50 UTC,Orchidaceae,Chiloglottis,Chiloglottis formicifera,5.monocot-colorful,native
9/09/2023,5150898,2023-09-09 04:58:04 UTC,Orchidaceae,Chiloglottis,Chiloglottis formicifera,5.monocot-colorful,native
13/04/2022,5150898,2022-05-19 04:56:49 UTC,Orchidaceae,Chiloglottis,Chiloglottis seminuda,5.monocot-colorful,native
19/06/2022,5150898,2022-06-19 04:50:22 UTC,Orchidaceae,Chiloglottis,Chiloglottis seminuda,5.monocot-colorful,native
23/10/2021,3880468,2021-10-24 11:10:39 UTC,Orchidaceae,Chiloglottis,Chiloglottis trapeziformis,5.monocot-colorful,native
14/08/2022,5150898,2022-08-14 05:51:05 UTC,Orchidaceae,Chiloglottis,Chiloglottis trapeziformis,5.monocot-colorful,native
18/09/2022,5150898,2022-09-20 11:37:57 UTC,Orchidaceae,Chiloglottis,Chiloglottis trapeziformis,5.monocot-colorful,native
16/05/2020,2488549,2020-05-16 01:17:21 UTC,Lamiaceae,Chloanthes,Chloanthes stoechadis,3.dicot,native
16/05/2020,2488549,2020-05-16 11:26:44 UTC,Lamiaceae,Chloanthes,Chloanthes stoechadis,3.dicot,native
13/07/2021,4095677,2021-07-14 08:23:14 UTC,Lamiaceae,Chloanthes,Chloanthes stoechadis,3.dicot,native
25/05/2021,4743351,2021-07-20 08:29:59 UTC,Lamiaceae,Chloanthes,Chloanthes stoechadis,3.dicot,native
25/05/2021,4743351,2021-07-20 08:29:59 UTC,Lamiaceae,Chloanthes,Chloanthes stoechadis,3.dicot,native
12/10/2021,4743351,2021-10-14 11:00:55 UTC,Lamiaceae,Chloanthes,Chloanthes stoechadis,3.dicot,native
30/11/2021,4916136,2021-11-30 11:39:48 UTC,Lamiaceae,Chloanthes,Chloanthes stoechadis,3.dicot,native
11/01/2022,4743351,2022-02-09 10:09:21 UTC,Lamiaceae,Chloanthes,Chloanthes stoechadis,3.dicot,native
14/08/2022,3978191,2022-08-14 10:00:58 UTC,Lamiaceae,Chloanthes,Chloanthes stoechadis,3.dicot,native
20/08/2022,3678274,2022-09-03 01:09:03 UTC,Lamiaceae,Chloanthes,Chloanthes stoechadis,3.dicot,native
17/11/2022,2488549,2022-11-17 02:29:31 UTC,Lamiaceae,Chloanthes,Chloanthes stoechadis,3.dicot,native
19/02/2023,5364942,2023-02-20 20:37:07 UTC,Lamiaceae,Chloanthes,Chloanthes stoechadis,3.dicot,native
26/02/2023,4743351,2023-02-27 01:01:29 UTC,Lamiaceae,Chloanthes,Chloanthes stoechadis,3.dicot,native
5/05/2023,2531563,2023-05-08 04:23:16 UTC,Lamiaceae,Chloanthes,Chloanthes stoechadis,3.dicot,native
27/05/2023,5283632,2023-05-27 10:30:41 UTC,Lamiaceae,Chloanthes,Chloanthes stoechadis,3.dicot,native
6/06/2023,4743351,2023-06-07 00:31:37 UTC,Lamiaceae,Chloanthes,Chloanthes stoechadis,3.dicot,native
16/06/2023,3748684,2023-06-17 12:09:04 UTC,Lamiaceae,Chloanthes,Chloanthes stoechadis,3.dicot,native
29/07/2023,2650798,2023-07-30 11:31:09 UTC,Lamiaceae,Chloanthes,Chloanthes stoechadis,3.dicot,native
9/09/2023,3978191,2023-09-09 22:26:34 UTC,Lamiaceae,Chloanthes,Chloanthes stoechadis,3.dicot,native
18/09/2023,3345535,2023-10-02 03:21:32 UTC,Lamiaceae,Chloanthes,Chloanthes stoechadis,3.dicot,native
10/08/2023,2379395,2023-12-05 05:43:03 UTC,Lamiaceae,Chloanthes,Chloanthes stoechadis,3.dicot,native
14/09/2022,745089,2024-03-29 04:10:46 UTC,Lamiaceae,Chloanthes,Chloanthes stoechadis,3.dicot,native
21/08/2020,2488549,2020-08-21 23:02:40 UTC,Asparagaceae,Chlorophytum,Chlorophytum comosum,5.monocot-colorful,introduced
28/03/2022,2243582,2022-03-28 07:40:44 UTC,Asparagaceae,Chlorophytum,Chlorophytum comosum,5.monocot-colorful,introduced
24/09/2023,1138587,2023-09-27 02:55:59 UTC,Asparagaceae,Chlorophytum,Chlorophytum comosum,5.monocot-colorful,introduced
24/09/2023,661392,2023-09-29 11:38:17 UTC,Asparagaceae,Chlorophytum,Chlorophytum comosum,5.monocot-colorful,introduced
26/12/2019,2488549,2019-12-26 07:50:55 UTC,Asteraceae,Cirsium,Cirsium vulgare,3.dicot,introduced
1/01/2021,2376854,2021-01-01 13:59:17 UTC,Asteraceae,Cirsium,Cirsium vulgare,3.dicot,introduced
30/09/2021,4916136,2021-09-30 08:36:54 UTC,Asteraceae,Cirsium,Cirsium vulgare,3.dicot,introduced
23/10/2021,5159187,2021-10-26 07:53:35 UTC,Asteraceae,Cirsium,Cirsium vulgare,3.dicot,introduced
13/11/2022,624851,2022-11-21 06:14:56 UTC,Asteraceae,Cirsium,Cirsium vulgare,3.dicot,introduced
16/07/2023,2366151,2023-07-16 10:47:17 UTC,Asteraceae,Cirsium,Cirsium vulgare,3.dicot,introduced
2/01/2024,1138587,2024-01-02 08:51:12 UTC,Asteraceae,Cirsium,Cirsium vulgare,3.dicot,introduced
9/05/2020,2488549,2020-05-09 12:50:56 UTC,Ranunculaceae,Clematis,Clematis aristata,3.dicot,native
29/08/2020,2488549,2020-08-29 07:55:00 UTC,Ranunculaceae,Clematis,Clematis aristata,3.dicot,native
12/09/2020,2488549,2020-09-12 08:15:11 UTC,Ranunculaceae,Clematis,Clematis aristata,3.dicot,native
12/09/2021,2488549,2021-09-12 09:15:49 UTC,Ranunculaceae,Clematis,Clematis aristata,3.dicot,native
21/09/2021,4743351,2021-09-22 10:48:04 UTC,Ranunculaceae,Clematis,Clematis aristata,3.dicot,native
30/09/2021,2488549,2021-09-30 10:37:42 UTC,Ranunculaceae,Clematis,Clematis aristata,3.dicot,native
30/09/2021,2488549,2021-09-30 10:37:42 UTC,Ranunculaceae,Clematis,Clematis aristata,3.dicot,native
9/10/2021,2488549,2021-10-09 09:26:56 UTC,Ranunculaceae,Clematis,Clematis aristata,3.dicot,native
2/10/2022,6209647,2022-10-02 10:49:23 UTC,Ranunculaceae,Clematis,Clematis aristata,3.dicot,native
24/09/2023,1138587,2023-09-27 02:45:35 UTC,Ranunculaceae,Clematis,Clematis aristata,3.dicot,native
24/09/2023,661392,2023-09-28 13:40:58 UTC,Ranunculaceae,Clematis,Clematis aristata,3.dicot,native
26/01/2020,2488549,2020-01-26 03:56:09 UTC,Lamiaceae,Clerodendrum,Clerodendrum tomentosum,3.dicot,native
21/11/2020,265090,2020-11-21 22:17:08 UTC,Lamiaceae,Clerodendrum,Clerodendrum tomentosum,3.dicot,native
6/12/2020,2488549,2020-12-06 09:01:54 UTC,Lamiaceae,Clerodendrum,Clerodendrum tomentosum,3.dicot,native
12/12/2021,265090,2021-12-12 04:21:13 UTC,Lamiaceae,Clerodendrum,Clerodendrum tomentosum,3.dicot,native
19/11/2022,2488549,2022-11-19 03:03:40 UTC,Lamiaceae,Clerodendrum,Clerodendrum tomentosum,3.dicot,native
22/12/2022,2488549,2022-12-22 02:30:40 UTC,Lamiaceae,Clerodendrum,Clerodendrum tomentosum,3.dicot,native
26/04/2019,287994,2019-04-26 06:34:17 UTC,Lamiaceae,Coleus,Coleus australis,3.dicot,native
20/03/2023,1259195,2023-03-26 10:28:11 UTC,Lamiaceae,Coleus,Coleus australis,3.dicot,native
29/10/2014,2991,2015-07-23 16:49:14 UTC,Polygalaceae,Comesperma,Comesperma ericinum,3.dicot,native
19/10/2018,554709,2018-10-20 06:22:14 UTC,Polygalaceae,Comesperma,Comesperma ericinum,3.dicot,native
5/08/2020,3312793,2020-08-05 01:26:57 UTC,Polygalaceae,Comesperma,Comesperma ericinum,3.dicot,native
29/08/2020,2488549,2020-08-30 00:10:20 UTC,Polygalaceae,Comesperma,Comesperma ericinum,3.dicot,native
9/10/2020,2488549,2020-10-09 20:49:55 UTC,Polygalaceae,Comesperma,Comesperma ericinum,3.dicot,native
23/10/2020,2488549,2020-10-24 08:36:41 UTC,Polygalaceae,Comesperma,Comesperma ericinum,3.dicot,native
18/12/2020,2779982,2021-01-02 03:17:27 UTC,Polygalaceae,Comesperma,Comesperma ericinum,3.dicot,native
18/08/2020,4743351,2021-07-26 09:50:48 UTC,Polygalaceae,Comesperma,Comesperma ericinum,3.dicot,native
6/08/2021,4095677,2021-08-12 10:12:32 UTC,Polygalaceae,Comesperma,Comesperma ericinum,3.dicot,native
8/11/2008,4916136,2021-09-02 09:06:47 UTC,Polygalaceae,Comesperma,Comesperma ericinum,3.dicot,native
8/11/2008,4916136,2021-09-02 09:06:47 UTC,Polygalaceae,Comesperma,Comesperma ericinum,3.dicot,native
3/09/2021,4916136,2021-09-03 08:59:51 UTC,Polygalaceae,Comesperma,Comesperma ericinum,3.dicot,native
19/10/2021,4743351,2021-10-24 07:28:52 UTC,Polygalaceae,Comesperma,Comesperma ericinum,3.dicot,native
21/10/2021,325733,2021-11-03 01:00:20 UTC,Polygalaceae,Comesperma,Comesperma ericinum,3.dicot,native
30/10/2021,4916136,2021-11-09 12:27:22 UTC,Polygalaceae,Comesperma,Comesperma ericinum,3.dicot,native
28/11/2021,2376854,2021-11-30 14:32:00 UTC,Polygalaceae,Comesperma,Comesperma ericinum,3.dicot,native
29/12/2019,5283632,2022-01-10 09:35:48 UTC,Polygalaceae,Comesperma,Comesperma ericinum,3.dicot,native
22/01/2022,2376854,2022-01-26 14:37:43 UTC,Polygalaceae,Comesperma,Comesperma ericinum,3.dicot,native
29/01/2022,5188972,2022-01-31 12:42:06 UTC,Polygalaceae,Comesperma,Comesperma ericinum,3.dicot,native
21/02/2022,2488549,2022-02-21 08:41:58 UTC,Polygalaceae,Comesperma,Comesperma ericinum,3.dicot,native
22/09/2022,3893507,2022-09-23 11:42:26 UTC,Polygalaceae,Comesperma,Comesperma ericinum,3.dicot,native
25/09/2022,1138587,2022-09-25 06:10:43 UTC,Polygalaceae,Comesperma,Comesperma ericinum,3.dicot,native
25/09/2022,3978191,2022-09-25 09:17:47 UTC,Polygalaceae,Comesperma,Comesperma ericinum,3.dicot,native
29/10/2022,1175154,2022-10-29 05:17:16 UTC,Polygalaceae,Comesperma,Comesperma ericinum,3.dicot,native
25/09/2022,6385192,2022-12-19 01:44:31 UTC,Polygalaceae,Comesperma,Comesperma ericinum,3.dicot,native
25/09/2022,6385192,2022-12-19 01:45:55 UTC,Polygalaceae,Comesperma,Comesperma ericinum,3.dicot,native
26/02/2023,4025155,2023-02-26 20:54:30 UTC,Polygalaceae,Comesperma,Comesperma ericinum,3.dicot,native
7/09/2023,5188972,2023-09-07 12:01:21 UTC,Polygalaceae,Comesperma,Comesperma ericinum,3.dicot,native
5/09/2023,4743351,2023-09-14 11:56:26 UTC,Polygalaceae,Comesperma,Comesperma ericinum,3.dicot,native
24/09/2023,1138587,2023-09-27 02:08:29 UTC,Polygalaceae,Comesperma,Comesperma ericinum,3.dicot,native
24/09/2023,7311986,2023-09-29 03:22:40 UTC,Polygalaceae,Comesperma,Comesperma ericinum,3.dicot,native
2/10/2023,7415739,2023-10-03 01:17:13 UTC,Polygalaceae,Comesperma,Comesperma ericinum,3.dicot,native
7/09/2023,6516136,2023-10-04 01:09:44 UTC,Polygalaceae,Comesperma,Comesperma ericinum,3.dicot,native
16/09/2023,745089,2023-11-07 07:21:43 UTC,Polygalaceae,Comesperma,Comesperma ericinum,3.dicot,native
26/11/2023,1438982,2023-11-29 21:25:08 UTC,Polygalaceae,Comesperma,Comesperma ericinum,3.dicot,native
13/11/2020,2488549,2020-11-13 20:05:46 UTC,Polygalaceae,Comesperma,Comesperma sphaerocarpum,3.dicot,native
5/10/2020,2867806,2020-10-05 01:19:38 UTC,Polygalaceae,Comesperma,Comesperma volubile,3.dicot,native
9/10/2020,2488549,2020-10-09 21:01:08 UTC,Polygalaceae,Comesperma,Comesperma volubile,3.dicot,native
11/10/2020,2488549,2020-10-12 10:09:44 UTC,Polygalaceae,Comesperma,Comesperma volubile,3.dicot,native
22/08/2021,2215616,2021-08-22 00:00:18 UTC,Polygalaceae,Comesperma,Comesperma volubile,3.dicot,native
28/08/2021,4095677,2021-08-28 06:51:56 UTC,Polygalaceae,Comesperma,Comesperma volubile,3.dicot,native
12/09/2021,2488549,2021-09-12 09:30:47 UTC,Polygalaceae,Comesperma,Comesperma volubile,3.dicot,native
17/09/2021,4916136,2021-09-17 13:44:23 UTC,Polygalaceae,Comesperma,Comesperma volubile,3.dicot,native
20/09/2021,4916136,2021-09-24 02:25:32 UTC,Polygalaceae,Comesperma,Comesperma volubile,3.dicot,native
9/10/2021,4916136,2021-10-09 11:52:49 UTC,Polygalaceae,Comesperma,Comesperma volubile,3.dicot,native
10/08/2022,2488549,2022-08-10 06:55:39 UTC,Polygalaceae,Comesperma,Comesperma volubile,3.dicot,native
15/08/2022,2376854,2022-08-17 08:15:39 UTC,Polygalaceae,Comesperma,Comesperma volubile,3.dicot,native
25/09/2022,1138587,2022-09-25 06:10:43 UTC,Polygalaceae,Comesperma,Comesperma volubile,3.dicot,native
31/08/2022,6209647,2022-10-01 13:12:37 UTC,Polygalaceae,Comesperma,Comesperma volubile,3.dicot,native
3/08/2023,3978191,2023-08-03 09:12:21 UTC,Polygalaceae,Comesperma,Comesperma volubile,3.dicot,native
12/08/2023,5188972,2023-08-12 08:33:33 UTC,Polygalaceae,Comesperma,Comesperma volubile,3.dicot,native
18/08/2023,6308282,2023-08-18 04:27:21 UTC,Polygalaceae,Comesperma,Comesperma volubile,3.dicot,native
24/09/2023,4359490,2023-09-24 06:38:59 UTC,Polygalaceae,Comesperma,Comesperma volubile,3.dicot,native
24/09/2023,661392,2023-09-28 10:32:57 UTC,Polygalaceae,Comesperma,Comesperma volubile,3.dicot,native
24/09/2023,661392,2023-09-28 12:45:30 UTC,Polygalaceae,Comesperma,Comesperma volubile,3.dicot,native
26/04/2019,287994,2019-04-26 10:43:15 UTC,Commelinaceae,Commelina,Commelina cyanea,5.monocot-colorful,native
19/03/2020,2488549,2020-03-19 05:56:20 UTC,Commelinaceae,Commelina,Commelina cyanea,5.monocot-colorful,native
7/01/2021,3564126,2021-01-07 03:20:01 UTC,Commelinaceae,Commelina,Commelina cyanea,5.monocot-colorful,native
26/10/2021,4916136,2021-10-26 12:50:47 UTC,Commelinaceae,Commelina,Commelina cyanea,5.monocot-colorful,native
28/12/2021,2385138,2021-12-28 01:11:29 UTC,Commelinaceae,Commelina,Commelina cyanea,5.monocot-colorful,native
18/01/1988,717200,2022-06-17 02:20:58 UTC,Commelinaceae,Commelina,Commelina cyanea,5.monocot-colorful,native
12/02/2023,4743351,2023-02-13 23:20:23 UTC,Commelinaceae,Commelina,Commelina cyanea,5.monocot-colorful,native
12/03/2023,6566631,2023-03-12 06:14:38 UTC,Commelinaceae,Commelina,Commelina cyanea,5.monocot-colorful,native
20/03/2023,1259195,2023-03-26 10:27:35 UTC,Commelinaceae,Commelina,Commelina cyanea,5.monocot-colorful,native
20/03/2023,1259195,2023-03-26 10:27:51 UTC,Commelinaceae,Commelina,Commelina cyanea,5.monocot-colorful,native
20/03/2023,1259195,2023-03-26 10:27:52 UTC,Commelinaceae,Commelina,Commelina cyanea,5.monocot-colorful,native
20/03/2023,1259195,2023-03-26 10:27:58 UTC,Commelinaceae,Commelina,Commelina cyanea,5.monocot-colorful,native
26/03/2023,2650798,2023-03-26 23:27:51 UTC,Commelinaceae,Commelina,Commelina cyanea,5.monocot-colorful,native
30/01/2024,3478104,2024-01-30 21:44:26 UTC,Commelinaceae,Commelina,Commelina cyanea,5.monocot-colorful,native
29/08/2020,4743351,2021-07-25 12:07:09 UTC,Malvaceae,Commersonia,Commersonia hermanniifolia,3.dicot,native
16/09/2022,3678274,2022-09-18 04:43:39 UTC,Malvaceae,Commersonia,Commersonia hermanniifolia,3.dicot,native
29/10/2014,2991,2015-07-18 05:15:56 UTC,Proteaceae,Conospermum,Conospermum ellipticum,3.dicot,native
17/01/2017,1952929,2019-07-20 18:25:04 UTC,Proteaceae,Conospermum,Conospermum ellipticum,3.dicot,native
22/08/2019,2158793,2019-08-22 03:57:38 UTC,Proteaceae,Conospermum,Conospermum ellipticum,3.dicot,native
18/07/2020,2488549,2020-07-18 09:45:20 UTC,Proteaceae,Conospermum,Conospermum ellipticum,3.dicot,native
18/07/2020,2488549,2020-07-18 09:51:53 UTC,Proteaceae,Conospermum,Conospermum ellipticum,3.dicot,native
18/07/2020,2488549,2020-07-18 10:03:19 UTC,Proteaceae,Conospermum,Conospermum ellipticum,3.dicot,native
24/07/2020,2488549,2020-07-24 10:14:25 UTC,Proteaceae,Conospermum,Conospermum ellipticum,3.dicot,native
16/08/2020,2512752,2020-08-16 08:53:07 UTC,Proteaceae,Conospermum,Conospermum ellipticum,3.dicot,native
29/08/2020,2488549,2020-08-29 09:46:21 UTC,Proteaceae,Conospermum,Conospermum ellipticum,3.dicot,native
8/09/2020,3408787,2020-09-10 05:19:12 UTC,Proteaceae,Conospermum,Conospermum ellipticum,3.dicot,native
13/09/2020,3627098,2020-09-18 21:33:45 UTC,Proteaceae,Conospermum,Conospermum ellipticum,3.dicot,native
18/10/2020,265090,2020-10-19 07:40:38 UTC,Proteaceae,Conospermum,Conospermum ellipticum,3.dicot,native
23/10/2020,2488549,2020-10-24 06:34:12 UTC,Proteaceae,Conospermum,Conospermum ellipticum,3.dicot,native
15/11/2020,3313573,2021-01-03 08:52:33 UTC,Proteaceae,Conospermum,Conospermum ellipticum,3.dicot,native
2/07/2019,4743351,2021-08-04 06:25:27 UTC,Proteaceae,Conospermum,Conospermum ellipticum,3.dicot,native
20/10/2018,4359544,2021-08-07 06:25:59 UTC,Proteaceae,Conospermum,Conospermum ellipticum,3.dicot,native
28/08/2021,4095677,2021-08-28 07:36:52 UTC,Proteaceae,Conospermum,Conospermum ellipticum,3.dicot,native
5/09/2021,4916136,2021-09-05 09:29:51 UTC,Proteaceae,Conospermum,Conospermum ellipticum,3.dicot,native
6/09/2021,4887682,2021-09-06 09:06:53 UTC,Proteaceae,Conospermum,Conospermum ellipticum,3.dicot,native
12/09/2021,4025155,2021-09-17 10:31:07 UTC,Proteaceae,Conospermum,Conospermum ellipticum,3.dicot,native
17/09/2021,2488549,2021-09-17 11:13:19 UTC,Proteaceae,Conospermum,Conospermum ellipticum,3.dicot,native
18/09/2021,4944844,2021-09-18 10:22:22 UTC,Proteaceae,Conospermum,Conospermum ellipticum,3.dicot,native
22/09/2021,4916136,2021-09-26 02:53:41 UTC,Proteaceae,Conospermum,Conospermum ellipticum,3.dicot,native
28/09/2021,4916136,2021-09-28 13:15:39 UTC,Proteaceae,Conospermum,Conospermum ellipticum,3.dicot,native
23/09/2021,3893507,2021-09-29 11:35:21 UTC,Proteaceae,Conospermum,Conospermum ellipticum,3.dicot,native
12/10/2021,4743351,2021-10-15 10:56:52 UTC,Proteaceae,Conospermum,Conospermum ellipticum,3.dicot,native
11/10/2021,3313573,2021-10-20 07:00:06 UTC,Proteaceae,Conospermum,Conospermum ellipticum,3.dicot,native
19/10/2021,4743351,2021-10-24 07:28:50 UTC,Proteaceae,Conospermum,Conospermum ellipticum,3.dicot,native
15/07/1989,717200,2022-06-02 06:49:30 UTC,Proteaceae,Conospermum,Conospermum ellipticum,3.dicot,native
24/07/2022,2488549,2022-07-24 04:08:20 UTC,Proteaceae,Conospermum,Conospermum ellipticum,3.dicot,native
24/07/2022,2488549,2022-07-24 04:09:48 UTC,Proteaceae,Conospermum,Conospermum ellipticum,3.dicot,native
6/08/2022,4743351,2022-08-08 11:13:10 UTC,Proteaceae,Conospermum,Conospermum ellipticum,3.dicot,native
20/08/2022,3678274,2022-09-03 02:10:44 UTC,Proteaceae,Conospermum,Conospermum ellipticum,3.dicot,native
22/09/2022,3893507,2022-09-23 12:17:16 UTC,Proteaceae,Conospermum,Conospermum ellipticum,3.dicot,native
24/09/2022,2488549,2022-09-24 11:59:08 UTC,Proteaceae,Conospermum,Conospermum ellipticum,3.dicot,native
3/10/2022,2488549,2022-10-03 07:47:38 UTC,Proteaceae,Conospermum,Conospermum ellipticum,3.dicot,native
3/10/2022,2488549,2022-10-03 07:52:58 UTC,Proteaceae,Conospermum,Conospermum ellipticum,3.dicot,native
4/10/2022,4743351,2022-10-06 09:52:04 UTC,Proteaceae,Conospermum,Conospermum ellipticum,3.dicot,native
25/10/2022,2512752,2022-10-25 22:16:52 UTC,Proteaceae,Conospermum,Conospermum ellipticum,3.dicot,native
10/11/2022,2488549,2022-11-10 10:03:29 UTC,Proteaceae,Conospermum,Conospermum ellipticum,3.dicot,native
17/11/2022,2488549,2022-11-17 02:56:53 UTC,Proteaceae,Conospermum,Conospermum ellipticum,3.dicot,native
17/11/2022,2488549,2022-11-17 02:58:31 UTC,Proteaceae,Conospermum,Conospermum ellipticum,3.dicot,native
19/11/2022,6308282,2022-11-27 08:43:49 UTC,Proteaceae,Conospermum,Conospermum ellipticum,3.dicot,native
29/12/2022,4299702,2022-12-29 03:29:30 UTC,Proteaceae,Conospermum,Conospermum ellipticum,3.dicot,native
3/09/2023,5194154,2023-09-05 04:26:15 UTC,Proteaceae,Conospermum,Conospermum ellipticum,3.dicot,native
29/10/2014,2991,2015-07-23 16:48:53 UTC,Proteaceae,Conospermum,Conospermum longifolium,3.dicot,native
18/07/2020,2488549,2020-07-18 09:24:14 UTC,Proteaceae,Conospermum,Conospermum longifolium,3.dicot,native
18/07/2020,2488549,2020-07-18 09:42:15 UTC,Proteaceae,Conospermum,Conospermum longifolium,3.dicot,native
1/01/2021,2376854,2021-01-01 15:09:31 UTC,Proteaceae,Conospermum,Conospermum longifolium,3.dicot,native
1/01/2021,2376854,2021-01-01 15:17:00 UTC,Proteaceae,Conospermum,Conospermum longifolium,3.dicot,native
21/08/2021,3312793,2021-08-21 03:47:21 UTC,Proteaceae,Conospermum,Conospermum longifolium,3.dicot,native
29/08/2021,2215616,2021-08-28 23:04:54 UTC,Proteaceae,Conospermum,Conospermum longifolium,3.dicot,native
12/09/2021,4095677,2021-09-15 03:35:26 UTC,Proteaceae,Conospermum,Conospermum longifolium,3.dicot,native
23/10/2021,2376854,2021-10-23 12:52:02 UTC,Proteaceae,Conospermum,Conospermum longifolium,3.dicot,native
24/10/2021,2376854,2021-10-24 13:41:47 UTC,Proteaceae,Conospermum,Conospermum longifolium,3.dicot,native
21/10/2021,325733,2021-11-03 01:01:13 UTC,Proteaceae,Conospermum,Conospermum longifolium,3.dicot,native
13/11/2021,325733,2021-11-15 23:35:28 UTC,Proteaceae,Conospermum,Conospermum longifolium,3.dicot,native
28/11/2021,2376854,2021-11-30 04:59:31 UTC,Proteaceae,Conospermum,Conospermum longifolium,3.dicot,native
24/07/2022,2488549,2022-07-24 04:03:42 UTC,Proteaceae,Conospermum,Conospermum longifolium,3.dicot,native
30/07/2022,4743351,2022-08-03 12:23:18 UTC,Proteaceae,Conospermum,Conospermum longifolium,3.dicot,native
25/09/2022,1138587,2022-09-25 06:58:28 UTC,Proteaceae,Conospermum,Conospermum longifolium,3.dicot,native
3/10/2022,2488549,2022-10-03 07:48:22 UTC,Proteaceae,Conospermum,Conospermum longifolium,3.dicot,native
27/10/2022,2631448,2022-10-31 10:38:16 UTC,Proteaceae,Conospermum,Conospermum longifolium,3.dicot,native
28/10/2023,2631448,2023-10-29 01:36:57 UTC,Proteaceae,Conospermum,Conospermum longifolium,3.dicot,native
26/11/2023,1438982,2023-11-29 21:24:14 UTC,Proteaceae,Conospermum,Conospermum longifolium,3.dicot,native
29/08/2021,4916136,2021-08-29 12:24:01 UTC,Proteaceae,Conospermum,Conospermum tenuifolium,3.dicot,native
21/09/2021,4743351,2021-09-22 10:48:02 UTC,Proteaceae,Conospermum,Conospermum tenuifolium,3.dicot,native
30/09/2021,4916136,2021-09-30 08:50:39 UTC,Proteaceae,Conospermum,Conospermum tenuifolium,3.dicot,native
4/10/2021,4916136,2021-10-04 12:32:46 UTC,Proteaceae,Conospermum,Conospermum tenuifolium,3.dicot,native
1/09/2021,2665854,2021-10-22 06:32:02 UTC,Proteaceae,Conospermum,Conospermum tenuifolium,3.dicot,native
22/05/2022,2488549,2022-05-22 11:46:12 UTC,Proteaceae,Conospermum,Conospermum tenuifolium,3.dicot,native
25/09/2022,4743351,2022-12-23 00:57:15 UTC,Proteaceae,Conospermum,Conospermum tenuifolium,3.dicot,native
28/12/2022,2488549,2022-12-28 00:09:52 UTC,Proteaceae,Conospermum,Conospermum tenuifolium,3.dicot,native
28/12/2022,2488549,2022-12-28 02:28:21 UTC,Proteaceae,Conospermum,Conospermum tenuifolium,3.dicot,native
5/08/2020,2488549,2020-08-05 05:27:14 UTC,Asteraceae,Coronidium,Coronidium elatum,3.dicot,native
5/08/2020,793005,2020-08-06 01:06:53 UTC,Asteraceae,Coronidium,Coronidium elatum,3.dicot,native
16/08/2020,2512752,2020-08-16 08:51:38 UTC,Asteraceae,Coronidium,Coronidium elatum,3.dicot,native
29/08/2020,2488549,2020-08-29 03:57:48 UTC,Asteraceae,Coronidium,Coronidium elatum,3.dicot,native
29/08/2020,2488549,2020-08-29 07:41:07 UTC,Asteraceae,Coronidium,Coronidium elatum,3.dicot,native
30/08/2020,3012594,2020-08-30 09:43:28 UTC,Asteraceae,Coronidium,Coronidium elatum,3.dicot,native
8/09/2020,3408787,2020-09-09 00:11:46 UTC,Asteraceae,Coronidium,Coronidium elatum,3.dicot,native
13/09/2020,2472277,2020-09-16 08:06:29 UTC,Asteraceae,Coronidium,Coronidium elatum,3.dicot,native
16/10/2020,2488549,2020-10-16 05:24:21 UTC,Asteraceae,Coronidium,Coronidium elatum,3.dicot,native
16/10/2020,2488549,2020-10-17 02:20:56 UTC,Asteraceae,Coronidium,Coronidium elatum,3.dicot,native
21/11/2020,265090,2020-11-21 22:31:50 UTC,Asteraceae,Coronidium,Coronidium elatum,3.dicot,native
8/09/2020,4743351,2021-07-25 05:14:25 UTC,Asteraceae,Coronidium,Coronidium elatum,3.dicot,native
5/09/2021,4095677,2021-09-05 09:33:56 UTC,Asteraceae,Coronidium,Coronidium elatum,3.dicot,native
12/09/2004,614054,2021-09-17 11:35:47 UTC,Asteraceae,Coronidium,Coronidium elatum,3.dicot,native
18/09/2021,4037891,2021-09-19 02:01:32 UTC,Asteraceae,Coronidium,Coronidium elatum,3.dicot,native
21/09/2021,4743351,2021-09-22 10:48:05 UTC,Asteraceae,Coronidium,Coronidium elatum,3.dicot,native
21/09/2021,4743351,2021-09-23 10:03:42 UTC,Asteraceae,Coronidium,Coronidium elatum,3.dicot,native
24/09/2021,3559742,2021-09-24 04:13:58 UTC,Asteraceae,Coronidium,Coronidium elatum,3.dicot,native
24/09/2021,4887682,2021-09-24 05:43:37 UTC,Asteraceae,Coronidium,Coronidium elatum,3.dicot,native
30/09/2021,2488549,2021-09-30 10:24:33 UTC,Asteraceae,Coronidium,Coronidium elatum,3.dicot,native
1/10/2021,2850357,2021-10-01 05:07:23 UTC,Asteraceae,Coronidium,Coronidium elatum,3.dicot,native
20/09/2021,4916136,2021-10-13 13:08:47 UTC,Asteraceae,Coronidium,Coronidium elatum,3.dicot,native
23/10/2021,3880468,2021-12-22 11:51:11 UTC,Asteraceae,Coronidium,Coronidium elatum,3.dicot,native
1/08/2020,5283632,2022-01-09 13:05:32 UTC,Asteraceae,Coronidium,Coronidium elatum,3.dicot,native
12/04/2022,5448318,2022-04-12 06:28:26 UTC,Asteraceae,Coronidium,Coronidium elatum,3.dicot,native
22/07/2022,4724286,2022-07-22 08:19:36 UTC,Asteraceae,Coronidium,Coronidium elatum,3.dicot,native
10/08/2022,2488549,2022-08-10 10:41:12 UTC,Asteraceae,Coronidium,Coronidium elatum,3.dicot,native
16/09/2022,3678274,2022-09-18 12:59:13 UTC,Asteraceae,Coronidium,Coronidium elatum,3.dicot,native
4/10/2022,4743351,2022-10-06 09:52:10 UTC,Asteraceae,Coronidium,Coronidium elatum,3.dicot,native
19/11/2022,6308282,2022-11-19 09:06:53 UTC,Asteraceae,Coronidium,Coronidium elatum,3.dicot,native
19/11/2022,6308282,2022-11-23 08:10:45 UTC,Asteraceae,Coronidium,Coronidium elatum,3.dicot,native
17/12/2022,37650,2022-12-17 10:31:38 UTC,Asteraceae,Coronidium,Coronidium elatum,3.dicot,native
20/03/2023,1259195,2023-03-26 10:27:38 UTC,Asteraceae,Coronidium,Coronidium elatum,3.dicot,native
29/07/2023,2650798,2023-07-30 10:39:27 UTC,Asteraceae,Coronidium,Coronidium elatum,3.dicot,native
6/08/2023,149222,2023-08-06 04:45:02 UTC,Asteraceae,Coronidium,Coronidium elatum,3.dicot,native
12/08/2023,3936801,2023-08-12 03:38:41 UTC,Asteraceae,Coronidium,Coronidium elatum,3.dicot,native
7/09/2023,2338918,2023-09-07 20:25:59 UTC,Asteraceae,Coronidium,Coronidium elatum,3.dicot,native
26/09/2023,5997026,2023-09-27 05:17:27 UTC,Asteraceae,Coronidium,Coronidium elatum,3.dicot,native
24/09/2023,661392,2023-09-28 09:37:39 UTC,Asteraceae,Coronidium,Coronidium elatum,3.dicot,native
21/10/2023,5739,2023-10-24 00:07:00 UTC,Asteraceae,Coronidium,Coronidium elatum,3.dicot,native
21/10/2023,1708045,2023-10-24 04:41:13 UTC,Asteraceae,Coronidium,Coronidium elatum,3.dicot,native
3/11/2023,4743351,2023-11-05 02:41:02 UTC,Asteraceae,Coronidium,Coronidium elatum,3.dicot,native
15/12/2023,2873764,2023-12-18 02:54:12 UTC,Asteraceae,Coronidium,Coronidium elatum,3.dicot,native
9/09/2023,7901906,2024-03-24 13:00:58 UTC,Asteraceae,Coronidium,Coronidium elatum,3.dicot,native
14/09/2022,745089,2024-03-29 03:51:06 UTC,Asteraceae,Coronidium,Coronidium elatum,3.dicot,native
23/02/2020,45978,2020-02-23 07:24:19 UTC,Asteraceae,Coronidium,Coronidium rutidolepis,3.dicot,native
13/02/2023,2631448,2023-02-18 23:15:33 UTC,Asteraceae,Coronidium,Coronidium scorpioides,3.dicot,native
20/03/2023,1259195,2023-03-26 10:27:50 UTC,Asteraceae,Coronidium,Coronidium scorpioides,3.dicot,native
12/06/2020,2602714,2020-06-12 11:36:24 UTC,Rutaceae,Correa,Correa reflexa,3.dicot,native
23/06/2020,2488549,2020-06-23 06:53:57 UTC,Rutaceae,Correa,Correa reflexa,3.dicot,native
16/07/2020,2488549,2020-07-16 08:56:51 UTC,Rutaceae,Correa,Correa reflexa,3.dicot,native
16/07/2020,2488549,2020-07-16 10:41:32 UTC,Rutaceae,Correa,Correa reflexa,3.dicot,native
18/07/2020,2488549,2020-07-18 10:11:17 UTC,Rutaceae,Correa,Correa reflexa,3.dicot,native
17/07/2020,3063457,2020-07-21 08:42:42 UTC,Rutaceae,Correa,Correa reflexa,3.dicot,native
2/08/2020,2444826,2020-08-02 02:15:10 UTC,Rutaceae,Correa,Correa reflexa,3.dicot,native
16/08/2020,2512752,2020-08-16 08:55:50 UTC,Rutaceae,Correa,Correa reflexa,3.dicot,native
29/08/2020,2488549,2020-08-29 05:27:38 UTC,Rutaceae,Correa,Correa reflexa,3.dicot,native
25/06/2021,3197473,2021-06-25 08:36:29 UTC,Rutaceae,Correa,Correa reflexa,3.dicot,native
12/07/2021,4095677,2021-07-12 06:09:10 UTC,Rutaceae,Correa,Correa reflexa,3.dicot,native
18/08/2020,4743351,2021-07-26 10:27:02 UTC,Rutaceae,Correa,Correa reflexa,3.dicot,native
22/07/2019,4743351,2021-08-04 05:58:49 UTC,Rutaceae,Correa,Correa reflexa,3.dicot,native
3/09/2021,4916136,2021-10-03 13:38:31 UTC,Rutaceae,Correa,Correa reflexa,3.dicot,native
7/08/2022,4045770,2022-08-07 05:57:23 UTC,Rutaceae,Correa,Correa reflexa,3.dicot,native
6/08/2022,4743351,2022-08-08 01:05:23 UTC,Rutaceae,Correa,Correa reflexa,3.dicot,native
26/09/2022,3678274,2022-09-29 03:06:40 UTC,Rutaceae,Correa,Correa reflexa,3.dicot,native
24/08/2022,3880468,2022-10-10 11:09:08 UTC,Rutaceae,Correa,Correa reflexa,3.dicot,native
14/07/2023,6196075,2023-07-14 02:37:00 UTC,Rutaceae,Correa,Correa reflexa,3.dicot,native
14/07/2023,6196075,2023-07-14 02:39:56 UTC,Rutaceae,Correa,Correa reflexa,3.dicot,native
19/07/2023,4916136,2023-07-19 12:49:57 UTC,Rutaceae,Correa,Correa reflexa,3.dicot,native
21/07/2023,6196075,2023-07-21 01:47:48 UTC,Rutaceae,Correa,Correa reflexa,3.dicot,native
11/08/2023,4916136,2023-08-11 05:09:19 UTC,Rutaceae,Correa,Correa reflexa,3.dicot,native
12/08/2023,3936801,2023-08-12 03:54:42 UTC,Rutaceae,Correa,Correa reflexa,3.dicot,native
5/08/2023,4317345,2023-09-07 02:04:09 UTC,Rutaceae,Correa,Correa reflexa,3.dicot,native
5/09/2023,4743351,2023-09-14 11:56:16 UTC,Rutaceae,Correa,Correa reflexa,3.dicot,native
25/09/2023,6199647,2023-09-25 08:51:40 UTC,Rutaceae,Correa,Correa reflexa,3.dicot,native
24/09/2023,1138587,2023-09-27 02:30:58 UTC,Rutaceae,Correa,Correa reflexa,3.dicot,native
17/09/2023,745089,2023-12-09 05:39:27 UTC,Rutaceae,Correa,Correa reflexa,3.dicot,native
22/03/2024,7134096,2024-03-22 08:34:52 UTC,Rutaceae,Correa,Correa reflexa,3.dicot,native
21/04/2024,265090,2024-04-21 05:33:59 UTC,Rutaceae,Correa,Correa reflexa,3.dicot,native
2/05/2021,2488549,2021-05-02 22:27:12 UTC,Poaceae,Cortaderia,Cortaderia selloana,4.monocot,introduced
27/05/2023,5283632,2023-06-05 08:34:16 UTC,Poaceae,Cortaderia,Cortaderia selloana,4.monocot,introduced
5/09/2023,6196075,2023-09-05 10:39:42 UTC,Poaceae,Cortaderia,Cortaderia selloana,4.monocot,introduced
28/10/2023,6585857,2023-10-28 05:19:02 UTC,Poaceae,Cortaderia,Cortaderia selloana,4.monocot,introduced
12/07/2020,2488549,2020-07-12 08:54:33 UTC,Orchidaceae,Corybas,Corybas aconitiflorus,5.monocot-colorful,native
12/06/2021,3678274,2021-07-07 00:54:07 UTC,Orchidaceae,Corybas,Corybas aconitiflorus,5.monocot-colorful,native
18/04/2022,5150898,2022-04-18 08:40:16 UTC,Orchidaceae,Corybas,Corybas aconitiflorus,5.monocot-colorful,native
28/04/2022,2488549,2022-04-28 06:30:51 UTC,Orchidaceae,Corybas,Corybas aconitiflorus,5.monocot-colorful,native
7/05/2022,5188972,2022-05-07 11:08:36 UTC,Orchidaceae,Corybas,Corybas aconitiflorus,5.monocot-colorful,native
14/05/2022,5188972,2022-05-14 11:45:42 UTC,Orchidaceae,Corybas,Corybas aconitiflorus,5.monocot-colorful,native
15/05/2022,2488549,2022-05-15 04:26:08 UTC,Orchidaceae,Corybas,Corybas aconitiflorus,5.monocot-colorful,native
15/05/2022,2488549,2022-05-15 04:26:09 UTC,Orchidaceae,Corybas,Corybas aconitiflorus,5.monocot-colorful,native
15/05/2022,2488549,2022-05-15 04:26:12 UTC,Orchidaceae,Corybas,Corybas aconitiflorus,5.monocot-colorful,native
14/05/2022,3880468,2022-05-15 10:48:01 UTC,Orchidaceae,Corybas,Corybas aconitiflorus,5.monocot-colorful,native
22/05/2022,5150898,2022-05-22 10:14:48 UTC,Orchidaceae,Corybas,Corybas aconitiflorus,5.monocot-colorful,native
28/05/2022,3978191,2022-05-28 05:04:36 UTC,Orchidaceae,Corybas,Corybas aconitiflorus,5.monocot-colorful,native
29/05/2022,5150898,2022-05-29 07:20:57 UTC,Orchidaceae,Corybas,Corybas aconitiflorus,5.monocot-colorful,native
29/05/2022,5150898,2022-05-29 07:22:08 UTC,Orchidaceae,Corybas,Corybas aconitiflorus,5.monocot-colorful,native
29/05/2022,5150898,2022-05-29 07:22:40 UTC,Orchidaceae,Corybas,Corybas aconitiflorus,5.monocot-colorful,native
30/05/2022,5188972,2022-05-30 10:33:43 UTC,Orchidaceae,Corybas,Corybas aconitiflorus,5.monocot-colorful,native
31/05/2022,5150898,2022-05-31 08:26:35 UTC,Orchidaceae,Corybas,Corybas aconitiflorus,5.monocot-colorful,native
9/06/2022,2488549,2022-06-09 04:15:30 UTC,Orchidaceae,Corybas,Corybas aconitiflorus,5.monocot-colorful,native
9/06/2022,2488549,2022-06-09 04:18:30 UTC,Orchidaceae,Corybas,Corybas aconitiflorus,5.monocot-colorful,native
11/06/2022,3880468,2022-06-11 11:21:36 UTC,Orchidaceae,Corybas,Corybas aconitiflorus,5.monocot-colorful,native
23/06/2022,2488549,2022-06-23 04:09:16 UTC,Orchidaceae,Corybas,Corybas aconitiflorus,5.monocot-colorful,native
23/06/2022,2488549,2022-06-23 04:11:47 UTC,Orchidaceae,Corybas,Corybas aconitiflorus,5.monocot-colorful,native
25/06/2022,5150898,2022-06-26 05:26:34 UTC,Orchidaceae,Corybas,Corybas aconitiflorus,5.monocot-colorful,native
8/04/2023,5188972,2023-04-08 08:02:40 UTC,Orchidaceae,Corybas,Corybas aconitiflorus,5.monocot-colorful,native
30/04/2023,3978191,2023-04-30 08:53:32 UTC,Orchidaceae,Corybas,Corybas aconitiflorus,5.monocot-colorful,native
2/06/2023,5188972,2023-06-02 11:05:47 UTC,Orchidaceae,Corybas,Corybas aconitiflorus,5.monocot-colorful,native
28/05/2023,4317345,2023-06-09 11:08:33 UTC,Orchidaceae,Corybas,Corybas aconitiflorus,5.monocot-colorful,native
10/06/2023,5150898,2023-06-10 04:45:24 UTC,Orchidaceae,Corybas,Corybas aconitiflorus,5.monocot-colorful,native
11/06/2023,5150898,2023-06-11 09:31:55 UTC,Orchidaceae,Corybas,Corybas aconitiflorus,5.monocot-colorful,native
15/06/2023,2488549,2023-06-15 03:34:40 UTC,Orchidaceae,Corybas,Corybas aconitiflorus,5.monocot-colorful,native
15/06/2023,2488549,2023-06-15 03:45:30 UTC,Orchidaceae,Corybas,Corybas aconitiflorus,5.monocot-colorful,native
17/06/2023,5150898,2023-06-17 06:58:33 UTC,Orchidaceae,Corybas,Corybas aconitiflorus,5.monocot-colorful,native
17/06/2023,5150898,2023-06-17 07:01:55 UTC,Orchidaceae,Corybas,Corybas aconitiflorus,5.monocot-colorful,native
17/06/2023,2376854,2023-06-18 23:58:02 UTC,Orchidaceae,Corybas,Corybas aconitiflorus,5.monocot-colorful,native
22/06/2023,2488549,2023-06-22 03:39:40 UTC,Orchidaceae,Corybas,Corybas aconitiflorus,5.monocot-colorful,native
24/06/2023,5150898,2023-06-24 09:05:50 UTC,Orchidaceae,Corybas,Corybas aconitiflorus,5.monocot-colorful,native
24/06/2023,4025155,2023-06-25 00:02:24 UTC,Orchidaceae,Corybas,Corybas aconitiflorus,5.monocot-colorful,native
1/07/2023,3978191,2023-07-01 09:55:04 UTC,Orchidaceae,Corybas,Corybas aconitiflorus,5.monocot-colorful,native
25/04/2024,4317345,2024-04-26 12:22:23 UTC,Orchidaceae,Corybas,Corybas aconitiflorus,5.monocot-colorful,native
17/05/2024,5188972,2024-05-17 13:55:07 UTC,Orchidaceae,Corybas,Corybas aconitiflorus,5.monocot-colorful,native
19/05/2024,5150898,2024-05-19 07:59:58 UTC,Orchidaceae,Corybas,Corybas aconitiflorus,5.monocot-colorful,native
19/05/2024,5150898,2024-05-19 08:01:02 UTC,Orchidaceae,Corybas,Corybas aconitiflorus,5.monocot-colorful,native
25/05/2024,4317345,2024-05-25 05:12:26 UTC,Orchidaceae,Corybas,Corybas aconitiflorus,5.monocot-colorful,native
16/07/2023,2366151,2023-07-16 11:13:04 UTC,Orchidaceae,Corybas,Corybas barbarae,5.monocot-colorful,native
16/07/2023,2376854,2023-07-16 15:22:35 UTC,Orchidaceae,Corybas,Corybas barbarae,5.monocot-colorful,native
10/06/2020,2701041,2020-06-10 21:45:01 UTC,Orchidaceae,Corybas,Corybas fimbriatus,5.monocot-colorful,native
14/05/2022,3880468,2022-05-15 10:48:05 UTC,Orchidaceae,Corybas,Corybas fimbriatus,5.monocot-colorful,native
22/05/2022,5150898,2022-05-27 04:19:55 UTC,Orchidaceae,Corybas,Corybas fimbriatus,5.monocot-colorful,native
13/06/2022,5150898,2022-06-13 04:49:16 UTC,Orchidaceae,Corybas,Corybas fimbriatus,5.monocot-colorful,native
4/06/2023,5150898,2023-06-04 00:39:44 UTC,Orchidaceae,Corybas,Corybas fimbriatus,5.monocot-colorful,native
15/06/2023,2488549,2023-06-15 03:34:42 UTC,Orchidaceae,Corybas,Corybas fimbriatus,5.monocot-colorful,native
17/06/2023,5150898,2023-06-17 06:53:19 UTC,Orchidaceae,Corybas,Corybas fimbriatus,5.monocot-colorful,native
1/07/2023,3978191,2023-07-01 09:48:43 UTC,Orchidaceae,Corybas,Corybas fimbriatus,5.monocot-colorful,native
28/05/2020,3114986,2020-06-03 05:34:30 UTC,Orchidaceae,Corybas,Corybas pruinosus,5.monocot-colorful,native
28/05/2020,3114986,2020-06-03 05:34:30 UTC,Orchidaceae,Corybas,Corybas pruinosus,5.monocot-colorful,native
28/05/2020,3114986,2020-06-03 05:34:30 UTC,Orchidaceae,Corybas,Corybas pruinosus,5.monocot-colorful,native
15/05/2022,2488549,2022-05-15 04:26:06 UTC,Orchidaceae,Corybas,Corybas pruinosus,5.monocot-colorful,native
15/05/2022,2488549,2022-05-15 04:26:07 UTC,Orchidaceae,Corybas,Corybas pruinosus,5.monocot-colorful,native
15/05/2022,2488549,2022-05-15 04:26:08 UTC,Orchidaceae,Corybas,Corybas pruinosus,5.monocot-colorful,native
15/05/2022,2488549,2022-05-15 04:26:09 UTC,Orchidaceae,Corybas,Corybas pruinosus,5.monocot-colorful,native
15/05/2022,2488549,2022-05-15 04:26:10 UTC,Orchidaceae,Corybas,Corybas pruinosus,5.monocot-colorful,native
14/05/2022,3880468,2022-05-15 10:48:06 UTC,Orchidaceae,Corybas,Corybas pruinosus,5.monocot-colorful,native
22/05/2022,5150898,2022-05-22 10:11:30 UTC,Orchidaceae,Corybas,Corybas pruinosus,5.monocot-colorful,native
22/05/2022,5150898,2022-05-22 10:12:27 UTC,Orchidaceae,Corybas,Corybas pruinosus,5.monocot-colorful,native
29/05/2022,1330037,2022-05-29 08:29:13 UTC,Orchidaceae,Corybas,Corybas pruinosus,5.monocot-colorful,native
27/05/2023,3978191,2023-05-27 08:13:13 UTC,Orchidaceae,Corybas,Corybas pruinosus,5.monocot-colorful,native
27/05/2023,3978191,2023-05-27 08:15:31 UTC,Orchidaceae,Corybas,Corybas pruinosus,5.monocot-colorful,native
27/05/2023,3978191,2023-05-27 08:21:58 UTC,Orchidaceae,Corybas,Corybas pruinosus,5.monocot-colorful,native
27/05/2023,3978191,2023-05-27 08:26:52 UTC,Orchidaceae,Corybas,Corybas pruinosus,5.monocot-colorful,native
3/06/2023,6621251,2023-06-03 22:20:39 UTC,Orchidaceae,Corybas,Corybas pruinosus,5.monocot-colorful,native
4/06/2023,3978191,2023-06-04 07:31:26 UTC,Orchidaceae,Corybas,Corybas pruinosus,5.monocot-colorful,native
4/06/2023,3978191,2023-06-04 07:49:21 UTC,Orchidaceae,Corybas,Corybas pruinosus,5.monocot-colorful,native
10/06/2023,357410,2023-06-10 11:54:42 UTC,Orchidaceae,Corybas,Corybas pruinosus,5.monocot-colorful,native
12/06/2023,3728593,2023-06-12 07:07:17 UTC,Orchidaceae,Corybas,Corybas pruinosus,5.monocot-colorful,native
15/06/2023,2488549,2023-06-15 03:34:40 UTC,Orchidaceae,Corybas,Corybas pruinosus,5.monocot-colorful,native
15/06/2023,2488549,2023-06-15 03:34:40 UTC,Orchidaceae,Corybas,Corybas pruinosus,5.monocot-colorful,native
15/06/2023,2488549,2023-06-15 03:34:42 UTC,Orchidaceae,Corybas,Corybas pruinosus,5.monocot-colorful,native
17/06/2023,5150898,2023-06-17 06:48:11 UTC,Orchidaceae,Corybas,Corybas pruinosus,5.monocot-colorful,native
17/06/2023,5150898,2023-06-17 06:52:40 UTC,Orchidaceae,Corybas,Corybas pruinosus,5.monocot-colorful,native
1/07/2023,3978191,2023-07-01 09:52:17 UTC,Orchidaceae,Corybas,Corybas pruinosus,5.monocot-colorful,native
22/07/2023,3978191,2023-07-22 09:02:51 UTC,Orchidaceae,Corybas,Corybas pruinosus,5.monocot-colorful,native
19/05/2024,3978191,2024-05-20 06:40:50 UTC,Orchidaceae,Corybas,Corybas pruinosus,5.monocot-colorful,native
19/05/2022,5150898,2022-05-19 05:00:59 UTC,Orchidaceae,Corybas,Corybas undulatus,5.monocot-colorful,native
24/06/2023,2488549,2023-06-24 09:56:00 UTC,Orchidaceae,Corybas,Corybas undulatus,5.monocot-colorful,native
25/06/2023,2376854,2023-06-26 15:25:15 UTC,Orchidaceae,Corybas,Corybas undulatus,5.monocot-colorful,native
25/06/2023,2376854,2023-06-26 15:25:15 UTC,Orchidaceae,Corybas,Corybas undulatus,5.monocot-colorful,native
30/05/2022,5188972,2022-05-30 11:04:23 UTC,Orchidaceae,Corybas,Corybas unguiculatus,5.monocot-colorful,native
31/05/2022,5150898,2022-05-31 08:28:15 UTC,Orchidaceae,Corybas,Corybas unguiculatus,5.monocot-colorful,native
19/06/2022,5188972,2022-06-19 12:29:18 UTC,Orchidaceae,Corybas,Corybas unguiculatus,5.monocot-colorful,native
24/06/2022,2376854,2022-08-12 14:39:32 UTC,Orchidaceae,Corybas,Corybas unguiculatus,5.monocot-colorful,native
24/06/2022,2376854,2022-08-12 14:39:32 UTC,Orchidaceae,Corybas,Corybas unguiculatus,5.monocot-colorful,native
24/06/2022,2376854,2022-08-12 14:39:32 UTC,Orchidaceae,Corybas,Corybas unguiculatus,5.monocot-colorful,native
28/05/2023,2376854,2023-05-28 15:27:26 UTC,Orchidaceae,Corybas,Corybas unguiculatus,5.monocot-colorful,native
10/06/2023,5150898,2023-06-10 04:45:47 UTC,Orchidaceae,Corybas,Corybas unguiculatus,5.monocot-colorful,native
9/06/2023,3880468,2023-06-11 12:18:44 UTC,Orchidaceae,Corybas,Corybas unguiculatus,5.monocot-colorful,native
17/06/2023,2376854,2023-06-19 12:08:21 UTC,Orchidaceae,Corybas,Corybas unguiculatus,5.monocot-colorful,native
17/06/2023,2376854,2023-06-19 12:08:21 UTC,Orchidaceae,Corybas,Corybas unguiculatus,5.monocot-colorful,native
17/06/2023,2376854,2023-06-19 12:08:22 UTC,Orchidaceae,Corybas,Corybas unguiculatus,5.monocot-colorful,native
17/06/2023,2376854,2023-06-19 12:08:23 UTC,Orchidaceae,Corybas,Corybas unguiculatus,5.monocot-colorful,native
17/06/2023,2376854,2023-06-19 12:08:25 UTC,Orchidaceae,Corybas,Corybas unguiculatus,5.monocot-colorful,native
24/06/2023,2488549,2023-06-24 09:55:55 UTC,Orchidaceae,Corybas,Corybas unguiculatus,5.monocot-colorful,native
24/06/2023,2488549,2023-06-24 09:55:59 UTC,Orchidaceae,Corybas,Corybas unguiculatus,5.monocot-colorful,native
25/06/2023,2376854,2023-06-26 15:25:15 UTC,Orchidaceae,Corybas,Corybas unguiculatus,5.monocot-colorful,native
19/04/2019,45978,2019-04-19 07:09:31 UTC,Myrtaceae,Corymbia,Corymbia gummifera,3.dicot,native
18/01/2020,2488549,2020-01-18 09:42:13 UTC,Myrtaceae,Corymbia,Corymbia gummifera,3.dicot,native
15/02/2020,2488549,2020-02-15 10:21:47 UTC,Myrtaceae,Corymbia,Corymbia gummifera,3.dicot,native
30/04/2022,1138587,2022-04-30 08:39:41 UTC,Myrtaceae,Corymbia,Corymbia gummifera,3.dicot,native
24/07/2022,265090,2022-07-24 20:58:44 UTC,Myrtaceae,Corymbia,Corymbia gummifera,3.dicot,native
14/08/2022,265090,2022-08-14 07:29:13 UTC,Myrtaceae,Corymbia,Corymbia gummifera,3.dicot,native
9/03/2023,1658043,2023-03-13 07:22:48 UTC,Myrtaceae,Corymbia,Corymbia gummifera,3.dicot,native
3/06/2023,4095677,2023-06-04 02:19:16 UTC,Myrtaceae,Corymbia,Corymbia gummifera,3.dicot,native
25/11/2023,3408787,2023-12-07 12:58:06 UTC,Myrtaceae,Corymbia,Corymbia gummifera,3.dicot,native
11/12/2023,164735,2023-12-17 15:14:46 UTC,Myrtaceae,Corymbia,Corymbia gummifera,3.dicot,native
2/01/2024,661392,2024-01-02 06:14:28 UTC,Myrtaceae,Corymbia,Corymbia gummifera,3.dicot,native
2/01/2024,1138587,2024-01-02 07:38:43 UTC,Myrtaceae,Corymbia,Corymbia gummifera,3.dicot,native
23/01/2024,485705,2024-01-25 00:31:42 UTC,Myrtaceae,Corymbia,Corymbia gummifera,3.dicot,native
10/02/2024,1138587,2024-02-10 06:52:16 UTC,Myrtaceae,Corymbia,Corymbia gummifera,3.dicot,native
20/02/2024,4743351,2024-02-20 23:21:06 UTC,Myrtaceae,Corymbia,Corymbia gummifera,3.dicot,native
20/02/2024,4743351,2024-02-20 23:21:16 UTC,Myrtaceae,Corymbia,Corymbia gummifera,3.dicot,native
11/10/2020,2488549,2020-10-12 09:24:30 UTC,Crassulaceae,Crassula,Crassula multicava,3.dicot,introduced
10/02/2024,1138587,2024-02-10 07:02:55 UTC,Crassulaceae,Crassula,Crassula multicava,3.dicot,introduced
13/06/2015,64271,2015-06-20 13:14:52 UTC,Rutaceae,Crowea,Crowea saligna,3.dicot,native
24/04/2017,455905,2017-04-24 05:22:50 UTC,Rutaceae,Crowea,Crowea saligna,3.dicot,native
24/04/2017,458427,2017-06-08 13:46:08 UTC,Rutaceae,Crowea,Crowea saligna,3.dicot,native
19/04/2019,45978,2019-04-19 07:13:51 UTC,Rutaceae,Crowea,Crowea saligna,3.dicot,native
15/02/2020,2488549,2020-02-15 09:42:43 UTC,Rutaceae,Crowea,Crowea saligna,3.dicot,native
9/03/2020,2488549,2020-03-09 09:35:29 UTC,Rutaceae,Crowea,Crowea saligna,3.dicot,native
21/03/2020,485705,2020-03-24 07:46:29 UTC,Rutaceae,Crowea,Crowea saligna,3.dicot,native
28/03/2020,2677090,2020-03-28 01:32:11 UTC,Rutaceae,Crowea,Crowea saligna,3.dicot,native
9/04/2020,2723279,2020-04-10 11:19:55 UTC,Rutaceae,Crowea,Crowea saligna,3.dicot,native
17/04/2020,2488549,2020-04-18 02:29:21 UTC,Rutaceae,Crowea,Crowea saligna,3.dicot,native
24/04/2020,2488549,2020-04-24 12:13:21 UTC,Rutaceae,Crowea,Crowea saligna,3.dicot,native
26/04/2020,2488549,2020-04-26 02:49:48 UTC,Rutaceae,Crowea,Crowea saligna,3.dicot,native
23/05/2020,62599,2020-05-23 10:02:58 UTC,Rutaceae,Crowea,Crowea saligna,3.dicot,native
23/06/2020,2488549,2020-06-23 06:03:30 UTC,Rutaceae,Crowea,Crowea saligna,3.dicot,native
5/07/2020,265090,2020-07-05 20:08:20 UTC,Rutaceae,Crowea,Crowea saligna,3.dicot,native
12/08/2020,2488549,2020-08-12 04:57:22 UTC,Rutaceae,Crowea,Crowea saligna,3.dicot,native
21/08/2020,2488549,2020-08-21 11:56:39 UTC,Rutaceae,Crowea,Crowea saligna,3.dicot,native
28/02/2021,2376854,2021-02-28 12:08:23 UTC,Rutaceae,Crowea,Crowea saligna,3.dicot,native
28/02/2021,2376854,2021-02-28 12:10:00 UTC,Rutaceae,Crowea,Crowea saligna,3.dicot,native
1/04/2021,3527375,2021-04-06 07:01:38 UTC,Rutaceae,Crowea,Crowea saligna,3.dicot,native
8/04/2021,325733,2021-04-09 12:17:51 UTC,Rutaceae,Crowea,Crowea saligna,3.dicot,native
1/05/2021,2738946,2021-05-01 10:06:48 UTC,Rutaceae,Crowea,Crowea saligna,3.dicot,native
26/01/2004,614054,2021-07-03 10:34:31 UTC,Rutaceae,Crowea,Crowea saligna,3.dicot,native
15/06/2021,4743351,2021-07-20 05:32:46 UTC,Rutaceae,Crowea,Crowea saligna,3.dicot,native
16/04/2021,4743351,2021-07-21 03:11:12 UTC,Rutaceae,Crowea,Crowea saligna,3.dicot,native
9/04/2021,3678274,2021-08-05 00:27:06 UTC,Rutaceae,Crowea,Crowea saligna,3.dicot,native
22/01/2022,2317723,2022-01-28 01:37:15 UTC,Rutaceae,Crowea,Crowea saligna,3.dicot,native
6/02/2022,4194794,2022-02-06 02:09:14 UTC,Rutaceae,Crowea,Crowea saligna,3.dicot,native
11/01/2022,4743351,2022-02-09 10:09:24 UTC,Rutaceae,Crowea,Crowea saligna,3.dicot,native
13/02/2022,1980689,2022-02-13 07:56:58 UTC,Rutaceae,Crowea,Crowea saligna,3.dicot,native
10/03/2022,2488549,2022-03-10 10:40:05 UTC,Rutaceae,Crowea,Crowea saligna,3.dicot,native
13/03/2022,4916136,2022-03-14 02:43:50 UTC,Rutaceae,Crowea,Crowea saligna,3.dicot,native
5/04/2022,4743351,2022-04-06 05:37:14 UTC,Rutaceae,Crowea,Crowea saligna,3.dicot,native
15/04/2022,2488549,2022-04-15 09:02:22 UTC,Rutaceae,Crowea,Crowea saligna,3.dicot,native
16/04/2022,3751299,2022-04-16 04:55:10 UTC,Rutaceae,Crowea,Crowea saligna,3.dicot,native
3/05/2022,814216,2022-05-03 06:27:04 UTC,Rutaceae,Crowea,Crowea saligna,3.dicot,native
7/05/2022,2399118,2022-05-13 04:33:50 UTC,Rutaceae,Crowea,Crowea saligna,3.dicot,native
27/03/2022,3425899,2022-06-23 08:22:32 UTC,Rutaceae,Crowea,Crowea saligna,3.dicot,native
26/06/2022,2322306,2022-06-26 10:07:38 UTC,Rutaceae,Crowea,Crowea saligna,3.dicot,native
24/04/2022,3221790,2022-06-29 10:34:23 UTC,Rutaceae,Crowea,Crowea saligna,3.dicot,native
17/07/2022,3880468,2022-07-18 10:01:09 UTC,Rutaceae,Crowea,Crowea saligna,3.dicot,native
24/07/2022,265090,2022-07-25 09:57:00 UTC,Rutaceae,Crowea,Crowea saligna,3.dicot,native
27/07/2022,5283632,2022-07-27 08:32:46 UTC,Rutaceae,Crowea,Crowea saligna,3.dicot,native
14/08/2022,265090,2022-08-14 06:31:54 UTC,Rutaceae,Crowea,Crowea saligna,3.dicot,native
27/01/2023,6209647,2023-01-28 10:40:19 UTC,Rutaceae,Crowea,Crowea saligna,3.dicot,native
13/02/2023,2631448,2023-02-13 11:52:08 UTC,Rutaceae,Crowea,Crowea saligna,3.dicot,native
12/02/2023,4743351,2023-02-14 02:07:13 UTC,Rutaceae,Crowea,Crowea saligna,3.dicot,native
10/04/2019,6097168,2023-03-07 01:25:42 UTC,Rutaceae,Crowea,Crowea saligna,3.dicot,native
12/03/2023,6566631,2023-03-12 06:05:45 UTC,Rutaceae,Crowea,Crowea saligna,3.dicot,native
9/03/2023,1658043,2023-03-13 07:22:35 UTC,Rutaceae,Crowea,Crowea saligna,3.dicot,native
16/03/2023,1175154,2023-03-16 22:44:54 UTC,Rutaceae,Crowea,Crowea saligna,3.dicot,native
28/04/2023,5989765,2023-04-29 02:11:24 UTC,Rutaceae,Crowea,Crowea saligna,3.dicot,native
25/06/2023,5300031,2023-06-25 05:32:44 UTC,Rutaceae,Crowea,Crowea saligna,3.dicot,native
10/08/2023,2379395,2023-12-05 05:23:47 UTC,Rutaceae,Crowea,Crowea saligna,3.dicot,native
8/02/2024,2663646,2024-02-08 22:28:13 UTC,Rutaceae,Crowea,Crowea saligna,3.dicot,native
10/02/2024,1138587,2024-02-10 07:12:40 UTC,Rutaceae,Crowea,Crowea saligna,3.dicot,native
10/02/2024,1138587,2024-02-10 07:12:40 UTC,Rutaceae,Crowea,Crowea saligna,3.dicot,native
11/02/2024,4672448,2024-02-11 04:00:34 UTC,Rutaceae,Crowea,Crowea saligna,3.dicot,native
12/02/2024,4824275,2024-02-12 04:40:54 UTC,Rutaceae,Crowea,Crowea saligna,3.dicot,native
20/02/2024,4743351,2024-02-20 23:21:12 UTC,Rutaceae,Crowea,Crowea saligna,3.dicot,native
25/03/2024,2531563,2024-03-26 04:10:05 UTC,Rutaceae,Crowea,Crowea saligna,3.dicot,native
3/03/2024,2442561,2024-03-27 19:52:36 UTC,Rutaceae,Crowea,Crowea saligna,3.dicot,native
14/09/2022,745089,2024-03-29 03:31:50 UTC,Rutaceae,Crowea,Crowea saligna,3.dicot,native
21/04/2024,265090,2024-04-21 04:48:09 UTC,Rutaceae,Crowea,Crowea saligna,3.dicot,native
26/04/2020,2488549,2020-04-26 08:28:17 UTC,Rhamnaceae,Cryptandra,Cryptandra amara,3.dicot,native
2/06/2020,2871822,2020-06-03 01:17:49 UTC,Rhamnaceae,Cryptandra,Cryptandra amara,3.dicot,native
22/05/2022,2488549,2022-05-22 11:46:11 UTC,Rhamnaceae,Cryptandra,Cryptandra amara,3.dicot,native
5/06/2022,2376854,2022-06-14 16:41:45 UTC,Rhamnaceae,Cryptandra,Cryptandra amara,3.dicot,native
24/05/2022,3425899,2022-06-23 08:19:10 UTC,Rhamnaceae,Cryptandra,Cryptandra amara,3.dicot,native
24/07/2022,265090,2022-07-25 19:36:10 UTC,Rhamnaceae,Cryptandra,Cryptandra amara,3.dicot,native
1/04/2023,3978191,2023-04-02 07:21:00 UTC,Rhamnaceae,Cryptandra,Cryptandra amara,3.dicot,native
25/04/2023,2376854,2023-04-29 16:58:02 UTC,Rhamnaceae,Cryptandra,Cryptandra amara,3.dicot,native
25/05/2023,2488549,2023-05-25 08:55:17 UTC,Rhamnaceae,Cryptandra,Cryptandra amara,3.dicot,native
28/05/2023,2376854,2023-05-28 15:27:24 UTC,Rhamnaceae,Cryptandra,Cryptandra amara,3.dicot,native
27/05/2023,6209647,2023-05-28 15:56:54 UTC,Rhamnaceae,Cryptandra,Cryptandra amara,3.dicot,native
25/06/2023,2376854,2023-06-26 15:25:13 UTC,Rhamnaceae,Cryptandra,Cryptandra amara,3.dicot,native
21/07/2023,6196075,2023-07-21 05:19:57 UTC,Rhamnaceae,Cryptandra,Cryptandra amara,3.dicot,native
20/03/2022,5037697,2022-03-20 08:55:55 UTC,Rhamnaceae,Cryptandra,Cryptandra ericoides,3.dicot,native
22/05/2022,2488549,2022-05-23 06:44:25 UTC,Rhamnaceae,Cryptandra,Cryptandra ericoides,3.dicot,native
2/01/2019,1284296,2020-02-25 20:51:11 UTC,Orchidaceae,Cryptostylis,Cryptostylis erecta,5.monocot-colorful,native
8/12/2020,793005,2020-12-28 15:43:22 UTC,Orchidaceae,Cryptostylis,Cryptostylis erecta,5.monocot-colorful,native
1/01/2021,2376854,2021-01-01 14:36:42 UTC,Orchidaceae,Cryptostylis,Cryptostylis erecta,5.monocot-colorful,native
7/01/2021,3564126,2021-01-07 03:18:55 UTC,Orchidaceae,Cryptostylis,Cryptostylis erecta,5.monocot-colorful,native
23/10/2021,3880468,2021-10-24 11:10:40 UTC,Orchidaceae,Cryptostylis,Cryptostylis erecta,5.monocot-colorful,native
14/11/2021,5150898,2021-11-18 10:08:50 UTC,Orchidaceae,Cryptostylis,Cryptostylis erecta,5.monocot-colorful,native
20/11/2021,2488549,2021-11-20 10:17:46 UTC,Orchidaceae,Cryptostylis,Cryptostylis erecta,5.monocot-colorful,native
28/11/2021,2376854,2021-11-30 14:37:18 UTC,Orchidaceae,Cryptostylis,Cryptostylis erecta,5.monocot-colorful,native
17/12/2021,2488549,2021-12-17 09:59:14 UTC,Orchidaceae,Cryptostylis,Cryptostylis erecta,5.monocot-colorful,native
17/12/2021,2488549,2021-12-17 09:59:14 UTC,Orchidaceae,Cryptostylis,Cryptostylis erecta,5.monocot-colorful,native
17/12/2021,2488549,2021-12-17 09:59:15 UTC,Orchidaceae,Cryptostylis,Cryptostylis erecta,5.monocot-colorful,native
18/12/2021,2376854,2021-12-21 02:29:28 UTC,Orchidaceae,Cryptostylis,Cryptostylis erecta,5.monocot-colorful,native
25/12/2021,5150898,2021-12-24 23:22:18 UTC,Orchidaceae,Cryptostylis,Cryptostylis erecta,5.monocot-colorful,native
25/12/2021,5150898,2021-12-24 23:22:57 UTC,Orchidaceae,Cryptostylis,Cryptostylis erecta,5.monocot-colorful,native
25/12/2021,5150898,2021-12-25 00:24:06 UTC,Orchidaceae,Cryptostylis,Cryptostylis erecta,5.monocot-colorful,native
4/01/2022,5150898,2022-01-04 10:08:31 UTC,Orchidaceae,Cryptostylis,Cryptostylis erecta,5.monocot-colorful,native
9/01/2022,3880468,2022-01-09 12:36:34 UTC,Orchidaceae,Cryptostylis,Cryptostylis erecta,5.monocot-colorful,native
29/01/2022,5150898,2022-01-30 04:37:25 UTC,Orchidaceae,Cryptostylis,Cryptostylis erecta,5.monocot-colorful,native
30/01/2022,5330029,2022-02-08 03:25:52 UTC,Orchidaceae,Cryptostylis,Cryptostylis erecta,5.monocot-colorful,native
13/02/2022,4037891,2022-02-13 08:55:07 UTC,Orchidaceae,Cryptostylis,Cryptostylis erecta,5.monocot-colorful,native
30/01/2022,2376854,2022-03-14 15:33:25 UTC,Orchidaceae,Cryptostylis,Cryptostylis erecta,5.monocot-colorful,native
11/12/2022,6332085,2022-12-11 07:14:51 UTC,Orchidaceae,Cryptostylis,Cryptostylis erecta,5.monocot-colorful,native
16/12/2022,5150898,2022-12-16 23:05:26 UTC,Orchidaceae,Cryptostylis,Cryptostylis erecta,5.monocot-colorful,native
16/12/2022,5150898,2022-12-16 23:06:00 UTC,Orchidaceae,Cryptostylis,Cryptostylis erecta,5.monocot-colorful,native
28/12/2022,2488549,2022-12-28 00:09:08 UTC,Orchidaceae,Cryptostylis,Cryptostylis erecta,5.monocot-colorful,native
28/12/2022,2488549,2022-12-28 00:21:50 UTC,Orchidaceae,Cryptostylis,Cryptostylis erecta,5.monocot-colorful,native
28/12/2022,2488549,2022-12-28 02:21:38 UTC,Orchidaceae,Cryptostylis,Cryptostylis erecta,5.monocot-colorful,native
10/12/2022,3843404,2023-01-13 00:38:52 UTC,Orchidaceae,Cryptostylis,Cryptostylis erecta,5.monocot-colorful,native
13/01/2023,5188972,2023-01-13 09:17:18 UTC,Orchidaceae,Cryptostylis,Cryptostylis erecta,5.monocot-colorful,native
21/01/2023,5453857,2023-01-21 10:13:47 UTC,Orchidaceae,Cryptostylis,Cryptostylis erecta,5.monocot-colorful,native
25/01/2023,6029661,2023-01-25 03:35:00 UTC,Orchidaceae,Cryptostylis,Cryptostylis erecta,5.monocot-colorful,native
25/01/2023,2873764,2023-02-08 08:05:28 UTC,Orchidaceae,Cryptostylis,Cryptostylis erecta,5.monocot-colorful,native
11/02/2023,5188972,2023-02-11 09:06:51 UTC,Orchidaceae,Cryptostylis,Cryptostylis erecta,5.monocot-colorful,native
11/12/2022,6224734,2023-02-24 23:25:09 UTC,Orchidaceae,Cryptostylis,Cryptostylis erecta,5.monocot-colorful,native
25/02/2023,3653978,2023-02-25 07:04:42 UTC,Orchidaceae,Cryptostylis,Cryptostylis erecta,5.monocot-colorful,native
2/03/2023,5183897,2023-03-02 01:42:08 UTC,Orchidaceae,Cryptostylis,Cryptostylis erecta,5.monocot-colorful,native
11/03/2023,745089,2023-03-18 20:23:59 UTC,Orchidaceae,Cryptostylis,Cryptostylis erecta,5.monocot-colorful,native
26/03/2023,149222,2023-03-26 06:37:12 UTC,Orchidaceae,Cryptostylis,Cryptostylis erecta,5.monocot-colorful,native
26/03/2023,2650798,2023-03-26 23:29:43 UTC,Orchidaceae,Cryptostylis,Cryptostylis erecta,5.monocot-colorful,native
28/05/2023,4095677,2023-05-28 23:48:18 UTC,Orchidaceae,Cryptostylis,Cryptostylis erecta,5.monocot-colorful,native
18/12/2022,151454,2023-09-26 01:24:32 UTC,Orchidaceae,Cryptostylis,Cryptostylis erecta,5.monocot-colorful,native
18/11/2023,3653978,2023-11-18 09:51:06 UTC,Orchidaceae,Cryptostylis,Cryptostylis erecta,5.monocot-colorful,native
18/11/2023,2376854,2023-12-01 04:37:18 UTC,Orchidaceae,Cryptostylis,Cryptostylis erecta,5.monocot-colorful,native
15/12/2023,7471329,2023-12-15 07:30:06 UTC,Orchidaceae,Cryptostylis,Cryptostylis erecta,5.monocot-colorful,native
15/12/2023,2873764,2023-12-18 02:54:06 UTC,Orchidaceae,Cryptostylis,Cryptostylis erecta,5.monocot-colorful,native
15/12/2023,2873764,2023-12-18 02:54:10 UTC,Orchidaceae,Cryptostylis,Cryptostylis erecta,5.monocot-colorful,native
22/12/2023,6433690,2023-12-22 04:44:52 UTC,Orchidaceae,Cryptostylis,Cryptostylis erecta,5.monocot-colorful,native
4/01/2024,6908976,2024-01-04 04:02:16 UTC,Orchidaceae,Cryptostylis,Cryptostylis erecta,5.monocot-colorful,native
2/01/2024,7707818,2024-01-04 09:15:12 UTC,Orchidaceae,Cryptostylis,Cryptostylis erecta,5.monocot-colorful,native
5/01/2024,3712636,2024-01-05 09:22:41 UTC,Orchidaceae,Cryptostylis,Cryptostylis erecta,5.monocot-colorful,native
6/01/2024,325733,2024-01-26 21:53:06 UTC,Orchidaceae,Cryptostylis,Cryptostylis erecta,5.monocot-colorful,native
8/02/2024,2663646,2024-02-08 22:22:36 UTC,Orchidaceae,Cryptostylis,Cryptostylis erecta,5.monocot-colorful,native
3/02/2024,3311964,2024-02-11 09:01:56 UTC,Orchidaceae,Cryptostylis,Cryptostylis erecta,5.monocot-colorful,native
3/01/2022,5150898,2022-01-03 09:35:58 UTC,Orchidaceae,Cryptostylis,Cryptostylis hunteriana,5.monocot-colorful,native
23/01/2022,149222,2022-01-23 21:14:33 UTC,Orchidaceae,Cryptostylis,Cryptostylis hunteriana,5.monocot-colorful,native
31/01/2021,265090,2021-01-31 05:53:51 UTC,Orchidaceae,Cryptostylis,Cryptostylis leptochila,5.monocot-colorful,native
31/01/2021,265090,2021-01-31 06:00:05 UTC,Orchidaceae,Cryptostylis,Cryptostylis leptochila,5.monocot-colorful,native
14/11/2021,5150898,2021-11-19 10:56:09 UTC,Orchidaceae,Cryptostylis,Cryptostylis leptochila,5.monocot-colorful,native
16/12/2021,2488549,2021-12-16 10:03:17 UTC,Orchidaceae,Cryptostylis,Cryptostylis leptochila,5.monocot-colorful,native
16/12/2021,2488549,2021-12-16 10:03:18 UTC,Orchidaceae,Cryptostylis,Cryptostylis leptochila,5.monocot-colorful,native
16/12/2021,2488549,2021-12-16 10:03:18 UTC,Orchidaceae,Cryptostylis,Cryptostylis leptochila,5.monocot-colorful,native
16/12/2021,2488549,2021-12-16 10:03:19 UTC,Orchidaceae,Cryptostylis,Cryptostylis leptochila,5.monocot-colorful,native
20/12/2021,3880468,2021-12-21 03:21:51 UTC,Orchidaceae,Cryptostylis,Cryptostylis leptochila,5.monocot-colorful,native
20/12/2021,3880468,2021-12-21 03:21:53 UTC,Orchidaceae,Cryptostylis,Cryptostylis leptochila,5.monocot-colorful,native
18/12/2021,2376854,2021-12-21 08:15:10 UTC,Orchidaceae,Cryptostylis,Cryptostylis leptochila,5.monocot-colorful,native
11/01/2022,5188972,2022-01-11 22:41:27 UTC,Orchidaceae,Cryptostylis,Cryptostylis leptochila,5.monocot-colorful,native
22/12/2022,2488549,2022-12-22 02:24:53 UTC,Orchidaceae,Cryptostylis,Cryptostylis leptochila,5.monocot-colorful,native
22/12/2022,2488549,2022-12-22 02:25:29 UTC,Orchidaceae,Cryptostylis,Cryptostylis leptochila,5.monocot-colorful,native
22/12/2022,2488549,2022-12-22 02:27:47 UTC,Orchidaceae,Cryptostylis,Cryptostylis leptochila,5.monocot-colorful,native
22/12/2022,2488549,2022-12-22 02:28:26 UTC,Orchidaceae,Cryptostylis,Cryptostylis leptochila,5.monocot-colorful,native
22/12/2022,2488549,2022-12-22 02:31:25 UTC,Orchidaceae,Cryptostylis,Cryptostylis leptochila,5.monocot-colorful,native
22/12/2022,2488549,2022-12-22 02:31:46 UTC,Orchidaceae,Cryptostylis,Cryptostylis leptochila,5.monocot-colorful,native
22/12/2022,2488549,2022-12-22 02:33:16 UTC,Orchidaceae,Cryptostylis,Cryptostylis leptochila,5.monocot-colorful,native
5/02/2023,2376854,2023-02-06 13:16:40 UTC,Orchidaceae,Cryptostylis,Cryptostylis leptochila,5.monocot-colorful,native
7/09/2023,5188972,2023-09-07 11:35:13 UTC,Orchidaceae,Cryptostylis,Cryptostylis leptochila,5.monocot-colorful,native
22/12/2023,5150898,2023-12-22 07:04:35 UTC,Orchidaceae,Cryptostylis,Cryptostylis leptochila,5.monocot-colorful,native
3/01/2024,3653978,2024-01-03 01:57:50 UTC,Orchidaceae,Cryptostylis,Cryptostylis leptochila,5.monocot-colorful,native
3/01/2024,357410,2024-01-05 12:24:28 UTC,Orchidaceae,Cryptostylis,Cryptostylis leptochila,5.monocot-colorful,native
1/01/2021,3728593,2021-01-01 10:00:35 UTC,Orchidaceae,Cryptostylis,Cryptostylis subulata,5.monocot-colorful,native
1/01/2021,2376854,2021-01-01 14:25:57 UTC,Orchidaceae,Cryptostylis,Cryptostylis subulata,5.monocot-colorful,native
15/12/2018,3313573,2021-01-04 06:50:14 UTC,Orchidaceae,Cryptostylis,Cryptostylis subulata,5.monocot-colorful,native
23/10/2021,3880468,2021-10-24 11:10:48 UTC,Orchidaceae,Cryptostylis,Cryptostylis subulata,5.monocot-colorful,native
14/11/2021,5150898,2021-11-18 10:10:01 UTC,Orchidaceae,Cryptostylis,Cryptostylis subulata,5.monocot-colorful,native
14/11/2021,5150898,2021-11-19 10:57:03 UTC,Orchidaceae,Cryptostylis,Cryptostylis subulata,5.monocot-colorful,native
20/11/2021,2488549,2021-11-20 10:17:43 UTC,Orchidaceae,Cryptostylis,Cryptostylis subulata,5.monocot-colorful,native
20/11/2021,2488549,2021-11-20 10:17:44 UTC,Orchidaceae,Cryptostylis,Cryptostylis subulata,5.monocot-colorful,native
23/11/2021,5150898,2021-11-23 07:10:43 UTC,Orchidaceae,Cryptostylis,Cryptostylis subulata,5.monocot-colorful,native
23/11/2021,5188972,2021-11-24 12:23:36 UTC,Orchidaceae,Cryptostylis,Cryptostylis subulata,5.monocot-colorful,native
28/11/2021,2376854,2021-11-28 14:25:00 UTC,Orchidaceae,Cryptostylis,Cryptostylis subulata,5.monocot-colorful,native
28/11/2021,2376854,2021-11-28 14:25:56 UTC,Orchidaceae,Cryptostylis,Cryptostylis subulata,5.monocot-colorful,native
14/12/2021,2376854,2021-12-20 04:49:56 UTC,Orchidaceae,Cryptostylis,Cryptostylis subulata,5.monocot-colorful,native
18/12/2021,2376854,2021-12-21 02:43:56 UTC,Orchidaceae,Cryptostylis,Cryptostylis subulata,5.monocot-colorful,native
18/12/2021,2376854,2021-12-21 02:45:43 UTC,Orchidaceae,Cryptostylis,Cryptostylis subulata,5.monocot-colorful,native
20/12/2021,3880468,2021-12-21 03:21:49 UTC,Orchidaceae,Cryptostylis,Cryptostylis subulata,5.monocot-colorful,native
11/06/2022,3880468,2022-06-11 11:21:37 UTC,Orchidaceae,Cryptostylis,Cryptostylis subulata,5.monocot-colorful,native
9/11/2022,4109301,2022-11-09 08:56:40 UTC,Orchidaceae,Cryptostylis,Cryptostylis subulata,5.monocot-colorful,native
13/11/2022,2488549,2022-11-13 05:49:20 UTC,Orchidaceae,Cryptostylis,Cryptostylis subulata,5.monocot-colorful,native
14/11/2022,5150898,2022-11-14 05:33:51 UTC,Orchidaceae,Cryptostylis,Cryptostylis subulata,5.monocot-colorful,native
14/11/2022,2488549,2022-11-14 05:58:44 UTC,Orchidaceae,Cryptostylis,Cryptostylis subulata,5.monocot-colorful,native
17/11/2022,2488549,2022-11-17 03:23:17 UTC,Orchidaceae,Cryptostylis,Cryptostylis subulata,5.monocot-colorful,native
2/12/2022,5188972,2022-12-02 08:50:51 UTC,Orchidaceae,Cryptostylis,Cryptostylis subulata,5.monocot-colorful,native
30/11/2022,1477617,2022-12-02 13:45:35 UTC,Orchidaceae,Cryptostylis,Cryptostylis subulata,5.monocot-colorful,native
3/12/2022,3527375,2022-12-04 00:38:30 UTC,Orchidaceae,Cryptostylis,Cryptostylis subulata,5.monocot-colorful,native
20/11/2022,3919609,2022-12-04 05:10:29 UTC,Orchidaceae,Cryptostylis,Cryptostylis subulata,5.monocot-colorful,native
22/12/2022,2488549,2022-12-22 02:34:23 UTC,Orchidaceae,Cryptostylis,Cryptostylis subulata,5.monocot-colorful,native
28/12/2022,2488549,2022-12-28 02:32:16 UTC,Orchidaceae,Cryptostylis,Cryptostylis subulata,5.monocot-colorful,native
1/01/2023,2376854,2023-01-01 15:40:32 UTC,Orchidaceae,Cryptostylis,Cryptostylis subulata,5.monocot-colorful,native
13/01/2023,5188972,2023-01-13 09:14:28 UTC,Orchidaceae,Cryptostylis,Cryptostylis subulata,5.monocot-colorful,native
16/01/2023,5453857,2023-01-16 09:57:26 UTC,Orchidaceae,Cryptostylis,Cryptostylis subulata,5.monocot-colorful,native
25/01/2023,5188972,2023-01-25 12:12:58 UTC,Orchidaceae,Cryptostylis,Cryptostylis subulata,5.monocot-colorful,native
13/02/2023,2631448,2023-02-13 11:26:20 UTC,Orchidaceae,Cryptostylis,Cryptostylis subulata,5.monocot-colorful,native
9/09/2023,6556876,2023-09-09 12:34:34 UTC,Orchidaceae,Cryptostylis,Cryptostylis subulata,5.monocot-colorful,native
22/01/2023,5733066,2023-09-24 10:25:27 UTC,Orchidaceae,Cryptostylis,Cryptostylis subulata,5.monocot-colorful,native
11/10/2023,6516136,2023-10-12 03:57:13 UTC,Orchidaceae,Cryptostylis,Cryptostylis subulata,5.monocot-colorful,native
12/10/2023,7117393,2023-11-05 20:10:31 UTC,Orchidaceae,Cryptostylis,Cryptostylis subulata,5.monocot-colorful,native
16/11/2023,2488549,2023-11-15 22:26:05 UTC,Orchidaceae,Cryptostylis,Cryptostylis subulata,5.monocot-colorful,native
18/11/2023,3653978,2023-11-18 09:50:02 UTC,Orchidaceae,Cryptostylis,Cryptostylis subulata,5.monocot-colorful,native
26/11/2023,1438982,2023-11-28 11:51:27 UTC,Orchidaceae,Cryptostylis,Cryptostylis subulata,5.monocot-colorful,native
30/11/2023,5188972,2023-11-30 13:15:01 UTC,Orchidaceae,Cryptostylis,Cryptostylis subulata,5.monocot-colorful,native
18/11/2023,2376854,2023-12-01 04:43:34 UTC,Orchidaceae,Cryptostylis,Cryptostylis subulata,5.monocot-colorful,native
4/12/2023,6308847,2023-12-04 07:18:51 UTC,Orchidaceae,Cryptostylis,Cryptostylis subulata,5.monocot-colorful,native
3/12/2023,7295809,2023-12-05 23:09:22 UTC,Orchidaceae,Cryptostylis,Cryptostylis subulata,5.monocot-colorful,native
25/11/2023,3408787,2023-12-07 12:57:57 UTC,Orchidaceae,Cryptostylis,Cryptostylis subulata,5.monocot-colorful,native
15/12/2023,7471329,2023-12-15 07:30:07 UTC,Orchidaceae,Cryptostylis,Cryptostylis subulata,5.monocot-colorful,native
17/12/2023,1305186,2023-12-17 11:56:34 UTC,Orchidaceae,Cryptostylis,Cryptostylis subulata,5.monocot-colorful,native
30/12/2023,4923400,2023-12-30 09:35:53 UTC,Orchidaceae,Cryptostylis,Cryptostylis subulata,5.monocot-colorful,native
28/12/2023,7464766,2023-12-31 00:12:30 UTC,Orchidaceae,Cryptostylis,Cryptostylis subulata,5.monocot-colorful,native
28/12/2023,7464766,2024-01-01 04:16:39 UTC,Orchidaceae,Cryptostylis,Cryptostylis subulata,5.monocot-colorful,native
3/01/2024,3197473,2024-01-03 04:32:59 UTC,Orchidaceae,Cryptostylis,Cryptostylis subulata,5.monocot-colorful,native
3/02/2024,3311964,2024-02-11 09:01:50 UTC,Orchidaceae,Cryptostylis,Cryptostylis subulata,5.monocot-colorful,native
18/12/2022,4916136,2023-07-12 13:40:49 UTC,Sapindaceae,Cupaniopsis,Cupaniopsis anacardioides,3.dicot,native
28/02/2021,2376854,2021-02-28 12:18:50 UTC,Asteraceae,Cyanthillium,Cyanthillium cinereum,3.dicot,native
5/08/2020,793005,2020-08-06 07:52:57 UTC,Cyatheaceae,Cyathea,Cyathea australis,1.ferns/primitive,native
21/09/2021,4916136,2021-09-23 13:03:55 UTC,Cyatheaceae,Cyathea,Cyathea australis,1.ferns/primitive,native
26/10/2021,4743351,2021-10-30 01:57:54 UTC,Apiaceae,Cyclospermum,Cyclospermum leptophyllum,3.dicot,introduced
28/09/2021,4743351,2021-10-01 12:16:17 UTC,Juncaginaceae,Cycnogeton,Cycnogeton procerum,4.monocot,native
3/10/2020,2488549,2020-10-04 09:02:52 UTC,Orchidaceae,Cymbidium,Cymbidium suave,5.monocot-colorful,native
16/10/2020,2488549,2020-10-18 11:01:26 UTC,Orchidaceae,Cymbidium,Cymbidium suave,5.monocot-colorful,native
21/11/2020,265090,2020-11-21 21:35:00 UTC,Orchidaceae,Cymbidium,Cymbidium suave,5.monocot-colorful,native
21/11/2020,265090,2020-11-21 21:51:37 UTC,Orchidaceae,Cymbidium,Cymbidium suave,5.monocot-colorful,native
21/11/2020,265090,2020-11-21 22:31:51 UTC,Orchidaceae,Cymbidium,Cymbidium suave,5.monocot-colorful,native
28/02/2021,265090,2021-02-28 02:43:27 UTC,Orchidaceae,Cymbidium,Cymbidium suave,5.monocot-colorful,native
28/02/2021,265090,2021-02-28 11:33:47 UTC,Orchidaceae,Cymbidium,Cymbidium suave,5.monocot-colorful,native
23/10/2021,3880468,2021-10-24 11:10:49 UTC,Orchidaceae,Cymbidium,Cymbidium suave,5.monocot-colorful,native
1/11/2021,4916136,2021-11-01 10:14:48 UTC,Orchidaceae,Cymbidium,Cymbidium suave,5.monocot-colorful,native
7/11/2021,4025155,2021-11-14 03:44:17 UTC,Orchidaceae,Cymbidium,Cymbidium suave,5.monocot-colorful,native
15/11/2021,2453859,2021-11-15 09:54:52 UTC,Orchidaceae,Cymbidium,Cymbidium suave,5.monocot-colorful,native
17/11/2021,3880468,2021-11-17 11:56:44 UTC,Orchidaceae,Cymbidium,Cymbidium suave,5.monocot-colorful,native
12/12/2021,265090,2021-12-12 05:11:56 UTC,Orchidaceae,Cymbidium,Cymbidium suave,5.monocot-colorful,native
12/12/2021,265090,2021-12-12 06:06:10 UTC,Orchidaceae,Cymbidium,Cymbidium suave,5.monocot-colorful,native
12/12/2021,265090,2021-12-12 06:13:48 UTC,Orchidaceae,Cymbidium,Cymbidium suave,5.monocot-colorful,native
12/12/2021,265090,2021-12-12 06:14:38 UTC,Orchidaceae,Cymbidium,Cymbidium suave,5.monocot-colorful,native
1/01/2022,265090,2022-01-01 09:34:02 UTC,Orchidaceae,Cymbidium,Cymbidium suave,5.monocot-colorful,native
1/01/2022,265090,2022-01-01 10:49:04 UTC,Orchidaceae,Cymbidium,Cymbidium suave,5.monocot-colorful,native
1/01/2022,265090,2022-01-01 19:15:27 UTC,Orchidaceae,Cymbidium,Cymbidium suave,5.monocot-colorful,native
9/01/2022,3880468,2022-01-09 12:36:26 UTC,Orchidaceae,Cymbidium,Cymbidium suave,5.monocot-colorful,native
26/11/2022,3843404,2022-11-28 10:05:42 UTC,Orchidaceae,Cymbidium,Cymbidium suave,5.monocot-colorful,native
2/12/2022,5188972,2022-12-02 13:28:17 UTC,Orchidaceae,Cymbidium,Cymbidium suave,5.monocot-colorful,native
17/06/2023,5150898,2023-06-17 07:01:16 UTC,Orchidaceae,Cymbidium,Cymbidium suave,5.monocot-colorful,native
28/10/2023,2631448,2023-10-29 02:27:26 UTC,Orchidaceae,Cymbidium,Cymbidium suave,5.monocot-colorful,native
30/04/2022,1138587,2022-04-30 09:41:55 UTC,Cyperaceae,Cyperus,Cyperus eragrostis,4.monocot,introduced
26/11/2022,4743351,2022-11-29 08:56:51 UTC,Cyperaceae,Cyperus,Cyperus eragrostis,4.monocot,introduced
2/01/2024,1138587,2024-01-02 08:51:17 UTC,Cyperaceae,Cyperus,Cyperus eragrostis,4.monocot,introduced
30/04/2022,1138587,2022-04-30 10:27:08 UTC,Cyperaceae,Cyperus,Cyperus sesquiflorus,4.monocot,introduced
27/05/2023,5283632,2023-12-05 14:33:47 UTC,Dryopteridaceae,Cyrtomium,Cyrtomium falcatum,1.ferns/primitive,introduced
10/05/2020,2488549,2020-05-11 07:16:22 UTC,Goodeniaceae,Dampiera,Dampiera purpurea,3.dicot,native
9/10/2020,2488549,2020-10-09 21:00:14 UTC,Goodeniaceae,Dampiera,Dampiera purpurea,3.dicot,native
9/10/2020,2488549,2020-10-09 21:01:33 UTC,Goodeniaceae,Dampiera,Dampiera purpurea,3.dicot,native
23/10/2020,2488549,2020-10-24 08:26:55 UTC,Goodeniaceae,Dampiera,Dampiera purpurea,3.dicot,native
18/09/2020,4743351,2021-09-05 12:26:17 UTC,Goodeniaceae,Dampiera,Dampiera purpurea,3.dicot,native
23/09/2022,2488549,2022-09-23 10:00:46 UTC,Goodeniaceae,Dampiera,Dampiera purpurea,3.dicot,native
19/11/2022,2488549,2022-11-19 03:03:55 UTC,Goodeniaceae,Dampiera,Dampiera purpurea,3.dicot,native
13/02/2023,2631448,2023-02-18 23:20:03 UTC,Goodeniaceae,Dampiera,Dampiera purpurea,3.dicot,native
24/09/2023,661392,2023-09-28 12:45:32 UTC,Goodeniaceae,Dampiera,Dampiera purpurea,3.dicot,native
24/09/2023,661392,2023-09-28 13:41:03 UTC,Goodeniaceae,Dampiera,Dampiera purpurea,3.dicot,native
14/10/2023,1175154,2023-10-14 09:49:32 UTC,Goodeniaceae,Dampiera,Dampiera purpurea,3.dicot,native
8/11/2023,2631448,2023-11-12 05:02:31 UTC,Goodeniaceae,Dampiera,Dampiera purpurea,3.dicot,native
10/06/2019,1477617,2019-06-13 10:23:34 UTC,Goodeniaceae,Dampiera,Dampiera stricta,3.dicot,native
3/10/2019,1477617,2019-10-03 14:10:31 UTC,Goodeniaceae,Dampiera,Dampiera stricta,3.dicot,native
3/10/2019,1477617,2019-10-04 14:15:06 UTC,Goodeniaceae,Dampiera,Dampiera stricta,3.dicot,native
21/10/2019,550350,2019-10-21 06:46:30 UTC,Goodeniaceae,Dampiera,Dampiera stricta,3.dicot,native
31/12/2019,2488549,2019-12-31 20:05:48 UTC,Goodeniaceae,Dampiera,Dampiera stricta,3.dicot,native
9/10/2004,2584563,2020-04-02 06:26:15 UTC,Goodeniaceae,Dampiera,Dampiera stricta,3.dicot,native
25/09/2004,2584563,2020-04-04 06:46:22 UTC,Goodeniaceae,Dampiera,Dampiera stricta,3.dicot,native
25/09/2004,2584563,2020-04-08 00:44:18 UTC,Goodeniaceae,Dampiera,Dampiera stricta,3.dicot,native
16/10/2005,2584563,2020-04-08 00:47:13 UTC,Goodeniaceae,Dampiera,Dampiera stricta,3.dicot,native
16/07/2020,2488549,2020-07-16 09:05:42 UTC,Goodeniaceae,Dampiera,Dampiera stricta,3.dicot,native
5/08/2020,3312793,2020-08-05 00:00:42 UTC,Goodeniaceae,Dampiera,Dampiera stricta,3.dicot,native
21/08/2020,2488549,2020-08-21 11:50:01 UTC,Goodeniaceae,Dampiera,Dampiera stricta,3.dicot,native
8/09/2020,3408787,2020-09-09 11:03:20 UTC,Goodeniaceae,Dampiera,Dampiera stricta,3.dicot,native
18/09/2020,2488549,2020-09-18 10:04:54 UTC,Goodeniaceae,Dampiera,Dampiera stricta,3.dicot,native
23/10/2020,3654699,2020-10-26 04:42:49 UTC,Goodeniaceae,Dampiera,Dampiera stricta,3.dicot,native
7/02/2021,2376854,2021-02-07 11:19:12 UTC,Goodeniaceae,Dampiera,Dampiera stricta,3.dicot,native
28/02/2021,2376854,2021-02-28 12:43:12 UTC,Goodeniaceae,Dampiera,Dampiera stricta,3.dicot,native
18/09/2020,4743351,2021-07-24 07:48:19 UTC,Goodeniaceae,Dampiera,Dampiera stricta,3.dicot,native
29/08/2020,4743351,2021-07-25 12:03:25 UTC,Goodeniaceae,Dampiera,Dampiera stricta,3.dicot,native
28/09/2019,4743351,2021-08-03 03:51:07 UTC,Goodeniaceae,Dampiera,Dampiera stricta,3.dicot,native
22/08/2021,2215616,2021-08-21 23:46:06 UTC,Goodeniaceae,Dampiera,Dampiera stricta,3.dicot,native
28/08/2021,4095677,2021-08-28 05:53:49 UTC,Goodeniaceae,Dampiera,Dampiera stricta,3.dicot,native
29/08/2021,4916136,2021-08-29 12:35:30 UTC,Goodeniaceae,Dampiera,Dampiera stricta,3.dicot,native
4/09/2021,3893507,2021-09-04 22:05:03 UTC,Goodeniaceae,Dampiera,Dampiera stricta,3.dicot,native
6/09/2021,4887682,2021-09-06 09:44:53 UTC,Goodeniaceae,Dampiera,Dampiera stricta,3.dicot,native
16/09/2021,4944844,2021-09-16 07:13:15 UTC,Goodeniaceae,Dampiera,Dampiera stricta,3.dicot,native
12/09/2021,4025155,2021-09-17 08:37:57 UTC,Goodeniaceae,Dampiera,Dampiera stricta,3.dicot,native
17/09/2021,2488549,2021-09-17 10:46:23 UTC,Goodeniaceae,Dampiera,Dampiera stricta,3.dicot,native
18/09/2021,4037891,2021-09-19 01:15:40 UTC,Goodeniaceae,Dampiera,Dampiera stricta,3.dicot,native
28/09/2021,4916136,2021-09-28 13:34:26 UTC,Goodeniaceae,Dampiera,Dampiera stricta,3.dicot,native
23/09/2021,3893507,2021-09-29 11:36:26 UTC,Goodeniaceae,Dampiera,Dampiera stricta,3.dicot,native
9/09/2021,4916136,2021-09-29 12:18:40 UTC,Goodeniaceae,Dampiera,Dampiera stricta,3.dicot,native
1/10/2021,4916136,2021-10-01 12:40:19 UTC,Goodeniaceae,Dampiera,Dampiera stricta,3.dicot,native
8/10/2021,4916136,2021-10-08 08:34:44 UTC,Goodeniaceae,Dampiera,Dampiera stricta,3.dicot,native
12/10/2021,4743351,2021-10-15 10:56:55 UTC,Goodeniaceae,Dampiera,Dampiera stricta,3.dicot,native
30/09/2021,4916136,2021-10-23 12:07:09 UTC,Goodeniaceae,Dampiera,Dampiera stricta,3.dicot,native
23/10/2021,2376854,2021-10-23 12:58:36 UTC,Goodeniaceae,Dampiera,Dampiera stricta,3.dicot,native
30/10/2021,4916136,2021-10-30 13:06:04 UTC,Goodeniaceae,Dampiera,Dampiera stricta,3.dicot,native
21/10/2021,325733,2021-11-03 01:10:52 UTC,Goodeniaceae,Dampiera,Dampiera stricta,3.dicot,native
15/12/2021,2531563,2021-12-23 06:03:04 UTC,Goodeniaceae,Dampiera,Dampiera stricta,3.dicot,native
9/01/2022,3880468,2022-01-09 12:36:29 UTC,Goodeniaceae,Dampiera,Dampiera stricta,3.dicot,native
6/02/2022,4194794,2022-02-06 02:08:33 UTC,Goodeniaceae,Dampiera,Dampiera stricta,3.dicot,native
20/07/2021,3678274,2022-06-19 11:33:19 UTC,Goodeniaceae,Dampiera,Dampiera stricta,3.dicot,native
26/06/2022,2322306,2022-06-27 21:54:47 UTC,Goodeniaceae,Dampiera,Dampiera stricta,3.dicot,native
24/04/2022,3221790,2022-06-29 10:43:26 UTC,Goodeniaceae,Dampiera,Dampiera stricta,3.dicot,native
6/08/2022,4743351,2022-08-08 05:06:58 UTC,Goodeniaceae,Dampiera,Dampiera stricta,3.dicot,native
6/08/2022,4743351,2022-08-08 05:07:04 UTC,Goodeniaceae,Dampiera,Dampiera stricta,3.dicot,native
30/08/2022,4916136,2022-08-30 11:22:17 UTC,Goodeniaceae,Dampiera,Dampiera stricta,3.dicot,native
7/09/2022,3527375,2022-09-07 22:59:05 UTC,Goodeniaceae,Dampiera,Dampiera stricta,3.dicot,native
26/09/2022,3678274,2022-09-30 10:12:17 UTC,Goodeniaceae,Dampiera,Dampiera stricta,3.dicot,native
4/10/2022,4743351,2022-10-06 09:52:13 UTC,Goodeniaceae,Dampiera,Dampiera stricta,3.dicot,native
2/11/2022,2631448,2022-11-05 05:07:24 UTC,Goodeniaceae,Dampiera,Dampiera stricta,3.dicot,native
19/11/2022,6308282,2022-11-27 08:43:46 UTC,Goodeniaceae,Dampiera,Dampiera stricta,3.dicot,native
26/11/2022,4743351,2022-11-29 10:16:12 UTC,Goodeniaceae,Dampiera,Dampiera stricta,3.dicot,native
26/11/2022,4743351,2022-11-29 10:38:59 UTC,Goodeniaceae,Dampiera,Dampiera stricta,3.dicot,native
13/02/2023,2631448,2023-02-13 12:05:45 UTC,Goodeniaceae,Dampiera,Dampiera stricta,3.dicot,native
25/02/2023,3653978,2023-02-25 07:12:53 UTC,Goodeniaceae,Dampiera,Dampiera stricta,3.dicot,native
21/07/2023,6196075,2023-07-21 01:23:00 UTC,Goodeniaceae,Dampiera,Dampiera stricta,3.dicot,native
23/07/2023,3978191,2023-07-23 10:01:45 UTC,Goodeniaceae,Dampiera,Dampiera stricta,3.dicot,native
11/10/2023,6516136,2023-10-12 03:46:59 UTC,Goodeniaceae,Dampiera,Dampiera stricta,3.dicot,native
16/09/2023,745089,2023-11-07 06:37:08 UTC,Goodeniaceae,Dampiera,Dampiera stricta,3.dicot,native
16/09/2023,745089,2023-11-07 07:22:02 UTC,Goodeniaceae,Dampiera,Dampiera stricta,3.dicot,native
14/09/2022,745089,2024-03-29 03:15:53 UTC,Goodeniaceae,Dampiera,Dampiera stricta,3.dicot,native
26/09/2020,2488549,2020-09-26 22:20:13 UTC,Myrtaceae,Darwinia,Darwinia diminuta,3.dicot,native
30/04/2022,1138587,2022-04-30 10:45:09 UTC,Myrtaceae,Darwinia,Darwinia diminuta,3.dicot,native
30/04/2022,1138587,2022-04-30 10:45:13 UTC,Myrtaceae,Darwinia,Darwinia diminuta,3.dicot,native
22/05/2022,2488549,2022-05-22 11:46:14 UTC,Myrtaceae,Darwinia,Darwinia diminuta,3.dicot,native
24/07/2022,2488549,2022-07-24 04:17:54 UTC,Myrtaceae,Darwinia,Darwinia diminuta,3.dicot,native
9/08/2022,2488549,2022-08-09 11:31:41 UTC,Myrtaceae,Darwinia,Darwinia diminuta,3.dicot,native
2/11/2011,2991,2013-06-10 21:16:39 UTC,Myrtaceae,Darwinia,Darwinia fascicularis,3.dicot,native
29/10/2014,2991,2015-07-18 06:19:30 UTC,Myrtaceae,Darwinia,Darwinia fascicularis,3.dicot,native
27/11/2016,322026,2017-07-09 18:51:48 UTC,Myrtaceae,Darwinia,Darwinia fascicularis,3.dicot,native
17/05/2018,364713,2018-05-17 08:43:37 UTC,Myrtaceae,Darwinia,Darwinia fascicularis,3.dicot,native
30/06/2019,196849,2019-07-02 10:01:57 UTC,Myrtaceae,Darwinia,Darwinia fascicularis,3.dicot,native
23/09/2019,636550,2019-10-18 08:07:05 UTC,Myrtaceae,Darwinia,Darwinia fascicularis,3.dicot,native
28/12/2019,59123,2019-12-28 09:08:12 UTC,Myrtaceae,Darwinia,Darwinia fascicularis,3.dicot,native
31/12/2019,2488549,2019-12-31 03:57:18 UTC,Myrtaceae,Darwinia,Darwinia fascicularis,3.dicot,native
15/02/2020,2488549,2020-02-15 09:02:49 UTC,Myrtaceae,Darwinia,Darwinia fascicularis,3.dicot,native
23/02/2020,1980689,2020-02-24 08:50:13 UTC,Myrtaceae,Darwinia,Darwinia fascicularis,3.dicot,native
22/03/2020,1677488,2020-03-22 03:42:56 UTC,Myrtaceae,Darwinia,Darwinia fascicularis,3.dicot,native
22/03/2020,2512752,2020-03-27 22:48:47 UTC,Myrtaceae,Darwinia,Darwinia fascicularis,3.dicot,native
5/04/2020,2488549,2020-04-06 09:50:30 UTC,Myrtaceae,Darwinia,Darwinia fascicularis,3.dicot,native
17/04/2020,2488549,2020-04-17 08:58:37 UTC,Myrtaceae,Darwinia,Darwinia fascicularis,3.dicot,native
2/05/2020,2488549,2020-05-02 09:16:06 UTC,Myrtaceae,Darwinia,Darwinia fascicularis,3.dicot,native
23/05/2020,62599,2020-05-23 10:16:28 UTC,Myrtaceae,Darwinia,Darwinia fascicularis,3.dicot,native
23/05/2020,62599,2020-05-23 11:03:35 UTC,Myrtaceae,Darwinia,Darwinia fascicularis,3.dicot,native
6/06/2020,3134813,2020-06-07 23:39:23 UTC,Myrtaceae,Darwinia,Darwinia fascicularis,3.dicot,native
11/08/1980,2851,2020-06-16 00:51:56 UTC,Myrtaceae,Darwinia,Darwinia fascicularis,3.dicot,native
30/06/2020,844060,2020-07-01 12:51:44 UTC,Myrtaceae,Darwinia,Darwinia fascicularis,3.dicot,native
10/07/2020,45047,2020-07-12 04:45:20 UTC,Myrtaceae,Darwinia,Darwinia fascicularis,3.dicot,native
12/07/2020,2488549,2020-07-12 10:28:12 UTC,Myrtaceae,Darwinia,Darwinia fascicularis,3.dicot,native
24/07/2020,2488549,2020-07-24 08:49:49 UTC,Myrtaceae,Darwinia,Darwinia fascicularis,3.dicot,native
24/07/2020,2488549,2020-07-24 10:19:21 UTC,Myrtaceae,Darwinia,Darwinia fascicularis,3.dicot,native
8/09/2020,3408787,2020-09-09 06:06:54 UTC,Myrtaceae,Darwinia,Darwinia fascicularis,3.dicot,native
13/09/2020,3627098,2020-09-18 21:23:21 UTC,Myrtaceae,Darwinia,Darwinia fascicularis,3.dicot,native
23/09/2016,742241,2020-09-28 23:27:53 UTC,Myrtaceae,Darwinia,Darwinia fascicularis,3.dicot,native
29/09/2020,738376,2020-10-02 02:40:49 UTC,Myrtaceae,Darwinia,Darwinia fascicularis,3.dicot,native
4/10/2020,2488549,2020-10-04 09:27:01 UTC,Myrtaceae,Darwinia,Darwinia fascicularis,3.dicot,native
4/10/2020,2444826,2020-10-04 10:06:27 UTC,Myrtaceae,Darwinia,Darwinia fascicularis,3.dicot,native
18/10/2020,265090,2020-10-19 08:30:11 UTC,Myrtaceae,Darwinia,Darwinia fascicularis,3.dicot,native
1/01/2021,2376854,2021-01-01 14:29:04 UTC,Myrtaceae,Darwinia,Darwinia fascicularis,3.dicot,native
1/01/2021,2376854,2021-01-01 15:59:00 UTC,Myrtaceae,Darwinia,Darwinia fascicularis,3.dicot,native
15/11/2018,3313573,2021-01-04 07:12:22 UTC,Myrtaceae,Darwinia,Darwinia fascicularis,3.dicot,native
1/04/2021,3527375,2021-04-06 06:49:55 UTC,Myrtaceae,Darwinia,Darwinia fascicularis,3.dicot,native
24/05/2021,3957444,2021-05-24 11:11:38 UTC,Myrtaceae,Darwinia,Darwinia fascicularis,3.dicot,native
25/06/2021,3197473,2021-06-25 03:33:54 UTC,Myrtaceae,Darwinia,Darwinia fascicularis,3.dicot,native
3/07/2021,3978426,2021-07-03 07:11:35 UTC,Myrtaceae,Darwinia,Darwinia fascicularis,3.dicot,native
15/06/2021,4743351,2021-07-20 05:32:47 UTC,Myrtaceae,Darwinia,Darwinia fascicularis,3.dicot,native
29/08/2020,4743351,2021-07-25 12:03:24 UTC,Myrtaceae,Darwinia,Darwinia fascicularis,3.dicot,native
7/07/2020,4743351,2021-08-02 00:11:33 UTC,Myrtaceae,Darwinia,Darwinia fascicularis,3.dicot,native
28/09/2019,4743351,2021-08-03 03:51:06 UTC,Myrtaceae,Darwinia,Darwinia fascicularis,3.dicot,native
22/07/2019,4743351,2021-08-04 05:58:48 UTC,Myrtaceae,Darwinia,Darwinia fascicularis,3.dicot,native
5/09/2021,4916136,2021-09-05 11:47:01 UTC,Myrtaceae,Darwinia,Darwinia fascicularis,3.dicot,native
6/09/2021,4887682,2021-09-06 09:17:07 UTC,Myrtaceae,Darwinia,Darwinia fascicularis,3.dicot,native
7/10/2013,2451999,2021-09-07 10:49:40 UTC,Myrtaceae,Darwinia,Darwinia fascicularis,3.dicot,native
7/10/2013,2451999,2021-09-07 10:49:41 UTC,Myrtaceae,Darwinia,Darwinia fascicularis,3.dicot,native
12/06/2021,4966726,2021-09-08 06:37:58 UTC,Myrtaceae,Darwinia,Darwinia fascicularis,3.dicot,native
12/09/2021,4025155,2021-09-15 21:54:36 UTC,Myrtaceae,Darwinia,Darwinia fascicularis,3.dicot,native
17/09/2021,2488549,2021-09-17 11:07:20 UTC,Myrtaceae,Darwinia,Darwinia fascicularis,3.dicot,native
18/09/2021,4945027,2021-09-18 10:33:06 UTC,Myrtaceae,Darwinia,Darwinia fascicularis,3.dicot,native
27/09/2021,3978426,2021-09-27 03:38:48 UTC,Myrtaceae,Darwinia,Darwinia fascicularis,3.dicot,native
23/09/2021,3893507,2021-09-29 12:05:00 UTC,Myrtaceae,Darwinia,Darwinia fascicularis,3.dicot,native
3/10/2021,2488549,2021-10-03 03:11:15 UTC,Myrtaceae,Darwinia,Darwinia fascicularis,3.dicot,native
22/09/2021,4916136,2021-10-05 09:50:43 UTC,Myrtaceae,Darwinia,Darwinia fascicularis,3.dicot,native
12/10/2021,4743351,2021-10-16 11:21:51 UTC,Myrtaceae,Darwinia,Darwinia fascicularis,3.dicot,native
9/10/2021,5033453,2021-10-16 22:55:08 UTC,Myrtaceae,Darwinia,Darwinia fascicularis,3.dicot,native
23/10/2021,2376854,2021-10-23 12:00:46 UTC,Myrtaceae,Darwinia,Darwinia fascicularis,3.dicot,native
23/10/2021,2376854,2021-10-23 12:03:05 UTC,Myrtaceae,Darwinia,Darwinia fascicularis,3.dicot,native
6/11/2021,2376854,2021-11-08 00:13:51 UTC,Myrtaceae,Darwinia,Darwinia fascicularis,3.dicot,native
13/11/2021,325733,2021-11-18 01:47:49 UTC,Myrtaceae,Darwinia,Darwinia fascicularis,3.dicot,native
1/11/2020,5283632,2022-01-07 13:34:02 UTC,Myrtaceae,Darwinia,Darwinia fascicularis,3.dicot,native
7/04/2020,3408787,2022-02-15 14:09:32 UTC,Myrtaceae,Darwinia,Darwinia fascicularis,3.dicot,native
3/04/2022,5037697,2022-04-03 02:27:26 UTC,Myrtaceae,Darwinia,Darwinia fascicularis,3.dicot,native
16/04/2022,2488549,2022-04-16 06:31:30 UTC,Myrtaceae,Darwinia,Darwinia fascicularis,3.dicot,native
18/04/2022,4146984,2022-04-18 09:38:51 UTC,Myrtaceae,Darwinia,Darwinia fascicularis,3.dicot,native
30/04/2022,1138587,2022-04-30 09:41:59 UTC,Myrtaceae,Darwinia,Darwinia fascicularis,3.dicot,native
23/01/2022,2512752,2022-05-06 10:41:51 UTC,Myrtaceae,Darwinia,Darwinia fascicularis,3.dicot,native
22/05/2022,2488549,2022-05-22 11:46:21 UTC,Myrtaceae,Darwinia,Darwinia fascicularis,3.dicot,native
15/07/1989,717200,2022-06-02 06:49:35 UTC,Myrtaceae,Darwinia,Darwinia fascicularis,3.dicot,native
7/06/2022,1233583,2022-06-07 08:52:45 UTC,Myrtaceae,Darwinia,Darwinia fascicularis,3.dicot,native
7/06/2022,1233583,2022-06-07 08:55:32 UTC,Myrtaceae,Darwinia,Darwinia fascicularis,3.dicot,native
18/01/1988,717200,2022-06-17 02:20:55 UTC,Myrtaceae,Darwinia,Darwinia fascicularis,3.dicot,native
26/06/2022,3978191,2022-06-26 08:40:25 UTC,Myrtaceae,Darwinia,Darwinia fascicularis,3.dicot,native
26/06/2022,2322306,2022-06-27 07:31:44 UTC,Myrtaceae,Darwinia,Darwinia fascicularis,3.dicot,native
22/04/2022,3221790,2022-06-29 10:23:18 UTC,Myrtaceae,Darwinia,Darwinia fascicularis,3.dicot,native
24/07/2022,265090,2022-07-24 19:54:05 UTC,Myrtaceae,Darwinia,Darwinia fascicularis,3.dicot,native
6/08/2022,4743351,2022-08-08 05:06:58 UTC,Myrtaceae,Darwinia,Darwinia fascicularis,3.dicot,native
14/08/2022,265090,2022-08-14 07:37:32 UTC,Myrtaceae,Darwinia,Darwinia fascicularis,3.dicot,native
14/08/2022,3978191,2022-08-14 10:04:55 UTC,Myrtaceae,Darwinia,Darwinia fascicularis,3.dicot,native
17/08/2022,2488549,2022-08-17 21:32:24 UTC,Myrtaceae,Darwinia,Darwinia fascicularis,3.dicot,native
21/08/2022,3839358,2022-08-21 11:09:41 UTC,Myrtaceae,Darwinia,Darwinia fascicularis,3.dicot,native
24/08/2022,6011270,2022-08-24 01:39:40 UTC,Myrtaceae,Darwinia,Darwinia fascicularis,3.dicot,native
3/06/2017,5971295,2022-08-29 19:07:26 UTC,Myrtaceae,Darwinia,Darwinia fascicularis,3.dicot,native
16/09/2022,3678274,2022-09-18 04:43:39 UTC,Myrtaceae,Darwinia,Darwinia fascicularis,3.dicot,native
22/09/2022,3893507,2022-09-22 11:10:14 UTC,Myrtaceae,Darwinia,Darwinia fascicularis,3.dicot,native
25/09/2022,3957444,2022-09-25 08:45:28 UTC,Myrtaceae,Darwinia,Darwinia fascicularis,3.dicot,native
28/08/2022,3629879,2022-09-26 21:26:50 UTC,Myrtaceae,Darwinia,Darwinia fascicularis,3.dicot,native
4/10/2022,4743351,2022-10-06 09:52:05 UTC,Myrtaceae,Darwinia,Darwinia fascicularis,3.dicot,native
25/10/2022,2512752,2022-10-25 22:11:24 UTC,Myrtaceae,Darwinia,Darwinia fascicularis,3.dicot,native
19/11/2022,6308282,2022-11-19 09:17:20 UTC,Myrtaceae,Darwinia,Darwinia fascicularis,3.dicot,native
13/11/2022,624851,2022-11-21 06:15:01 UTC,Myrtaceae,Darwinia,Darwinia fascicularis,3.dicot,native
19/11/2022,6308282,2022-11-27 08:43:48 UTC,Myrtaceae,Darwinia,Darwinia fascicularis,3.dicot,native
11/10/2022,6259435,2022-12-02 13:11:53 UTC,Myrtaceae,Darwinia,Darwinia fascicularis,3.dicot,native
14/12/2022,1974770,2022-12-14 05:43:59 UTC,Myrtaceae,Darwinia,Darwinia fascicularis,3.dicot,native
26/12/2022,6020519,2022-12-26 06:45:51 UTC,Myrtaceae,Darwinia,Darwinia fascicularis,3.dicot,native
29/12/2022,4299702,2022-12-29 03:33:23 UTC,Myrtaceae,Darwinia,Darwinia fascicularis,3.dicot,native
5/02/2023,2376854,2023-02-06 13:16:38 UTC,Myrtaceae,Darwinia,Darwinia fascicularis,3.dicot,native
11/12/2022,6224734,2023-02-24 23:26:03 UTC,Myrtaceae,Darwinia,Darwinia fascicularis,3.dicot,native
26/02/2023,4743351,2023-02-27 09:57:04 UTC,Myrtaceae,Darwinia,Darwinia fascicularis,3.dicot,native
4/03/2023,1187603,2023-03-14 11:13:18 UTC,Myrtaceae,Darwinia,Darwinia fascicularis,3.dicot,native
19/03/2023,2325183,2023-03-19 07:59:02 UTC,Myrtaceae,Darwinia,Darwinia fascicularis,3.dicot,native
13/09/2013,69857,2023-05-05 03:31:41 UTC,Myrtaceae,Darwinia,Darwinia fascicularis,3.dicot,native
29/12/2022,542372,2023-05-13 10:05:57 UTC,Myrtaceae,Darwinia,Darwinia fascicularis,3.dicot,native
3/06/2023,2376854,2023-06-03 17:32:00 UTC,Myrtaceae,Darwinia,Darwinia fascicularis,3.dicot,native
25/06/2023,6955767,2023-06-25 05:23:27 UTC,Myrtaceae,Darwinia,Darwinia fascicularis,3.dicot,native
9/04/2023,7096001,2023-06-30 05:56:56 UTC,Myrtaceae,Darwinia,Darwinia fascicularis,3.dicot,native
2/07/2023,3936801,2023-07-01 23:19:47 UTC,Myrtaceae,Darwinia,Darwinia fascicularis,3.dicot,native
8/07/2023,6196075,2023-07-08 01:55:45 UTC,Myrtaceae,Darwinia,Darwinia fascicularis,3.dicot,native
9/07/2023,4059674,2023-07-09 05:05:55 UTC,Myrtaceae,Darwinia,Darwinia fascicularis,3.dicot,native
9/07/2023,4059674,2023-07-09 15:26:30 UTC,Myrtaceae,Darwinia,Darwinia fascicularis,3.dicot,native
12/07/2023,738376,2023-07-12 07:32:42 UTC,Myrtaceae,Darwinia,Darwinia fascicularis,3.dicot,native
14/07/2023,6196075,2023-07-14 01:33:26 UTC,Myrtaceae,Darwinia,Darwinia fascicularis,3.dicot,native
16/07/2023,2366151,2023-07-16 11:00:17 UTC,Myrtaceae,Darwinia,Darwinia fascicularis,3.dicot,native
16/07/2023,3653978,2023-07-16 11:26:53 UTC,Myrtaceae,Darwinia,Darwinia fascicularis,3.dicot,native
19/07/2023,6333238,2023-07-19 00:14:22 UTC,Myrtaceae,Darwinia,Darwinia fascicularis,3.dicot,native
21/07/2023,6196075,2023-07-21 01:48:10 UTC,Myrtaceae,Darwinia,Darwinia fascicularis,3.dicot,native
24/07/2023,5330029,2023-07-25 09:31:08 UTC,Myrtaceae,Darwinia,Darwinia fascicularis,3.dicot,native
29/07/2023,3011927,2023-07-29 09:22:56 UTC,Myrtaceae,Darwinia,Darwinia fascicularis,3.dicot,native
29/07/2023,2650798,2023-07-30 11:30:11 UTC,Myrtaceae,Darwinia,Darwinia fascicularis,3.dicot,native
21/08/2023,6209647,2023-08-21 11:22:22 UTC,Myrtaceae,Darwinia,Darwinia fascicularis,3.dicot,native
29/07/2023,846234,2023-08-21 12:36:19 UTC,Myrtaceae,Darwinia,Darwinia fascicularis,3.dicot,native
21/08/2023,4177273,2023-08-21 22:22:22 UTC,Myrtaceae,Darwinia,Darwinia fascicularis,3.dicot,native
20/08/2023,5150199,2023-08-24 12:49:14 UTC,Myrtaceae,Darwinia,Darwinia fascicularis,3.dicot,native
27/08/2023,149222,2023-08-27 00:04:21 UTC,Myrtaceae,Darwinia,Darwinia fascicularis,3.dicot,native
19/08/2023,4317345,2023-09-07 22:50:44 UTC,Myrtaceae,Darwinia,Darwinia fascicularis,3.dicot,native
24/09/2023,1138587,2023-09-27 03:20:43 UTC,Myrtaceae,Darwinia,Darwinia fascicularis,3.dicot,native
24/09/2023,661392,2023-09-29 14:08:40 UTC,Myrtaceae,Darwinia,Darwinia fascicularis,3.dicot,native
24/09/2023,661392,2023-10-03 13:23:42 UTC,Myrtaceae,Darwinia,Darwinia fascicularis,3.dicot,native
24/09/2023,6209647,2023-10-10 11:47:56 UTC,Myrtaceae,Darwinia,Darwinia fascicularis,3.dicot,native
7/09/2023,6516136,2023-10-11 01:45:58 UTC,Myrtaceae,Darwinia,Darwinia fascicularis,3.dicot,native
13/10/2023,3936801,2023-10-13 03:13:47 UTC,Myrtaceae,Darwinia,Darwinia fascicularis,3.dicot,native
14/10/2023,3751299,2023-10-14 05:39:28 UTC,Myrtaceae,Darwinia,Darwinia fascicularis,3.dicot,native
6/11/2023,2441642,2023-11-06 10:05:03 UTC,Myrtaceae,Darwinia,Darwinia fascicularis,3.dicot,native
11/11/2023,6585857,2023-11-11 06:55:15 UTC,Myrtaceae,Darwinia,Darwinia fascicularis,3.dicot,native
26/11/2023,1438982,2023-11-26 23:28:31 UTC,Myrtaceae,Darwinia,Darwinia fascicularis,3.dicot,native
11/11/2023,6209647,2023-11-30 09:23:32 UTC,Myrtaceae,Darwinia,Darwinia fascicularis,3.dicot,native
10/08/2023,2379395,2023-12-05 05:22:42 UTC,Myrtaceae,Darwinia,Darwinia fascicularis,3.dicot,native
6/12/2023,6020519,2023-12-13 03:09:50 UTC,Myrtaceae,Darwinia,Darwinia fascicularis,3.dicot,native
28/12/2023,7464766,2023-12-31 07:09:29 UTC,Myrtaceae,Darwinia,Darwinia fascicularis,3.dicot,native
2/01/2024,661392,2024-01-02 06:30:26 UTC,Myrtaceae,Darwinia,Darwinia fascicularis,3.dicot,native
10/09/2023,4317345,2024-01-06 18:38:36 UTC,Myrtaceae,Darwinia,Darwinia fascicularis,3.dicot,native
14/01/2024,7500688,2024-01-14 21:42:23 UTC,Myrtaceae,Darwinia,Darwinia fascicularis,3.dicot,native
30/01/2024,3478104,2024-01-30 22:58:52 UTC,Myrtaceae,Darwinia,Darwinia fascicularis,3.dicot,native
30/01/2024,3478104,2024-02-04 05:59:24 UTC,Myrtaceae,Darwinia,Darwinia fascicularis,3.dicot,native
10/03/2024,613264,2024-03-12 09:53:32 UTC,Myrtaceae,Darwinia,Darwinia fascicularis,3.dicot,native
14/09/2022,745089,2024-03-13 12:07:48 UTC,Myrtaceae,Darwinia,Darwinia fascicularis,3.dicot,native
20/03/2024,6138595,2024-03-20 06:30:43 UTC,Myrtaceae,Darwinia,Darwinia fascicularis,3.dicot,native
22/03/2024,7134096,2024-03-22 00:11:59 UTC,Myrtaceae,Darwinia,Darwinia fascicularis,3.dicot,native
14/09/2022,745089,2024-03-29 03:31:48 UTC,Myrtaceae,Darwinia,Darwinia fascicularis,3.dicot,native
24/05/2024,2177281,2024-05-26 00:22:12 UTC,Myrtaceae,Darwinia,Darwinia fascicularis,3.dicot,native
6/11/2021,2376854,2021-11-07 14:23:15 UTC,Myrtaceae,Darwinia,Darwinia grandiflora,3.dicot,native
28/03/2024,1138587,2024-03-28 06:55:22 UTC,Solanaceae,Datura,Datura stramonium,3.dicot,introduced
2/11/2011,2991,2013-06-10 20:57:28 UTC,Fabaceae,Daviesia,Daviesia alata,3.dicot,native
26/10/2014,64271,2014-11-20 22:06:46 UTC,Fabaceae,Daviesia,Daviesia alata,3.dicot,native
29/10/2014,2991,2015-07-23 17:18:58 UTC,Fabaceae,Daviesia,Daviesia alata,3.dicot,native
30/10/2018,3408787,2020-08-04 08:09:17 UTC,Fabaceae,Daviesia,Daviesia alata,3.dicot,native
5/10/2020,2867806,2020-10-05 02:20:22 UTC,Fabaceae,Daviesia,Daviesia alata,3.dicot,native
9/10/2020,2488549,2020-10-09 08:31:22 UTC,Fabaceae,Daviesia,Daviesia alata,3.dicot,native
9/10/2020,2488549,2020-10-09 20:41:43 UTC,Fabaceae,Daviesia,Daviesia alata,3.dicot,native
9/10/2020,2488549,2020-10-09 20:50:47 UTC,Fabaceae,Daviesia,Daviesia alata,3.dicot,native
9/10/2020,2488549,2020-10-09 20:55:40 UTC,Fabaceae,Daviesia,Daviesia alata,3.dicot,native
10/10/2020,2779982,2020-10-11 03:14:36 UTC,Fabaceae,Daviesia,Daviesia alata,3.dicot,native
7/09/2021,4916136,2021-09-12 05:59:27 UTC,Fabaceae,Daviesia,Daviesia alata,3.dicot,native
16/09/2021,4916136,2021-09-16 12:34:44 UTC,Fabaceae,Daviesia,Daviesia alata,3.dicot,native
24/09/2021,4916136,2021-09-24 14:44:06 UTC,Fabaceae,Daviesia,Daviesia alata,3.dicot,native
27/09/2021,4916136,2021-09-27 13:08:37 UTC,Fabaceae,Daviesia,Daviesia alata,3.dicot,native
23/09/2021,3893507,2021-09-29 11:44:07 UTC,Fabaceae,Daviesia,Daviesia alata,3.dicot,native
20/10/2021,4916136,2021-10-20 08:34:52 UTC,Fabaceae,Daviesia,Daviesia alata,3.dicot,native
24/10/2021,2376854,2021-10-24 13:16:36 UTC,Fabaceae,Daviesia,Daviesia alata,3.dicot,native
17/11/2021,3880468,2021-11-18 10:45:43 UTC,Fabaceae,Daviesia,Daviesia alata,3.dicot,native
22/10/2021,5283632,2022-01-02 09:15:03 UTC,Fabaceae,Daviesia,Daviesia alata,3.dicot,native
17/11/2021,3880468,2022-05-17 12:56:51 UTC,Fabaceae,Daviesia,Daviesia alata,3.dicot,native
23/09/2023,3936801,2023-09-23 06:19:13 UTC,Fabaceae,Daviesia,Daviesia alata,3.dicot,native
24/09/2023,1138587,2023-09-27 02:08:28 UTC,Fabaceae,Daviesia,Daviesia alata,3.dicot,native
24/09/2023,661392,2023-09-28 10:32:51 UTC,Fabaceae,Daviesia,Daviesia alata,3.dicot,native
24/09/2023,661392,2023-09-28 10:32:54 UTC,Fabaceae,Daviesia,Daviesia alata,3.dicot,native
24/09/2023,661392,2023-09-28 10:32:55 UTC,Fabaceae,Daviesia,Daviesia alata,3.dicot,native
2/10/2023,3488848,2023-10-02 04:29:49 UTC,Fabaceae,Daviesia,Daviesia alata,3.dicot,native
9/10/2023,6308282,2023-10-14 09:33:25 UTC,Fabaceae,Daviesia,Daviesia alata,3.dicot,native
2/10/2023,7415739,2023-10-16 23:29:41 UTC,Fabaceae,Daviesia,Daviesia alata,3.dicot,native
22/10/2023,2583877,2023-10-22 00:18:21 UTC,Fabaceae,Daviesia,Daviesia alata,3.dicot,native
9/10/2016,1305186,2018-12-01 11:21:21 UTC,Fabaceae,Daviesia,Daviesia corymbosa,3.dicot,native
4/09/2021,3893507,2021-09-04 13:41:39 UTC,Fabaceae,Daviesia,Daviesia corymbosa,3.dicot,native
5/09/2021,2488549,2021-09-05 10:39:05 UTC,Fabaceae,Daviesia,Daviesia corymbosa,3.dicot,native
10/09/2021,2488549,2021-09-10 10:04:20 UTC,Fabaceae,Daviesia,Daviesia corymbosa,3.dicot,native
10/09/2021,2488549,2021-09-10 10:27:44 UTC,Fabaceae,Daviesia,Daviesia corymbosa,3.dicot,native
10/09/2021,4916136,2021-09-10 12:11:33 UTC,Fabaceae,Daviesia,Daviesia corymbosa,3.dicot,native
22/09/2021,4887682,2021-09-24 05:14:16 UTC,Fabaceae,Daviesia,Daviesia corymbosa,3.dicot,native
24/07/2022,2488549,2022-07-24 03:58:17 UTC,Fabaceae,Daviesia,Daviesia corymbosa,3.dicot,native
29/07/2022,2488549,2022-07-29 03:13:45 UTC,Fabaceae,Daviesia,Daviesia corymbosa,3.dicot,native
9/08/2022,2488549,2022-08-09 04:04:24 UTC,Fabaceae,Daviesia,Daviesia corymbosa,3.dicot,native
10/08/2022,2488549,2022-08-10 06:49:08 UTC,Fabaceae,Daviesia,Daviesia corymbosa,3.dicot,native
5/09/2022,6029661,2022-09-05 05:55:44 UTC,Fabaceae,Daviesia,Daviesia corymbosa,3.dicot,native
25/09/2022,1138587,2022-09-25 06:10:44 UTC,Fabaceae,Daviesia,Daviesia corymbosa,3.dicot,native
25/09/2022,1138587,2022-09-25 06:10:45 UTC,Fabaceae,Daviesia,Daviesia corymbosa,3.dicot,native
25/09/2022,1138587,2022-09-25 06:58:26 UTC,Fabaceae,Daviesia,Daviesia corymbosa,3.dicot,native
25/09/2022,1138587,2022-09-25 06:58:28 UTC,Fabaceae,Daviesia,Daviesia corymbosa,3.dicot,native
3/10/2022,2488549,2022-10-03 07:48:56 UTC,Fabaceae,Daviesia,Daviesia corymbosa,3.dicot,native
22/09/2022,2325183,2023-05-16 09:56:47 UTC,Fabaceae,Daviesia,Daviesia corymbosa,3.dicot,native
29/07/2023,3978191,2023-07-29 09:17:15 UTC,Fabaceae,Daviesia,Daviesia corymbosa,3.dicot,native
18/08/2023,6308282,2023-08-18 03:34:28 UTC,Fabaceae,Daviesia,Daviesia corymbosa,3.dicot,native
7/09/2023,5188972,2023-09-07 12:20:46 UTC,Fabaceae,Daviesia,Daviesia corymbosa,3.dicot,native
16/09/2023,745089,2023-11-07 06:02:39 UTC,Fabaceae,Daviesia,Daviesia corymbosa,3.dicot,native
16/09/2023,745089,2023-11-07 06:18:23 UTC,Fabaceae,Daviesia,Daviesia corymbosa,3.dicot,native
16/09/2023,745089,2023-11-07 06:25:32 UTC,Fabaceae,Daviesia,Daviesia corymbosa,3.dicot,native
18/09/2020,2488549,2020-09-18 06:49:28 UTC,Fabaceae,Daviesia,Daviesia ulicifolia,3.dicot,native
18/09/2020,2488549,2020-09-18 08:40:13 UTC,Fabaceae,Daviesia,Daviesia ulicifolia,3.dicot,native
5/09/2021,3712636,2021-09-05 13:00:45 UTC,Fabaceae,Daviesia,Daviesia ulicifolia,3.dicot,native
17/09/2022,2376854,2022-10-05 07:45:10 UTC,Fabaceae,Daviesia,Daviesia ulicifolia,3.dicot,native
9/01/2022,3880468,2023-02-19 05:31:01 UTC,Fabaceae,Daviesia,Daviesia ulicifolia,3.dicot,native
24/09/2023,1138587,2023-09-27 02:45:33 UTC,Fabaceae,Daviesia,Daviesia ulicifolia,3.dicot,native
24/09/2023,1138587,2023-09-27 02:45:33 UTC,Fabaceae,Daviesia,Daviesia ulicifolia,3.dicot,native
24/09/2023,661392,2023-09-29 11:25:14 UTC,Fabaceae,Daviesia,Daviesia ulicifolia,3.dicot,native
8/06/2020,2460258,2020-06-08 03:46:09 UTC,Orchidaceae,Dendrobium,Dendrobium linguiforme,5.monocot-colorful,native
3/10/2020,3708481,2020-10-05 01:17:29 UTC,Orchidaceae,Dendrobium,Dendrobium linguiforme,5.monocot-colorful,native
12/09/2021,4095677,2021-09-15 03:37:16 UTC,Orchidaceae,Dendrobium,Dendrobium linguiforme,5.monocot-colorful,native
27/10/2021,5150898,2021-11-18 20:51:55 UTC,Orchidaceae,Dendrobium,Dendrobium linguiforme,5.monocot-colorful,native
13/02/2022,4025155,2022-02-13 08:42:13 UTC,Orchidaceae,Dendrobium,Dendrobium linguiforme,5.monocot-colorful,native
8/07/2022,5188972,2022-07-09 08:23:32 UTC,Orchidaceae,Dendrobium,Dendrobium linguiforme,5.monocot-colorful,native
17/07/2022,3880468,2022-07-18 08:41:48 UTC,Orchidaceae,Dendrobium,Dendrobium linguiforme,5.monocot-colorful,native
6/08/2022,2488549,2022-08-06 08:54:01 UTC,Orchidaceae,Dendrobium,Dendrobium linguiforme,5.monocot-colorful,native
6/08/2022,2488549,2022-08-06 08:54:42 UTC,Orchidaceae,Dendrobium,Dendrobium linguiforme,5.monocot-colorful,native
7/08/2022,5150898,2022-08-07 04:53:10 UTC,Orchidaceae,Dendrobium,Dendrobium linguiforme,5.monocot-colorful,native
14/08/2022,265090,2022-08-14 06:21:55 UTC,Orchidaceae,Dendrobium,Dendrobium linguiforme,5.monocot-colorful,native
12/10/2022,285621,2022-10-15 04:08:53 UTC,Orchidaceae,Dendrobium,Dendrobium linguiforme,5.monocot-colorful,native
14/12/2022,63317,2022-12-14 11:17:09 UTC,Orchidaceae,Dendrobium,Dendrobium linguiforme,5.monocot-colorful,native
9/03/2023,1658043,2023-03-13 05:43:50 UTC,Orchidaceae,Dendrobium,Dendrobium linguiforme,5.monocot-colorful,native
4/06/2023,4125092,2023-06-04 03:51:13 UTC,Orchidaceae,Dendrobium,Dendrobium linguiforme,5.monocot-colorful,native
17/08/2023,6196075,2023-08-17 05:31:43 UTC,Orchidaceae,Dendrobium,Dendrobium linguiforme,5.monocot-colorful,native
24/09/2023,1138587,2023-09-27 02:56:08 UTC,Orchidaceae,Dendrobium,Dendrobium linguiforme,5.monocot-colorful,native
24/09/2023,5280950,2023-11-29 07:15:27 UTC,Orchidaceae,Dendrobium,Dendrobium linguiforme,5.monocot-colorful,native
11/09/2021,3963390,2021-09-21 12:00:41 UTC,Orchidaceae,Dendrobium,Dendrobium speciosum,5.monocot-colorful,native
23/10/2021,3880468,2021-10-24 11:10:49 UTC,Orchidaceae,Dendrobium,Dendrobium speciosum,5.monocot-colorful,native
1/09/2008,4916136,2021-10-29 10:43:24 UTC,Orchidaceae,Dendrobium,Dendrobium speciosum,5.monocot-colorful,native
12/12/2021,265090,2021-12-12 05:01:52 UTC,Orchidaceae,Dendrobium,Dendrobium speciosum,5.monocot-colorful,native
14/08/2022,265090,2022-08-14 06:05:11 UTC,Orchidaceae,Dendrobium,Dendrobium speciosum,5.monocot-colorful,native
14/08/2022,265090,2022-08-14 06:13:09 UTC,Orchidaceae,Dendrobium,Dendrobium speciosum,5.monocot-colorful,native
14/08/2022,265090,2022-08-14 06:18:25 UTC,Orchidaceae,Dendrobium,Dendrobium speciosum,5.monocot-colorful,native
22/10/2022,4916136,2022-10-23 07:28:06 UTC,Orchidaceae,Dendrobium,Dendrobium speciosum,5.monocot-colorful,native
2/10/2022,811913,2022-10-23 18:25:47 UTC,Orchidaceae,Dendrobium,Dendrobium speciosum,5.monocot-colorful,native
8/04/2023,2376854,2023-04-14 00:15:35 UTC,Orchidaceae,Dendrobium,Dendrobium speciosum,5.monocot-colorful,native
22/10/2023,3916999,2024-03-04 21:40:34 UTC,Orchidaceae,Dendrobium,Dendrobium speciosum,5.monocot-colorful,native
28/02/2021,265090,2021-02-28 03:06:05 UTC,Orchidaceae,Dendrobium,Dendrobium striolatum,5.monocot-colorful,native
10/09/2023,6532297,2023-09-10 08:26:39 UTC,Orchidaceae,Dendrobium,Dendrobium striolatum,5.monocot-colorful,native
10/08/2022,4916136,2022-08-10 07:23:18 UTC,Orchidaceae,Dendrobium,Dendrobium teretifolium,5.monocot-colorful,native
25/02/2024,7075846,2024-02-25 04:07:18 UTC,Orchidaceae,Dendrobium,Dendrobium teretifolium,5.monocot-colorful,native
19/10/2023,7471329,2023-10-30 08:53:52 UTC,Orchidaceae,Dendrobium,Dendrobium tetragonum,5.monocot-colorful,native
18/10/2021,5136334,2021-10-19 03:04:23 UTC,Loranthaceae,Dendrophthoe,Dendrophthoe vitellina,3.dicot,native
20/09/2021,4916136,2021-09-20 12:59:47 UTC,Asphodelaceae,Dianella,Dianella caerulea,5.monocot-colorful,native
26/10/2021,4916136,2021-10-26 13:50:45 UTC,Asphodelaceae,Dianella,Dianella congesta,5.monocot-colorful,native
28/11/2021,2376854,2021-12-01 04:04:01 UTC,Asphodelaceae,Dianella,Dianella revoluta,5.monocot-colorful,native
18/09/2021,4945027,2021-09-18 10:06:08 UTC,Convolvulaceae,Dichondra,Dichondra repens,3.dicot,native
24/09/2021,4887682,2021-09-24 05:43:38 UTC,Convolvulaceae,Dichondra,Dichondra repens,3.dicot,native
18/09/2021,4025155,2021-09-22 13:02:48 UTC,Iridaceae,Dietes,Dietes grandiflora,5.monocot-colorful,introduced
23/09/2019,636550,2019-10-18 08:07:07 UTC,Fabaceae,Dillwynia,Dillwynia floribunda,3.dicot,native
30/08/2020,2091535,2020-08-30 03:03:51 UTC,Fabaceae,Dillwynia,Dillwynia floribunda,3.dicot,native
29/08/2020,4743351,2021-07-25 12:03:25 UTC,Fabaceae,Dillwynia,Dillwynia floribunda,3.dicot,native
28/08/2021,4095677,2021-08-28 07:32:01 UTC,Fabaceae,Dillwynia,Dillwynia floribunda,3.dicot,native
4/09/2021,3712636,2021-09-04 08:23:01 UTC,Fabaceae,Dillwynia,Dillwynia floribunda,3.dicot,native
4/09/2021,3712636,2021-09-04 12:51:18 UTC,Fabaceae,Dillwynia,Dillwynia floribunda,3.dicot,native
6/09/2021,4887682,2021-09-06 09:06:54 UTC,Fabaceae,Dillwynia,Dillwynia floribunda,3.dicot,native
15/09/2021,3345535,2021-09-15 03:12:08 UTC,Fabaceae,Dillwynia,Dillwynia floribunda,3.dicot,native
23/09/2021,3893507,2021-09-25 11:53:32 UTC,Fabaceae,Dillwynia,Dillwynia floribunda,3.dicot,native
28/09/2021,4743351,2021-10-01 12:16:16 UTC,Fabaceae,Dillwynia,Dillwynia floribunda,3.dicot,native
31/08/2021,2665854,2021-10-22 06:45:15 UTC,Fabaceae,Dillwynia,Dillwynia floribunda,3.dicot,native
11/09/2022,1175154,2022-09-11 08:12:16 UTC,Fabaceae,Dillwynia,Dillwynia floribunda,3.dicot,native
16/09/2022,3678274,2022-09-18 12:37:37 UTC,Fabaceae,Dillwynia,Dillwynia floribunda,3.dicot,native
25/09/2022,3978191,2022-09-25 10:51:07 UTC,Fabaceae,Dillwynia,Dillwynia floribunda,3.dicot,native
25/08/2023,2453859,2023-08-28 21:54:55 UTC,Fabaceae,Dillwynia,Dillwynia floribunda,3.dicot,native
8/08/2023,4317345,2023-09-07 02:04:25 UTC,Fabaceae,Dillwynia,Dillwynia floribunda,3.dicot,native
7/09/2023,7162362,2023-09-08 00:56:43 UTC,Fabaceae,Dillwynia,Dillwynia floribunda,3.dicot,native
17/09/2023,745089,2023-12-09 10:12:00 UTC,Fabaceae,Dillwynia,Dillwynia floribunda,3.dicot,native
14/09/2022,745089,2024-03-29 03:15:54 UTC,Fabaceae,Dillwynia,Dillwynia floribunda,3.dicot,native
23/09/2016,7789371,2024-04-05 03:44:44 UTC,Fabaceae,Dillwynia,Dillwynia floribunda,3.dicot,native
23/09/2016,7789371,2024-04-05 04:02:35 UTC,Fabaceae,Dillwynia,Dillwynia floribunda,3.dicot,native
23/09/2016,7789371,2024-04-05 04:44:19 UTC,Fabaceae,Dillwynia,Dillwynia floribunda,3.dicot,native
11/08/2019,45978,2019-08-11 05:56:05 UTC,Fabaceae,Dillwynia,Dillwynia retorta,3.dicot,native
22/08/2019,701243,2019-08-22 02:17:14 UTC,Fabaceae,Dillwynia,Dillwynia retorta,3.dicot,native
22/09/2018,2488549,2019-12-20 01:48:13 UTC,Fabaceae,Dillwynia,Dillwynia retorta,3.dicot,native
31/12/2019,2488549,2019-12-31 01:45:02 UTC,Fabaceae,Dillwynia,Dillwynia retorta,3.dicot,native
23/06/2020,2488549,2020-06-23 08:41:44 UTC,Fabaceae,Dillwynia,Dillwynia retorta,3.dicot,native
15/07/2020,3299714,2020-07-15 05:48:25 UTC,Fabaceae,Dillwynia,Dillwynia retorta,3.dicot,native
15/07/2020,2488549,2020-07-15 07:09:50 UTC,Fabaceae,Dillwynia,Dillwynia retorta,3.dicot,native
22/07/2020,3312793,2020-07-22 02:00:42 UTC,Fabaceae,Dillwynia,Dillwynia retorta,3.dicot,native
24/07/2020,2488549,2020-07-24 10:17:10 UTC,Fabaceae,Dillwynia,Dillwynia retorta,3.dicot,native
2/08/2020,3376917,2020-08-02 09:07:18 UTC,Fabaceae,Dillwynia,Dillwynia retorta,3.dicot,native
3/07/2021,3313584,2021-07-08 08:17:02 UTC,Fabaceae,Dillwynia,Dillwynia retorta,3.dicot,native
22/07/2019,4743351,2021-08-04 05:58:50 UTC,Fabaceae,Dillwynia,Dillwynia retorta,3.dicot,native
1/09/2021,4916136,2021-09-02 08:15:50 UTC,Fabaceae,Dillwynia,Dillwynia retorta,3.dicot,native
6/09/2021,4887682,2021-09-06 09:44:51 UTC,Fabaceae,Dillwynia,Dillwynia retorta,3.dicot,native
8/09/2021,4743351,2021-09-08 12:08:11 UTC,Fabaceae,Dillwynia,Dillwynia retorta,3.dicot,native
5/09/2021,3792160,2021-09-15 03:06:15 UTC,Fabaceae,Dillwynia,Dillwynia retorta,3.dicot,native
1/10/2021,4916136,2021-10-06 12:47:59 UTC,Fabaceae,Dillwynia,Dillwynia retorta,3.dicot,native
12/10/2021,4916136,2021-10-12 12:11:01 UTC,Fabaceae,Dillwynia,Dillwynia retorta,3.dicot,native
16/05/2020,3408787,2022-02-15 16:38:09 UTC,Fabaceae,Dillwynia,Dillwynia retorta,3.dicot,native
24/07/2022,265090,2022-07-24 18:22:15 UTC,Fabaceae,Dillwynia,Dillwynia retorta,3.dicot,native
30/07/2022,4743351,2022-08-01 12:37:32 UTC,Fabaceae,Dillwynia,Dillwynia retorta,3.dicot,native
14/08/2022,3978191,2022-08-14 10:08:26 UTC,Fabaceae,Dillwynia,Dillwynia retorta,3.dicot,native
10/06/2023,4916136,2023-06-22 08:59:18 UTC,Fabaceae,Dillwynia,Dillwynia retorta,3.dicot,native
16/07/2023,5315657,2023-07-16 06:04:30 UTC,Fabaceae,Dillwynia,Dillwynia retorta,3.dicot,native
14/09/2022,745089,2024-03-13 12:07:48 UTC,Fabaceae,Dillwynia,Dillwynia retorta,3.dicot,native
26/03/2023,149222,2023-03-26 06:38:11 UTC,Ebenaceae,Diospyros,Diospyros australis,3.dicot,native
12/05/2022,149222,2022-05-12 13:36:18 UTC,Sapindaceae,Diploglottis,Diploglottis australis,3.dicot,native
26/12/2021,2488549,2021-12-27 10:30:28 UTC,Orchidaceae,Dipodium,Dipodium punctatum,5.monocot-colorful,native
28/03/2020,2488549,2020-03-28 10:52:55 UTC,Orchidaceae,Dipodium,Dipodium roseum,5.monocot-colorful,native
28/12/2020,2488549,2020-12-28 21:00:40 UTC,Orchidaceae,Dipodium,Dipodium roseum,5.monocot-colorful,native
3/12/2021,3312793,2021-12-03 01:03:22 UTC,Orchidaceae,Dipodium,Dipodium roseum,5.monocot-colorful,native
7/12/2021,5150898,2021-12-07 11:27:17 UTC,Orchidaceae,Dipodium,Dipodium roseum,5.monocot-colorful,native
3/01/2022,5150898,2022-01-03 09:38:15 UTC,Orchidaceae,Dipodium,Dipodium roseum,5.monocot-colorful,native
9/11/2022,4109301,2022-11-09 10:56:12 UTC,Orchidaceae,Dipodium,Dipodium roseum,5.monocot-colorful,native
2/12/2022,5188972,2022-12-02 11:59:07 UTC,Orchidaceae,Dipodium,Dipodium roseum,5.monocot-colorful,native
1/01/2018,269775,2018-06-13 07:44:35 UTC,Orchidaceae,Dipodium,Dipodium variegatum,5.monocot-colorful,native
23/12/2019,2488549,2019-12-23 08:52:33 UTC,Orchidaceae,Dipodium,Dipodium variegatum,5.monocot-colorful,native
6/03/2020,701243,2020-03-06 14:42:01 UTC,Orchidaceae,Dipodium,Dipodium variegatum,5.monocot-colorful,native
26/12/2018,2867806,2020-05-03 05:21:10 UTC,Orchidaceae,Dipodium,Dipodium variegatum,5.monocot-colorful,native
17/05/2020,783222,2020-06-25 02:13:28 UTC,Orchidaceae,Dipodium,Dipodium variegatum,5.monocot-colorful,native
6/12/2020,2488549,2020-12-06 08:55:16 UTC,Orchidaceae,Dipodium,Dipodium variegatum,5.monocot-colorful,native
18/12/2020,2779982,2020-12-19 00:02:23 UTC,Orchidaceae,Dipodium,Dipodium variegatum,5.monocot-colorful,native
28/12/2020,2488549,2020-12-28 20:59:45 UTC,Orchidaceae,Dipodium,Dipodium variegatum,5.monocot-colorful,native
31/12/2020,2458005,2020-12-31 03:42:38 UTC,Orchidaceae,Dipodium,Dipodium variegatum,5.monocot-colorful,native
31/12/2020,2583305,2020-12-31 04:47:04 UTC,Orchidaceae,Dipodium,Dipodium variegatum,5.monocot-colorful,native
1/01/2021,2376854,2021-01-01 13:55:04 UTC,Orchidaceae,Dipodium,Dipodium variegatum,5.monocot-colorful,native
1/01/2021,2376854,2021-01-01 14:07:53 UTC,Orchidaceae,Dipodium,Dipodium variegatum,5.monocot-colorful,native
7/01/2021,3564126,2021-01-07 03:17:14 UTC,Orchidaceae,Dipodium,Dipodium variegatum,5.monocot-colorful,native
31/01/2021,265090,2021-01-31 06:19:47 UTC,Orchidaceae,Dipodium,Dipodium variegatum,5.monocot-colorful,native
31/01/2021,265090,2021-01-31 07:23:02 UTC,Orchidaceae,Dipodium,Dipodium variegatum,5.monocot-colorful,native
14/04/2021,4198682,2021-04-14 04:46:41 UTC,Orchidaceae,Dipodium,Dipodium variegatum,5.monocot-colorful,native
19/05/2021,4458820,2021-05-23 02:07:50 UTC,Orchidaceae,Dipodium,Dipodium variegatum,5.monocot-colorful,native
17/11/2021,3880468,2021-11-17 11:56:38 UTC,Orchidaceae,Dipodium,Dipodium variegatum,5.monocot-colorful,native
18/11/2021,5150898,2021-11-18 10:07:53 UTC,Orchidaceae,Dipodium,Dipodium variegatum,5.monocot-colorful,native
11/11/2021,5150898,2021-11-19 10:55:09 UTC,Orchidaceae,Dipodium,Dipodium variegatum,5.monocot-colorful,native
28/11/2021,2376854,2021-11-30 04:35:42 UTC,Orchidaceae,Dipodium,Dipodium variegatum,5.monocot-colorful,native
28/11/2021,2376854,2021-11-30 04:54:06 UTC,Orchidaceae,Dipodium,Dipodium variegatum,5.monocot-colorful,native
30/11/2021,5188972,2021-12-01 06:38:20 UTC,Orchidaceae,Dipodium,Dipodium variegatum,5.monocot-colorful,native
10/12/2021,2531563,2021-12-10 06:05:27 UTC,Orchidaceae,Dipodium,Dipodium variegatum,5.monocot-colorful,native
14/12/2021,2488549,2021-12-15 01:46:56 UTC,Orchidaceae,Dipodium,Dipodium variegatum,5.monocot-colorful,native
16/12/2021,2488549,2021-12-16 10:03:15 UTC,Orchidaceae,Dipodium,Dipodium variegatum,5.monocot-colorful,native
16/12/2021,2488549,2021-12-16 10:03:21 UTC,Orchidaceae,Dipodium,Dipodium variegatum,5.monocot-colorful,native
14/12/2021,2376854,2021-12-20 08:24:18 UTC,Orchidaceae,Dipodium,Dipodium variegatum,5.monocot-colorful,native
20/12/2021,3880468,2021-12-21 03:21:47 UTC,Orchidaceae,Dipodium,Dipodium variegatum,5.monocot-colorful,native
20/12/2021,3880468,2021-12-21 03:21:50 UTC,Orchidaceae,Dipodium,Dipodium variegatum,5.monocot-colorful,native
20/12/2021,3880468,2021-12-21 03:21:51 UTC,Orchidaceae,Dipodium,Dipodium variegatum,5.monocot-colorful,native
26/12/2021,2488549,2021-12-27 10:30:25 UTC,Orchidaceae,Dipodium,Dipodium variegatum,5.monocot-colorful,native
28/12/2014,3129911,2021-12-27 23:23:30 UTC,Orchidaceae,Dipodium,Dipodium variegatum,5.monocot-colorful,native
30/12/2021,3880468,2021-12-30 13:54:48 UTC,Orchidaceae,Dipodium,Dipodium variegatum,5.monocot-colorful,native
3/01/2022,5150898,2022-01-03 09:35:15 UTC,Orchidaceae,Dipodium,Dipodium variegatum,5.monocot-colorful,native
26/12/2021,5150898,2022-01-03 09:47:02 UTC,Orchidaceae,Dipodium,Dipodium variegatum,5.monocot-colorful,native
4/01/2022,5150898,2022-01-04 10:07:38 UTC,Orchidaceae,Dipodium,Dipodium variegatum,5.monocot-colorful,native
9/01/2022,3880468,2022-01-09 12:36:26 UTC,Orchidaceae,Dipodium,Dipodium variegatum,5.monocot-colorful,native
9/01/2022,3880468,2022-01-09 12:36:31 UTC,Orchidaceae,Dipodium,Dipodium variegatum,5.monocot-colorful,native
22/01/2022,2317723,2022-01-22 19:40:51 UTC,Orchidaceae,Dipodium,Dipodium variegatum,5.monocot-colorful,native
22/01/2022,2317723,2022-01-22 19:42:51 UTC,Orchidaceae,Dipodium,Dipodium variegatum,5.monocot-colorful,native
23/01/2022,149222,2022-01-23 09:14:30 UTC,Orchidaceae,Dipodium,Dipodium variegatum,5.monocot-colorful,native
22/01/2022,2376854,2022-01-26 14:37:43 UTC,Orchidaceae,Dipodium,Dipodium variegatum,5.monocot-colorful,native
24/01/2022,5330029,2022-02-03 08:33:07 UTC,Orchidaceae,Dipodium,Dipodium variegatum,5.monocot-colorful,native
30/01/2022,3880468,2022-02-06 08:39:32 UTC,Orchidaceae,Dipodium,Dipodium variegatum,5.monocot-colorful,native
18/04/2022,3978191,2022-04-18 03:54:13 UTC,Orchidaceae,Dipodium,Dipodium variegatum,5.monocot-colorful,native
20/12/2021,6029661,2022-08-17 00:29:58 UTC,Orchidaceae,Dipodium,Dipodium variegatum,5.monocot-colorful,native
10/12/2022,3382917,2022-12-10 13:04:11 UTC,Orchidaceae,Dipodium,Dipodium variegatum,5.monocot-colorful,native
14/12/2022,63317,2022-12-14 11:18:40 UTC,Orchidaceae,Dipodium,Dipodium variegatum,5.monocot-colorful,native
26/01/2022,793005,2022-12-15 12:56:03 UTC,Orchidaceae,Dipodium,Dipodium variegatum,5.monocot-colorful,native
22/12/2022,4390073,2022-12-22 05:10:23 UTC,Orchidaceae,Dipodium,Dipodium variegatum,5.monocot-colorful,native
28/12/2022,2488549,2022-12-28 00:08:04 UTC,Orchidaceae,Dipodium,Dipodium variegatum,5.monocot-colorful,native
31/12/2022,3932690,2022-12-31 06:50:04 UTC,Orchidaceae,Dipodium,Dipodium variegatum,5.monocot-colorful,native
1/01/2023,3978191,2023-01-01 13:13:43 UTC,Orchidaceae,Dipodium,Dipodium variegatum,5.monocot-colorful,native
1/01/2023,2376854,2023-01-01 15:40:33 UTC,Orchidaceae,Dipodium,Dipodium variegatum,5.monocot-colorful,native
1/01/2023,2376854,2023-01-01 15:40:33 UTC,Orchidaceae,Dipodium,Dipodium variegatum,5.monocot-colorful,native
1/01/2023,2376854,2023-01-01 15:40:33 UTC,Orchidaceae,Dipodium,Dipodium variegatum,5.monocot-colorful,native
2/01/2023,2488549,2023-01-02 07:04:12 UTC,Orchidaceae,Dipodium,Dipodium variegatum,5.monocot-colorful,native
17/01/2021,6423038,2023-01-10 02:45:07 UTC,Orchidaceae,Dipodium,Dipodium variegatum,5.monocot-colorful,native
29/12/2022,6433690,2023-01-15 07:02:13 UTC,Orchidaceae,Dipodium,Dipodium variegatum,5.monocot-colorful,native
16/01/2023,5453857,2023-01-16 10:00:39 UTC,Orchidaceae,Dipodium,Dipodium variegatum,5.monocot-colorful,native
18/01/2023,6323218,2023-01-18 07:07:22 UTC,Orchidaceae,Dipodium,Dipodium variegatum,5.monocot-colorful,native
17/01/2023,2517717,2023-01-21 04:12:15 UTC,Orchidaceae,Dipodium,Dipodium variegatum,5.monocot-colorful,native
21/01/2023,5453857,2023-01-24 05:49:16 UTC,Orchidaceae,Dipodium,Dipodium variegatum,5.monocot-colorful,native
26/01/2023,2376854,2023-01-27 12:25:34 UTC,Orchidaceae,Dipodium,Dipodium variegatum,5.monocot-colorful,native
26/01/2023,2376854,2023-01-27 12:25:34 UTC,Orchidaceae,Dipodium,Dipodium variegatum,5.monocot-colorful,native
29/01/2023,5150898,2023-01-29 06:49:48 UTC,Orchidaceae,Dipodium,Dipodium variegatum,5.monocot-colorful,native
5/02/2023,2376854,2023-02-06 13:16:39 UTC,Orchidaceae,Dipodium,Dipodium variegatum,5.monocot-colorful,native
25/01/2023,2873764,2023-02-08 08:05:24 UTC,Orchidaceae,Dipodium,Dipodium variegatum,5.monocot-colorful,native
25/01/2023,2873764,2023-02-08 08:05:28 UTC,Orchidaceae,Dipodium,Dipodium variegatum,5.monocot-colorful,native
25/01/2023,2873764,2023-02-08 08:05:30 UTC,Orchidaceae,Dipodium,Dipodium variegatum,5.monocot-colorful,native
2/01/2023,6507685,2023-02-17 07:16:26 UTC,Orchidaceae,Dipodium,Dipodium variegatum,5.monocot-colorful,native
19/03/2023,149222,2023-03-18 23:41:23 UTC,Orchidaceae,Dipodium,Dipodium variegatum,5.monocot-colorful,native
24/04/2021,3488848,2023-10-10 11:02:59 UTC,Orchidaceae,Dipodium,Dipodium variegatum,5.monocot-colorful,native
7/12/2020,3488848,2023-10-10 11:47:41 UTC,Orchidaceae,Dipodium,Dipodium variegatum,5.monocot-colorful,native
14/11/2023,5828482,2023-11-15 02:58:10 UTC,Orchidaceae,Dipodium,Dipodium variegatum,5.monocot-colorful,native
4/12/2023,6308847,2023-12-04 06:58:18 UTC,Orchidaceae,Dipodium,Dipodium variegatum,5.monocot-colorful,native
15/12/2023,7471329,2023-12-15 07:23:38 UTC,Orchidaceae,Dipodium,Dipodium variegatum,5.monocot-colorful,native
22/12/2023,5150898,2023-12-22 07:05:23 UTC,Orchidaceae,Dipodium,Dipodium variegatum,5.monocot-colorful,native
8/12/2023,6308847,2023-12-24 05:45:25 UTC,Orchidaceae,Dipodium,Dipodium variegatum,5.monocot-colorful,native
26/12/2023,2665854,2023-12-26 06:17:08 UTC,Orchidaceae,Dipodium,Dipodium variegatum,5.monocot-colorful,native
28/12/2023,7464766,2023-12-28 11:15:25 UTC,Orchidaceae,Dipodium,Dipodium variegatum,5.monocot-colorful,native
28/12/2023,7464766,2023-12-29 09:11:26 UTC,Orchidaceae,Dipodium,Dipodium variegatum,5.monocot-colorful,native
30/12/2023,6456653,2023-12-29 22:07:07 UTC,Orchidaceae,Dipodium,Dipodium variegatum,5.monocot-colorful,native
28/12/2023,6542702,2023-12-29 22:20:27 UTC,Orchidaceae,Dipodium,Dipodium variegatum,5.monocot-colorful,native
30/12/2023,4923400,2023-12-30 09:37:51 UTC,Orchidaceae,Dipodium,Dipodium variegatum,5.monocot-colorful,native
30/12/2023,4923400,2023-12-30 09:39:41 UTC,Orchidaceae,Dipodium,Dipodium variegatum,5.monocot-colorful,native
28/12/2023,7464766,2023-12-30 11:21:23 UTC,Orchidaceae,Dipodium,Dipodium variegatum,5.monocot-colorful,native
1/01/2024,7635265,2024-01-01 08:31:19 UTC,Orchidaceae,Dipodium,Dipodium variegatum,5.monocot-colorful,native
3/01/2024,3653978,2024-01-03 00:30:12 UTC,Orchidaceae,Dipodium,Dipodium variegatum,5.monocot-colorful,native
4/01/2024,6908976,2024-01-04 00:39:07 UTC,Orchidaceae,Dipodium,Dipodium variegatum,5.monocot-colorful,native
2/01/2024,7707818,2024-01-04 09:16:33 UTC,Orchidaceae,Dipodium,Dipodium variegatum,5.monocot-colorful,native
5/01/2024,3712636,2024-01-05 09:17:20 UTC,Orchidaceae,Dipodium,Dipodium variegatum,5.monocot-colorful,native
6/01/2024,4923400,2024-01-06 06:52:41 UTC,Orchidaceae,Dipodium,Dipodium variegatum,5.monocot-colorful,native
3/02/2024,3311964,2024-02-11 09:02:03 UTC,Orchidaceae,Dipodium,Dipodium variegatum,5.monocot-colorful,native
28/03/2024,1138587,2024-03-28 06:55:17 UTC,Asteraceae,Dittrichia,Dittrichia graveolens,3.dicot,introduced
28/03/2024,1138587,2024-03-28 06:55:19 UTC,Asteraceae,Dittrichia,Dittrichia graveolens,3.dicot,introduced
28/03/2024,1138587,2024-03-28 06:55:19 UTC,Asteraceae,Dittrichia,Dittrichia graveolens,3.dicot,introduced
5/10/2020,2867806,2020-10-05 02:15:07 UTC,Orchidaceae,Diuris,Diuris aurea,5.monocot-colorful,native
28/09/2021,4916136,2021-09-28 08:32:40 UTC,Orchidaceae,Diuris,Diuris aurea,5.monocot-colorful,native
28/09/2021,4095677,2021-09-28 08:33:58 UTC,Orchidaceae,Diuris,Diuris aurea,5.monocot-colorful,native
30/09/2021,3712636,2021-09-30 04:23:45 UTC,Orchidaceae,Diuris,Diuris aurea,5.monocot-colorful,native
3/10/2021,3978191,2022-01-23 06:37:00 UTC,Orchidaceae,Diuris,Diuris aurea,5.monocot-colorful,native
9/10/2022,151454,2022-10-09 09:12:20 UTC,Orchidaceae,Diuris,Diuris aurea,5.monocot-colorful,native
13/10/2022,6029661,2022-10-13 12:06:53 UTC,Orchidaceae,Diuris,Diuris aurea,5.monocot-colorful,native
17/10/2022,6209647,2022-10-17 10:20:26 UTC,Orchidaceae,Diuris,Diuris aurea,5.monocot-colorful,native
22/08/2021,2215616,2021-08-22 11:19:07 UTC,Orchidaceae,Diuris,Diuris maculata,5.monocot-colorful,native
10/08/2022,2488549,2022-08-10 06:36:56 UTC,Orchidaceae,Diuris,Diuris maculata,5.monocot-colorful,native
10/08/2022,2488549,2022-08-10 06:39:20 UTC,Orchidaceae,Diuris,Diuris maculata,5.monocot-colorful,native
10/08/2022,2488549,2022-08-10 06:43:09 UTC,Orchidaceae,Diuris,Diuris maculata,5.monocot-colorful,native
10/08/2022,2488549,2022-08-10 06:46:19 UTC,Orchidaceae,Diuris,Diuris maculata,5.monocot-colorful,native
10/08/2022,2488549,2022-08-10 06:50:35 UTC,Orchidaceae,Diuris,Diuris maculata,5.monocot-colorful,native
11/08/2022,2488549,2022-08-11 11:41:08 UTC,Orchidaceae,Diuris,Diuris maculata,5.monocot-colorful,native
13/08/2022,5188972,2022-08-13 09:16:56 UTC,Orchidaceae,Diuris,Diuris maculata,5.monocot-colorful,native
15/08/2022,2376854,2022-08-17 08:15:36 UTC,Orchidaceae,Diuris,Diuris maculata,5.monocot-colorful,native
15/08/2022,2376854,2022-08-17 08:15:36 UTC,Orchidaceae,Diuris,Diuris maculata,5.monocot-colorful,native
15/08/2022,2376854,2022-08-17 08:15:37 UTC,Orchidaceae,Diuris,Diuris maculata,5.monocot-colorful,native
15/08/2022,2376854,2022-08-17 08:15:38 UTC,Orchidaceae,Diuris,Diuris maculata,5.monocot-colorful,native
24/08/2022,6011270,2022-08-23 23:34:52 UTC,Orchidaceae,Diuris,Diuris maculata,5.monocot-colorful,native
24/08/2022,2664375,2022-08-23 23:35:34 UTC,Orchidaceae,Diuris,Diuris maculata,5.monocot-colorful,native
12/08/2023,5188972,2023-08-12 08:30:37 UTC,Orchidaceae,Diuris,Diuris maculata,5.monocot-colorful,native
19/08/2023,6209647,2023-08-19 11:04:54 UTC,Orchidaceae,Diuris,Diuris maculata,5.monocot-colorful,native
20/08/2023,3758346,2023-08-20 06:48:34 UTC,Orchidaceae,Diuris,Diuris maculata,5.monocot-colorful,native
21/10/2016,13444,2016-10-23 22:17:13 UTC,Sapindaceae,Dodonaea,Dodonaea triquetra,3.dicot,native
19/03/2020,2488549,2020-03-19 09:44:41 UTC,Sapindaceae,Dodonaea,Dodonaea triquetra,3.dicot,native
16/10/2005,2584563,2020-04-04 06:38:02 UTC,Sapindaceae,Dodonaea,Dodonaea triquetra,3.dicot,native
23/06/2020,2488549,2020-06-23 05:50:52 UTC,Sapindaceae,Dodonaea,Dodonaea triquetra,3.dicot,native
12/08/2020,2488549,2020-08-12 04:12:19 UTC,Sapindaceae,Dodonaea,Dodonaea triquetra,3.dicot,native
11/09/2020,3559171,2020-09-11 03:03:05 UTC,Sapindaceae,Dodonaea,Dodonaea triquetra,3.dicot,native
18/09/2020,4743351,2021-07-24 07:11:22 UTC,Sapindaceae,Dodonaea,Dodonaea triquetra,3.dicot,native
29/08/2021,4945027,2021-09-03 06:38:48 UTC,Sapindaceae,Dodonaea,Dodonaea triquetra,3.dicot,native
6/09/2021,4887682,2021-09-06 09:56:15 UTC,Sapindaceae,Dodonaea,Dodonaea triquetra,3.dicot,native
12/09/2021,2488549,2021-09-12 09:30:46 UTC,Sapindaceae,Dodonaea,Dodonaea triquetra,3.dicot,native
17/09/2021,2488549,2021-09-17 10:27:00 UTC,Sapindaceae,Dodonaea,Dodonaea triquetra,3.dicot,native
21/09/2021,4743351,2021-09-22 10:47:55 UTC,Sapindaceae,Dodonaea,Dodonaea triquetra,3.dicot,native
23/09/2021,4916136,2021-09-23 12:53:56 UTC,Sapindaceae,Dodonaea,Dodonaea triquetra,3.dicot,native
24/09/2021,4916136,2021-09-24 14:28:41 UTC,Sapindaceae,Dodonaea,Dodonaea triquetra,3.dicot,native
28/09/2021,4743351,2021-10-01 07:22:16 UTC,Sapindaceae,Dodonaea,Dodonaea triquetra,3.dicot,native
18/10/2021,4916136,2021-10-20 07:56:30 UTC,Sapindaceae,Dodonaea,Dodonaea triquetra,3.dicot,native
6/02/2022,4194794,2022-02-06 02:07:16 UTC,Sapindaceae,Dodonaea,Dodonaea triquetra,3.dicot,native
25/09/2022,3957444,2022-09-25 08:25:03 UTC,Sapindaceae,Dodonaea,Dodonaea triquetra,3.dicot,native
15/10/2022,6160459,2022-10-24 10:56:15 UTC,Sapindaceae,Dodonaea,Dodonaea triquetra,3.dicot,native
27/10/2022,2631448,2022-10-31 08:58:26 UTC,Sapindaceae,Dodonaea,Dodonaea triquetra,3.dicot,native
26/11/2022,4743351,2022-11-29 08:56:50 UTC,Sapindaceae,Dodonaea,Dodonaea triquetra,3.dicot,native
25/09/2022,4743351,2022-12-22 04:08:29 UTC,Sapindaceae,Dodonaea,Dodonaea triquetra,3.dicot,native
12/02/2023,4743351,2023-02-13 02:47:19 UTC,Sapindaceae,Dodonaea,Dodonaea triquetra,3.dicot,native
12/02/2023,2376854,2023-02-13 15:43:13 UTC,Sapindaceae,Dodonaea,Dodonaea triquetra,3.dicot,native
9/03/2023,1658043,2023-03-13 07:22:32 UTC,Sapindaceae,Dodonaea,Dodonaea triquetra,3.dicot,native
16/07/2023,2366151,2023-07-16 10:53:04 UTC,Sapindaceae,Dodonaea,Dodonaea triquetra,3.dicot,native
11/08/2023,4743351,2023-08-12 12:27:04 UTC,Sapindaceae,Dodonaea,Dodonaea triquetra,3.dicot,native
21/08/2023,4177273,2023-08-21 22:27:06 UTC,Sapindaceae,Dodonaea,Dodonaea triquetra,3.dicot,native
20/09/2023,7415742,2023-09-26 08:01:36 UTC,Sapindaceae,Dodonaea,Dodonaea triquetra,3.dicot,native
24/09/2023,1138587,2023-09-27 02:56:03 UTC,Sapindaceae,Dodonaea,Dodonaea triquetra,3.dicot,native
10/02/2024,1138587,2024-02-10 07:02:57 UTC,Sapindaceae,Dodonaea,Dodonaea triquetra,3.dicot,native
11/02/2024,4672448,2024-02-11 04:03:24 UTC,Sapindaceae,Dodonaea,Dodonaea triquetra,3.dicot,native
9/05/2020,2488549,2020-05-09 03:28:24 UTC,Blechnaceae,Doodia,Doodia aspera,1.ferns/primitive,native
5/08/2020,793005,2020-08-06 01:41:07 UTC,Blechnaceae,Doodia,Doodia aspera,1.ferns/primitive,native
4/07/2021,4743351,2021-07-19 11:31:12 UTC,Blechnaceae,Doodia,Doodia aspera,1.ferns/primitive,native
21/09/2021,4743351,2021-09-23 10:03:53 UTC,Blechnaceae,Doodia,Doodia aspera,1.ferns/primitive,native
26/10/2021,4743351,2021-10-26 11:05:55 UTC,Blechnaceae,Doodia,Doodia aspera,1.ferns/primitive,native
26/03/2023,2650798,2023-03-26 23:21:04 UTC,Blechnaceae,Doodia,Doodia aspera,1.ferns/primitive,native
26/03/2023,2650798,2023-03-26 23:33:20 UTC,Blechnaceae,Doodia,Doodia aspera,1.ferns/primitive,native
2/01/2024,1138587,2024-01-02 08:07:08 UTC,Blechnaceae,Doodia,Doodia aspera,1.ferns/primitive,native
25/05/2021,4743351,2021-07-20 06:37:56 UTC,Blechnaceae,Doodia,Doodia caudata,1.ferns/primitive,native
2/01/2024,661392,2024-01-02 05:55:12 UTC,Blechnaceae,Doodia,Doodia caudata,1.ferns/primitive,native
2/01/2024,1138587,2024-01-02 08:51:08 UTC,Blechnaceae,Doodia,Doodia caudata,1.ferns/primitive,native
29/10/2014,2991,2015-07-23 17:19:03 UTC,Doryanthaceae,Doryanthes,Doryanthes excelsa,5.monocot-colorful,native
29/10/2014,2991,2015-07-23 17:56:34 UTC,Doryanthaceae,Doryanthes,Doryanthes excelsa,5.monocot-colorful,native
27/11/2016,322026,2017-07-09 18:40:38 UTC,Doryanthaceae,Doryanthes,Doryanthes excelsa,5.monocot-colorful,native
16/07/2018,851031,2018-12-18 06:44:01 UTC,Doryanthaceae,Doryanthes,Doryanthes excelsa,5.monocot-colorful,native
26/04/2019,287994,2019-04-26 10:50:43 UTC,Doryanthaceae,Doryanthes,Doryanthes excelsa,5.monocot-colorful,native
10/06/2019,1477617,2019-06-10 13:07:04 UTC,Doryanthaceae,Doryanthes,Doryanthes excelsa,5.monocot-colorful,native
5/05/2019,265090,2019-07-29 10:16:05 UTC,Doryanthaceae,Doryanthes,Doryanthes excelsa,5.monocot-colorful,native
2/08/2019,2080826,2019-08-02 04:03:04 UTC,Doryanthaceae,Doryanthes,Doryanthes excelsa,5.monocot-colorful,native
16/09/2018,2488549,2019-12-21 04:37:51 UTC,Doryanthaceae,Doryanthes,Doryanthes excelsa,5.monocot-colorful,native
1/09/2018,2488549,2019-12-21 04:40:43 UTC,Doryanthaceae,Doryanthes,Doryanthes excelsa,5.monocot-colorful,native
23/12/2019,2488549,2019-12-23 07:38:00 UTC,Doryanthaceae,Doryanthes,Doryanthes excelsa,5.monocot-colorful,native
28/03/2020,2677090,2020-03-28 01:06:40 UTC,Doryanthaceae,Doryanthes,Doryanthes excelsa,5.monocot-colorful,native
26/09/2004,2584563,2020-04-08 00:40:51 UTC,Doryanthaceae,Doryanthes,Doryanthes excelsa,5.monocot-colorful,native
22/03/2020,2633838,2020-04-10 15:56:15 UTC,Doryanthaceae,Doryanthes,Doryanthes excelsa,5.monocot-colorful,native
14/04/2020,2742244,2020-04-15 23:27:48 UTC,Doryanthaceae,Doryanthes,Doryanthes excelsa,5.monocot-colorful,native
26/04/2020,2488549,2020-04-26 08:06:39 UTC,Doryanthaceae,Doryanthes,Doryanthes excelsa,5.monocot-colorful,native
23/06/2020,2488549,2020-06-23 06:57:09 UTC,Doryanthaceae,Doryanthes,Doryanthes excelsa,5.monocot-colorful,native
18/07/2020,2518052,2020-07-18 08:40:31 UTC,Doryanthaceae,Doryanthes,Doryanthes excelsa,5.monocot-colorful,native
18/07/2020,2488549,2020-07-18 10:07:54 UTC,Doryanthaceae,Doryanthes,Doryanthes excelsa,5.monocot-colorful,native
19/07/2020,3063457,2020-07-21 08:11:19 UTC,Doryanthaceae,Doryanthes,Doryanthes excelsa,5.monocot-colorful,native
30/10/2018,3408787,2020-08-04 08:09:18 UTC,Doryanthaceae,Doryanthes,Doryanthes excelsa,5.monocot-colorful,native
5/08/2020,2488549,2020-08-05 09:36:06 UTC,Doryanthaceae,Doryanthes,Doryanthes excelsa,5.monocot-colorful,native
5/08/2020,2488549,2020-08-05 10:13:27 UTC,Doryanthaceae,Doryanthes,Doryanthes excelsa,5.monocot-colorful,native
5/08/2020,793005,2020-08-06 02:02:04 UTC,Doryanthaceae,Doryanthes,Doryanthes excelsa,5.monocot-colorful,native
16/08/2020,3328383,2020-08-16 07:35:46 UTC,Doryanthaceae,Doryanthes,Doryanthes excelsa,5.monocot-colorful,native
16/08/2020,3332383,2020-08-16 09:46:23 UTC,Doryanthaceae,Doryanthes,Doryanthes excelsa,5.monocot-colorful,native
22/08/2020,1739873,2020-08-22 07:34:14 UTC,Doryanthaceae,Doryanthes,Doryanthes excelsa,5.monocot-colorful,native
29/08/2020,2488549,2020-08-29 05:01:49 UTC,Doryanthaceae,Doryanthes,Doryanthes excelsa,5.monocot-colorful,native
31/08/2020,793005,2020-09-08 03:44:40 UTC,Doryanthaceae,Doryanthes,Doryanthes excelsa,5.monocot-colorful,native
23/09/2016,742241,2020-09-29 03:23:32 UTC,Doryanthaceae,Doryanthes,Doryanthes excelsa,5.monocot-colorful,native
5/10/2020,2867806,2020-10-05 01:17:24 UTC,Doryanthaceae,Doryanthes,Doryanthes excelsa,5.monocot-colorful,native
10/10/2020,3769668,2020-10-21 09:45:18 UTC,Doryanthaceae,Doryanthes,Doryanthes excelsa,5.monocot-colorful,native
23/10/2020,3654699,2020-10-26 04:42:51 UTC,Doryanthaceae,Doryanthes,Doryanthes excelsa,5.monocot-colorful,native
1/01/2021,2376854,2021-01-01 16:14:27 UTC,Doryanthaceae,Doryanthes,Doryanthes excelsa,5.monocot-colorful,native
8/04/2021,325733,2021-04-09 12:13:55 UTC,Doryanthaceae,Doryanthes,Doryanthes excelsa,5.monocot-colorful,native
13/04/2021,2453859,2021-04-15 03:43:50 UTC,Doryanthaceae,Doryanthes,Doryanthes excelsa,5.monocot-colorful,native
10/05/2021,793005,2021-06-03 03:08:28 UTC,Doryanthaceae,Doryanthes,Doryanthes excelsa,5.monocot-colorful,native
4/07/2021,3957444,2021-07-04 05:36:14 UTC,Doryanthaceae,Doryanthes,Doryanthes excelsa,5.monocot-colorful,native
16/04/2021,4743351,2021-07-21 03:11:12 UTC,Doryanthaceae,Doryanthes,Doryanthes excelsa,5.monocot-colorful,native
27/11/2016,321597,2021-07-22 02:10:38 UTC,Doryanthaceae,Doryanthes,Doryanthes excelsa,5.monocot-colorful,native
2/09/2021,4887682,2021-09-02 09:58:55 UTC,Doryanthaceae,Doryanthes,Doryanthes excelsa,5.monocot-colorful,native
8/09/2021,4743351,2021-09-09 13:11:05 UTC,Doryanthaceae,Doryanthes,Doryanthes excelsa,5.monocot-colorful,native
20/09/2021,4916136,2021-09-20 12:22:31 UTC,Doryanthaceae,Doryanthes,Doryanthes excelsa,5.monocot-colorful,native
21/10/2019,4916136,2021-09-25 02:26:32 UTC,Doryanthaceae,Doryanthes,Doryanthes excelsa,5.monocot-colorful,native
27/09/2021,4916136,2021-09-29 13:22:16 UTC,Doryanthaceae,Doryanthes,Doryanthes excelsa,5.monocot-colorful,native
17/10/2021,1175154,2021-10-17 08:26:46 UTC,Doryanthaceae,Doryanthes,Doryanthes excelsa,5.monocot-colorful,native
11/09/2021,4028658,2021-10-27 00:10:34 UTC,Doryanthaceae,Doryanthes,Doryanthes excelsa,5.monocot-colorful,native
11/10/2019,4916136,2021-11-14 11:51:06 UTC,Doryanthaceae,Doryanthes,Doryanthes excelsa,5.monocot-colorful,native
20/12/2021,3978426,2021-12-20 01:50:52 UTC,Doryanthaceae,Doryanthes,Doryanthes excelsa,5.monocot-colorful,native
20/12/2021,3978426,2021-12-20 02:00:26 UTC,Doryanthaceae,Doryanthes,Doryanthes excelsa,5.monocot-colorful,native
26/04/2015,4002106,2022-02-28 18:27:41 UTC,Doryanthaceae,Doryanthes,Doryanthes excelsa,5.monocot-colorful,native
28/03/2022,2243582,2022-03-28 07:34:56 UTC,Doryanthaceae,Doryanthes,Doryanthes excelsa,5.monocot-colorful,native
16/04/2022,3751299,2022-04-16 09:50:04 UTC,Doryanthaceae,Doryanthes,Doryanthes excelsa,5.monocot-colorful,native
30/04/2022,1138587,2022-04-30 08:15:22 UTC,Doryanthaceae,Doryanthes,Doryanthes excelsa,5.monocot-colorful,native
30/04/2022,1138587,2022-04-30 09:06:34 UTC,Doryanthaceae,Doryanthes,Doryanthes excelsa,5.monocot-colorful,native
30/04/2022,1138587,2022-04-30 09:06:35 UTC,Doryanthaceae,Doryanthes,Doryanthes excelsa,5.monocot-colorful,native
30/04/2022,1138587,2022-04-30 09:42:05 UTC,Doryanthaceae,Doryanthes,Doryanthes excelsa,5.monocot-colorful,native
30/04/2022,1138587,2022-04-30 09:48:56 UTC,Doryanthaceae,Doryanthes,Doryanthes excelsa,5.monocot-colorful,native
12/06/2022,2479985,2022-06-15 10:59:08 UTC,Doryanthaceae,Doryanthes,Doryanthes excelsa,5.monocot-colorful,native
25/09/2022,1138587,2022-09-25 06:10:44 UTC,Doryanthaceae,Doryanthes,Doryanthes excelsa,5.monocot-colorful,native
25/09/2022,1138587,2022-09-25 06:10:45 UTC,Doryanthaceae,Doryanthes,Doryanthes excelsa,5.monocot-colorful,native
25/09/2022,1138587,2022-09-25 06:58:26 UTC,Doryanthaceae,Doryanthes,Doryanthes excelsa,5.monocot-colorful,native
25/09/2022,1138587,2022-09-25 06:58:32 UTC,Doryanthaceae,Doryanthes,Doryanthes excelsa,5.monocot-colorful,native
3/10/2022,6209647,2022-10-03 12:02:36 UTC,Doryanthaceae,Doryanthes,Doryanthes excelsa,5.monocot-colorful,native
15/10/2022,6271352,2022-10-23 04:43:56 UTC,Doryanthaceae,Doryanthes,Doryanthes excelsa,5.monocot-colorful,native
2/10/2022,811913,2022-10-23 18:25:40 UTC,Doryanthaceae,Doryanthes,Doryanthes excelsa,5.monocot-colorful,native
15/10/2022,6268795,2022-10-25 05:08:53 UTC,Doryanthaceae,Doryanthes,Doryanthes excelsa,5.monocot-colorful,native
13/11/2022,624851,2022-11-21 05:42:57 UTC,Doryanthaceae,Doryanthes,Doryanthes excelsa,5.monocot-colorful,native
24/11/2022,68283,2022-11-24 10:03:21 UTC,Doryanthaceae,Doryanthes,Doryanthes excelsa,5.monocot-colorful,native
14/12/2022,1974770,2022-12-15 04:52:04 UTC,Doryanthaceae,Doryanthes,Doryanthes excelsa,5.monocot-colorful,native
23/10/2021,6414269,2023-01-06 04:40:22 UTC,Doryanthaceae,Doryanthes,Doryanthes excelsa,5.monocot-colorful,native
25/08/2019,863991,2023-02-01 23:48:02 UTC,Doryanthaceae,Doryanthes,Doryanthes excelsa,5.monocot-colorful,native
25/08/2019,863991,2023-02-01 23:51:24 UTC,Doryanthaceae,Doryanthes,Doryanthes excelsa,5.monocot-colorful,native
30/09/2008,4425,2023-02-26 23:05:50 UTC,Doryanthaceae,Doryanthes,Doryanthes excelsa,5.monocot-colorful,native
9/04/2019,6097168,2023-03-07 01:15:41 UTC,Doryanthaceae,Doryanthes,Doryanthes excelsa,5.monocot-colorful,native
20/03/2023,1259195,2023-03-26 10:27:35 UTC,Doryanthaceae,Doryanthes,Doryanthes excelsa,5.monocot-colorful,native
20/03/2023,1259195,2023-03-26 10:28:09 UTC,Doryanthaceae,Doryanthes,Doryanthes excelsa,5.monocot-colorful,native
5/04/2023,1809954,2023-04-06 23:16:08 UTC,Doryanthaceae,Doryanthes,Doryanthes excelsa,5.monocot-colorful,native
17/04/2023,6308282,2023-04-17 03:37:51 UTC,Doryanthaceae,Doryanthes,Doryanthes excelsa,5.monocot-colorful,native
17/04/2023,6308282,2023-04-17 03:43:31 UTC,Doryanthaceae,Doryanthes,Doryanthes excelsa,5.monocot-colorful,native
20/10/2016,6727201,2023-05-29 01:59:29 UTC,Doryanthaceae,Doryanthes,Doryanthes excelsa,5.monocot-colorful,native
21/06/2023,4966704,2023-06-20 23:11:28 UTC,Doryanthaceae,Doryanthes,Doryanthes excelsa,5.monocot-colorful,native
16/07/2023,2366151,2023-07-16 11:21:25 UTC,Doryanthaceae,Doryanthes,Doryanthes excelsa,5.monocot-colorful,native
12/08/2023,3936801,2023-08-12 03:20:49 UTC,Doryanthaceae,Doryanthes,Doryanthes excelsa,5.monocot-colorful,native
22/09/2023,3824247,2023-09-22 22:41:00 UTC,Doryanthaceae,Doryanthes,Doryanthes excelsa,5.monocot-colorful,native
24/09/2023,661392,2023-09-25 09:44:25 UTC,Doryanthaceae,Doryanthes,Doryanthes excelsa,5.monocot-colorful,native
20/09/2023,5435930,2023-09-25 12:15:24 UTC,Doryanthaceae,Doryanthes,Doryanthes excelsa,5.monocot-colorful,native
20/09/2023,7415742,2023-09-26 05:53:40 UTC,Doryanthaceae,Doryanthes,Doryanthes excelsa,5.monocot-colorful,native
24/09/2023,1138587,2023-09-26 11:25:38 UTC,Doryanthaceae,Doryanthes,Doryanthes excelsa,5.monocot-colorful,native
24/09/2023,661392,2023-09-28 09:29:28 UTC,Doryanthaceae,Doryanthes,Doryanthes excelsa,5.monocot-colorful,native
24/09/2023,661392,2023-09-28 09:37:38 UTC,Doryanthaceae,Doryanthes,Doryanthes excelsa,5.monocot-colorful,native
24/09/2023,661392,2023-09-29 11:25:17 UTC,Doryanthaceae,Doryanthes,Doryanthes excelsa,5.monocot-colorful,native
2/10/2023,3488848,2023-10-02 04:50:11 UTC,Doryanthaceae,Doryanthes,Doryanthes excelsa,5.monocot-colorful,native
2/10/2023,7415739,2023-10-03 00:16:40 UTC,Doryanthaceae,Doryanthes,Doryanthes excelsa,5.monocot-colorful,native
7/09/2023,6516136,2023-10-04 01:11:42 UTC,Doryanthaceae,Doryanthes,Doryanthes excelsa,5.monocot-colorful,native
14/10/2023,1175154,2023-10-15 03:06:59 UTC,Doryanthaceae,Doryanthes,Doryanthes excelsa,5.monocot-colorful,native
14/10/2023,1175154,2023-10-15 03:06:59 UTC,Doryanthaceae,Doryanthes,Doryanthes excelsa,5.monocot-colorful,native
22/10/2023,5874479,2023-10-22 08:56:26 UTC,Doryanthaceae,Doryanthes,Doryanthes excelsa,5.monocot-colorful,native
26/11/2023,1438982,2023-11-28 11:53:01 UTC,Doryanthaceae,Doryanthes,Doryanthes excelsa,5.monocot-colorful,native
3/12/2023,7295809,2023-12-05 23:10:18 UTC,Doryanthaceae,Doryanthes,Doryanthes excelsa,5.monocot-colorful,native
29/12/2023,5281531,2024-01-01 03:11:53 UTC,Doryanthaceae,Doryanthes,Doryanthes excelsa,5.monocot-colorful,native
28/12/2023,7464766,2024-01-02 03:28:41 UTC,Doryanthaceae,Doryanthes,Doryanthes excelsa,5.monocot-colorful,native
10/09/2023,4317345,2024-01-06 18:38:36 UTC,Doryanthaceae,Doryanthes,Doryanthes excelsa,5.monocot-colorful,native
25/08/2019,863991,2024-01-23 00:38:32 UTC,Doryanthaceae,Doryanthes,Doryanthes excelsa,5.monocot-colorful,native
8/02/2024,2663646,2024-02-09 00:23:44 UTC,Doryanthaceae,Doryanthes,Doryanthes excelsa,5.monocot-colorful,native
10/02/2024,1138587,2024-02-10 06:52:17 UTC,Doryanthaceae,Doryanthes,Doryanthes excelsa,5.monocot-colorful,native
21/04/2024,265090,2024-04-21 06:17:56 UTC,Doryanthaceae,Doryanthes,Doryanthes excelsa,5.monocot-colorful,native
2/09/2019,7873642,2024-04-24 11:24:11 UTC,Doryanthaceae,Doryanthes,Doryanthes excelsa,5.monocot-colorful,native
9/05/2020,2488549,2020-05-09 03:17:16 UTC,Atherospermataceae,Doryphora,Doryphora sassafras,3.dicot,native
5/08/2020,793005,2020-08-06 01:38:11 UTC,Atherospermataceae,Doryphora,Doryphora sassafras,3.dicot,native
5/08/2020,2488549,2020-08-06 02:14:56 UTC,Atherospermataceae,Doryphora,Doryphora sassafras,3.dicot,native
16/08/2020,2512752,2020-08-16 08:50:14 UTC,Atherospermataceae,Doryphora,Doryphora sassafras,3.dicot,native
16/08/2020,2512752,2020-08-16 08:52:23 UTC,Atherospermataceae,Doryphora,Doryphora sassafras,3.dicot,native
12/09/2020,2488549,2020-09-12 10:32:02 UTC,Ericaceae,Dracophyllum,Dracophyllum secundum,3.dicot,native
12/09/2020,2488549,2020-09-12 10:35:43 UTC,Ericaceae,Dracophyllum,Dracophyllum secundum,3.dicot,native
13/09/2020,2472277,2020-09-18 17:04:36 UTC,Ericaceae,Dracophyllum,Dracophyllum secundum,3.dicot,native
11/10/2020,2488549,2020-10-11 06:44:13 UTC,Ericaceae,Dracophyllum,Dracophyllum secundum,3.dicot,native
11/10/2020,2488549,2020-10-11 06:46:48 UTC,Ericaceae,Dracophyllum,Dracophyllum secundum,3.dicot,native
24/09/2021,4887682,2021-09-24 05:43:38 UTC,Ericaceae,Dracophyllum,Dracophyllum secundum,3.dicot,native
30/09/2021,2488549,2021-09-30 10:15:39 UTC,Ericaceae,Dracophyllum,Dracophyllum secundum,3.dicot,native
14/10/2021,4916136,2021-10-14 12:42:03 UTC,Ericaceae,Dracophyllum,Dracophyllum secundum,3.dicot,native
18/10/2021,4916136,2021-10-18 12:00:12 UTC,Ericaceae,Dracophyllum,Dracophyllum secundum,3.dicot,native
22/09/2022,3978191,2022-09-22 10:01:12 UTC,Ericaceae,Dracophyllum,Dracophyllum secundum,3.dicot,native
2/10/2022,811913,2022-10-23 18:25:36 UTC,Ericaceae,Dracophyllum,Dracophyllum secundum,3.dicot,native
11/08/2023,4743351,2023-08-13 03:27:28 UTC,Ericaceae,Dracophyllum,Dracophyllum secundum,3.dicot,native
18/09/2023,3678274,2023-09-20 07:02:03 UTC,Ericaceae,Dracophyllum,Dracophyllum secundum,3.dicot,native
14/09/2022,745089,2024-03-29 04:10:49 UTC,Ericaceae,Dracophyllum,Dracophyllum secundum,3.dicot,native
13/09/2020,2472277,2020-09-18 06:23:53 UTC,Droseraceae,Drosera,Drosera auriculata,3.dicot,native
17/09/2022,3012653,2022-09-19 07:31:20 UTC,Droseraceae,Drosera,Drosera auriculata,3.dicot,native
25/09/2022,1138587,2022-09-25 06:38:12 UTC,Droseraceae,Drosera,Drosera auriculata,3.dicot,native
17/06/2023,2376854,2023-06-18 23:58:03 UTC,Droseraceae,Drosera,Drosera auriculata,3.dicot,native
16/07/2023,2366151,2023-07-16 11:17:05 UTC,Droseraceae,Drosera,Drosera auriculata,3.dicot,native
29/10/2014,2991,2015-07-23 17:46:25 UTC,Droseraceae,Drosera,Drosera binata,3.dicot,native
23/10/2020,2488549,2020-10-23 19:28:41 UTC,Droseraceae,Drosera,Drosera binata,3.dicot,native
11/10/2011,4916136,2021-09-06 12:40:57 UTC,Droseraceae,Drosera,Drosera binata,3.dicot,native
21/10/2021,325733,2021-11-03 00:58:39 UTC,Droseraceae,Drosera,Drosera binata,3.dicot,native
29/12/2019,5283632,2022-01-09 16:06:29 UTC,Droseraceae,Drosera,Drosera binata,3.dicot,native
10/08/2022,3811255,2022-10-03 04:09:37 UTC,Droseraceae,Drosera,Drosera binata,3.dicot,native
7/09/2023,6516136,2023-10-11 01:01:30 UTC,Droseraceae,Drosera,Drosera binata,3.dicot,native
7/09/2023,7117393,2023-11-05 20:29:45 UTC,Droseraceae,Drosera,Drosera binata,3.dicot,native
3/12/2023,7295809,2023-12-05 23:07:37 UTC,Droseraceae,Drosera,Drosera binata,3.dicot,native
3/02/2024,3311964,2024-02-11 09:02:32 UTC,Droseraceae,Drosera,Drosera binata,3.dicot,native
26/01/2023,8088598,2024-05-03 04:12:27 UTC,Droseraceae,Drosera,Drosera binata,3.dicot,native
17/04/2020,2488549,2020-04-17 09:49:52 UTC,Droseraceae,Drosera,Drosera peltata,3.dicot,native
1/05/2020,2488549,2020-05-01 03:31:25 UTC,Droseraceae,Drosera,Drosera peltata,3.dicot,native
2/05/2020,2488549,2020-05-02 09:12:18 UTC,Droseraceae,Drosera,Drosera peltata,3.dicot,native
3/05/2020,2488549,2020-05-03 01:39:59 UTC,Droseraceae,Drosera,Drosera peltata,3.dicot,native
16/08/2019,64271,2020-05-23 23:06:57 UTC,Droseraceae,Drosera,Drosera peltata,3.dicot,native
8/09/2020,3408787,2020-09-10 06:40:53 UTC,Droseraceae,Drosera,Drosera peltata,3.dicot,native
8/04/2021,325733,2021-04-09 12:10:59 UTC,Droseraceae,Drosera,Drosera peltata,3.dicot,native
7/07/2020,4743351,2021-08-02 00:11:33 UTC,Droseraceae,Drosera,Drosera peltata,3.dicot,native
23/10/2021,2376854,2021-10-23 12:49:13 UTC,Droseraceae,Drosera,Drosera peltata,3.dicot,native
16/04/2022,2488549,2022-04-16 06:31:42 UTC,Droseraceae,Drosera,Drosera peltata,3.dicot,native
30/04/2022,1138587,2022-04-30 09:41:57 UTC,Droseraceae,Drosera,Drosera peltata,3.dicot,native
5/06/2022,2376854,2022-06-14 16:41:44 UTC,Droseraceae,Drosera,Drosera peltata,3.dicot,native
4/06/2022,2376854,2022-06-14 16:41:45 UTC,Droseraceae,Drosera,Drosera peltata,3.dicot,native
3/06/2023,2376854,2023-06-03 17:31:59 UTC,Droseraceae,Drosera,Drosera peltata,3.dicot,native
15/06/2023,2531563,2023-06-20 05:04:09 UTC,Droseraceae,Drosera,Drosera peltata,3.dicot,native
25/06/2023,2376854,2023-06-26 15:25:11 UTC,Droseraceae,Drosera,Drosera peltata,3.dicot,native
25/06/2023,2376854,2023-06-26 15:25:13 UTC,Droseraceae,Drosera,Drosera peltata,3.dicot,native
25/06/2023,2376854,2023-06-26 15:25:14 UTC,Droseraceae,Drosera,Drosera peltata,3.dicot,native
21/08/2023,6209647,2023-08-21 14:57:18 UTC,Droseraceae,Drosera,Drosera peltata,3.dicot,native
5/09/2023,4743351,2023-09-14 11:56:27 UTC,Droseraceae,Drosera,Drosera peltata,3.dicot,native
20/09/2023,5435930,2023-09-25 12:15:24 UTC,Droseraceae,Drosera,Drosera peltata,3.dicot,native
5/04/2020,2488549,2020-04-05 10:20:17 UTC,Droseraceae,Drosera,Drosera pygmaea,3.dicot,native
19/10/2020,793005,2020-10-29 15:17:29 UTC,Droseraceae,Drosera,Drosera pygmaea,3.dicot,native
1/01/2021,2376854,2021-01-01 14:18:45 UTC,Droseraceae,Drosera,Drosera pygmaea,3.dicot,native
15/08/2021,3712636,2021-08-15 08:58:19 UTC,Droseraceae,Drosera,Drosera pygmaea,3.dicot,native
12/09/2021,4037891,2021-09-13 11:24:07 UTC,Droseraceae,Drosera,Drosera pygmaea,3.dicot,native
6/11/2021,2376854,2021-11-07 23:50:05 UTC,Droseraceae,Drosera,Drosera pygmaea,3.dicot,native
6/11/2021,2376854,2021-11-07 23:52:37 UTC,Droseraceae,Drosera,Drosera pygmaea,3.dicot,native
30/12/2021,3880468,2021-12-30 13:54:45 UTC,Droseraceae,Drosera,Drosera pygmaea,3.dicot,native
9/01/2022,3880468,2022-01-09 12:36:33 UTC,Droseraceae,Drosera,Drosera pygmaea,3.dicot,native
13/02/2022,2488549,2022-02-13 04:02:05 UTC,Droseraceae,Drosera,Drosera pygmaea,3.dicot,native
20/02/2022,5330029,2022-02-20 23:33:58 UTC,Droseraceae,Drosera,Drosera pygmaea,3.dicot,native
10/08/2022,5370674,2022-08-28 06:23:27 UTC,Droseraceae,Drosera,Drosera pygmaea,3.dicot,native
3/01/2020,394168,2022-09-14 10:43:51 UTC,Droseraceae,Drosera,Drosera pygmaea,3.dicot,native
24/09/2022,2488549,2022-09-24 11:58:24 UTC,Droseraceae,Drosera,Drosera pygmaea,3.dicot,native
29/12/2022,6433690,2023-01-15 07:00:26 UTC,Droseraceae,Drosera,Drosera pygmaea,3.dicot,native
26/01/2023,2376854,2023-01-27 12:25:33 UTC,Droseraceae,Drosera,Drosera pygmaea,3.dicot,native
25/01/2023,2873764,2023-02-08 08:05:33 UTC,Droseraceae,Drosera,Drosera pygmaea,3.dicot,native
12/02/2023,2376854,2023-02-13 15:43:16 UTC,Droseraceae,Drosera,Drosera pygmaea,3.dicot,native
4/03/2023,1187603,2023-03-14 11:05:42 UTC,Droseraceae,Drosera,Drosera pygmaea,3.dicot,native
18/03/2023,5678217,2023-03-18 00:31:57 UTC,Droseraceae,Drosera,Drosera pygmaea,3.dicot,native
18/03/2023,5678217,2023-03-18 02:15:17 UTC,Droseraceae,Drosera,Drosera pygmaea,3.dicot,native
18/03/2023,5678217,2023-03-18 08:16:41 UTC,Droseraceae,Drosera,Drosera pygmaea,3.dicot,native
18/03/2023,5678217,2023-03-18 08:16:49 UTC,Droseraceae,Drosera,Drosera pygmaea,3.dicot,native
19/03/2023,4743351,2023-03-23 11:18:05 UTC,Droseraceae,Drosera,Drosera pygmaea,3.dicot,native
29/07/2023,2650798,2023-07-30 10:58:07 UTC,Droseraceae,Drosera,Drosera pygmaea,3.dicot,native
18/08/2023,5304898,2023-08-18 10:44:04 UTC,Droseraceae,Drosera,Drosera pygmaea,3.dicot,native
2/12/2023,6603678,2023-12-04 19:57:04 UTC,Droseraceae,Drosera,Drosera pygmaea,3.dicot,native
2/01/2024,661392,2024-01-02 06:33:05 UTC,Droseraceae,Drosera,Drosera pygmaea,3.dicot,native
22/03/2024,7134096,2024-03-22 00:16:21 UTC,Droseraceae,Drosera,Drosera pygmaea,3.dicot,native
2/11/2011,2991,2011-12-29 22:00:45 UTC,Droseraceae,Drosera,Drosera spatulata,3.dicot,native
2/11/2011,2991,2013-06-10 21:23:57 UTC,Droseraceae,Drosera,Drosera spatulata,3.dicot,native
13/06/2015,64271,2015-06-20 13:15:42 UTC,Droseraceae,Drosera,Drosera spatulata,3.dicot,native
29/10/2014,2991,2015-07-23 16:49:22 UTC,Droseraceae,Drosera,Drosera spatulata,3.dicot,native
10/06/2019,1477617,2019-06-10 13:06:50 UTC,Droseraceae,Drosera,Drosera spatulata,3.dicot,native
10/06/2019,1477617,2019-06-10 14:03:03 UTC,Droseraceae,Drosera,Drosera spatulata,3.dicot,native
3/10/2019,1477617,2019-10-04 12:27:23 UTC,Droseraceae,Drosera,Drosera spatulata,3.dicot,native
3/10/2019,1477617,2019-10-04 14:15:50 UTC,Droseraceae,Drosera,Drosera spatulata,3.dicot,native
23/09/2019,636550,2019-10-18 08:07:10 UTC,Droseraceae,Drosera,Drosera spatulata,3.dicot,native
13/03/2020,2300338,2020-03-13 05:43:44 UTC,Droseraceae,Drosera,Drosera spatulata,3.dicot,native
21/03/2020,756714,2020-03-21 05:41:03 UTC,Droseraceae,Drosera,Drosera spatulata,3.dicot,native
21/03/2020,485705,2020-03-22 09:05:31 UTC,Droseraceae,Drosera,Drosera spatulata,3.dicot,native
5/04/2020,2488549,2020-04-05 10:21:51 UTC,Droseraceae,Drosera,Drosera spatulata,3.dicot,native
5/04/2020,2488549,2020-04-06 09:50:57 UTC,Droseraceae,Drosera,Drosera spatulata,3.dicot,native
16/07/2020,2488549,2020-07-16 09:06:49 UTC,Droseraceae,Drosera,Drosera spatulata,3.dicot,native
16/07/2020,2488549,2020-07-16 10:21:44 UTC,Droseraceae,Drosera,Drosera spatulata,3.dicot,native
12/08/2020,2488549,2020-08-12 23:07:56 UTC,Droseraceae,Drosera,Drosera spatulata,3.dicot,native
23/08/2020,575123,2020-09-05 07:14:23 UTC,Droseraceae,Drosera,Drosera spatulata,3.dicot,native
12/09/2020,3312996,2020-09-12 07:25:49 UTC,Droseraceae,Drosera,Drosera spatulata,3.dicot,native
24/09/2020,2488549,2020-09-24 10:03:40 UTC,Droseraceae,Drosera,Drosera spatulata,3.dicot,native
21/09/2020,3345535,2020-10-01 10:55:54 UTC,Droseraceae,Drosera,Drosera spatulata,3.dicot,native
29/09/2020,738376,2020-10-02 02:40:51 UTC,Droseraceae,Drosera,Drosera spatulata,3.dicot,native
10/10/2020,2779982,2020-10-11 03:14:35 UTC,Droseraceae,Drosera,Drosera spatulata,3.dicot,native
18/10/2020,265090,2020-10-19 08:30:17 UTC,Droseraceae,Drosera,Drosera spatulata,3.dicot,native
18/10/2020,265090,2020-10-19 19:24:00 UTC,Droseraceae,Drosera,Drosera spatulata,3.dicot,native
23/10/2020,2488549,2020-10-23 09:42:08 UTC,Droseraceae,Drosera,Drosera spatulata,3.dicot,native
23/10/2020,2488549,2020-10-24 05:47:06 UTC,Droseraceae,Drosera,Drosera spatulata,3.dicot,native
23/10/2020,2488549,2020-10-24 09:27:30 UTC,Droseraceae,Drosera,Drosera spatulata,3.dicot,native
22/11/2020,3361124,2020-11-22 10:33:47 UTC,Droseraceae,Drosera,Drosera spatulata,3.dicot,native
1/01/2021,2376854,2021-01-01 14:17:12 UTC,Droseraceae,Drosera,Drosera spatulata,3.dicot,native
1/01/2021,2376854,2021-01-01 14:26:43 UTC,Droseraceae,Drosera,Drosera spatulata,3.dicot,native
1/01/2021,2376854,2021-01-01 14:35:34 UTC,Droseraceae,Drosera,Drosera spatulata,3.dicot,native
5/01/2021,2488549,2021-01-05 09:30:10 UTC,Droseraceae,Drosera,Drosera spatulata,3.dicot,native
7/02/2021,2376854,2021-02-07 08:27:43 UTC,Droseraceae,Drosera,Drosera spatulata,3.dicot,native
28/02/2021,2376854,2021-02-28 12:00:10 UTC,Droseraceae,Drosera,Drosera spatulata,3.dicot,native
27/03/2021,2384256,2021-03-27 07:54:14 UTC,Droseraceae,Drosera,Drosera spatulata,3.dicot,native
12/01/2021,4146984,2021-03-27 14:08:48 UTC,Droseraceae,Drosera,Drosera spatulata,3.dicot,native
7/04/2021,4134917,2021-04-07 05:57:40 UTC,Droseraceae,Drosera,Drosera spatulata,3.dicot,native
19/04/2021,3978426,2021-04-19 07:05:58 UTC,Droseraceae,Drosera,Drosera spatulata,3.dicot,native
19/04/2021,3978426,2021-04-19 07:06:50 UTC,Droseraceae,Drosera,Drosera spatulata,3.dicot,native
11/04/2021,486406,2021-05-04 18:26:52 UTC,Droseraceae,Drosera,Drosera spatulata,3.dicot,native
15/06/2021,4743351,2021-07-20 05:32:47 UTC,Droseraceae,Drosera,Drosera spatulata,3.dicot,native
18/09/2020,4743351,2021-07-24 07:52:52 UTC,Droseraceae,Drosera,Drosera spatulata,3.dicot,native
24/07/2021,4095677,2021-07-25 10:46:20 UTC,Droseraceae,Drosera,Drosera spatulata,3.dicot,native
27/08/2021,4743351,2021-08-29 04:54:39 UTC,Droseraceae,Drosera,Drosera spatulata,3.dicot,native
30/08/2021,4916136,2021-08-30 08:37:42 UTC,Droseraceae,Drosera,Drosera spatulata,3.dicot,native
5/09/2021,4944844,2021-09-05 11:47:19 UTC,Droseraceae,Drosera,Drosera spatulata,3.dicot,native
7/10/2013,2451999,2021-09-07 10:49:40 UTC,Droseraceae,Drosera,Drosera spatulata,3.dicot,native
9/09/2021,4887682,2021-09-08 23:59:56 UTC,Droseraceae,Drosera,Drosera spatulata,3.dicot,native
12/09/2021,4037891,2021-09-12 00:12:44 UTC,Droseraceae,Drosera,Drosera spatulata,3.dicot,native
16/09/2021,4916136,2021-09-16 08:49:20 UTC,Droseraceae,Drosera,Drosera spatulata,3.dicot,native
17/09/2021,2488549,2021-09-17 10:36:05 UTC,Droseraceae,Drosera,Drosera spatulata,3.dicot,native
12/09/2004,614054,2021-09-17 11:35:54 UTC,Droseraceae,Drosera,Drosera spatulata,3.dicot,native
21/09/2021,3963390,2021-09-21 12:14:02 UTC,Droseraceae,Drosera,Drosera spatulata,3.dicot,native
22/09/2021,4916136,2021-09-23 12:56:46 UTC,Droseraceae,Drosera,Drosera spatulata,3.dicot,native
27/09/2021,3978426,2021-09-27 03:40:23 UTC,Droseraceae,Drosera,Drosera spatulata,3.dicot,native
3/10/2021,2488549,2021-10-03 10:17:55 UTC,Droseraceae,Drosera,Drosera spatulata,3.dicot,native
8/09/2021,2665854,2021-10-22 06:23:13 UTC,Droseraceae,Drosera,Drosera spatulata,3.dicot,native
23/10/2021,2376854,2021-10-23 12:04:10 UTC,Droseraceae,Drosera,Drosera spatulata,3.dicot,native
23/10/2021,2376854,2021-10-23 12:05:03 UTC,Droseraceae,Drosera,Drosera spatulata,3.dicot,native
23/10/2021,2376854,2021-10-23 12:05:43 UTC,Droseraceae,Drosera,Drosera spatulata,3.dicot,native
23/10/2021,2376854,2021-10-23 12:06:06 UTC,Droseraceae,Drosera,Drosera spatulata,3.dicot,native
23/10/2021,2376854,2021-10-23 12:07:02 UTC,Droseraceae,Drosera,Drosera spatulata,3.dicot,native
19/10/2021,4743351,2021-10-24 07:28:44 UTC,Droseraceae,Drosera,Drosera spatulata,3.dicot,native
23/10/2021,3880468,2021-10-24 11:10:45 UTC,Droseraceae,Drosera,Drosera spatulata,3.dicot,native
6/11/2021,2376854,2021-11-07 23:48:40 UTC,Droseraceae,Drosera,Drosera spatulata,3.dicot,native
17/11/2021,3880468,2021-11-17 11:56:37 UTC,Droseraceae,Drosera,Drosera spatulata,3.dicot,native
13/11/2021,325733,2021-11-17 23:34:44 UTC,Droseraceae,Drosera,Drosera spatulata,3.dicot,native
1/01/2022,2317723,2021-12-31 23:53:46 UTC,Droseraceae,Drosera,Drosera spatulata,3.dicot,native
9/01/2022,3880468,2022-01-09 12:36:32 UTC,Droseraceae,Drosera,Drosera spatulata,3.dicot,native
9/01/2022,3880468,2022-01-09 12:36:33 UTC,Droseraceae,Drosera,Drosera spatulata,3.dicot,native
30/01/2022,3880468,2022-03-08 14:45:47 UTC,Droseraceae,Drosera,Drosera spatulata,3.dicot,native
5/04/2022,4743351,2022-04-06 05:37:17 UTC,Droseraceae,Drosera,Drosera spatulata,3.dicot,native
16/04/2022,3751299,2022-04-16 10:40:39 UTC,Droseraceae,Drosera,Drosera spatulata,3.dicot,native
30/04/2022,1138587,2022-04-30 10:27:11 UTC,Droseraceae,Drosera,Drosera spatulata,3.dicot,native
22/05/2022,2488549,2022-05-22 11:46:17 UTC,Droseraceae,Drosera,Drosera spatulata,3.dicot,native
18/06/2022,5342880,2022-06-18 07:47:45 UTC,Droseraceae,Drosera,Drosera spatulata,3.dicot,native
26/06/2022,2322306,2022-06-27 09:35:37 UTC,Droseraceae,Drosera,Drosera spatulata,3.dicot,native
30/06/2022,4945177,2022-06-30 02:19:14 UTC,Droseraceae,Drosera,Drosera spatulata,3.dicot,native
12/07/2022,2355064,2022-07-24 19:27:35 UTC,Droseraceae,Drosera,Drosera spatulata,3.dicot,native
24/07/2022,2587832,2022-07-25 09:11:08 UTC,Droseraceae,Drosera,Drosera spatulata,3.dicot,native
6/08/2022,2591298,2022-08-11 03:19:29 UTC,Droseraceae,Drosera,Drosera spatulata,3.dicot,native
20/08/2022,3012594,2022-08-21 04:23:33 UTC,Droseraceae,Drosera,Drosera spatulata,3.dicot,native
21/08/2022,3839358,2022-08-21 11:08:54 UTC,Droseraceae,Drosera,Drosera spatulata,3.dicot,native
10/08/2022,5370674,2022-08-28 06:21:22 UTC,Droseraceae,Drosera,Drosera spatulata,3.dicot,native
10/08/2022,5370674,2022-08-28 10:49:08 UTC,Droseraceae,Drosera,Drosera spatulata,3.dicot,native
5/09/2022,6029661,2022-09-05 06:01:46 UTC,Droseraceae,Drosera,Drosera spatulata,3.dicot,native
8/09/2022,5188972,2022-09-10 08:57:19 UTC,Droseraceae,Drosera,Drosera spatulata,3.dicot,native
11/09/2022,1175154,2022-09-11 07:23:15 UTC,Droseraceae,Drosera,Drosera spatulata,3.dicot,native
16/09/2022,2488549,2022-09-16 06:39:18 UTC,Droseraceae,Drosera,Drosera spatulata,3.dicot,native
22/09/2022,3893507,2022-09-23 11:38:44 UTC,Droseraceae,Drosera,Drosera spatulata,3.dicot,native
25/09/2022,1138587,2022-09-25 06:58:34 UTC,Droseraceae,Drosera,Drosera spatulata,3.dicot,native
25/09/2022,3957444,2022-09-25 08:46:40 UTC,Droseraceae,Drosera,Drosera spatulata,3.dicot,native
2/10/2022,1401423,2022-10-03 11:01:42 UTC,Droseraceae,Drosera,Drosera spatulata,3.dicot,native
1/11/2022,6209647,2022-11-01 09:18:55 UTC,Droseraceae,Drosera,Drosera spatulata,3.dicot,native
26/11/2022,2531563,2022-11-26 23:26:06 UTC,Droseraceae,Drosera,Drosera spatulata,3.dicot,native
26/11/2022,4743351,2022-11-29 10:16:15 UTC,Droseraceae,Drosera,Drosera spatulata,3.dicot,native
14/12/2022,1974770,2022-12-14 05:34:48 UTC,Droseraceae,Drosera,Drosera spatulata,3.dicot,native
15/12/2022,6157361,2022-12-16 00:58:45 UTC,Droseraceae,Drosera,Drosera spatulata,3.dicot,native
30/11/2022,1477617,2022-12-20 08:01:06 UTC,Droseraceae,Drosera,Drosera spatulata,3.dicot,native
10/12/2022,3843404,2023-01-13 00:27:28 UTC,Droseraceae,Drosera,Drosera spatulata,3.dicot,native
24/01/2023,2794141,2023-01-24 10:19:08 UTC,Droseraceae,Drosera,Drosera spatulata,3.dicot,native
26/01/2023,2376854,2023-01-27 12:25:33 UTC,Droseraceae,Drosera,Drosera spatulata,3.dicot,native
26/01/2023,2376854,2023-01-27 12:25:33 UTC,Droseraceae,Drosera,Drosera spatulata,3.dicot,native
25/01/2023,2873764,2023-02-08 08:05:25 UTC,Droseraceae,Drosera,Drosera spatulata,3.dicot,native
13/02/2023,2631448,2023-02-13 11:30:31 UTC,Droseraceae,Drosera,Drosera spatulata,3.dicot,native
25/02/2023,3653978,2023-02-25 07:05:28 UTC,Droseraceae,Drosera,Drosera spatulata,3.dicot,native
26/02/2023,6468406,2023-02-26 08:17:41 UTC,Droseraceae,Drosera,Drosera spatulata,3.dicot,native
12/03/2023,6566631,2023-03-12 05:33:55 UTC,Droseraceae,Drosera,Drosera spatulata,3.dicot,native
9/03/2023,1658043,2023-03-13 07:22:30 UTC,Droseraceae,Drosera,Drosera spatulata,3.dicot,native
4/03/2023,1187603,2023-03-14 11:06:14 UTC,Droseraceae,Drosera,Drosera spatulata,3.dicot,native
5/04/2023,1809954,2023-04-06 23:16:09 UTC,Droseraceae,Drosera,Drosera spatulata,3.dicot,native
12/04/2023,6603678,2023-04-12 07:17:56 UTC,Droseraceae,Drosera,Drosera spatulata,3.dicot,native
16/04/2023,6342750,2023-04-16 12:47:34 UTC,Droseraceae,Drosera,Drosera spatulata,3.dicot,native
18/04/2023,3009465,2023-04-18 06:26:44 UTC,Droseraceae,Drosera,Drosera spatulata,3.dicot,native
12/04/2023,6612786,2023-04-27 02:57:00 UTC,Droseraceae,Drosera,Drosera spatulata,3.dicot,native
28/04/2023,5989765,2023-04-30 03:04:02 UTC,Droseraceae,Drosera,Drosera spatulata,3.dicot,native
6/05/2023,1492000,2023-05-06 06:18:30 UTC,Droseraceae,Drosera,Drosera spatulata,3.dicot,native
29/05/2023,4231868,2023-05-29 04:25:19 UTC,Droseraceae,Drosera,Drosera spatulata,3.dicot,native
27/05/2023,6209647,2023-05-29 16:49:45 UTC,Droseraceae,Drosera,Drosera spatulata,3.dicot,native
12/02/2023,74355,2023-06-02 11:31:50 UTC,Droseraceae,Drosera,Drosera spatulata,3.dicot,native
3/06/2023,2376854,2023-06-04 07:43:53 UTC,Droseraceae,Drosera,Drosera spatulata,3.dicot,native
25/06/2023,6955767,2023-06-25 05:41:53 UTC,Droseraceae,Drosera,Drosera spatulata,3.dicot,native
3/06/2023,4916136,2023-07-03 12:49:22 UTC,Droseraceae,Drosera,Drosera spatulata,3.dicot,native
16/07/2023,2366151,2023-07-16 11:01:32 UTC,Droseraceae,Drosera,Drosera spatulata,3.dicot,native
16/07/2023,3653978,2023-07-16 11:26:04 UTC,Droseraceae,Drosera,Drosera spatulata,3.dicot,native
29/07/2023,2650798,2023-07-30 10:30:36 UTC,Droseraceae,Drosera,Drosera spatulata,3.dicot,native
24/06/2023,5869062,2023-08-08 07:50:02 UTC,Droseraceae,Drosera,Drosera spatulata,3.dicot,native
11/08/2023,4743351,2023-08-13 03:27:27 UTC,Droseraceae,Drosera,Drosera spatulata,3.dicot,native
14/08/2023,4059674,2023-08-14 07:41:44 UTC,Droseraceae,Drosera,Drosera spatulata,3.dicot,native
21/08/2023,6209647,2023-08-21 14:54:30 UTC,Droseraceae,Drosera,Drosera spatulata,3.dicot,native
21/08/2023,4177273,2023-08-21 22:26:42 UTC,Droseraceae,Drosera,Drosera spatulata,3.dicot,native
7/09/2023,5188972,2023-09-07 12:10:49 UTC,Droseraceae,Drosera,Drosera spatulata,3.dicot,native
10/09/2023,3361124,2023-09-10 08:17:10 UTC,Droseraceae,Drosera,Drosera spatulata,3.dicot,native
5/09/2023,4743351,2023-09-14 11:56:28 UTC,Droseraceae,Drosera,Drosera spatulata,3.dicot,native
24/09/2023,4359490,2023-09-24 06:42:08 UTC,Droseraceae,Drosera,Drosera spatulata,3.dicot,native
20/09/2023,5435930,2023-09-25 12:15:16 UTC,Droseraceae,Drosera,Drosera spatulata,3.dicot,native
20/09/2023,5435930,2023-09-25 12:15:17 UTC,Droseraceae,Drosera,Drosera spatulata,3.dicot,native
30/09/2023,7066727,2023-09-30 04:13:46 UTC,Droseraceae,Drosera,Drosera spatulata,3.dicot,native
14/10/2023,3751299,2023-10-14 04:33:40 UTC,Droseraceae,Drosera,Drosera spatulata,3.dicot,native
22/10/2023,5874479,2023-10-22 08:58:38 UTC,Droseraceae,Drosera,Drosera spatulata,3.dicot,native
11/10/2023,6516136,2023-10-23 03:41:31 UTC,Droseraceae,Drosera,Drosera spatulata,3.dicot,native
21/10/2023,1708045,2023-10-24 04:36:24 UTC,Droseraceae,Drosera,Drosera spatulata,3.dicot,native
28/10/2023,7487910,2023-10-28 09:52:12 UTC,Droseraceae,Drosera,Drosera spatulata,3.dicot,native
28/10/2023,2631448,2023-10-29 01:31:48 UTC,Droseraceae,Drosera,Drosera spatulata,3.dicot,native
28/10/2023,7538694,2023-10-31 10:09:45 UTC,Droseraceae,Drosera,Drosera spatulata,3.dicot,native
15/12/2023,6542702,2023-12-15 00:20:04 UTC,Droseraceae,Drosera,Drosera spatulata,3.dicot,native
15/12/2023,7471329,2023-12-15 07:30:07 UTC,Droseraceae,Drosera,Drosera spatulata,3.dicot,native
13/12/2023,7617746,2023-12-16 20:45:24 UTC,Droseraceae,Drosera,Drosera spatulata,3.dicot,native
28/12/2023,7464766,2023-12-28 11:15:25 UTC,Droseraceae,Drosera,Drosera spatulata,3.dicot,native
28/12/2023,7464766,2023-12-31 02:55:24 UTC,Droseraceae,Drosera,Drosera spatulata,3.dicot,native
28/12/2023,7464766,2023-12-31 02:55:25 UTC,Droseraceae,Drosera,Drosera spatulata,3.dicot,native
28/12/2023,7464766,2024-01-02 03:28:41 UTC,Droseraceae,Drosera,Drosera spatulata,3.dicot,native
2/01/2024,661392,2024-01-02 06:22:33 UTC,Droseraceae,Drosera,Drosera spatulata,3.dicot,native
2/01/2024,1138587,2024-01-02 09:12:25 UTC,Droseraceae,Drosera,Drosera spatulata,3.dicot,native
3/01/2024,3197473,2024-01-03 04:54:16 UTC,Droseraceae,Drosera,Drosera spatulata,3.dicot,native
10/02/2024,1138587,2024-02-10 07:12:37 UTC,Droseraceae,Drosera,Drosera spatulata,3.dicot,native
12/02/2024,4824275,2024-02-12 04:43:36 UTC,Droseraceae,Drosera,Drosera spatulata,3.dicot,native
20/02/2024,4743351,2024-02-20 23:21:06 UTC,Droseraceae,Drosera,Drosera spatulata,3.dicot,native
2/03/2024,5810336,2024-03-03 00:48:13 UTC,Droseraceae,Drosera,Drosera spatulata,3.dicot,native
19/01/2024,1792,2024-03-10 05:33:50 UTC,Droseraceae,Drosera,Drosera spatulata,3.dicot,native
28/03/2024,1138587,2024-03-28 06:55:17 UTC,Droseraceae,Drosera,Drosera spatulata,3.dicot,native
31/03/2024,2879008,2024-03-31 10:25:07 UTC,Droseraceae,Drosera,Drosera spatulata,3.dicot,native
26/01/2023,8088598,2024-05-01 04:43:23 UTC,Droseraceae,Drosera,Drosera spatulata,3.dicot,native
19/05/2024,3308584,2024-05-19 07:36:47 UTC,Droseraceae,Drosera,Drosera spatulata,3.dicot,native
19/10/2019,2385182,2019-10-24 02:16:55 UTC,Solanaceae,Duboisia,Duboisia myoporoides,3.dicot,native
11/10/2020,2488549,2020-10-11 08:24:57 UTC,Solanaceae,Duboisia,Duboisia myoporoides,3.dicot,native
11/10/2020,2488549,2020-10-11 10:34:17 UTC,Solanaceae,Duboisia,Duboisia myoporoides,3.dicot,native
24/09/2021,4887682,2021-09-24 05:36:41 UTC,Solanaceae,Duboisia,Duboisia myoporoides,3.dicot,native
30/09/2021,2488549,2021-09-30 10:24:31 UTC,Solanaceae,Duboisia,Duboisia myoporoides,3.dicot,native
30/09/2021,2488549,2021-09-30 10:24:32 UTC,Solanaceae,Duboisia,Duboisia myoporoides,3.dicot,native
30/09/2021,2488549,2021-09-30 10:24:34 UTC,Solanaceae,Duboisia,Duboisia myoporoides,3.dicot,native
22/10/2021,2488549,2021-10-22 09:10:43 UTC,Solanaceae,Duboisia,Duboisia myoporoides,3.dicot,native
18/11/2022,2488549,2022-11-18 03:55:48 UTC,Solanaceae,Duboisia,Duboisia myoporoides,3.dicot,native
11/08/2023,2488549,2023-08-11 11:59:41 UTC,Solanaceae,Duboisia,Duboisia myoporoides,3.dicot,native
14/09/2022,745089,2024-03-29 04:10:48 UTC,Solanaceae,Duboisia,Duboisia myoporoides,3.dicot,native
14/09/2022,745089,2024-03-29 04:10:50 UTC,Solanaceae,Duboisia,Duboisia myoporoides,3.dicot,native
27/04/2024,6315426,2024-04-27 09:12:25 UTC,Solanaceae,Duboisia,Duboisia myoporoides,3.dicot,native
1/01/2023,2376854,2023-01-01 15:40:38 UTC,Poaceae,Echinopogon,Echinopogon ovatus,4.monocot,native
25/01/2020,2488549,2020-01-25 03:05:09 UTC,Elaeocarpaceae,Elaeocarpus,Elaeocarpus reticulatus,3.dicot,native
26/01/2020,2488549,2020-01-26 07:26:29 UTC,Elaeocarpaceae,Elaeocarpus,Elaeocarpus reticulatus,3.dicot,native
4/08/2020,2488549,2020-08-04 05:25:05 UTC,Elaeocarpaceae,Elaeocarpus,Elaeocarpus reticulatus,3.dicot,native
21/08/2020,2488549,2020-08-21 10:25:08 UTC,Elaeocarpaceae,Elaeocarpus,Elaeocarpus reticulatus,3.dicot,native
29/08/2020,2488549,2020-08-29 05:24:36 UTC,Elaeocarpaceae,Elaeocarpus,Elaeocarpus reticulatus,3.dicot,native
11/10/2020,2488549,2020-10-12 09:46:31 UTC,Elaeocarpaceae,Elaeocarpus,Elaeocarpus reticulatus,3.dicot,native
21/11/2020,265090,2020-11-21 22:12:46 UTC,Elaeocarpaceae,Elaeocarpus,Elaeocarpus reticulatus,3.dicot,native
15/12/2018,3313573,2021-01-04 07:39:44 UTC,Elaeocarpaceae,Elaeocarpus,Elaeocarpus reticulatus,3.dicot,native
8/11/2020,3313584,2021-02-02 02:58:31 UTC,Elaeocarpaceae,Elaeocarpus,Elaeocarpus reticulatus,3.dicot,native
13/11/2021,325733,2021-11-15 23:19:40 UTC,Elaeocarpaceae,Elaeocarpus,Elaeocarpus reticulatus,3.dicot,native
26/11/2022,4743351,2022-11-29 08:56:48 UTC,Elaeocarpaceae,Elaeocarpus,Elaeocarpus reticulatus,3.dicot,native
16/11/2022,6209647,2023-01-25 13:54:29 UTC,Elaeocarpaceae,Elaeocarpus,Elaeocarpus reticulatus,3.dicot,native
20/03/2023,1259195,2023-03-26 10:27:33 UTC,Elaeocarpaceae,Elaeocarpus,Elaeocarpus reticulatus,3.dicot,native
20/03/2023,1259195,2023-03-26 10:28:05 UTC,Elaeocarpaceae,Elaeocarpus,Elaeocarpus reticulatus,3.dicot,native
28/07/2023,6196075,2023-07-28 01:41:21 UTC,Elaeocarpaceae,Elaeocarpus,Elaeocarpus reticulatus,3.dicot,native
24/09/2023,1138587,2023-09-27 02:56:05 UTC,Elaeocarpaceae,Elaeocarpus,Elaeocarpus reticulatus,3.dicot,native
2/03/2019,2488549,2019-12-17 09:10:46 UTC,Celastraceae,Elaeodendron,Elaeodendron australe,3.dicot,native
7/05/2022,1175154,2022-05-07 05:01:12 UTC,Celastraceae,Elaeodendron,Elaeodendron australe,3.dicot,native
20/03/2023,1259195,2023-03-26 10:27:47 UTC,Celastraceae,Elaeodendron,Elaeodendron australe,3.dicot,native
20/03/2023,1259195,2023-03-26 10:27:48 UTC,Celastraceae,Elaeodendron,Elaeodendron australe,3.dicot,native
29/01/2023,2583877,2023-01-29 04:29:51 UTC,Elatinaceae,Elatine,Elatine gratioloides,3.dicot,native
12/10/2021,4743351,2021-10-15 10:56:53 UTC,Restionaceae,Empodisma,Empodisma minus,4.monocot,native
24/09/2023,1138587,2023-09-27 01:50:03 UTC,Musaceae,Ensete,Ensete ventricosum,3.dicot,introduced
24/09/2023,661392,2023-09-27 09:54:30 UTC,Musaceae,Ensete,Ensete ventricosum,3.dicot,introduced
30/04/2022,1138587,2022-04-30 08:39:45 UTC,Poaceae,Entolasia,Entolasia stricta,4.monocot,native
30/04/2022,1138587,2022-04-30 08:39:48 UTC,Poaceae,Entolasia,Entolasia stricta,4.monocot,native
30/04/2022,1138587,2022-04-30 10:27:05 UTC,Poaceae,Entolasia,Entolasia stricta,4.monocot,native
25/09/2022,1138587,2022-09-25 06:58:38 UTC,Poaceae,Entolasia,Entolasia stricta,4.monocot,native
24/09/2023,1138587,2023-09-27 02:08:27 UTC,Poaceae,Entolasia,Entolasia stricta,4.monocot,native
29/08/2020,2488549,2020-08-30 08:51:27 UTC,Ericaceae,Epacris,Epacris coriacea,3.dicot,native
25/10/2010,2991,2012-10-09 01:14:40 UTC,Ericaceae,Epacris,Epacris longiflora,3.dicot,native
2/11/2011,2991,2013-06-10 21:30:13 UTC,Ericaceae,Epacris,Epacris longiflora,3.dicot,native
26/10/2014,64271,2014-11-20 22:06:47 UTC,Ericaceae,Epacris,Epacris longiflora,3.dicot,native
2/01/2015,62990,2015-01-02 06:24:17 UTC,Ericaceae,Epacris,Epacris longiflora,3.dicot,native
13/06/2015,64271,2015-06-20 13:15:40 UTC,Ericaceae,Epacris,Epacris longiflora,3.dicot,native
29/10/2014,2991,2015-07-23 18:25:05 UTC,Ericaceae,Epacris,Epacris longiflora,3.dicot,native
21/10/2016,13444,2016-10-23 22:17:14 UTC,Ericaceae,Epacris,Epacris longiflora,3.dicot,native
24/04/2017,455905,2017-04-24 03:14:07 UTC,Ericaceae,Epacris,Epacris longiflora,3.dicot,native
27/06/2017,508985,2017-06-27 11:28:21 UTC,Ericaceae,Epacris,Epacris longiflora,3.dicot,native
23/04/2018,852658,2018-04-23 05:56:11 UTC,Ericaceae,Epacris,Epacris longiflora,3.dicot,native
17/05/2018,364713,2018-05-17 08:49:01 UTC,Ericaceae,Epacris,Epacris longiflora,3.dicot,native
16/05/2018,558419,2018-05-18 13:25:46 UTC,Ericaceae,Epacris,Epacris longiflora,3.dicot,native
1/01/2018,269775,2018-06-13 07:44:36 UTC,Ericaceae,Epacris,Epacris longiflora,3.dicot,native
14/10/2018,1148374,2018-10-20 03:21:35 UTC,Ericaceae,Epacris,Epacris longiflora,3.dicot,native
3/02/2019,793005,2019-02-03 10:54:58 UTC,Ericaceae,Epacris,Epacris longiflora,3.dicot,native
25/04/2019,1607606,2019-04-24 14:48:12 UTC,Ericaceae,Epacris,Epacris longiflora,3.dicot,native
26/04/2019,287994,2019-04-26 05:46:00 UTC,Ericaceae,Epacris,Epacris longiflora,3.dicot,native
23/04/2019,1589168,2019-04-28 02:01:48 UTC,Ericaceae,Epacris,Epacris longiflora,3.dicot,native
19/05/2019,1527933,2019-05-19 12:27:40 UTC,Ericaceae,Epacris,Epacris longiflora,3.dicot,native
11/08/2019,45978,2019-08-11 05:51:23 UTC,Ericaceae,Epacris,Epacris longiflora,3.dicot,native
6/08/2019,783222,2019-08-14 01:39:51 UTC,Ericaceae,Epacris,Epacris longiflora,3.dicot,native
7/10/2019,708958,2019-10-07 05:58:15 UTC,Ericaceae,Epacris,Epacris longiflora,3.dicot,native
23/09/2019,636550,2019-10-18 08:07:05 UTC,Ericaceae,Epacris,Epacris longiflora,3.dicot,native
21/10/2019,550350,2019-10-21 06:48:07 UTC,Ericaceae,Epacris,Epacris longiflora,3.dicot,native
21/10/2019,550350,2019-10-21 06:49:45 UTC,Ericaceae,Epacris,Epacris longiflora,3.dicot,native
19/10/2019,2385182,2019-10-24 02:30:49 UTC,Ericaceae,Epacris,Epacris longiflora,3.dicot,native
1/09/2018,2488549,2019-12-21 04:39:06 UTC,Ericaceae,Epacris,Epacris longiflora,3.dicot,native
15/02/2020,2488549,2020-02-15 08:59:12 UTC,Ericaceae,Epacris,Epacris longiflora,3.dicot,native
9/03/2020,2488549,2020-03-09 09:26:36 UTC,Ericaceae,Epacris,Epacris longiflora,3.dicot,native
19/03/2020,2488549,2020-03-19 05:54:01 UTC,Ericaceae,Epacris,Epacris longiflora,3.dicot,native
28/03/2020,2677090,2020-03-28 01:06:52 UTC,Ericaceae,Epacris,Epacris longiflora,3.dicot,native
3/04/2020,2488549,2020-04-03 08:18:23 UTC,Ericaceae,Epacris,Epacris longiflora,3.dicot,native
9/10/2004,2584563,2020-04-03 10:13:13 UTC,Ericaceae,Epacris,Epacris longiflora,3.dicot,native
1/05/2020,2488549,2020-05-01 07:29:38 UTC,Ericaceae,Epacris,Epacris longiflora,3.dicot,native
12/04/2019,364517,2020-06-29 15:20:42 UTC,Ericaceae,Epacris,Epacris longiflora,3.dicot,native
24/12/1981,648584,2020-07-04 02:25:08 UTC,Ericaceae,Epacris,Epacris longiflora,3.dicot,native
24/07/2020,2488549,2020-07-24 12:02:34 UTC,Ericaceae,Epacris,Epacris longiflora,3.dicot,native
5/06/2020,793005,2020-07-25 03:32:30 UTC,Ericaceae,Epacris,Epacris longiflora,3.dicot,native
5/06/2020,793005,2020-07-25 03:33:22 UTC,Ericaceae,Epacris,Epacris longiflora,3.dicot,native
25/06/2020,793005,2020-07-30 16:00:51 UTC,Ericaceae,Epacris,Epacris longiflora,3.dicot,native
26/06/2020,793005,2020-07-31 12:53:48 UTC,Ericaceae,Epacris,Epacris longiflora,3.dicot,native
2/08/2020,2444826,2020-08-02 08:52:38 UTC,Ericaceae,Epacris,Epacris longiflora,3.dicot,native
2/08/2020,3376917,2020-08-02 09:03:43 UTC,Ericaceae,Epacris,Epacris longiflora,3.dicot,native
5/08/2020,2488549,2020-08-05 09:22:50 UTC,Ericaceae,Epacris,Epacris longiflora,3.dicot,native
16/08/2020,3328383,2020-08-16 07:44:20 UTC,Ericaceae,Epacris,Epacris longiflora,3.dicot,native
29/08/2020,2488549,2020-08-29 05:11:42 UTC,Ericaceae,Epacris,Epacris longiflora,3.dicot,native
30/08/2020,3012594,2020-08-31 04:05:15 UTC,Ericaceae,Epacris,Epacris longiflora,3.dicot,native
13/09/2020,2472277,2020-09-16 02:33:29 UTC,Ericaceae,Epacris,Epacris longiflora,3.dicot,native
23/09/2016,742241,2020-09-28 23:49:01 UTC,Ericaceae,Epacris,Epacris longiflora,3.dicot,native
29/09/2020,738376,2020-10-02 02:40:53 UTC,Ericaceae,Epacris,Epacris longiflora,3.dicot,native
20/10/2020,3629360,2020-10-22 05:41:13 UTC,Ericaceae,Epacris,Epacris longiflora,3.dicot,native
20/10/2020,3629360,2020-10-22 05:41:13 UTC,Ericaceae,Epacris,Epacris longiflora,3.dicot,native
20/10/2020,3629360,2020-10-22 05:41:13 UTC,Ericaceae,Epacris,Epacris longiflora,3.dicot,native
20/10/2020,3629360,2020-10-22 05:41:14 UTC,Ericaceae,Epacris,Epacris longiflora,3.dicot,native
10/10/2020,3769668,2020-10-23 21:36:04 UTC,Ericaceae,Epacris,Epacris longiflora,3.dicot,native
23/10/2020,3654699,2020-10-26 04:42:48 UTC,Ericaceae,Epacris,Epacris longiflora,3.dicot,native
21/11/2020,265090,2020-11-21 22:31:49 UTC,Ericaceae,Epacris,Epacris longiflora,3.dicot,native
1/01/2021,2376854,2021-01-01 14:16:37 UTC,Ericaceae,Epacris,Epacris longiflora,3.dicot,native
15/12/2018,3313573,2021-01-04 07:57:01 UTC,Ericaceae,Epacris,Epacris longiflora,3.dicot,native
28/02/2021,2376854,2021-02-28 12:07:00 UTC,Ericaceae,Epacris,Epacris longiflora,3.dicot,native
7/03/2021,4074096,2021-03-07 07:51:22 UTC,Ericaceae,Epacris,Epacris longiflora,3.dicot,native
1/05/2021,2738946,2021-05-01 12:18:11 UTC,Ericaceae,Epacris,Epacris longiflora,3.dicot,native
12/06/2021,3309790,2021-06-12 05:48:50 UTC,Ericaceae,Epacris,Epacris longiflora,3.dicot,native
27/06/2021,3957444,2021-06-27 07:45:33 UTC,Ericaceae,Epacris,Epacris longiflora,3.dicot,native
4/07/2021,3957444,2021-07-04 05:56:47 UTC,Ericaceae,Epacris,Epacris longiflora,3.dicot,native
15/06/2021,4743351,2021-07-20 05:32:48 UTC,Ericaceae,Epacris,Epacris longiflora,3.dicot,native
25/05/2021,4743351,2021-07-20 08:29:59 UTC,Ericaceae,Epacris,Epacris longiflora,3.dicot,native
18/09/2020,4743351,2021-07-24 07:17:15 UTC,Ericaceae,Epacris,Epacris longiflora,3.dicot,native
15/09/2020,4743351,2021-07-25 04:51:45 UTC,Ericaceae,Epacris,Epacris longiflora,3.dicot,native
29/08/2020,4743351,2021-07-25 10:37:35 UTC,Ericaceae,Epacris,Epacris longiflora,3.dicot,native
20/10/2018,4359544,2021-08-07 06:25:59 UTC,Ericaceae,Epacris,Epacris longiflora,3.dicot,native
5/09/2021,4944844,2021-09-05 11:45:42 UTC,Ericaceae,Epacris,Epacris longiflora,3.dicot,native
31/08/2021,4916136,2021-09-05 13:44:24 UTC,Ericaceae,Epacris,Epacris longiflora,3.dicot,native
6/09/2021,4887682,2021-09-06 09:17:06 UTC,Ericaceae,Epacris,Epacris longiflora,3.dicot,native
12/06/2021,4966726,2021-09-08 06:39:08 UTC,Ericaceae,Epacris,Epacris longiflora,3.dicot,native
11/09/2021,4025155,2021-09-11 22:33:22 UTC,Ericaceae,Epacris,Epacris longiflora,3.dicot,native
12/09/2021,2488549,2021-09-12 09:19:33 UTC,Ericaceae,Epacris,Epacris longiflora,3.dicot,native
18/09/2021,4945027,2021-09-18 10:29:00 UTC,Ericaceae,Epacris,Epacris longiflora,3.dicot,native
5/09/2021,3792160,2021-09-22 08:51:44 UTC,Ericaceae,Epacris,Epacris longiflora,3.dicot,native
23/09/2021,4916136,2021-09-26 03:20:11 UTC,Ericaceae,Epacris,Epacris longiflora,3.dicot,native
23/09/2021,3893507,2021-09-29 11:30:03 UTC,Ericaceae,Epacris,Epacris longiflora,3.dicot,native
8/10/2021,4916136,2021-10-08 12:24:48 UTC,Ericaceae,Epacris,Epacris longiflora,3.dicot,native
12/10/2021,4743351,2021-10-16 11:21:51 UTC,Ericaceae,Epacris,Epacris longiflora,3.dicot,native
17/10/2021,1175154,2021-10-17 08:26:36 UTC,Ericaceae,Epacris,Epacris longiflora,3.dicot,native
1/09/2021,2665854,2021-10-22 06:40:08 UTC,Ericaceae,Epacris,Epacris longiflora,3.dicot,native
28/09/2021,3792160,2021-10-24 11:33:14 UTC,Ericaceae,Epacris,Epacris longiflora,3.dicot,native
13/11/2021,325733,2021-11-15 23:32:34 UTC,Ericaceae,Epacris,Epacris longiflora,3.dicot,native
29/11/2021,5194154,2021-11-29 21:58:12 UTC,Ericaceae,Epacris,Epacris longiflora,3.dicot,native
16/12/2021,2531563,2021-12-23 05:54:24 UTC,Ericaceae,Epacris,Epacris longiflora,3.dicot,native
17/11/2021,3880468,2022-01-08 10:55:36 UTC,Ericaceae,Epacris,Epacris longiflora,3.dicot,native
12/07/2021,5283632,2022-01-09 14:10:24 UTC,Ericaceae,Epacris,Epacris longiflora,3.dicot,native
30/10/2021,5304898,2022-01-15 08:33:59 UTC,Ericaceae,Epacris,Epacris longiflora,3.dicot,native
3/04/2011,2173044,2022-01-16 05:45:25 UTC,Ericaceae,Epacris,Epacris longiflora,3.dicot,native
22/01/2022,2317723,2022-01-28 01:39:06 UTC,Ericaceae,Epacris,Epacris longiflora,3.dicot,native
6/02/2022,4194794,2022-02-06 02:09:41 UTC,Ericaceae,Epacris,Epacris longiflora,3.dicot,native
6/02/2022,575123,2022-02-11 08:25:01 UTC,Ericaceae,Epacris,Epacris longiflora,3.dicot,native
1/02/2022,5376627,2022-02-24 04:42:16 UTC,Ericaceae,Epacris,Epacris longiflora,3.dicot,native
27/03/2022,5451322,2022-03-27 01:31:00 UTC,Ericaceae,Epacris,Epacris longiflora,3.dicot,native
28/03/2022,2243582,2022-03-28 07:34:42 UTC,Ericaceae,Epacris,Epacris longiflora,3.dicot,native
16/04/2022,2488549,2022-04-16 06:31:35 UTC,Ericaceae,Epacris,Epacris longiflora,3.dicot,native
16/04/2022,3751299,2022-04-16 10:57:54 UTC,Ericaceae,Epacris,Epacris longiflora,3.dicot,native
29/05/2022,3978191,2022-06-05 09:22:56 UTC,Ericaceae,Epacris,Epacris longiflora,3.dicot,native
7/06/2022,1233583,2022-06-07 08:53:54 UTC,Ericaceae,Epacris,Epacris longiflora,3.dicot,native
18/01/1988,717200,2022-06-17 02:20:45 UTC,Ericaceae,Epacris,Epacris longiflora,3.dicot,native
20/07/2021,3678274,2022-06-19 11:33:19 UTC,Ericaceae,Epacris,Epacris longiflora,3.dicot,native
26/06/2022,3978191,2022-06-26 08:13:08 UTC,Ericaceae,Epacris,Epacris longiflora,3.dicot,native
26/06/2022,2322306,2022-06-26 10:11:08 UTC,Ericaceae,Epacris,Epacris longiflora,3.dicot,native
22/04/2022,3221790,2022-06-29 10:29:44 UTC,Ericaceae,Epacris,Epacris longiflora,3.dicot,native
30/04/2019,2453859,2022-07-07 09:49:14 UTC,Ericaceae,Epacris,Epacris longiflora,3.dicot,native
19/07/2022,4724286,2022-07-19 08:01:52 UTC,Ericaceae,Epacris,Epacris longiflora,3.dicot,native
30/07/2022,4743351,2022-08-03 12:23:19 UTC,Ericaceae,Epacris,Epacris longiflora,3.dicot,native
6/08/2022,4743351,2022-08-08 11:13:11 UTC,Ericaceae,Epacris,Epacris longiflora,3.dicot,native
14/08/2022,3978191,2022-08-14 10:13:28 UTC,Ericaceae,Epacris,Epacris longiflora,3.dicot,native
21/08/2022,3839358,2022-08-21 11:07:41 UTC,Ericaceae,Epacris,Epacris longiflora,3.dicot,native
27/08/2022,5188972,2022-08-28 21:51:37 UTC,Ericaceae,Epacris,Epacris longiflora,3.dicot,native
3/06/2017,5971295,2022-08-29 19:12:11 UTC,Ericaceae,Epacris,Epacris longiflora,3.dicot,native
6/09/2022,5650282,2022-09-08 07:24:25 UTC,Ericaceae,Epacris,Epacris longiflora,3.dicot,native
11/09/2022,1175154,2022-09-11 08:03:15 UTC,Ericaceae,Epacris,Epacris longiflora,3.dicot,native
25/09/2022,1138587,2022-09-25 06:58:34 UTC,Ericaceae,Epacris,Epacris longiflora,3.dicot,native
25/09/2022,3957444,2022-09-25 08:24:46 UTC,Ericaceae,Epacris,Epacris longiflora,3.dicot,native
12/08/2017,5083980,2022-10-02 05:11:37 UTC,Ericaceae,Epacris,Epacris longiflora,3.dicot,native
2/10/2022,1401423,2022-10-03 11:01:44 UTC,Ericaceae,Epacris,Epacris longiflora,3.dicot,native
21/10/2022,2340828,2022-10-21 07:21:26 UTC,Ericaceae,Epacris,Epacris longiflora,3.dicot,native
2/10/2022,811913,2022-10-23 18:25:47 UTC,Ericaceae,Epacris,Epacris longiflora,3.dicot,native
25/10/2022,2512752,2022-10-25 22:10:55 UTC,Ericaceae,Epacris,Epacris longiflora,3.dicot,native
10/11/2022,3676913,2022-11-11 02:37:26 UTC,Ericaceae,Epacris,Epacris longiflora,3.dicot,native
14/11/2022,3441963,2022-11-14 23:05:50 UTC,Ericaceae,Epacris,Epacris longiflora,3.dicot,native
10/11/2022,624851,2022-11-19 22:28:42 UTC,Ericaceae,Epacris,Epacris longiflora,3.dicot,native
13/11/2022,624851,2022-11-21 05:42:56 UTC,Ericaceae,Epacris,Epacris longiflora,3.dicot,native
10/11/2022,3676913,2022-11-26 02:10:42 UTC,Ericaceae,Epacris,Epacris longiflora,3.dicot,native
19/11/2022,6308282,2022-11-27 08:43:53 UTC,Ericaceae,Epacris,Epacris longiflora,3.dicot,native
26/11/2022,5335499,2022-11-28 14:18:04 UTC,Ericaceae,Epacris,Epacris longiflora,3.dicot,native
26/11/2022,4743351,2022-11-29 08:56:47 UTC,Ericaceae,Epacris,Epacris longiflora,3.dicot,native
11/10/2022,6259435,2022-12-02 13:21:45 UTC,Ericaceae,Epacris,Epacris longiflora,3.dicot,native
14/12/2022,1974770,2022-12-15 04:50:27 UTC,Ericaceae,Epacris,Epacris longiflora,3.dicot,native
25/09/2022,4743351,2022-12-22 04:08:27 UTC,Ericaceae,Epacris,Epacris longiflora,3.dicot,native
29/12/2022,4299702,2022-12-28 22:37:40 UTC,Ericaceae,Epacris,Epacris longiflora,3.dicot,native
29/12/2022,4299702,2022-12-28 22:37:55 UTC,Ericaceae,Epacris,Epacris longiflora,3.dicot,native
4/01/2023,5027854,2023-01-05 03:24:11 UTC,Ericaceae,Epacris,Epacris longiflora,3.dicot,native
25/08/2019,863991,2023-02-01 23:55:47 UTC,Ericaceae,Epacris,Epacris longiflora,3.dicot,native
12/02/2023,4743351,2023-02-13 10:50:54 UTC,Ericaceae,Epacris,Epacris longiflora,3.dicot,native
12/03/2023,6566631,2023-03-12 05:27:16 UTC,Ericaceae,Epacris,Epacris longiflora,3.dicot,native
9/03/2023,1658043,2023-03-13 05:43:56 UTC,Ericaceae,Epacris,Epacris longiflora,3.dicot,native
16/03/2023,1175154,2023-03-16 22:44:54 UTC,Ericaceae,Epacris,Epacris longiflora,3.dicot,native
18/03/2023,5678217,2023-03-18 02:12:37 UTC,Ericaceae,Epacris,Epacris longiflora,3.dicot,native
19/03/2023,4743351,2023-03-23 11:18:06 UTC,Ericaceae,Epacris,Epacris longiflora,3.dicot,native
26/03/2023,2650798,2023-03-26 23:32:30 UTC,Ericaceae,Epacris,Epacris longiflora,3.dicot,native
7/06/2017,3936801,2023-05-11 08:08:06 UTC,Ericaceae,Epacris,Epacris longiflora,3.dicot,native
28/12/2022,542372,2023-05-14 08:13:41 UTC,Ericaceae,Epacris,Epacris longiflora,3.dicot,native
20/05/2023,3978191,2023-05-20 10:44:44 UTC,Ericaceae,Epacris,Epacris longiflora,3.dicot,native
6/06/2023,4743351,2023-06-07 00:31:36 UTC,Ericaceae,Epacris,Epacris longiflora,3.dicot,native
25/06/2023,6955767,2023-06-25 05:29:35 UTC,Ericaceae,Epacris,Epacris longiflora,3.dicot,native
2/07/2023,3936801,2023-07-02 02:49:27 UTC,Ericaceae,Epacris,Epacris longiflora,3.dicot,native
7/06/2023,4916136,2023-07-03 12:46:06 UTC,Ericaceae,Epacris,Epacris longiflora,3.dicot,native
9/07/2023,4059674,2023-07-09 05:05:56 UTC,Ericaceae,Epacris,Epacris longiflora,3.dicot,native
9/07/2023,4059674,2023-07-09 05:05:59 UTC,Ericaceae,Epacris,Epacris longiflora,3.dicot,native
16/07/2023,2366151,2023-07-16 10:52:07 UTC,Ericaceae,Epacris,Epacris longiflora,3.dicot,native
20/07/2023,6196075,2023-07-20 02:54:52 UTC,Ericaceae,Epacris,Epacris longiflora,3.dicot,native
29/07/2023,3011927,2023-07-29 09:28:43 UTC,Ericaceae,Epacris,Epacris longiflora,3.dicot,native
29/07/2023,2650798,2023-07-30 10:24:10 UTC,Ericaceae,Epacris,Epacris longiflora,3.dicot,native
14/08/2023,4059674,2023-08-14 07:41:40 UTC,Ericaceae,Epacris,Epacris longiflora,3.dicot,native
13/08/2023,7237427,2023-08-15 06:21:45 UTC,Ericaceae,Epacris,Epacris longiflora,3.dicot,native
16/08/2023,4373866,2023-08-16 10:51:41 UTC,Ericaceae,Epacris,Epacris longiflora,3.dicot,native
21/08/2023,4177273,2023-08-21 22:26:18 UTC,Ericaceae,Epacris,Epacris longiflora,3.dicot,native
27/08/2023,149222,2023-08-27 01:31:03 UTC,Ericaceae,Epacris,Epacris longiflora,3.dicot,native
8/09/2023,2338918,2023-09-09 06:31:15 UTC,Ericaceae,Epacris,Epacris longiflora,3.dicot,native
14/09/2023,4203451,2023-09-14 00:21:20 UTC,Ericaceae,Epacris,Epacris longiflora,3.dicot,native
24/09/2023,4359490,2023-09-24 03:40:17 UTC,Ericaceae,Epacris,Epacris longiflora,3.dicot,native
20/09/2023,5435930,2023-09-25 12:15:21 UTC,Ericaceae,Epacris,Epacris longiflora,3.dicot,native
24/09/2023,1138587,2023-09-27 02:56:04 UTC,Ericaceae,Epacris,Epacris longiflora,3.dicot,native
24/09/2023,661392,2023-09-29 12:23:43 UTC,Ericaceae,Epacris,Epacris longiflora,3.dicot,native
24/09/2023,661392,2023-09-29 12:41:07 UTC,Ericaceae,Epacris,Epacris longiflora,3.dicot,native
7/10/2023,7091879,2023-10-15 01:23:22 UTC,Ericaceae,Epacris,Epacris longiflora,3.dicot,native
15/10/2023,7465608,2023-10-19 13:35:34 UTC,Ericaceae,Epacris,Epacris longiflora,3.dicot,native
28/10/2023,6585857,2023-10-28 05:17:37 UTC,Ericaceae,Epacris,Epacris longiflora,3.dicot,native
30/10/2023,2453859,2023-11-05 02:53:59 UTC,Ericaceae,Epacris,Epacris longiflora,3.dicot,native
6/11/2023,2441642,2023-11-06 09:57:33 UTC,Ericaceae,Epacris,Epacris longiflora,3.dicot,native
13/10/2023,5158,2023-11-06 23:27:19 UTC,Ericaceae,Epacris,Epacris longiflora,3.dicot,native
10/08/2023,2379395,2023-12-05 05:28:08 UTC,Ericaceae,Epacris,Epacris longiflora,3.dicot,native
17/09/2023,745089,2023-12-09 05:39:56 UTC,Ericaceae,Epacris,Epacris longiflora,3.dicot,native
6/12/2023,6020519,2023-12-13 02:54:25 UTC,Ericaceae,Epacris,Epacris longiflora,3.dicot,native
12/12/2023,3786096,2023-12-14 06:57:25 UTC,Ericaceae,Epacris,Epacris longiflora,3.dicot,native
16/01/2024,485705,2024-01-17 01:15:43 UTC,Ericaceae,Epacris,Epacris longiflora,3.dicot,native
23/01/2024,2891161,2024-01-23 05:42:44 UTC,Ericaceae,Epacris,Epacris longiflora,3.dicot,native
28/01/2024,1998322,2024-02-04 03:37:39 UTC,Ericaceae,Epacris,Epacris longiflora,3.dicot,native
11/02/2024,4672448,2024-02-11 03:54:01 UTC,Ericaceae,Epacris,Epacris longiflora,3.dicot,native
22/02/2024,1175154,2024-02-22 06:41:56 UTC,Ericaceae,Epacris,Epacris longiflora,3.dicot,native
5/07/2023,7853818,2024-03-08 06:12:14 UTC,Ericaceae,Epacris,Epacris longiflora,3.dicot,native
14/09/2022,745089,2024-03-13 12:07:46 UTC,Ericaceae,Epacris,Epacris longiflora,3.dicot,native
22/03/2024,7134096,2024-03-22 07:44:34 UTC,Ericaceae,Epacris,Epacris longiflora,3.dicot,native
23/09/2016,7789371,2024-04-05 03:44:41 UTC,Ericaceae,Epacris,Epacris longiflora,3.dicot,native
23/09/2016,7789371,2024-04-05 03:44:44 UTC,Ericaceae,Epacris,Epacris longiflora,3.dicot,native
26/01/2023,8088598,2024-05-03 04:19:36 UTC,Ericaceae,Epacris,Epacris longiflora,3.dicot,native
12/05/2024,6395769,2024-05-12 10:18:40 UTC,Ericaceae,Epacris,Epacris longiflora,3.dicot,native
24/05/2024,2177281,2024-05-26 00:22:31 UTC,Ericaceae,Epacris,Epacris longiflora,3.dicot,native
2/11/2011,2991,2013-06-10 21:17:51 UTC,Ericaceae,Epacris,Epacris microphylla,3.dicot,native
13/06/2015,64271,2015-06-20 13:14:51 UTC,Ericaceae,Epacris,Epacris microphylla,3.dicot,native
29/10/2014,2991,2015-07-23 16:49:03 UTC,Ericaceae,Epacris,Epacris microphylla,3.dicot,native
29/10/2014,2991,2015-07-23 17:56:31 UTC,Ericaceae,Epacris,Epacris microphylla,3.dicot,native
11/08/2019,45978,2019-08-11 05:54:09 UTC,Ericaceae,Epacris,Epacris microphylla,3.dicot,native
16/08/2019,64271,2020-05-23 00:08:03 UTC,Ericaceae,Epacris,Epacris microphylla,3.dicot,native
11/08/1980,2851,2020-06-16 01:29:41 UTC,Ericaceae,Epacris,Epacris microphylla,3.dicot,native
24/12/1981,648584,2020-07-04 13:12:59 UTC,Ericaceae,Epacris,Epacris microphylla,3.dicot,native
18/07/2020,2488549,2020-07-18 09:53:40 UTC,Ericaceae,Epacris,Epacris microphylla,3.dicot,native
19/07/2020,447429,2020-07-19 07:57:26 UTC,Ericaceae,Epacris,Epacris microphylla,3.dicot,native
24/07/2020,2488549,2020-07-24 10:12:57 UTC,Ericaceae,Epacris,Epacris microphylla,3.dicot,native
12/08/2020,2488549,2020-08-12 22:55:56 UTC,Ericaceae,Epacris,Epacris microphylla,3.dicot,native
21/08/2020,2488549,2020-08-21 12:34:53 UTC,Ericaceae,Epacris,Epacris microphylla,3.dicot,native
21/08/2020,2488549,2020-08-21 22:30:34 UTC,Ericaceae,Epacris,Epacris microphylla,3.dicot,native
13/09/2020,3627098,2020-09-17 20:18:47 UTC,Ericaceae,Epacris,Epacris microphylla,3.dicot,native
24/09/2020,2518052,2020-09-24 07:49:07 UTC,Ericaceae,Epacris,Epacris microphylla,3.dicot,native
29/09/2020,738376,2020-10-02 02:40:49 UTC,Ericaceae,Epacris,Epacris microphylla,3.dicot,native
4/10/2020,2444826,2020-10-04 23:49:36 UTC,Ericaceae,Epacris,Epacris microphylla,3.dicot,native
10/10/2020,2779982,2020-10-11 03:14:36 UTC,Ericaceae,Epacris,Epacris microphylla,3.dicot,native
21/07/2021,3312793,2021-07-26 00:16:01 UTC,Ericaceae,Epacris,Epacris microphylla,3.dicot,native
30/08/2021,4916136,2021-08-30 08:29:21 UTC,Ericaceae,Epacris,Epacris microphylla,3.dicot,native
6/09/2021,4887682,2021-09-06 08:23:54 UTC,Ericaceae,Epacris,Epacris microphylla,3.dicot,native
11/09/2021,4025155,2021-09-17 10:37:47 UTC,Ericaceae,Epacris,Epacris microphylla,3.dicot,native
12/10/2021,1786313,2021-10-15 01:32:38 UTC,Ericaceae,Epacris,Epacris microphylla,3.dicot,native
12/10/2021,4743351,2021-10-15 10:56:51 UTC,Ericaceae,Epacris,Epacris microphylla,3.dicot,native
1/09/2021,2665854,2021-10-22 06:49:14 UTC,Ericaceae,Epacris,Epacris microphylla,3.dicot,native
23/10/2021,2376854,2021-10-23 11:55:40 UTC,Ericaceae,Epacris,Epacris microphylla,3.dicot,native
4/09/2016,2451999,2022-02-06 21:50:41 UTC,Ericaceae,Epacris,Epacris microphylla,3.dicot,native
23/06/2022,2488549,2022-06-23 04:08:45 UTC,Ericaceae,Epacris,Epacris microphylla,3.dicot,native
24/07/2022,2488549,2022-07-24 04:05:33 UTC,Ericaceae,Epacris,Epacris microphylla,3.dicot,native
24/07/2022,1175154,2022-07-24 07:12:27 UTC,Ericaceae,Epacris,Epacris microphylla,3.dicot,native
21/08/2022,3345535,2022-08-21 02:23:39 UTC,Ericaceae,Epacris,Epacris microphylla,3.dicot,native
20/08/2022,3012594,2022-08-21 03:52:23 UTC,Ericaceae,Epacris,Epacris microphylla,3.dicot,native
11/09/2022,1175154,2022-09-11 08:15:10 UTC,Ericaceae,Epacris,Epacris microphylla,3.dicot,native
28/08/2022,3629879,2022-09-27 21:42:02 UTC,Ericaceae,Epacris,Epacris microphylla,3.dicot,native
26/09/2022,6199647,2022-09-28 09:51:11 UTC,Ericaceae,Epacris,Epacris microphylla,3.dicot,native
13/11/2022,624851,2022-11-21 06:15:01 UTC,Ericaceae,Epacris,Epacris microphylla,3.dicot,native
11/10/2022,6259435,2022-12-02 13:11:15 UTC,Ericaceae,Epacris,Epacris microphylla,3.dicot,native
25/09/2022,6385192,2022-12-19 01:46:35 UTC,Ericaceae,Epacris,Epacris microphylla,3.dicot,native
22/06/2023,2531563,2023-06-22 08:17:43 UTC,Ericaceae,Epacris,Epacris microphylla,3.dicot,native
2/07/2023,4916136,2023-07-02 09:22:03 UTC,Ericaceae,Epacris,Epacris microphylla,3.dicot,native
8/07/2023,6196075,2023-07-08 02:01:35 UTC,Ericaceae,Epacris,Epacris microphylla,3.dicot,native
23/07/2023,3978191,2023-07-23 10:03:45 UTC,Ericaceae,Epacris,Epacris microphylla,3.dicot,native
23/07/2023,3978191,2023-07-23 10:03:45 UTC,Ericaceae,Epacris,Epacris microphylla,3.dicot,native
24/08/2023,3927361,2023-08-23 21:43:19 UTC,Ericaceae,Epacris,Epacris microphylla,3.dicot,native
25/08/2023,6196075,2023-08-25 08:42:46 UTC,Ericaceae,Epacris,Epacris microphylla,3.dicot,native
8/09/2023,7238725,2023-09-09 04:55:27 UTC,Ericaceae,Epacris,Epacris microphylla,3.dicot,native
5/09/2023,4743351,2023-09-14 11:56:20 UTC,Ericaceae,Epacris,Epacris microphylla,3.dicot,native
24/09/2023,4359490,2023-09-24 06:25:27 UTC,Ericaceae,Epacris,Epacris microphylla,3.dicot,native
20/09/2023,5435930,2023-09-25 12:15:11 UTC,Ericaceae,Epacris,Epacris microphylla,3.dicot,native
20/09/2023,5435930,2023-09-25 12:15:12 UTC,Ericaceae,Epacris,Epacris microphylla,3.dicot,native
24/09/2023,1138587,2023-09-27 03:10:30 UTC,Ericaceae,Epacris,Epacris microphylla,3.dicot,native
24/09/2023,661392,2023-09-29 13:53:56 UTC,Ericaceae,Epacris,Epacris microphylla,3.dicot,native
24/09/2023,661392,2023-09-29 14:08:38 UTC,Ericaceae,Epacris,Epacris microphylla,3.dicot,native
30/09/2023,3678274,2023-10-01 00:19:23 UTC,Ericaceae,Epacris,Epacris microphylla,3.dicot,native
30/09/2023,3678274,2023-10-01 00:19:23 UTC,Ericaceae,Epacris,Epacris microphylla,3.dicot,native
30/01/2024,3478104,2024-01-30 23:01:09 UTC,Ericaceae,Epacris,Epacris microphylla,3.dicot,native
14/09/2022,745089,2024-03-13 12:07:49 UTC,Ericaceae,Epacris,Epacris microphylla,3.dicot,native
23/09/2016,7789371,2024-04-05 03:44:41 UTC,Ericaceae,Epacris,Epacris microphylla,3.dicot,native
4/09/2022,7011911,2024-05-14 10:15:08 UTC,Ericaceae,Epacris,Epacris microphylla,3.dicot,native
13/06/2015,64271,2015-06-20 13:14:52 UTC,Ericaceae,Epacris,Epacris obtusifolia,3.dicot,native
13/06/2015,64271,2015-06-20 13:15:40 UTC,Ericaceae,Epacris,Epacris obtusifolia,3.dicot,native
16/08/2019,64271,2020-05-23 00:21:19 UTC,Ericaceae,Epacris,Epacris obtusifolia,3.dicot,native
23/05/2020,62599,2020-05-23 09:51:13 UTC,Ericaceae,Epacris,Epacris obtusifolia,3.dicot,native
11/08/1980,2851,2020-05-28 22:36:36 UTC,Ericaceae,Epacris,Epacris obtusifolia,3.dicot,native
18/07/2020,3063457,2020-07-21 08:30:54 UTC,Ericaceae,Epacris,Epacris obtusifolia,3.dicot,native
24/07/2020,2488549,2020-07-24 08:50:48 UTC,Ericaceae,Epacris,Epacris obtusifolia,3.dicot,native
24/07/2020,2488549,2020-07-24 08:58:54 UTC,Ericaceae,Epacris,Epacris obtusifolia,3.dicot,native
29/08/2020,4743351,2021-07-26 00:01:51 UTC,Ericaceae,Epacris,Epacris obtusifolia,3.dicot,native
7/07/2020,4743351,2021-08-02 00:24:28 UTC,Ericaceae,Epacris,Epacris obtusifolia,3.dicot,native
15/08/2021,2362113,2021-08-14 23:22:09 UTC,Ericaceae,Epacris,Epacris obtusifolia,3.dicot,native
30/08/2021,4916136,2021-08-30 09:00:11 UTC,Ericaceae,Epacris,Epacris obtusifolia,3.dicot,native
27/09/2021,3978426,2021-09-27 03:38:22 UTC,Ericaceae,Epacris,Epacris obtusifolia,3.dicot,native
29/08/2021,4916136,2021-10-10 12:51:21 UTC,Ericaceae,Epacris,Epacris obtusifolia,3.dicot,native
1/09/2021,2665854,2021-10-22 06:26:34 UTC,Ericaceae,Epacris,Epacris obtusifolia,3.dicot,native
17/11/2021,3880468,2022-01-08 10:55:36 UTC,Ericaceae,Epacris,Epacris obtusifolia,3.dicot,native
23/01/2022,2512752,2022-05-06 10:39:43 UTC,Ericaceae,Epacris,Epacris obtusifolia,3.dicot,native
22/05/2022,2488549,2022-05-22 11:46:15 UTC,Ericaceae,Epacris,Epacris obtusifolia,3.dicot,native
22/05/2022,2488549,2022-05-23 06:44:23 UTC,Ericaceae,Epacris,Epacris obtusifolia,3.dicot,native
26/06/2022,3978191,2022-06-26 08:07:37 UTC,Ericaceae,Epacris,Epacris obtusifolia,3.dicot,native
6/08/2022,4743351,2022-08-08 11:13:11 UTC,Ericaceae,Epacris,Epacris obtusifolia,3.dicot,native
28/12/2022,2488549,2022-12-28 02:14:17 UTC,Ericaceae,Epacris,Epacris obtusifolia,3.dicot,native
25/01/2023,2873764,2023-02-08 08:05:37 UTC,Ericaceae,Epacris,Epacris obtusifolia,3.dicot,native
2/06/2023,5037697,2023-06-02 03:56:09 UTC,Ericaceae,Epacris,Epacris obtusifolia,3.dicot,native
2/07/2023,4916136,2023-07-02 09:24:21 UTC,Ericaceae,Epacris,Epacris obtusifolia,3.dicot,native
15/07/2023,2531563,2023-07-16 06:22:34 UTC,Ericaceae,Epacris,Epacris obtusifolia,3.dicot,native
20/07/2023,6196075,2023-07-20 02:04:28 UTC,Ericaceae,Epacris,Epacris obtusifolia,3.dicot,native
29/07/2023,2650798,2023-07-30 10:38:54 UTC,Ericaceae,Epacris,Epacris obtusifolia,3.dicot,native
29/07/2023,2650798,2023-07-30 11:04:11 UTC,Ericaceae,Epacris,Epacris obtusifolia,3.dicot,native
21/08/2023,6209647,2023-08-21 10:34:57 UTC,Ericaceae,Epacris,Epacris obtusifolia,3.dicot,native
26/08/2023,1175154,2023-08-26 07:49:13 UTC,Ericaceae,Epacris,Epacris obtusifolia,3.dicot,native
19/08/2023,4317345,2023-09-07 22:50:42 UTC,Ericaceae,Epacris,Epacris obtusifolia,3.dicot,native
5/09/2023,4743351,2023-09-14 11:56:28 UTC,Ericaceae,Epacris,Epacris obtusifolia,3.dicot,native
5/09/2023,4743351,2023-09-14 11:56:29 UTC,Ericaceae,Epacris,Epacris obtusifolia,3.dicot,native
24/09/2023,6209647,2023-10-10 11:19:09 UTC,Ericaceae,Epacris,Epacris obtusifolia,3.dicot,native
26/11/2023,1438982,2023-11-29 21:24:25 UTC,Ericaceae,Epacris,Epacris obtusifolia,3.dicot,native
11/12/2023,5529159,2023-12-14 05:51:55 UTC,Ericaceae,Epacris,Epacris obtusifolia,3.dicot,native
17/12/2023,1305186,2023-12-17 12:05:57 UTC,Ericaceae,Epacris,Epacris obtusifolia,3.dicot,native
2/01/2024,661392,2024-01-02 06:23:34 UTC,Ericaceae,Epacris,Epacris obtusifolia,3.dicot,native
2/01/2024,1138587,2024-01-02 09:12:27 UTC,Ericaceae,Epacris,Epacris obtusifolia,3.dicot,native
13/06/2015,64271,2015-06-20 13:15:38 UTC,Ericaceae,Epacris,Epacris pulchella,3.dicot,native
18/01/2020,2488549,2020-01-18 01:36:06 UTC,Ericaceae,Epacris,Epacris pulchella,3.dicot,native
3/04/2020,2488549,2020-04-03 08:53:28 UTC,Ericaceae,Epacris,Epacris pulchella,3.dicot,native
18/04/2020,2488549,2020-04-18 23:53:28 UTC,Ericaceae,Epacris,Epacris pulchella,3.dicot,native
26/04/2020,2488549,2020-04-26 08:05:59 UTC,Ericaceae,Epacris,Epacris pulchella,3.dicot,native
26/04/2020,2488549,2020-04-26 08:10:24 UTC,Ericaceae,Epacris,Epacris pulchella,3.dicot,native
28/02/2021,2376854,2021-02-28 11:16:01 UTC,Ericaceae,Epacris,Epacris pulchella,3.dicot,native
28/11/2021,2376854,2021-11-30 05:10:55 UTC,Ericaceae,Epacris,Epacris pulchella,3.dicot,native
6/02/2022,4194794,2022-02-05 22:03:39 UTC,Ericaceae,Epacris,Epacris pulchella,3.dicot,native
6/02/2022,4194794,2022-02-06 02:07:42 UTC,Ericaceae,Epacris,Epacris pulchella,3.dicot,native
5/04/2022,4743351,2022-04-06 05:37:14 UTC,Ericaceae,Epacris,Epacris pulchella,3.dicot,native
5/04/2022,4743351,2022-04-06 05:37:18 UTC,Ericaceae,Epacris,Epacris pulchella,3.dicot,native
1/01/2023,2376854,2023-01-01 15:40:29 UTC,Ericaceae,Epacris,Epacris pulchella,3.dicot,native
12/02/2023,4743351,2023-02-13 10:50:57 UTC,Ericaceae,Epacris,Epacris pulchella,3.dicot,native
13/02/2023,2631448,2023-02-13 12:02:23 UTC,Ericaceae,Epacris,Epacris pulchella,3.dicot,native
11/03/2023,1175154,2023-03-11 08:03:38 UTC,Ericaceae,Epacris,Epacris pulchella,3.dicot,native
26/03/2023,3978191,2023-03-26 07:16:08 UTC,Ericaceae,Epacris,Epacris pulchella,3.dicot,native
2/04/2023,2376854,2023-04-03 10:28:18 UTC,Ericaceae,Epacris,Epacris pulchella,3.dicot,native
17/04/2023,6308282,2023-04-17 04:47:10 UTC,Ericaceae,Epacris,Epacris pulchella,3.dicot,native
16/07/2023,7001195,2023-07-16 05:57:04 UTC,Ericaceae,Epacris,Epacris pulchella,3.dicot,native
16/07/2023,5315657,2023-07-16 05:59:01 UTC,Ericaceae,Epacris,Epacris pulchella,3.dicot,native
2/01/2024,1138587,2024-01-02 09:12:31 UTC,Ericaceae,Epacris,Epacris pulchella,3.dicot,native
10/02/2024,1138587,2024-02-10 07:12:39 UTC,Ericaceae,Epacris,Epacris pulchella,3.dicot,native
11/02/2024,4672448,2024-02-11 03:46:48 UTC,Ericaceae,Epacris,Epacris pulchella,3.dicot,native
16/04/2024,3936801,2024-04-16 12:25:39 UTC,Ericaceae,Epacris,Epacris pulchella,3.dicot,native
21/04/2024,265090,2024-04-21 06:12:45 UTC,Ericaceae,Epacris,Epacris pulchella,3.dicot,native
14/05/2024,3748684,2024-05-14 06:07:47 UTC,Ericaceae,Epacris,Epacris pulchella,3.dicot,native
16/04/2022,3751299,2022-04-16 04:55:48 UTC,Poaceae,Eragrostis,Eragrostis curvula,4.monocot,introduced
30/04/2022,1138587,2022-04-30 09:06:31 UTC,Poaceae,Eragrostis,Eragrostis curvula,4.monocot,introduced
16/11/2021,4916136,2021-11-16 11:36:12 UTC,Asteraceae,Erigeron,Erigeron karvinskianus,3.dicot,introduced
12/02/2023,4743351,2023-02-14 02:07:13 UTC,Asteraceae,Erigeron,Erigeron karvinskianus,3.dicot,introduced
24/09/2023,1138587,2023-09-27 02:55:57 UTC,Asteraceae,Erigeron,Erigeron karvinskianus,3.dicot,introduced
17/04/2020,2488549,2020-04-18 02:04:13 UTC,Orchidaceae,Eriochilus,Eriochilus cucullatus,5.monocot-colorful,native
25/04/2023,5150898,2023-05-27 06:27:11 UTC,Orchidaceae,Eriochilus,Eriochilus petricola,5.monocot-colorful,native
25/04/2023,5150898,2023-05-27 06:28:07 UTC,Orchidaceae,Eriochilus,Eriochilus petricola,5.monocot-colorful,native
22/09/2018,2488549,2019-12-20 01:59:51 UTC,Rutaceae,Eriostemon,Eriostemon australasius,3.dicot,native
25/09/2004,2584563,2020-04-08 00:03:25 UTC,Rutaceae,Eriostemon,Eriostemon australasius,3.dicot,native
1/05/2020,2488549,2020-05-01 07:56:10 UTC,Rutaceae,Eriostemon,Eriostemon australasius,3.dicot,native
19/07/2020,45978,2020-07-19 09:54:37 UTC,Rutaceae,Eriostemon,Eriostemon australasius,3.dicot,native
18/09/2020,2488549,2020-09-18 10:03:33 UTC,Rutaceae,Eriostemon,Eriostemon australasius,3.dicot,native
22/08/2021,3712636,2021-08-23 21:04:49 UTC,Rutaceae,Eriostemon,Eriostemon australasius,3.dicot,native
5/09/2021,2488549,2021-09-05 10:23:40 UTC,Rutaceae,Eriostemon,Eriostemon australasius,3.dicot,native
10/09/2021,2488549,2021-09-10 08:06:52 UTC,Rutaceae,Eriostemon,Eriostemon australasius,3.dicot,native
10/09/2021,4916136,2021-09-10 12:27:03 UTC,Rutaceae,Eriostemon,Eriostemon australasius,3.dicot,native
23/09/2021,3893507,2021-09-23 11:20:02 UTC,Rutaceae,Eriostemon,Eriostemon australasius,3.dicot,native
23/10/2021,2376854,2021-10-23 11:47:29 UTC,Rutaceae,Eriostemon,Eriostemon australasius,3.dicot,native
13/10/2008,4916136,2021-10-29 12:15:09 UTC,Rutaceae,Eriostemon,Eriostemon australasius,3.dicot,native
21/10/2021,325733,2021-11-03 00:59:56 UTC,Rutaceae,Eriostemon,Eriostemon australasius,3.dicot,native
29/07/2022,2488549,2022-07-29 03:50:05 UTC,Rutaceae,Eriostemon,Eriostemon australasius,3.dicot,native
3/08/2022,3978191,2022-08-04 09:26:20 UTC,Rutaceae,Eriostemon,Eriostemon australasius,3.dicot,native
5/09/2022,6029661,2022-09-05 05:54:11 UTC,Rutaceae,Eriostemon,Eriostemon australasius,3.dicot,native
11/09/2022,2366151,2022-09-11 04:48:34 UTC,Rutaceae,Eriostemon,Eriostemon australasius,3.dicot,native
11/09/2022,2366151,2022-09-11 05:24:49 UTC,Rutaceae,Eriostemon,Eriostemon australasius,3.dicot,native
11/09/2022,1175154,2022-09-11 08:16:16 UTC,Rutaceae,Eriostemon,Eriostemon australasius,3.dicot,native
25/09/2022,1138587,2022-09-25 06:58:28 UTC,Rutaceae,Eriostemon,Eriostemon australasius,3.dicot,native
25/09/2022,1138587,2022-09-25 06:58:34 UTC,Rutaceae,Eriostemon,Eriostemon australasius,3.dicot,native
9/10/2022,6230908,2022-10-20 02:47:22 UTC,Rutaceae,Eriostemon,Eriostemon australasius,3.dicot,native
26/08/2023,1175154,2023-08-26 07:52:19 UTC,Rutaceae,Eriostemon,Eriostemon australasius,3.dicot,native
28/08/2023,3678274,2023-08-28 13:24:22 UTC,Rutaceae,Eriostemon,Eriostemon australasius,3.dicot,native
12/09/2023,3859342,2023-09-12 03:46:11 UTC,Rutaceae,Eriostemon,Eriostemon australasius,3.dicot,native
30/09/2023,3678274,2023-10-03 22:52:05 UTC,Rutaceae,Eriostemon,Eriostemon australasius,3.dicot,native
16/09/2023,745089,2023-11-07 07:12:58 UTC,Rutaceae,Eriostemon,Eriostemon australasius,3.dicot,native
7/10/2019,708958,2019-10-07 05:57:38 UTC,Orchidaceae,Erythrorchis,Erythrorchis cassythoides,5.monocot-colorful,native
7/10/2019,136877,2019-10-11 16:27:36 UTC,Orchidaceae,Erythrorchis,Erythrorchis cassythoides,5.monocot-colorful,native
6/10/2020,3708481,2020-10-06 09:50:48 UTC,Orchidaceae,Erythrorchis,Erythrorchis cassythoides,5.monocot-colorful,native
23/09/2021,3893507,2021-09-23 11:03:43 UTC,Orchidaceae,Erythrorchis,Erythrorchis cassythoides,5.monocot-colorful,native
22/09/2021,2665854,2021-10-22 06:14:47 UTC,Orchidaceae,Erythrorchis,Erythrorchis cassythoides,5.monocot-colorful,native
23/10/2021,3880468,2021-10-24 11:10:42 UTC,Orchidaceae,Erythrorchis,Erythrorchis cassythoides,5.monocot-colorful,native
17/11/2021,3880468,2021-11-17 11:56:42 UTC,Orchidaceae,Erythrorchis,Erythrorchis cassythoides,5.monocot-colorful,native
24/09/2023,1138587,2023-09-27 02:45:31 UTC,Orchidaceae,Erythrorchis,Erythrorchis cassythoides,5.monocot-colorful,native
17/10/2023,2322306,2023-10-17 09:54:48 UTC,Orchidaceae,Erythrorchis,Erythrorchis cassythoides,5.monocot-colorful,native
24/09/2023,5280950,2023-11-29 06:45:49 UTC,Orchidaceae,Erythrorchis,Erythrorchis cassythoides,5.monocot-colorful,native
28/07/2023,6196075,2023-07-28 01:57:16 UTC,Myrtaceae,Eucalyptus,Eucalyptus botryoides,3.dicot,native
16/05/2014,2754606,2020-05-01 08:59:59 UTC,Myrtaceae,Eucalyptus,Eucalyptus burgessiana,3.dicot,native
23/05/2020,62599,2020-05-23 10:20:36 UTC,Myrtaceae,Eucalyptus,Eucalyptus burgessiana,3.dicot,native
25/05/2021,4743351,2021-07-20 06:48:40 UTC,Myrtaceae,Eucalyptus,Eucalyptus burgessiana,3.dicot,native
14/11/2021,5194154,2021-11-13 23:22:17 UTC,Myrtaceae,Eucalyptus,Eucalyptus burgessiana,3.dicot,native
1/01/2022,265090,2022-01-01 23:31:34 UTC,Myrtaceae,Eucalyptus,Eucalyptus burgessiana,3.dicot,native
24/07/2022,265090,2022-07-24 10:34:53 UTC,Myrtaceae,Eucalyptus,Eucalyptus burgessiana,3.dicot,native
24/07/2022,265090,2022-07-25 18:40:24 UTC,Myrtaceae,Eucalyptus,Eucalyptus burgessiana,3.dicot,native
6/08/2022,4743351,2022-08-08 05:06:55 UTC,Myrtaceae,Eucalyptus,Eucalyptus burgessiana,3.dicot,native
14/08/2022,265090,2022-08-14 06:49:32 UTC,Myrtaceae,Eucalyptus,Eucalyptus burgessiana,3.dicot,native
20/12/2022,3280868,2022-12-22 03:11:07 UTC,Myrtaceae,Eucalyptus,Eucalyptus burgessiana,3.dicot,native
25/01/2023,2873764,2023-02-08 08:05:41 UTC,Myrtaceae,Eucalyptus,Eucalyptus burgessiana,3.dicot,native
26/02/2023,4743351,2023-02-27 09:57:03 UTC,Myrtaceae,Eucalyptus,Eucalyptus burgessiana,3.dicot,native
19/03/2023,4743351,2023-03-23 05:42:36 UTC,Myrtaceae,Eucalyptus,Eucalyptus burgessiana,3.dicot,native
2/06/2023,5037697,2023-06-02 03:56:07 UTC,Myrtaceae,Eucalyptus,Eucalyptus burgessiana,3.dicot,native
5/09/2023,4743351,2023-09-14 11:56:25 UTC,Myrtaceae,Eucalyptus,Eucalyptus burgessiana,3.dicot,native
25/11/2023,3408787,2023-12-07 12:58:05 UTC,Myrtaceae,Eucalyptus,Eucalyptus burgessiana,3.dicot,native
2/01/2024,661392,2024-01-02 06:13:51 UTC,Myrtaceae,Eucalyptus,Eucalyptus burgessiana,3.dicot,native
2/01/2024,1138587,2024-01-02 07:38:44 UTC,Myrtaceae,Eucalyptus,Eucalyptus burgessiana,3.dicot,native
4/12/2023,6308847,2024-01-04 23:41:38 UTC,Myrtaceae,Eucalyptus,Eucalyptus burgessiana,3.dicot,native
1/01/2022,265090,2022-01-02 00:06:00 UTC,Myrtaceae,Eucalyptus,Eucalyptus camfieldii,3.dicot,native
24/07/2022,265090,2022-07-24 19:15:46 UTC,Myrtaceae,Eucalyptus,Eucalyptus camfieldii,3.dicot,native
30/08/2022,4916136,2022-08-30 11:00:06 UTC,Myrtaceae,Eucalyptus,Eucalyptus camfieldii,3.dicot,native
19/02/2018,2754606,2020-05-02 12:03:52 UTC,Myrtaceae,Eucalyptus,Eucalyptus globoidea,3.dicot,native
22/03/2020,2633838,2020-04-11 10:58:43 UTC,Myrtaceae,Eucalyptus,Eucalyptus haemastoma,3.dicot,native
28/04/2021,4743351,2021-07-20 11:17:59 UTC,Myrtaceae,Eucalyptus,Eucalyptus haemastoma,3.dicot,native
6/02/2022,4194794,2022-02-06 00:43:41 UTC,Myrtaceae,Eucalyptus,Eucalyptus haemastoma,3.dicot,native
24/07/2022,265090,2022-07-24 18:34:27 UTC,Myrtaceae,Eucalyptus,Eucalyptus haemastoma,3.dicot,native
24/07/2022,265090,2022-07-25 10:10:24 UTC,Myrtaceae,Eucalyptus,Eucalyptus haemastoma,3.dicot,native
3/06/2023,4095677,2023-06-04 03:52:56 UTC,Myrtaceae,Eucalyptus,Eucalyptus haemastoma,3.dicot,native
20/02/2024,4743351,2024-02-20 23:21:13 UTC,Myrtaceae,Eucalyptus,Eucalyptus haemastoma,3.dicot,native
18/08/2019,265090,2019-08-20 18:39:12 UTC,Myrtaceae,Eucalyptus,Eucalyptus luehmanniana,3.dicot,native
16/05/2014,2754606,2020-04-17 12:42:27 UTC,Myrtaceae,Eucalyptus,Eucalyptus luehmanniana,3.dicot,native
1/01/2022,265090,2022-01-01 23:51:08 UTC,Myrtaceae,Eucalyptus,Eucalyptus luehmanniana,3.dicot,native
1/01/2022,265090,2022-01-02 00:35:13 UTC,Myrtaceae,Eucalyptus,Eucalyptus luehmanniana,3.dicot,native
14/08/2022,265090,2022-08-14 07:11:10 UTC,Myrtaceae,Eucalyptus,Eucalyptus luehmanniana,3.dicot,native
19/02/2023,5364942,2023-02-20 21:11:18 UTC,Myrtaceae,Eucalyptus,Eucalyptus multicaulis,3.dicot,native
19/02/2018,2754606,2022-07-02 04:13:57 UTC,Myrtaceae,Eucalyptus,Eucalyptus oblonga,3.dicot,native
18/10/2023,2754606,2023-10-23 23:38:44 UTC,Myrtaceae,Eucalyptus,Eucalyptus paniculata,3.dicot,native
23/02/2020,45978,2020-02-23 07:28:40 UTC,Myrtaceae,Eucalyptus,Eucalyptus pilularis,3.dicot,native
12/12/2021,265090,2021-12-12 04:30:53 UTC,Myrtaceae,Eucalyptus,Eucalyptus pilularis,3.dicot,native
18/10/2023,2754606,2023-10-23 23:38:45 UTC,Myrtaceae,Eucalyptus,Eucalyptus pilularis,3.dicot,native
24/07/2022,265090,2022-07-25 10:39:47 UTC,Myrtaceae,Eucalyptus,Eucalyptus piperita,3.dicot,native
31/07/2022,265090,2022-07-31 09:59:34 UTC,Myrtaceae,Eucalyptus,Eucalyptus punctata,3.dicot,native
28/05/2015,572477,2021-03-23 22:38:05 UTC,Myrtaceae,Eucalyptus,Eucalyptus racemosa,3.dicot,native
16/06/2020,4743351,2021-08-02 03:25:31 UTC,Myrtaceae,Eucalyptus,Eucalyptus racemosa,3.dicot,native
9/03/2023,1658043,2023-03-13 07:22:47 UTC,Myrtaceae,Eucalyptus,Eucalyptus racemosa,3.dicot,native
16/06/2020,4743351,2021-08-02 03:25:31 UTC,Myrtaceae,Eucalyptus,Eucalyptus sieberi,3.dicot,native
14/08/2022,265090,2022-08-14 07:54:08 UTC,Myrtaceae,Eucalyptus,Eucalyptus sieberi,3.dicot,native
25/09/2022,6385192,2022-12-19 01:42:41 UTC,Myrtaceae,Eucalyptus,Eucalyptus sieberi,3.dicot,native
19/03/2023,4743351,2023-03-23 11:18:08 UTC,Myrtaceae,Eucalyptus,Eucalyptus sieberi,3.dicot,native
19/03/2023,4743351,2023-03-23 11:18:08 UTC,Myrtaceae,Eucalyptus,Eucalyptus sieberi,3.dicot,native
5/04/2023,1809954,2023-04-06 23:16:11 UTC,Myrtaceae,Eucalyptus,Eucalyptus sieberi,3.dicot,native
5/09/2023,4743351,2023-09-14 11:56:26 UTC,Myrtaceae,Eucalyptus,Eucalyptus sieberi,3.dicot,native
17/09/2023,2531563,2023-09-17 11:17:21 UTC,Myrtaceae,Eucalyptus,Eucalyptus sieberi,3.dicot,native
7/09/2023,6516136,2023-10-04 01:04:50 UTC,Myrtaceae,Eucalyptus,Eucalyptus sieberi,3.dicot,native
10/09/2023,4317345,2024-01-06 18:38:37 UTC,Myrtaceae,Eucalyptus,Eucalyptus sieberi,3.dicot,native
12/02/2023,4743351,2023-02-13 10:50:58 UTC,Asteraceae,Euchiton,Euchiton sphaericus,3.dicot,native
14/11/2022,3441963,2022-11-14 22:52:02 UTC,Euphorbiaceae,Euphorbia,Euphorbia peplus,3.dicot,introduced
24/09/2023,1138587,2023-09-27 02:55:56 UTC,Euphorbiaceae,Euphorbia,Euphorbia peplus,3.dicot,introduced
24/09/2023,661392,2023-10-03 13:51:19 UTC,Euphorbiaceae,Euphorbia,Euphorbia peplus,3.dicot,introduced
2/01/2024,1138587,2024-01-02 08:51:18 UTC,Euphorbiaceae,Euphorbia,Euphorbia peplus,3.dicot,introduced
26/01/2020,2512752,2020-01-26 05:53:41 UTC,Eupomatiaceae,Eupomatia,Eupomatia laurina,3.dicot,native
26/01/2020,2512752,2020-01-26 05:56:50 UTC,Eupomatiaceae,Eupomatia,Eupomatia laurina,3.dicot,native
26/10/2014,64271,2014-11-20 22:06:46 UTC,Myrtaceae,Euryomyrtus,Euryomyrtus ramosissima,3.dicot,native
13/06/2015,64271,2015-06-20 13:15:41 UTC,Myrtaceae,Euryomyrtus,Euryomyrtus ramosissima,3.dicot,native
9/03/2020,2488549,2020-03-09 09:22:59 UTC,Myrtaceae,Euryomyrtus,Euryomyrtus ramosissima,3.dicot,native
25/09/2004,2584563,2020-04-04 06:57:12 UTC,Myrtaceae,Euryomyrtus,Euryomyrtus ramosissima,3.dicot,native
18/04/2020,2488549,2020-04-19 00:12:42 UTC,Myrtaceae,Euryomyrtus,Euryomyrtus ramosissima,3.dicot,native
24/04/2020,2488549,2020-04-24 11:00:15 UTC,Myrtaceae,Euryomyrtus,Euryomyrtus ramosissima,3.dicot,native
24/04/2020,2488549,2020-04-24 11:15:32 UTC,Myrtaceae,Euryomyrtus,Euryomyrtus ramosissima,3.dicot,native
26/04/2020,2488549,2020-04-26 08:12:31 UTC,Myrtaceae,Euryomyrtus,Euryomyrtus ramosissima,3.dicot,native
3/05/2020,2488549,2020-05-03 01:41:26 UTC,Myrtaceae,Euryomyrtus,Euryomyrtus ramosissima,3.dicot,native
12/08/2020,2488549,2020-08-12 03:41:45 UTC,Myrtaceae,Euryomyrtus,Euryomyrtus ramosissima,3.dicot,native
21/08/2020,2488549,2020-08-21 22:27:46 UTC,Myrtaceae,Euryomyrtus,Euryomyrtus ramosissima,3.dicot,native
18/09/2020,2488549,2020-09-18 09:42:24 UTC,Myrtaceae,Euryomyrtus,Euryomyrtus ramosissima,3.dicot,native
4/10/2020,2488549,2020-10-05 02:19:32 UTC,Myrtaceae,Euryomyrtus,Euryomyrtus ramosissima,3.dicot,native
19/10/2020,3312793,2020-10-19 00:32:11 UTC,Myrtaceae,Euryomyrtus,Euryomyrtus ramosissima,3.dicot,native
27/12/2020,2488549,2020-12-27 08:52:12 UTC,Myrtaceae,Euryomyrtus,Euryomyrtus ramosissima,3.dicot,native
28/02/2021,2376854,2021-02-28 12:12:52 UTC,Myrtaceae,Euryomyrtus,Euryomyrtus ramosissima,3.dicot,native
26/05/2021,3678274,2021-06-13 12:21:11 UTC,Myrtaceae,Euryomyrtus,Euryomyrtus ramosissima,3.dicot,native
15/09/2020,4743351,2021-07-25 05:08:53 UTC,Myrtaceae,Euryomyrtus,Euryomyrtus ramosissima,3.dicot,native
15/08/2021,3712636,2021-08-15 11:31:39 UTC,Myrtaceae,Euryomyrtus,Euryomyrtus ramosissima,3.dicot,native
29/08/2021,2215616,2021-08-28 22:56:10 UTC,Myrtaceae,Euryomyrtus,Euryomyrtus ramosissima,3.dicot,native
4/09/2021,3893507,2021-09-04 21:23:56 UTC,Myrtaceae,Euryomyrtus,Euryomyrtus ramosissima,3.dicot,native
5/09/2021,2488549,2021-09-05 10:32:49 UTC,Myrtaceae,Euryomyrtus,Euryomyrtus ramosissima,3.dicot,native
6/09/2021,4887682,2021-09-06 09:44:52 UTC,Myrtaceae,Euryomyrtus,Euryomyrtus ramosissima,3.dicot,native
8/09/2021,4743351,2021-09-09 13:11:12 UTC,Myrtaceae,Euryomyrtus,Euryomyrtus ramosissima,3.dicot,native
10/09/2021,2488549,2021-09-10 10:27:43 UTC,Myrtaceae,Euryomyrtus,Euryomyrtus ramosissima,3.dicot,native
12/09/2021,4037891,2021-09-11 23:30:27 UTC,Myrtaceae,Euryomyrtus,Euryomyrtus ramosissima,3.dicot,native
17/09/2021,2488549,2021-09-17 11:13:18 UTC,Myrtaceae,Euryomyrtus,Euryomyrtus ramosissima,3.dicot,native
16/09/2021,4916136,2021-09-18 12:10:59 UTC,Myrtaceae,Euryomyrtus,Euryomyrtus ramosissima,3.dicot,native
23/09/2021,3893507,2021-09-23 11:09:02 UTC,Myrtaceae,Euryomyrtus,Euryomyrtus ramosissima,3.dicot,native
27/09/2021,4916136,2021-09-27 11:17:36 UTC,Myrtaceae,Euryomyrtus,Euryomyrtus ramosissima,3.dicot,native
28/09/2021,4743351,2021-09-30 11:51:31 UTC,Myrtaceae,Euryomyrtus,Euryomyrtus ramosissima,3.dicot,native
3/10/2021,2488549,2021-10-03 10:06:58 UTC,Myrtaceae,Euryomyrtus,Euryomyrtus ramosissima,3.dicot,native
4/10/2021,4916136,2021-10-04 12:36:34 UTC,Myrtaceae,Euryomyrtus,Euryomyrtus ramosissima,3.dicot,native
27/10/2021,4916136,2021-10-27 11:39:21 UTC,Myrtaceae,Euryomyrtus,Euryomyrtus ramosissima,3.dicot,native
29/10/2021,2215616,2021-10-29 19:35:37 UTC,Myrtaceae,Euryomyrtus,Euryomyrtus ramosissima,3.dicot,native
21/10/2021,325733,2021-11-03 01:10:15 UTC,Myrtaceae,Euryomyrtus,Euryomyrtus ramosissima,3.dicot,native
28/11/2021,2376854,2021-12-01 02:06:21 UTC,Myrtaceae,Euryomyrtus,Euryomyrtus ramosissima,3.dicot,native
1/11/2020,5283632,2022-01-07 13:30:04 UTC,Myrtaceae,Euryomyrtus,Euryomyrtus ramosissima,3.dicot,native
17/09/2022,2215616,2022-09-16 23:07:28 UTC,Myrtaceae,Euryomyrtus,Euryomyrtus ramosissima,3.dicot,native
17/09/2022,2488549,2022-09-17 04:03:49 UTC,Myrtaceae,Euryomyrtus,Euryomyrtus ramosissima,3.dicot,native
25/09/2022,1138587,2022-09-25 06:38:08 UTC,Myrtaceae,Euryomyrtus,Euryomyrtus ramosissima,3.dicot,native
25/09/2022,1138587,2022-09-25 06:38:14 UTC,Myrtaceae,Euryomyrtus,Euryomyrtus ramosissima,3.dicot,native
25/09/2022,1138587,2022-09-25 06:58:30 UTC,Myrtaceae,Euryomyrtus,Euryomyrtus ramosissima,3.dicot,native
2/10/2022,1401423,2022-10-03 11:01:41 UTC,Myrtaceae,Euryomyrtus,Euryomyrtus ramosissima,3.dicot,native
4/10/2022,3678274,2022-10-06 10:29:21 UTC,Myrtaceae,Euryomyrtus,Euryomyrtus ramosissima,3.dicot,native
18/10/2022,4916136,2022-10-18 07:01:33 UTC,Myrtaceae,Euryomyrtus,Euryomyrtus ramosissima,3.dicot,native
2/11/2022,2631448,2022-11-02 06:40:10 UTC,Myrtaceae,Euryomyrtus,Euryomyrtus ramosissima,3.dicot,native
1/01/2023,2376854,2023-01-01 15:40:34 UTC,Myrtaceae,Euryomyrtus,Euryomyrtus ramosissima,3.dicot,native
26/01/2023,2376854,2023-01-27 12:25:35 UTC,Myrtaceae,Euryomyrtus,Euryomyrtus ramosissima,3.dicot,native
12/02/2023,4743351,2023-02-13 02:47:19 UTC,Myrtaceae,Euryomyrtus,Euryomyrtus ramosissima,3.dicot,native
17/06/2023,2531563,2023-06-20 04:57:11 UTC,Myrtaceae,Euryomyrtus,Euryomyrtus ramosissima,3.dicot,native
19/08/2023,6209647,2023-08-21 16:08:36 UTC,Myrtaceae,Euryomyrtus,Euryomyrtus ramosissima,3.dicot,native
24/09/2023,1138587,2023-09-27 02:08:28 UTC,Myrtaceae,Euryomyrtus,Euryomyrtus ramosissima,3.dicot,native
24/09/2023,1138587,2023-09-27 03:10:28 UTC,Myrtaceae,Euryomyrtus,Euryomyrtus ramosissima,3.dicot,native
24/09/2023,661392,2023-09-28 10:32:53 UTC,Myrtaceae,Euryomyrtus,Euryomyrtus ramosissima,3.dicot,native
24/09/2023,661392,2023-09-29 13:53:54 UTC,Myrtaceae,Euryomyrtus,Euryomyrtus ramosissima,3.dicot,native
26/11/2023,2589225,2023-11-26 01:52:11 UTC,Myrtaceae,Euryomyrtus,Euryomyrtus ramosissima,3.dicot,native
2/01/2024,661392,2024-01-02 06:33:59 UTC,Myrtaceae,Euryomyrtus,Euryomyrtus ramosissima,3.dicot,native
1/01/2024,5300031,2024-01-08 21:20:07 UTC,Myrtaceae,Euryomyrtus,Euryomyrtus ramosissima,3.dicot,native
4/02/2024,6439207,2024-02-04 01:39:25 UTC,Myrtaceae,Euryomyrtus,Euryomyrtus ramosissima,3.dicot,native
2/01/2024,661392,2024-01-02 06:00:20 UTC,Asteraceae,Euryops,Euryops chrysanthemoides,3.dicot,introduced
3/04/2020,2488549,2020-04-03 09:40:53 UTC,Asparagaceae,Eustrephus,Eustrephus latifolius,5.monocot-colorful,native
9/05/2020,2488549,2020-05-09 12:52:51 UTC,Asparagaceae,Eustrephus,Eustrephus latifolius,5.monocot-colorful,native
5/08/2020,2488549,2020-08-05 05:44:58 UTC,Asparagaceae,Eustrephus,Eustrephus latifolius,5.monocot-colorful,native
5/08/2020,793005,2020-08-05 17:07:11 UTC,Asparagaceae,Eustrephus,Eustrephus latifolius,5.monocot-colorful,native
16/03/2021,3721620,2021-03-16 10:44:29 UTC,Asparagaceae,Eustrephus,Eustrephus latifolius,5.monocot-colorful,native
19/09/2021,4887682,2021-09-19 09:25:28 UTC,Asparagaceae,Eustrephus,Eustrephus latifolius,5.monocot-colorful,native
1/11/2021,4916136,2021-11-01 12:24:02 UTC,Asparagaceae,Eustrephus,Eustrephus latifolius,5.monocot-colorful,native
15/04/2022,2488549,2022-04-15 09:19:22 UTC,Asparagaceae,Eustrephus,Eustrephus latifolius,5.monocot-colorful,native
12/06/2023,4231868,2023-06-12 01:13:15 UTC,Asparagaceae,Eustrephus,Eustrephus latifolius,5.monocot-colorful,native
24/09/2023,1138587,2023-09-27 02:31:00 UTC,Asparagaceae,Eustrephus,Eustrephus latifolius,5.monocot-colorful,native
31/12/2019,2488549,2019-12-30 23:14:39 UTC,Santalaceae,Exocarpos,Exocarpos cupressiformis,3.dicot,native
12/01/2020,2488549,2020-01-12 08:43:27 UTC,Santalaceae,Exocarpos,Exocarpos cupressiformis,3.dicot,native
15/06/2020,2488549,2020-06-15 07:22:07 UTC,Santalaceae,Exocarpos,Exocarpos cupressiformis,3.dicot,native
12/02/2023,4743351,2023-02-13 23:20:24 UTC,Santalaceae,Exocarpos,Exocarpos cupressiformis,3.dicot,native
27/04/2024,6315426,2024-04-27 07:01:12 UTC,Santalaceae,Exocarpos,Exocarpos cupressiformis,3.dicot,native
3/02/2019,793005,2019-02-03 10:53:47 UTC,Cyperaceae,Ficinia,Ficinia nodosa,4.monocot,native
23/01/2022,2665854,2022-02-10 06:05:24 UTC,Cyperaceae,Ficinia,Ficinia nodosa,4.monocot,native
2/04/2023,6524924,2023-04-02 04:42:59 UTC,Cyperaceae,Ficinia,Ficinia nodosa,4.monocot,native
7/01/2021,2488549,2021-01-07 08:48:07 UTC,Moraceae,Ficus,Ficus coronata,3.dicot,native
18/01/1988,717200,2022-06-17 02:20:49 UTC,Moraceae,Ficus,Ficus coronata,3.dicot,native
20/01/2023,4916136,2023-01-20 09:42:19 UTC,Moraceae,Ficus,Ficus coronata,3.dicot,native
2/01/2024,661392,2024-01-02 05:54:54 UTC,Moraceae,Ficus,Ficus coronata,3.dicot,native
19/10/2021,4916136,2021-10-19 04:12:55 UTC,Moraceae,Ficus,Ficus rubiginosa,3.dicot,native
2/03/2019,2488549,2019-12-17 09:01:26 UTC,Cyperaceae,Gahnia,Gahnia aspera,4.monocot,native
9/05/2020,2488549,2020-05-09 03:18:32 UTC,Cyperaceae,Gahnia,Gahnia aspera,4.monocot,native
5/08/2020,2488549,2020-08-05 05:45:49 UTC,Cyperaceae,Gahnia,Gahnia aspera,4.monocot,native
20/10/2021,2665854,2021-10-22 06:10:17 UTC,Orchidaceae,Gastrodia,Gastrodia sesamoides,5.monocot-colorful,native
24/10/2021,3712636,2021-10-24 10:03:36 UTC,Orchidaceae,Gastrodia,Gastrodia sesamoides,5.monocot-colorful,native
24/09/2023,1138587,2023-09-27 02:17:59 UTC,Orchidaceae,Gastrodia,Gastrodia sesamoides,5.monocot-colorful,native
24/09/2023,1138587,2023-09-27 02:45:30 UTC,Orchidaceae,Gastrodia,Gastrodia sesamoides,5.monocot-colorful,native
14/10/2023,6556876,2023-10-14 09:11:46 UTC,Orchidaceae,Gastrodia,Gastrodia sesamoides,5.monocot-colorful,native
12/01/2020,2488549,2020-01-12 06:32:01 UTC,Myrtaceae,Gaudium,Gaudium laevigatum,3.dicot,native
18/01/2020,2488549,2020-01-17 23:51:06 UTC,Myrtaceae,Gaudium,Gaudium laevigatum,3.dicot,native
23/10/2020,3654699,2020-10-26 04:42:49 UTC,Myrtaceae,Gaudium,Gaudium laevigatum,3.dicot,native
8/07/2021,4095677,2021-07-08 07:41:42 UTC,Myrtaceae,Gaudium,Gaudium laevigatum,3.dicot,native
